FULL_ADDR,COUNTY,TOWN,VILLAGE,NEIGHBORHOOD,ROAD,SECTION,LANE,ALLEY,SUB_ALLEY,TONG,NUMBER,X,Y
彰化縣芳苑鄉文津村10鄰功湖路草湖段建659號,10007,1000723,1000723-022,10鄰,功湖路,,,,,,草湖段建659號,120.366589906378,23.9595691138639
彰化縣芳苑鄉文津村9鄰功湖路339號,10007,1000723,1000723-022,9鄰,功湖路,,,,,,339號,120.373572215706,23.9596462498526
彰化縣芳苑鄉文津村9鄰功湖路351號,10007,1000723,1000723-022,9鄰,功湖路,,,,,,351號,120.373306647921,23.9596438116299
彰化縣芳苑鄉王功村17鄰功湖路王功段臨392號,10007,1000723,1000723-015,17鄰,功湖路,,,,,,王功段臨392號,120.344877284762,23.9647229827421
彰化縣芳苑鄉王功村4鄰功湖路12號,10007,1000723,1000723-015,4鄰,功湖路,,,,,,12號,120.343089171859,23.9651942505587
彰化縣芳苑鄉王功村4鄰功湖路12之2號,10007,1000723,1000723-015,4鄰,功湖路,,,,,,12之2號,120.342969704528,23.9651721594014
彰化縣芳苑鄉王功村4鄰功湖路12之3號,10007,1000723,1000723-015,4鄰,功湖路,,,,,,12之3號,120.342925392611,23.9651911116648
