FULL_ADDR,COUNTY,TOWN,VILLAGE,NEIGHBORHOOD,ROAD,SECTION,LANE,ALLEY,SUB_ALLEY,TONG,NUMBER,X,Y
嘉義縣鹿草鄉西井村19鄰鹿環南路97號附2,10010,1001011,1001011-004,19鄰,鹿環南路,,,,,,97號附2,120.308418026034,23.4076091366153
嘉義縣鹿草鄉西井村19鄰鹿環南路97號附3附3,10010,1001011,1001011-004,19鄰,鹿環南路,,,,,,97號附3附3,120.308468971002,23.40763374258
嘉義縣鹿草鄉西井村19鄰鹿環南路97號附5,10010,1001011,1001011-004,19鄰,鹿環南路,,,,,,97號附5,120.308000296019,23.4082959009726
嘉義縣鹿草鄉西井村19鄰鹿環南路97號附1,10010,1001011,1001011-004,19鄰,鹿環南路,,,,,,97號附1,120.309403029436,23.4074691061189
嘉義縣鹿草鄉鹿草村18鄰鹿環南路8號附1,10010,1001011,1001011-003,18鄰,鹿環南路,,,,,,8號附1,120.314592610054,23.4080925285243
嘉義縣鹿草鄉鹿草村18鄰鹿環南路148號,10010,1001011,1001011-003,18鄰,鹿環南路,,,,,,148號,120.311638086903,23.4072444633862
