FULL_ADDR,COUNTY,TOWN,VILLAGE,NEIGHBORHOOD,ROAD,SECTION,LANE,ALLEY,SUB_ALLEY,TONG,NUMBER,X,Y
澎湖縣馬公市鎖港里19鄰鎖港七路85巷25號,10016,1001601,1001601-028,19鄰,鎖港七路,,85巷,,,,25號,121.599006667527,23.5247190102964
澎湖縣馬公市鎖港里19鄰鎖港七路93號,10016,1001601,1001601-028,19鄰,鎖港七路,,,,,,93號,121.599248314773,23.5239748378271
澎湖縣馬公市鎖港里19鄰鎖港七路95號,10016,1001601,1001601-028,19鄰,鎖港七路,,,,,,95號,121.599351254604,23.5239355231204
澎湖縣馬公市鎖港里20鄰鎖港七路123巷7弄6號,10016,1001601,1001601-028,20鄰,鎖港七路,,123巷,7弄,,,6號,121.599983183093,23.5238278014854
澎湖縣馬公市鎖港里25鄰鎖港七路152巷20號,10016,1001601,1001601-028,25鄰,鎖港七路,,152巷,,,,20號,121.598695927013,23.5231570576507
澎湖縣馬公市鎖港里24鄰鎖港七路162號,10016,1001601,1001601-028,24鄰,鎖港七路,,,,,,162號,121.599571521885,23.5236390394246
