FULL_ADDR,COUNTY,TOWN,VILLAGE,NEIGHBORHOOD,ROAD,SECTION,LANE,ALLEY,SUB_ALLEY,TONG,NUMBER,X,Y
屏東縣竹田鄉西勢村14鄰東西四路56之1號,10013,1001314,1001314-009,14鄰,東西四路,,,,,,56之1號,120.514541625315,22.6205616392232
屏東縣竹田鄉西勢村14鄰東西四路88號,10013,1001314,1001314-009,14鄰,東西四路,,,,,,88號,120.511644951848,22.6206049575877
屏東縣竹田鄉西勢村14鄰東西四路126號,10013,1001314,1001314-009,14鄰,東西四路,,,,,,126號,120.510885464612,22.6209203524464
屏東縣竹田鄉西勢村14鄰東西四路128號,10013,1001314,1001314-009,14鄰,東西四路,,,,,,128號,120.510553481947,22.6209683780648
屏東縣竹田鄉西勢村14鄰東西四路138之1號,10013,1001314,1001314-009,14鄰,東西四路,,,,,,138之1號,120.509846597955,22.6204659065688
