FULL_ADDR,COUNTY,TOWN,VILLAGE,NEIGHBORHOOD,ROAD,SECTION,LANE,ALLEY,SUB_ALLEY,TONG,NUMBER,X,Y
臺北市北投區建民里10鄰士科路93號,63,6301200,6301200-001,10鄰,士科路,,,,,,93號,121.514163044833,25.1038620786002
臺北市北投區建民里10鄰士科路93號二樓,63,6301200,6301200-001,10鄰,士科路,,,,,,93號二樓,121.514163044833,25.1038620786002
臺北市北投區建民里10鄰士科路93號三樓,63,6301200,6301200-001,10鄰,士科路,,,,,,93號三樓,121.514163044833,25.1038620786002
臺北市北投區建民里10鄰士科路93號四樓,63,6301200,6301200-001,10鄰,士科路,,,,,,93號四樓,121.514163044833,25.1038620786002
臺北市北投區建民里10鄰士科路93號五樓,63,6301200,6301200-001,10鄰,士科路,,,,,,93號五樓,121.514163044833,25.1038620786002
臺北市北投區建民里10鄰士科路93號六樓,63,6301200,6301200-001,10鄰,士科路,,,,,,93號六樓,121.514163044833,25.1038620786002
臺北市北投區建民里10鄰士科路93號七樓,63,6301200,6301200-001,10鄰,士科路,,,,,,93號七樓,121.514163044833,25.1038620786002
臺北市北投區建民里10鄰士科路93號八樓,63,6301200,6301200-001,10鄰,士科路,,,,,,93號八樓,121.514163044833,25.1038620786002
臺北市北投區建民里10鄰士科路93號九樓,63,6301200,6301200-001,10鄰,士科路,,,,,,93號九樓,121.514163044833,25.1038620786002
臺北市北投區建民里10鄰士科路93號十樓,63,6301200,6301200-001,10鄰,士科路,,,,,,93號十樓,121.514163044833,25.1038620786002
臺北市北投區建民里10鄰士科路93號十一樓,63,6301200,6301200-001,10鄰,士科路,,,,,,93號十一樓,121.514163044833,25.1038620786002
臺北市北投區建民里10鄰士科路93之1號,63,6301200,6301200-001,10鄰,士科路,,,,,,93之1號,121.513994065509,25.1038572213201
臺北市北投區建民里10鄰士科路93之1號二樓,63,6301200,6301200-001,10鄰,士科路,,,,,,93之1號二樓,121.513994065509,25.1038572213201
臺北市北投區建民里10鄰士科路95號二樓,63,6301200,6301200-001,10鄰,士科路,,,,,,95號二樓,121.514149632931,25.1039628760169
臺北市北投區建民里10鄰士科路95號三樓,63,6301200,6301200-001,10鄰,士科路,,,,,,95號三樓,121.514149632931,25.1039628760169
臺北市北投區建民里10鄰士科路95號四樓,63,6301200,6301200-001,10鄰,士科路,,,,,,95號四樓,121.514149632931,25.1039628760169
臺北市北投區建民里10鄰士科路95號五樓,63,6301200,6301200-001,10鄰,士科路,,,,,,95號五樓,121.514149632931,25.1039628760169
臺北市北投區建民里10鄰士科路95號六樓,63,6301200,6301200-001,10鄰,士科路,,,,,,95號六樓,121.514149632931,25.1039628760169
臺北市北投區建民里10鄰士科路95號七樓,63,6301200,6301200-001,10鄰,士科路,,,,,,95號七樓,121.514149632931,25.1039628760169
臺北市北投區建民里10鄰士科路95號八樓,63,6301200,6301200-001,10鄰,士科路,,,,,,95號八樓,121.514149632931,25.1039628760169
臺北市北投區建民里10鄰士科路95號九樓,63,6301200,6301200-001,10鄰,士科路,,,,,,95號九樓,121.514149632931,25.1039628760169
臺北市北投區建民里10鄰士科路95號十樓,63,6301200,6301200-001,10鄰,士科路,,,,,,95號十樓,121.514149632931,25.1039628760169
臺北市北投區建民里10鄰士科路95號十一樓,63,6301200,6301200-001,10鄰,士科路,,,,,,95號十一樓,121.514149632931,25.1039628760169
臺北市北投區建民里10鄰士科路97號二樓,63,6301200,6301200-001,10鄰,士科路,,,,,,97號二樓,121.514141586305,25.1040466713169
臺北市北投區建民里10鄰士科路97號三樓,63,6301200,6301200-001,10鄰,士科路,,,,,,97號三樓,121.514141586305,25.1040466713169
臺北市北投區建民里10鄰士科路97號四樓,63,6301200,6301200-001,10鄰,士科路,,,,,,97號四樓,121.514141586305,25.1040466713169
臺北市北投區建民里10鄰士科路97號五樓,63,6301200,6301200-001,10鄰,士科路,,,,,,97號五樓,121.514141586305,25.1040466713169
臺北市北投區建民里10鄰士科路97號六樓,63,6301200,6301200-001,10鄰,士科路,,,,,,97號六樓,121.514141586305,25.1040466713169
臺北市北投區建民里10鄰士科路97號七樓,63,6301200,6301200-001,10鄰,士科路,,,,,,97號七樓,121.514141586305,25.1040466713169
臺北市北投區建民里10鄰士科路97號八樓,63,6301200,6301200-001,10鄰,士科路,,,,,,97號八樓,121.514141586305,25.1040466713169
臺北市北投區建民里10鄰士科路97號九樓,63,6301200,6301200-001,10鄰,士科路,,,,,,97號九樓,121.514141586305,25.1040466713169
臺北市北投區建民里10鄰士科路97號十樓,63,6301200,6301200-001,10鄰,士科路,,,,,,97號十樓,121.514141586305,25.1040466713169
臺北市北投區建民里10鄰士科路97號十一樓,63,6301200,6301200-001,10鄰,士科路,,,,,,97號十一樓,121.514141586305,25.1040466713169
臺北市北投區建民里10鄰士科路97號十二樓,63,6301200,6301200-001,10鄰,士科路,,,,,,97號十二樓,121.514141586305,25.1040466713169
臺北市北投區建民里10鄰士科路97號十三樓,63,6301200,6301200-001,10鄰,士科路,,,,,,97號十三樓,121.514141586305,25.1040466713169
臺北市北投區建民里10鄰士科路97號十四樓,63,6301200,6301200-001,10鄰,士科路,,,,,,97號十四樓,121.514141586305,25.1040466713169
臺北市北投區建民里10鄰士科路97號十五樓,63,6301200,6301200-001,10鄰,士科路,,,,,,97號十五樓,121.514141586305,25.1040466713169
臺北市北投區建民里10鄰士科路97號十六樓,63,6301200,6301200-001,10鄰,士科路,,,,,,97號十六樓,121.514141586305,25.1040466713169
臺北市北投區建民里10鄰士科路97號十七樓,63,6301200,6301200-001,10鄰,士科路,,,,,,97號十七樓,121.514141586305,25.1040466713169
臺北市北投區建民里10鄰士科路97號十八樓,63,6301200,6301200-001,10鄰,士科路,,,,,,97號十八樓,121.514141586305,25.1040466713169
臺北市北投區建民里10鄰士科路97號十九樓,63,6301200,6301200-001,10鄰,士科路,,,,,,97號十九樓,121.514141586305,25.1040466713169
臺北市北投區建民里10鄰士科路97號二十樓,63,6301200,6301200-001,10鄰,士科路,,,,,,97號二十樓,121.514141586305,25.1040466713169
臺北市北投區建民里10鄰士科路97號二十一樓,63,6301200,6301200-001,10鄰,士科路,,,,,,97號二十一樓,121.514141586305,25.1040466713169
臺北市北投區建民里10鄰士科路97號二十二樓,63,6301200,6301200-001,10鄰,士科路,,,,,,97號二十二樓,121.514141586305,25.1040466713169
臺北市北投區建民里10鄰士科路97號二十三樓,63,6301200,6301200-001,10鄰,士科路,,,,,,97號二十三樓,121.514141586305,25.1040466713169
臺北市北投區建民里10鄰士科路97號二十四樓,63,6301200,6301200-001,10鄰,士科路,,,,,,97號二十四樓,121.514141586305,25.1040466713169
臺北市北投區建民里10鄰士科路99號十二樓,63,6301200,6301200-001,10鄰,士科路,,,,,,99號十二樓,121.514122810865,25.104142610385
臺北市北投區建民里10鄰士科路99號十三樓,63,6301200,6301200-001,10鄰,士科路,,,,,,99號十三樓,121.514122810865,25.104142610385
臺北市北投區建民里10鄰士科路99號十四樓,63,6301200,6301200-001,10鄰,士科路,,,,,,99號十四樓,121.514122810865,25.104142610385
臺北市北投區建民里10鄰士科路99號十五樓,63,6301200,6301200-001,10鄰,士科路,,,,,,99號十五樓,121.514122810865,25.104142610385
臺北市北投區建民里10鄰士科路99號十六樓,63,6301200,6301200-001,10鄰,士科路,,,,,,99號十六樓,121.514122810865,25.104142610385
臺北市北投區建民里10鄰士科路99號十七樓,63,6301200,6301200-001,10鄰,士科路,,,,,,99號十七樓,121.514122810865,25.104142610385
臺北市北投區建民里10鄰士科路99號十八樓,63,6301200,6301200-001,10鄰,士科路,,,,,,99號十八樓,121.514122810865,25.104142610385
臺北市北投區建民里10鄰士科路99號十九樓,63,6301200,6301200-001,10鄰,士科路,,,,,,99號十九樓,121.514122810865,25.104142610385
臺北市北投區建民里10鄰士科路99號二十樓,63,6301200,6301200-001,10鄰,士科路,,,,,,99號二十樓,121.514122810865,25.104142610385
臺北市北投區建民里10鄰士科路99號二十一樓,63,6301200,6301200-001,10鄰,士科路,,,,,,99號二十一樓,121.514122810865,25.104142610385
臺北市北投區建民里10鄰士科路99號二十二樓,63,6301200,6301200-001,10鄰,士科路,,,,,,99號二十二樓,121.514122810865,25.104142610385
臺北市北投區建民里10鄰士科路99號二十三樓,63,6301200,6301200-001,10鄰,士科路,,,,,,99號二十三樓,121.514122810865,25.104142610385
臺北市北投區建民里10鄰士科路99號二十四樓,63,6301200,6301200-001,10鄰,士科路,,,,,,99號二十四樓,121.514122810865,25.104142610385
臺北市北投區建民里10鄰士科路99號二樓,63,6301200,6301200-001,10鄰,士科路,,,,,,99號二樓,121.514122810865,25.104142610385
臺北市北投區建民里10鄰士科路99號三樓,63,6301200,6301200-001,10鄰,士科路,,,,,,99號三樓,121.514122810865,25.104142610385
臺北市北投區建民里10鄰士科路99號四樓,63,6301200,6301200-001,10鄰,士科路,,,,,,99號四樓,121.514122810865,25.104142610385
臺北市北投區建民里10鄰士科路99號五樓,63,6301200,6301200-001,10鄰,士科路,,,,,,99號五樓,121.514122810865,25.104142610385
臺北市北投區建民里10鄰士科路99號六樓,63,6301200,6301200-001,10鄰,士科路,,,,,,99號六樓,121.514122810865,25.104142610385
臺北市北投區建民里10鄰士科路99號七樓,63,6301200,6301200-001,10鄰,士科路,,,,,,99號七樓,121.514122810865,25.104142610385
臺北市北投區建民里10鄰士科路99號八樓,63,6301200,6301200-001,10鄰,士科路,,,,,,99號八樓,121.514122810865,25.104142610385
臺北市北投區建民里10鄰士科路99號九樓,63,6301200,6301200-001,10鄰,士科路,,,,,,99號九樓,121.514122810865,25.104142610385
臺北市北投區建民里10鄰士科路99號十樓,63,6301200,6301200-001,10鄰,士科路,,,,,,99號十樓,121.514122810865,25.104142610385
臺北市北投區建民里10鄰士科路99號十一樓,63,6301200,6301200-001,10鄰,士科路,,,,,,99號十一樓,121.514122810865,25.104142610385
