FULL_ADDR,COUNTY,TOWN,VILLAGE,NEIGHBORHOOD,ROAD,SECTION,LANE,ALLEY,SUB_ALLEY,TONG,NUMBER,X,Y
臺北市文山區景行里2鄰車前路17號十九樓,63,6300800,6300800-001,2鄰,車前路,,,,,,17號十九樓,121.540696970751,24.9912320260529
臺北市文山區景行里2鄰車前路17號二十樓,63,6300800,6300800-001,2鄰,車前路,,,,,,17號二十樓,121.540696970751,24.9912320260529
臺北市文山區景行里2鄰車前路17號二十一樓,63,6300800,6300800-001,2鄰,車前路,,,,,,17號二十一樓,121.540696970751,24.9912320260529
臺北市文山區景行里2鄰車前路17號二十二樓,63,6300800,6300800-001,2鄰,車前路,,,,,,17號二十二樓,121.540696970751,24.9912320260529
臺北市文山區景行里2鄰車前路17號二十三樓,63,6300800,6300800-001,2鄰,車前路,,,,,,17號二十三樓,121.540696970751,24.9912320260529
臺北市文山區景行里2鄰車前路17號二十四樓,63,6300800,6300800-001,2鄰,車前路,,,,,,17號二十四樓,121.540696970751,24.9912320260529
臺北市文山區景行里2鄰車前路17號二十五樓,63,6300800,6300800-001,2鄰,車前路,,,,,,17號二十五樓,121.540696970751,24.9912320260529
臺北市文山區景行里2鄰車前路17號二十六樓,63,6300800,6300800-001,2鄰,車前路,,,,,,17號二十六樓,121.540696970751,24.9912320260529
臺北市文山區景行里2鄰車前路17號二十七樓,63,6300800,6300800-001,2鄰,車前路,,,,,,17號二十七樓,121.540696970751,24.9912320260529
臺北市文山區景行里2鄰車前路17號二十八樓,63,6300800,6300800-001,2鄰,車前路,,,,,,17號二十八樓,121.540696970751,24.9912320260529
臺北市文山區景行里2鄰車前路17號二十九樓,63,6300800,6300800-001,2鄰,車前路,,,,,,17號二十九樓,121.540696970751,24.9912320260529
臺北市文山區景行里2鄰車前路19號五樓,63,6300800,6300800-001,2鄰,車前路,,,,,,19號五樓,121.540769901082,24.9911278528563
臺北市文山區景行里2鄰車前路19號六樓,63,6300800,6300800-001,2鄰,車前路,,,,,,19號六樓,121.540769901082,24.9911278528563
臺北市文山區景行里2鄰車前路19號七樓,63,6300800,6300800-001,2鄰,車前路,,,,,,19號七樓,121.540769901082,24.9911278528563
臺北市文山區景行里2鄰車前路19號八樓,63,6300800,6300800-001,2鄰,車前路,,,,,,19號八樓,121.540769901082,24.9911278528563
臺北市文山區景行里2鄰車前路19號九樓,63,6300800,6300800-001,2鄰,車前路,,,,,,19號九樓,121.540769901082,24.9911278528563
臺北市文山區景行里2鄰車前路19號十樓,63,6300800,6300800-001,2鄰,車前路,,,,,,19號十樓,121.540769901082,24.9911278528563
臺北市文山區景行里2鄰車前路19號十一樓,63,6300800,6300800-001,2鄰,車前路,,,,,,19號十一樓,121.540769901082,24.9911278528563
臺北市文山區景行里2鄰車前路19號十二樓,63,6300800,6300800-001,2鄰,車前路,,,,,,19號十二樓,121.540769901082,24.9911278528563
臺北市文山區景行里2鄰車前路19號十三樓,63,6300800,6300800-001,2鄰,車前路,,,,,,19號十三樓,121.540769901082,24.9911278528563
臺北市文山區景行里2鄰車前路19號十四樓,63,6300800,6300800-001,2鄰,車前路,,,,,,19號十四樓,121.540769901082,24.9911278528563
臺北市文山區景行里2鄰車前路19號十五樓,63,6300800,6300800-001,2鄰,車前路,,,,,,19號十五樓,121.540769901082,24.9911278528563
臺北市文山區景行里2鄰車前路19號十六樓,63,6300800,6300800-001,2鄰,車前路,,,,,,19號十六樓,121.540769901082,24.9911278528563
臺北市文山區景行里2鄰車前路19號十七樓,63,6300800,6300800-001,2鄰,車前路,,,,,,19號十七樓,121.540769901082,24.9911278528563
臺北市文山區景行里2鄰車前路19號十八樓,63,6300800,6300800-001,2鄰,車前路,,,,,,19號十八樓,121.540769901082,24.9911278528563
臺北市文山區景行里2鄰車前路19號十九樓,63,6300800,6300800-001,2鄰,車前路,,,,,,19號十九樓,121.540769901082,24.9911278528563
臺北市文山區景行里2鄰車前路19號二十樓,63,6300800,6300800-001,2鄰,車前路,,,,,,19號二十樓,121.540769901082,24.9911278528563
臺北市文山區景行里2鄰車前路19號二十一樓,63,6300800,6300800-001,2鄰,車前路,,,,,,19號二十一樓,121.540769901082,24.9911278528563
臺北市文山區景行里2鄰車前路19號二十二樓,63,6300800,6300800-001,2鄰,車前路,,,,,,19號二十二樓,121.540769901082,24.9911278528563
臺北市文山區景行里2鄰車前路19號二十三樓,63,6300800,6300800-001,2鄰,車前路,,,,,,19號二十三樓,121.540769901082,24.9911278528563
臺北市文山區景行里2鄰車前路19號二十四樓,63,6300800,6300800-001,2鄰,車前路,,,,,,19號二十四樓,121.540769901082,24.9911278528563
臺北市文山區景行里2鄰車前路19號二十五樓,63,6300800,6300800-001,2鄰,車前路,,,,,,19號二十五樓,121.540769901082,24.9911278528563
臺北市文山區景行里2鄰車前路19號二十六樓,63,6300800,6300800-001,2鄰,車前路,,,,,,19號二十六樓,121.540769901082,24.9911278528563
臺北市文山區景行里2鄰車前路19號二十七樓,63,6300800,6300800-001,2鄰,車前路,,,,,,19號二十七樓,121.540769901082,24.9911278528563
臺北市文山區景行里2鄰車前路21號五樓,63,6300800,6300800-001,2鄰,車前路,,,,,,21號五樓,121.540670390899,24.991147324014
臺北市文山區景行里2鄰車前路21號六樓,63,6300800,6300800-001,2鄰,車前路,,,,,,21號六樓,121.540670390899,24.991147324014
臺北市文山區景行里2鄰車前路21號七樓,63,6300800,6300800-001,2鄰,車前路,,,,,,21號七樓,121.540670390899,24.991147324014
臺北市文山區景行里2鄰車前路21號八樓,63,6300800,6300800-001,2鄰,車前路,,,,,,21號八樓,121.540670390899,24.991147324014
臺北市文山區景行里2鄰車前路21號九樓,63,6300800,6300800-001,2鄰,車前路,,,,,,21號九樓,121.540670390899,24.991147324014
臺北市文山區景行里2鄰車前路21號十樓,63,6300800,6300800-001,2鄰,車前路,,,,,,21號十樓,121.540670390899,24.991147324014
臺北市文山區景行里2鄰車前路21號十一樓,63,6300800,6300800-001,2鄰,車前路,,,,,,21號十一樓,121.540670390899,24.991147324014
臺北市文山區景行里2鄰車前路21號十二樓,63,6300800,6300800-001,2鄰,車前路,,,,,,21號十二樓,121.540670390899,24.991147324014
臺北市文山區景行里2鄰車前路21號十三樓,63,6300800,6300800-001,2鄰,車前路,,,,,,21號十三樓,121.540670390899,24.991147324014
臺北市文山區景行里2鄰車前路21號十四樓,63,6300800,6300800-001,2鄰,車前路,,,,,,21號十四樓,121.540670390899,24.991147324014
臺北市文山區景行里2鄰車前路21號十五樓,63,6300800,6300800-001,2鄰,車前路,,,,,,21號十五樓,121.540670390899,24.991147324014
臺北市文山區景行里2鄰車前路21號十六樓,63,6300800,6300800-001,2鄰,車前路,,,,,,21號十六樓,121.540670390899,24.991147324014
臺北市文山區景行里2鄰車前路21號十七樓,63,6300800,6300800-001,2鄰,車前路,,,,,,21號十七樓,121.540670390899,24.991147324014
臺北市文山區景行里2鄰車前路21號十八樓,63,6300800,6300800-001,2鄰,車前路,,,,,,21號十八樓,121.540670390899,24.991147324014
臺北市文山區景行里2鄰車前路21號十九樓,63,6300800,6300800-001,2鄰,車前路,,,,,,21號十九樓,121.540670390899,24.991147324014
臺北市文山區景行里2鄰車前路21號二十樓,63,6300800,6300800-001,2鄰,車前路,,,,,,21號二十樓,121.540670390899,24.991147324014
臺北市文山區景行里2鄰車前路21號二十一樓,63,6300800,6300800-001,2鄰,車前路,,,,,,21號二十一樓,121.540670390899,24.991147324014
臺北市文山區景行里2鄰車前路21號二十二樓,63,6300800,6300800-001,2鄰,車前路,,,,,,21號二十二樓,121.540670390899,24.991147324014
臺北市文山區景行里2鄰車前路21號二十三樓,63,6300800,6300800-001,2鄰,車前路,,,,,,21號二十三樓,121.540670390899,24.991147324014
臺北市文山區景行里2鄰車前路21號二十四樓,63,6300800,6300800-001,2鄰,車前路,,,,,,21號二十四樓,121.540670390899,24.991147324014
臺北市文山區景行里2鄰車前路21號二十五樓,63,6300800,6300800-001,2鄰,車前路,,,,,,21號二十五樓,121.540670390899,24.991147324014
臺北市文山區景行里2鄰車前路21號二十六樓,63,6300800,6300800-001,2鄰,車前路,,,,,,21號二十六樓,121.540670390899,24.991147324014
臺北市文山區景行里2鄰車前路21號二十七樓,63,6300800,6300800-001,2鄰,車前路,,,,,,21號二十七樓,121.540670390899,24.991147324014
臺北市文山區景行里2鄰車前路25號,63,6300800,6300800-001,2鄰,車前路,,,,,,25號,121.540554633743,24.9914260553432
臺北市文山區景行里2鄰車前路27號,63,6300800,6300800-001,2鄰,車前路,,,,,,27號,121.540528253843,24.9912721906467
臺北市文山區景行里2鄰車前路31號,63,6300800,6300800-001,2鄰,車前路,,,,,,31號,121.540360137988,24.9912388450017
