FULL_ADDR,COUNTY,TOWN,VILLAGE,NEIGHBORHOOD,ROAD,SECTION,LANE,ALLEY,SUB_ALLEY,TONG,NUMBER,X,Y
高雄市鳥松區鳥松里43鄰大仁東路1號,64,6401800,6401800-001,43鄰,大仁東路,,,,,,1號,120.362800693241,22.6614014621099
高雄市鳥松區鳥松里43鄰大仁東路2號十樓,64,6401800,6401800-001,43鄰,大仁東路,,,,,,2號十樓,120.362675651733,22.6609813069809
高雄市鳥松區鳥松里43鄰大仁東路2號十樓之1,64,6401800,6401800-001,43鄰,大仁東路,,,,,,2號十樓之1,120.362675651733,22.6609813069809
高雄市鳥松區鳥松里43鄰大仁東路2號二樓,64,6401800,6401800-001,43鄰,大仁東路,,,,,,2號二樓,120.362675651733,22.6609813069809
高雄市鳥松區鳥松里43鄰大仁東路2號二樓之1,64,6401800,6401800-001,43鄰,大仁東路,,,,,,2號二樓之1,120.362675651733,22.6609813069809
高雄市鳥松區鳥松里43鄰大仁東路2號二樓之2,64,6401800,6401800-001,43鄰,大仁東路,,,,,,2號二樓之2,120.362675651733,22.6609813069809
高雄市鳥松區鳥松里43鄰大仁東路2號二樓之3,64,6401800,6401800-001,43鄰,大仁東路,,,,,,2號二樓之3,120.362675651733,22.6609813069809
高雄市鳥松區鳥松里43鄰大仁東路2號三樓,64,6401800,6401800-001,43鄰,大仁東路,,,,,,2號三樓,120.362675651733,22.6609813069809
高雄市鳥松區鳥松里43鄰大仁東路2號三樓之1,64,6401800,6401800-001,43鄰,大仁東路,,,,,,2號三樓之1,120.362675651733,22.6609813069809
高雄市鳥松區鳥松里43鄰大仁東路2號三樓之2,64,6401800,6401800-001,43鄰,大仁東路,,,,,,2號三樓之2,120.362675651733,22.6609813069809
高雄市鳥松區鳥松里43鄰大仁東路2號三樓之3,64,6401800,6401800-001,43鄰,大仁東路,,,,,,2號三樓之3,120.362675651733,22.6609813069809
高雄市鳥松區鳥松里43鄰大仁東路2號四樓,64,6401800,6401800-001,43鄰,大仁東路,,,,,,2號四樓,120.362675651733,22.6609813069809
高雄市鳥松區鳥松里43鄰大仁東路2號四樓之1,64,6401800,6401800-001,43鄰,大仁東路,,,,,,2號四樓之1,120.362675651733,22.6609813069809
高雄市鳥松區鳥松里43鄰大仁東路2號四樓之2,64,6401800,6401800-001,43鄰,大仁東路,,,,,,2號四樓之2,120.362675651733,22.6609813069809
高雄市鳥松區鳥松里43鄰大仁東路2號四樓之3,64,6401800,6401800-001,43鄰,大仁東路,,,,,,2號四樓之3,120.362675651733,22.6609813069809
高雄市鳥松區鳥松里43鄰大仁東路2號五樓,64,6401800,6401800-001,43鄰,大仁東路,,,,,,2號五樓,120.362675651733,22.6609813069809
高雄市鳥松區鳥松里43鄰大仁東路2號五樓之1,64,6401800,6401800-001,43鄰,大仁東路,,,,,,2號五樓之1,120.362675651733,22.6609813069809
高雄市鳥松區鳥松里43鄰大仁東路2號五樓之2,64,6401800,6401800-001,43鄰,大仁東路,,,,,,2號五樓之2,120.362675651733,22.6609813069809
高雄市鳥松區鳥松里43鄰大仁東路2號五樓之3,64,6401800,6401800-001,43鄰,大仁東路,,,,,,2號五樓之3,120.362675651733,22.6609813069809
高雄市鳥松區鳥松里43鄰大仁東路2號六樓,64,6401800,6401800-001,43鄰,大仁東路,,,,,,2號六樓,120.362675651733,22.6609813069809
高雄市鳥松區鳥松里43鄰大仁東路2號六樓之1,64,6401800,6401800-001,43鄰,大仁東路,,,,,,2號六樓之1,120.362675651733,22.6609813069809
高雄市鳥松區鳥松里43鄰大仁東路2號六樓之2,64,6401800,6401800-001,43鄰,大仁東路,,,,,,2號六樓之2,120.362675651733,22.6609813069809
高雄市鳥松區鳥松里43鄰大仁東路2號六樓之3,64,6401800,6401800-001,43鄰,大仁東路,,,,,,2號六樓之3,120.362675651733,22.6609813069809
高雄市鳥松區鳥松里43鄰大仁東路2號七樓,64,6401800,6401800-001,43鄰,大仁東路,,,,,,2號七樓,120.362675651733,22.6609813069809
高雄市鳥松區鳥松里43鄰大仁東路2號七樓之1,64,6401800,6401800-001,43鄰,大仁東路,,,,,,2號七樓之1,120.362675651733,22.6609813069809
高雄市鳥松區鳥松里43鄰大仁東路2號七樓之2,64,6401800,6401800-001,43鄰,大仁東路,,,,,,2號七樓之2,120.362675651733,22.6609813069809
高雄市鳥松區鳥松里43鄰大仁東路2號七樓之3,64,6401800,6401800-001,43鄰,大仁東路,,,,,,2號七樓之3,120.362675651733,22.6609813069809
高雄市鳥松區鳥松里43鄰大仁東路2號八樓,64,6401800,6401800-001,43鄰,大仁東路,,,,,,2號八樓,120.362675651733,22.6609813069809
高雄市鳥松區鳥松里43鄰大仁東路2號八樓之1,64,6401800,6401800-001,43鄰,大仁東路,,,,,,2號八樓之1,120.362675651733,22.6609813069809
高雄市鳥松區鳥松里43鄰大仁東路2號八樓之2,64,6401800,6401800-001,43鄰,大仁東路,,,,,,2號八樓之2,120.362675651733,22.6609813069809
高雄市鳥松區鳥松里43鄰大仁東路2號八樓之3,64,6401800,6401800-001,43鄰,大仁東路,,,,,,2號八樓之3,120.362675651733,22.6609813069809
高雄市鳥松區鳥松里43鄰大仁東路2號九樓,64,6401800,6401800-001,43鄰,大仁東路,,,,,,2號九樓,120.362675651733,22.6609813069809
高雄市鳥松區鳥松里43鄰大仁東路2號九樓之1,64,6401800,6401800-001,43鄰,大仁東路,,,,,,2號九樓之1,120.362675651733,22.6609813069809
高雄市鳥松區鳥松里43鄰大仁東路3號,64,6401800,6401800-001,43鄰,大仁東路,,,,,,3號,120.362854142179,22.6613951725397
高雄市鳥松區鳥松里43鄰大仁東路4號,64,6401800,6401800-001,43鄰,大仁東路,,,,,,4號,120.362769333738,22.6609648824351
高雄市鳥松區鳥松里43鄰大仁東路5號,64,6401800,6401800-001,43鄰,大仁東路,,,,,,5號,120.36289826469,22.6613856851134
高雄市鳥松區鳥松里43鄰大仁東路6號,64,6401800,6401800-001,43鄰,大仁東路,,,,,,6號,120.362649036541,22.6611820444455
高雄市鳥松區鳥松里43鄰大仁東路6之1號,64,6401800,6401800-001,43鄰,大仁東路,,,,,,6之1號,120.362612116102,22.6611911992256
高雄市鳥松區鳥松里43鄰大仁東路7號,64,6401800,6401800-001,43鄰,大仁東路,,,,,,7號,120.362950545575,22.6613794811735
高雄市鳥松區鳥松里43鄰大仁東路8號,64,6401800,6401800-001,43鄰,大仁東路,,,,,,8號,120.362688494753,22.6611711839131
高雄市鳥松區鳥松里43鄰大仁東路9號,64,6401800,6401800-001,43鄰,大仁東路,,,,,,9號,120.363127032413,22.6613632953236
高雄市鳥松區鳥松里43鄰大仁東路10號,64,6401800,6401800-001,43鄰,大仁東路,,,,,,10號,120.362726693453,22.6611591443672
高雄市鳥松區鳥松里43鄰大仁東路12號,64,6401800,6401800-001,43鄰,大仁東路,,,,,,12號,120.362773071772,22.6611457827339
高雄市鳥松區鳥松里43鄰大仁東路12號三樓之1,64,6401800,6401800-001,43鄰,大仁東路,,,,,,12號三樓之1,120.362773071772,22.6611457827339
高雄市鳥松區鳥松里43鄰大仁東路14號,64,6401800,6401800-001,43鄰,大仁東路,,,,,,14號,120.362808345143,22.6611350861428
高雄市鳥松區鳥松里43鄰大仁東路16號,64,6401800,6401800-001,43鄰,大仁東路,,,,,,16號,120.362853171618,22.6611206346276
高雄市鳥松區鳥松里43鄰大仁東路18號,64,6401800,6401800-001,43鄰,大仁東路,,,,,,18號,120.362892641053,22.6611073357929
