FULL_ADDR,COUNTY,TOWN,VILLAGE,NEIGHBORHOOD,ROAD,SECTION,LANE,ALLEY,SUB_ALLEY,TONG,NUMBER,X,Y
高雄市路竹區北嶺里10鄰北嶺二路1號,64,6402400,6402400-005,10鄰,北嶺二路,,,,,,1號,120.275394455407,22.8242936723331
高雄市路竹區北嶺里10鄰北嶺二路11之1號,64,6402400,6402400-005,10鄰,北嶺二路,,,,,,11之1號,120.271514026963,22.8258812255998
高雄市路竹區北嶺里10鄰北嶺二路11號,64,6402400,6402400-005,10鄰,北嶺二路,,,,,,11號,120.272619258126,22.8251257691906
高雄市路竹區北嶺里10鄰北嶺二路18號,64,6402400,6402400-005,10鄰,北嶺二路,,,,,,18號,120.270412783737,22.8277323167617
高雄市路竹區北嶺里10鄰北嶺二路22號,64,6402400,6402400-005,10鄰,北嶺二路,,,,,,22號,120.269240692444,22.8287935993491
