FULL_ADDR,COUNTY,TOWN,VILLAGE,NEIGHBORHOOD,ROAD,SECTION,LANE,ALLEY,SUB_ALLEY,TONG,NUMBER,X,Y
高雄市楠梓區宏榮里22鄰創意北路1號,64,6400400,6400400-017,22鄰,創意北路,,,,,,1號,120.301033245346,22.714600731969
高雄市楠梓區宏榮里22鄰創意北路1號二樓,64,6400400,6400400-017,22鄰,創意北路,,,,,,1號二樓,120.301033245346,22.714600731969
高雄市楠梓區宏榮里22鄰創意北路1號三樓,64,6400400,6400400-017,22鄰,創意北路,,,,,,1號三樓,120.301033245346,22.714600731969
高雄市楠梓區宏榮里22鄰創意北路1號四樓,64,6400400,6400400-017,22鄰,創意北路,,,,,,1號四樓,120.301033245346,22.714600731969
高雄市楠梓區宏榮里22鄰創意北路1號五樓,64,6400400,6400400-017,22鄰,創意北路,,,,,,1號五樓,120.301033245346,22.714600731969
高雄市楠梓區宏榮里22鄰創意北路1號六樓,64,6400400,6400400-017,22鄰,創意北路,,,,,,1號六樓,120.301033245346,22.714600731969
高雄市楠梓區宏榮里22鄰創意北路1號七樓,64,6400400,6400400-017,22鄰,創意北路,,,,,,1號七樓,120.301033245346,22.714600731969
高雄市楠梓區宏榮里22鄰創意北路1號八樓,64,6400400,6400400-017,22鄰,創意北路,,,,,,1號八樓,120.301033245346,22.714600731969
高雄市楠梓區宏榮里22鄰創意北路1號九樓,64,6400400,6400400-017,22鄰,創意北路,,,,,,1號九樓,120.301033245346,22.714600731969
