FULL_ADDR,COUNTY,TOWN,VILLAGE,NEIGHBORHOOD,ROAD,SECTION,LANE,ALLEY,SUB_ALLEY,TONG,NUMBER,X,Y
高雄市燕巢區西燕里18鄰工程路1號,64,6402100,6402100-009,18鄰,工程路,,,,,,1號,120.35646286267,22.8034071195453
高雄市燕巢區西燕里18鄰工程路8號,64,6402100,6402100-009,18鄰,工程路,,,,,,8號,120.357200480725,22.8014811670821
高雄市燕巢區西燕里18鄰工程路100之20號,64,6402100,6402100-009,18鄰,工程路,,,,,,100之20號,120.344563820687,22.8081778891815
高雄市燕巢區西燕里18鄰工程路100號,64,6402100,6402100-009,18鄰,工程路,,,,,,100號,120.344180215685,22.8110500992317
高雄市燕巢區西燕里18鄰工程路100之10號,64,6402100,6402100-009,18鄰,工程路,,,,,,100之10號,120.34466283288,22.8102455668928
高雄市燕巢區西燕里18鄰工程路100之60號(農業資材室不得設籍),64,6402100,6402100-009,18鄰,工程路,,,,,,100之60號(農業資材室不得設籍),120.337660302671,22.8088719799254
