FULL_ADDR,COUNTY,TOWN,VILLAGE,NEIGHBORHOOD,ROAD,SECTION,LANE,ALLEY,SUB_ALLEY,TONG,NUMBER,X,Y
高雄市三民區寶珠里6鄰正忠路455巷4弄14號,64,6400500,6400500-029,6鄰,正忠路,,455巷,4弄,,,14號,120.330234876845,22.6503572203168
高雄市三民區寶珠里6鄰正忠路455巷4弄15號,64,6400500,6400500-029,6鄰,正忠路,,455巷,4弄,,,15號,120.330089811728,22.6503746754774
高雄市三民區寶珠里6鄰正忠路455巷6弄1號,64,6400500,6400500-029,6鄰,正忠路,,455巷,6弄,,,1號,120.32990703872,22.6507441790171
高雄市三民區寶珠里6鄰正忠路455巷6弄2之1號,64,6400500,6400500-029,6鄰,正忠路,,455巷,6弄,,,2之1號,120.330035087949,22.6506182755321
高雄市三民區寶珠里6鄰正忠路455巷6弄3號,64,6400500,6400500-029,6鄰,正忠路,,455巷,6弄,,,3號,120.329901332547,22.6507170630759
高雄市三民區寶珠里6鄰正忠路455巷6弄5號,64,6400500,6400500-029,6鄰,正忠路,,455巷,6弄,,,5號,120.329896643141,22.65068092069
高雄市三民區寶珠里6鄰正忠路455巷6弄6號,64,6400500,6400500-029,6鄰,正忠路,,455巷,6弄,,,6號,120.330023660893,22.6505730833216
高雄市三民區寶珠里6鄰正忠路455巷6弄7號,64,6400500,6400500-029,6鄰,正忠路,,455巷,6弄,,,7號,120.329892926677,22.6506447823715
高雄市三民區寶珠里6鄰正忠路455巷6弄8號,64,6400500,6400500-029,6鄰,正忠路,,455巷,6弄,,,8號,120.330014194394,22.6505188595789
高雄市三民區寶珠里6鄰正忠路455巷6弄9號,64,6400500,6400500-029,6鄰,正忠路,,455巷,6弄,,,9號,120.329883328751,22.6506176501589
高雄市三民區寶珠里6鄰正忠路455巷6弄11號,64,6400500,6400500-029,6鄰,正忠路,,455巷,6弄,,,11號,120.329877666412,22.6505815037046
高雄市三民區寶珠里6鄰正忠路455巷6弄13號,64,6400500,6400500-029,6鄰,正忠路,,455巷,6弄,,,13號,120.329868068494,22.6505543714911
高雄市三民區寶珠里6鄰正忠路455巷6弄15號,64,6400500,6400500-029,6鄰,正忠路,,455巷,6弄,,,15號,120.329862396432,22.6505182249954
高雄市三民區寶珠里6鄰正忠路455巷6弄17號,64,6400500,6400500-029,6鄰,正忠路,,455巷,6弄,,,17號,120.329857663215,22.6504911131201
高雄市三民區寶珠里6鄰正忠路455巷6弄19號,64,6400500,6400500-029,6鄰,正忠路,,455巷,6弄,,,19號,120.329849082072,22.650454954461
高雄市三民區寶珠里6鄰正忠路455巷6弄21號,64,6400500,6400500-029,6鄰,正忠路,,455巷,6弄,,,21號,120.329844392686,22.650418812073
高雄市三民區寶珠里33鄰正忠路455號,64,6400500,6400500-029,33鄰,正忠路,,,,,,455號,120.330326066653,22.6506312043303
高雄市三民區寶珠里33鄰正忠路455之1號,64,6400500,6400500-029,33鄰,正忠路,,,,,,455之1號,120.330331251237,22.6503485922993
高雄市三民區寶珠里33鄰正忠路455之2號,64,6400500,6400500-029,33鄰,正忠路,,,,,,455之2號,120.330349518091,22.6503938220974
高雄市三民區寶珠里33鄰正忠路455之2號二樓,64,6400500,6400500-029,33鄰,正忠路,,,,,,455之2號二樓,120.330349518091,22.6503938220974
高雄市三民區寶珠里33鄰正忠路455之2號三樓,64,6400500,6400500-029,33鄰,正忠路,,,,,,455之2號三樓,120.330349518091,22.6503938220974
高雄市三民區寶珠里33鄰正忠路455之2號四樓,64,6400500,6400500-029,33鄰,正忠路,,,,,,455之2號四樓,120.330349518091,22.6503938220974
高雄市三民區寶珠里33鄰正忠路455之2號五樓,64,6400500,6400500-029,33鄰,正忠路,,,,,,455之2號五樓,120.330349518091,22.6503938220974
高雄市三民區寶珠里33鄰正忠路455之3號,64,6400500,6400500-029,33鄰,正忠路,,,,,,455之3號,120.330367784956,22.6504390518934
高雄市三民區寶珠里33鄰正忠路455之3號二樓,64,6400500,6400500-029,33鄰,正忠路,,,,,,455之3號二樓,120.330367784956,22.6504390518934
高雄市三民區寶珠里33鄰正忠路455之3號三樓,64,6400500,6400500-029,33鄰,正忠路,,,,,,455之3號三樓,120.330367784956,22.6504390518934
高雄市三民區寶珠里33鄰正忠路455之3號四樓,64,6400500,6400500-029,33鄰,正忠路,,,,,,455之3號四樓,120.330367784956,22.6504390518934
高雄市三民區寶珠里33鄰正忠路455之3號五樓,64,6400500,6400500-029,33鄰,正忠路,,,,,,455之3號五樓,120.330367784956,22.6504390518934
高雄市三民區寶珠里33鄰正忠路455之4號,64,6400500,6400500-029,33鄰,正忠路,,,,,,455之4號,120.330400436693,22.650529495262
高雄市三民區寶珠里33鄰正忠路455之5號,64,6400500,6400500-029,33鄰,正忠路,,,,,,455之5號,120.330386051833,22.6504842816874
高雄市三民區寶珠里8鄰正忠路456號,64,6400500,6400500-029,8鄰,正忠路,,,,,,456號,120.330509033998,22.6498521048143
高雄市三民區寶珠里33鄰正忠路457號,64,6400500,6400500-029,33鄰,正忠路,,,,,,457號,120.330377204803,22.6506273180437
高雄市三民區寶珠里33鄰正忠路459號,64,6400500,6400500-029,33鄰,正忠路,,,,,,459號,120.330393985936,22.6506559070875
高雄市三民區寶珠里8鄰正忠路460號,64,6400500,6400500-029,8鄰,正忠路,,,,,,460號,120.330557006891,22.6499431359297
高雄市三民區寶珠里33鄰正忠路461號,64,6400500,6400500-029,33鄰,正忠路,,,,,,461號,120.33041525925,22.6506830880457
高雄市三民區寶珠里8鄰正忠路462號,64,6400500,6400500-029,8鄰,正忠路,,,,,,462號,120.330570409048,22.6499883544184
高雄市三民區寶珠里33鄰正忠路463號,64,6400500,6400500-029,33鄰,正忠路,,,,,,463號,120.330436532572,22.6507102690012
高雄市三民區寶珠里8鄰正忠路464號,64,6400500,6400500-029,8鄰,正忠路,,,,,,464號,120.330580936227,22.6500245211715
高雄市三民區寶珠里33鄰正忠路465號,64,6400500,6400500-029,33鄰,正忠路,,,,,,465號,120.330456832961,22.6507374458897
高雄市三民區寶珠里8鄰正忠路466號,64,6400500,6400500-029,8鄰,正忠路,,,,,,466號,120.330587571668,22.6500606716707
高雄市三民區寶珠里33鄰正忠路467號,64,6400500,6400500-029,33鄰,正忠路,,,,,,467號,120.330476160418,22.6507646187117
高雄市三民區寶珠里8鄰正忠路468號,64,6400500,6400500-029,8鄰,正忠路,,,,,,468號,120.33059713565,22.6500968343999
高雄市三民區寶珠里33鄰正忠路469號,64,6400500,6400500-029,33鄰,正忠路,,,,,,469號,120.330493551729,22.6507917834442
高雄市三民區寶珠里8鄰正忠路470號,64,6400500,6400500-029,8鄰,正忠路,,,,,,470號,120.330611598366,22.6501239868899
高雄市三民區寶珠里33鄰正忠路471號,64,6400500,6400500-029,33鄰,正忠路,,,,,,471號,120.330520662732,22.6508189887728
高雄市三民區寶珠里8鄰正忠路472號,64,6400500,6400500-029,8鄰,正忠路,,,,,,472號,120.330621152629,22.6501601495771
高雄市三民區寶珠里33鄰正忠路473號,64,6400500,6400500-029,33鄰,正忠路,,,,,,473號,120.33054485492,22.650846181906
高雄市三民區寶珠里8鄰正忠路474號,64,6400500,6400500-029,8鄰,正忠路,,,,,,474號,120.330632652771,22.6501963203897
高雄市三民區寶珠里33鄰正忠路475巷1弄1號,64,6400500,6400500-029,33鄰,正忠路,,475巷,1弄,,,1號,120.330380909248,22.6509448437508
高雄市三民區寶珠里33鄰正忠路475巷1弄2號,64,6400500,6400500-029,33鄰,正忠路,,475巷,1弄,,,2號,120.330207010181,22.6510795595174
高雄市三民區寶珠里33鄰正忠路475巷1弄3號,64,6400500,6400500-029,33鄰,正忠路,,475巷,1弄,,,3號,120.330360608844,22.650917666853
高雄市三民區寶珠里33鄰正忠路475巷1弄4號,64,6400500,6400500-029,33鄰,正忠路,,475巷,1弄,,,4號,120.330179899192,22.6510523541368
高雄市三民區寶珠里33鄰正忠路475巷1弄5號,64,6400500,6400500-029,33鄰,正忠路,,475巷,1弄,,,5號,120.330320422875,22.650890126918
高雄市三民區寶珠里33鄰正忠路475巷1弄6號,64,6400500,6400500-029,33鄰,正忠路,,475巷,1弄,,,6號,120.330160654394,22.651016168992
高雄市三民區寶珠里33鄰正忠路475巷1弄7號,64,6400500,6400500-029,33鄰,正忠路,,475巷,1弄,,,7號,120.330308318269,22.6508542154511
高雄市三民區寶珠里33鄰正忠路475巷1弄8號,64,6400500,6400500-029,33鄰,正忠路,,475巷,1弄,,,8號,120.330135489312,22.6509889717363
高雄市三民區寶珠里33鄰正忠路475巷1弄9號,64,6400500,6400500-029,33鄰,正忠路,,475巷,1弄,,,9號,120.330283201789,22.6508270274519
高雄市三民區寶珠里33鄰正忠路475巷1弄10號,64,6400500,6400500-029,33鄰,正忠路,,475巷,1弄,,,10號,120.330111297182,22.6509617785432
高雄市三民區寶珠里33鄰正忠路475巷1弄11號,64,6400500,6400500-029,33鄰,正忠路,,475巷,1弄,,,11號,120.330263874362,22.6507998546075
高雄市三民區寶珠里33鄰正忠路475巷1弄12號,64,6400500,6400500-029,33鄰,正忠路,,475巷,1弄,,,12號,120.330087105061,22.6509345853466
高雄市三民區寶珠里33鄰正忠路475巷1弄13號,64,6400500,6400500-029,33鄰,正忠路,,475巷,1弄,,,13號,120.330244546943,22.6507726817609
高雄市三民區寶珠里33鄰正忠路475巷1弄14號,64,6400500,6400500-029,33鄰,正忠路,,475巷,1弄,,,14號,120.330064849104,22.650907400239
高雄市三民區寶珠里33鄰正忠路475巷1弄15號,64,6400500,6400500-029,33鄰,正忠路,,475巷,1弄,,,15號,120.330220388902,22.6507364580307
高雄市三民區寶珠里33鄰正忠路475巷1弄16號,64,6400500,6400500-029,33鄰,正忠路,,475巷,1弄,,,16號,120.330039684061,22.6508802029688
高雄市三民區寶珠里33鄰正忠路475巷1弄17號,64,6400500,6400500-029,33鄰,正忠路,,475巷,1弄,,,17號,120.330194250916,22.6507092567186
高雄市三民區寶珠里33鄰正忠路475巷1弄18號,64,6400500,6400500-029,33鄰,正忠路,,475巷,1弄,,,18號,120.330014562844,22.6508439751828
高雄市三民區寶珠里33鄰正忠路475巷1弄20號,64,6400500,6400500-029,33鄰,正忠路,,475巷,1弄,,,20號,120.32999620841,22.6508168063744
高雄市三民區寶珠里33鄰正忠路475巷1弄22號,64,6400500,6400500-029,33鄰,正忠路,,475巷,1弄,,,22號,120.330047546242,22.6506634901135
高雄市三民區寶珠里8鄰正忠路476號,64,6400500,6400500-029,8鄰,正忠路,,,,,,476號,120.330644152918,22.6502324912015
高雄市三民區寶珠里8鄰正忠路478號,64,6400500,6400500-029,8鄰,正忠路,,,,,,478號,120.330649815446,22.6502686376349
高雄市三民區寶珠里8鄰正忠路480號,64,6400500,6400500-029,8鄰,正忠路,,,,,,480號,120.330663261479,22.6503048165712
高雄市三民區寶珠里8鄰正忠路482號,64,6400500,6400500-029,8鄰,正忠路,,,,,,482號,120.330675778309,22.6503319699602
高雄市三民區寶珠里8鄰正忠路484號,64,6400500,6400500-029,8鄰,正忠路,,,,,,484號,120.330693082066,22.6503771956997
高雄市三民區寶珠里8鄰正忠路486號,64,6400500,6400500-029,8鄰,正忠路,,,,,,486號,120.330724882644,22.650440543363
高雄市三民區寶珠里8鄰正忠路488號,64,6400500,6400500-029,8鄰,正忠路,,,,,,488號,120.330747085164,22.650476758855
高雄市三民區寶珠里8鄰正忠路490號,64,6400500,6400500-029,8鄰,正忠路,,,,,,490號,120.330772206512,22.6505129865308
高雄市三民區寶珠里8鄰正忠路492號,64,6400500,6400500-029,8鄰,正忠路,,,,,,492號,120.330805994369,22.6505577753636
高雄市三民區寶珠里8鄰正忠路494號,64,6400500,6400500-029,8鄰,正忠路,,,,,,494號,120.330824404857,22.6505854500357
高雄市三民區寶珠里8鄰正忠路496號,64,6400500,6400500-029,8鄰,正忠路,,,,,,496號,120.330850499185,22.6506216817617
高雄市三民區寶珠里8鄰正忠路498號,64,6400500,6400500-029,8鄰,正忠路,,,,,,498號,120.330877522707,22.6506669480591
高雄市三民區寶珠里8鄰正忠路500號,64,6400500,6400500-029,8鄰,正忠路,,,,,,500號,120.330902653809,22.6507031847864
高雄市三民區寶珠里8鄰正忠路502號,64,6400500,6400500-029,8鄰,正忠路,,,,,,502號,120.330920920896,22.650748414523
高雄市三民區寶興里9鄰正忠路28號,64,6400500,6400500-019,9鄰,正忠路,,,,,,28號,120.330622459573,22.642870492086
高雄市三民區寶興里22鄰正忠路63號,64,6400500,6400500-019,22鄰,正忠路,,,,,,63號,120.330109503387,22.6422830245215
高雄市三民區寶興里22鄰正忠路65號,64,6400500,6400500-019,22鄰,正忠路,,,,,,65號,120.330119986122,22.6423282218441
高雄市三民區寶興里22鄰正忠路67號,64,6400500,6400500-019,22鄰,正忠路,,,,,,67號,120.330118804012,22.6423733704288
高雄市三民區寶興里22鄰正忠路69號,64,6400500,6400500-019,22鄰,正忠路,,,,,,69號,120.330139015534,22.6424186174286
高雄市三民區寶興里22鄰正忠路71號,64,6400500,6400500-019,22鄰,正忠路,,,,,,71號,120.330152416935,22.642463826943
高雄市三民區寶興里22鄰正忠路73號,64,6400500,6400500-019,22鄰,正忠路,,,,,,73號,120.330160997721,22.6424999856115
高雄市三民區寶興里22鄰正忠路75號,64,6400500,6400500-019,22鄰,正忠路,,,,,,75號,120.33017616975,22.6425813253396
高雄市三民區寶興里22鄰正忠路75號十樓之1,64,6400500,6400500-019,22鄰,正忠路,,,,,,75號十樓之1,120.33017616975,22.6425813253396
高雄市三民區寶興里22鄰正忠路75號十樓之2,64,6400500,6400500-019,22鄰,正忠路,,,,,,75號十樓之2,120.33017616975,22.6425813253396
高雄市三民區寶興里22鄰正忠路75號十樓之3,64,6400500,6400500-019,22鄰,正忠路,,,,,,75號十樓之3,120.33017616975,22.6425813253396
高雄市三民區寶興里22鄰正忠路75號十樓之4,64,6400500,6400500-019,22鄰,正忠路,,,,,,75號十樓之4,120.33017616975,22.6425813253396
高雄市三民區寶興里22鄰正忠路75號十樓之5,64,6400500,6400500-019,22鄰,正忠路,,,,,,75號十樓之5,120.33017616975,22.6425813253396
高雄市三民區寶興里22鄰正忠路75號十樓之6,64,6400500,6400500-019,22鄰,正忠路,,,,,,75號十樓之6,120.33017616975,22.6425813253396
高雄市三民區寶興里22鄰正忠路75號十樓之7,64,6400500,6400500-019,22鄰,正忠路,,,,,,75號十樓之7,120.33017616975,22.6425813253396
高雄市三民區寶興里22鄰正忠路75號二樓之1,64,6400500,6400500-019,22鄰,正忠路,,,,,,75號二樓之1,120.33017616975,22.6425813253396
高雄市三民區寶興里22鄰正忠路75號二樓之2,64,6400500,6400500-019,22鄰,正忠路,,,,,,75號二樓之2,120.33017616975,22.6425813253396
高雄市三民區寶興里22鄰正忠路75號三樓之1,64,6400500,6400500-019,22鄰,正忠路,,,,,,75號三樓之1,120.33017616975,22.6425813253396
高雄市三民區寶興里22鄰正忠路75號三樓之2,64,6400500,6400500-019,22鄰,正忠路,,,,,,75號三樓之2,120.33017616975,22.6425813253396
高雄市三民區寶興里22鄰正忠路75號三樓之3,64,6400500,6400500-019,22鄰,正忠路,,,,,,75號三樓之3,120.33017616975,22.6425813253396
高雄市三民區寶興里22鄰正忠路75號三樓之4,64,6400500,6400500-019,22鄰,正忠路,,,,,,75號三樓之4,120.33017616975,22.6425813253396
高雄市三民區寶興里22鄰正忠路75號三樓之5,64,6400500,6400500-019,22鄰,正忠路,,,,,,75號三樓之5,120.33017616975,22.6425813253396
高雄市三民區寶興里22鄰正忠路75號三樓之6,64,6400500,6400500-019,22鄰,正忠路,,,,,,75號三樓之6,120.33017616975,22.6425813253396
高雄市三民區寶興里22鄰正忠路75號三樓之7,64,6400500,6400500-019,22鄰,正忠路,,,,,,75號三樓之7,120.33017616975,22.6425813253396
高雄市三民區寶興里22鄰正忠路75號三樓之8,64,6400500,6400500-019,22鄰,正忠路,,,,,,75號三樓之8,120.33017616975,22.6425813253396
高雄市三民區寶興里22鄰正忠路75號四樓之1,64,6400500,6400500-019,22鄰,正忠路,,,,,,75號四樓之1,120.33017616975,22.6425813253396
高雄市三民區寶興里22鄰正忠路75號四樓之2,64,6400500,6400500-019,22鄰,正忠路,,,,,,75號四樓之2,120.33017616975,22.6425813253396
高雄市三民區寶興里22鄰正忠路75號四樓之3,64,6400500,6400500-019,22鄰,正忠路,,,,,,75號四樓之3,120.33017616975,22.6425813253396
高雄市三民區寶興里22鄰正忠路75號四樓之4,64,6400500,6400500-019,22鄰,正忠路,,,,,,75號四樓之4,120.33017616975,22.6425813253396
高雄市三民區寶興里22鄰正忠路75號四樓之5,64,6400500,6400500-019,22鄰,正忠路,,,,,,75號四樓之5,120.33017616975,22.6425813253396
高雄市三民區寶興里22鄰正忠路75號四樓之6,64,6400500,6400500-019,22鄰,正忠路,,,,,,75號四樓之6,120.33017616975,22.6425813253396
高雄市三民區寶興里22鄰正忠路75號四樓之8,64,6400500,6400500-019,22鄰,正忠路,,,,,,75號四樓之8,120.33017616975,22.6425813253396
高雄市三民區寶興里22鄰正忠路75號五樓之1,64,6400500,6400500-019,22鄰,正忠路,,,,,,75號五樓之1,120.33017616975,22.6425813253396
高雄市三民區寶興里22鄰正忠路75號五樓之2,64,6400500,6400500-019,22鄰,正忠路,,,,,,75號五樓之2,120.33017616975,22.6425813253396
高雄市三民區寶興里22鄰正忠路75號五樓之3,64,6400500,6400500-019,22鄰,正忠路,,,,,,75號五樓之3,120.33017616975,22.6425813253396
高雄市三民區寶興里22鄰正忠路75號五樓之4,64,6400500,6400500-019,22鄰,正忠路,,,,,,75號五樓之4,120.33017616975,22.6425813253396
高雄市三民區寶興里22鄰正忠路75號五樓之5,64,6400500,6400500-019,22鄰,正忠路,,,,,,75號五樓之5,120.33017616975,22.6425813253396
高雄市三民區寶興里22鄰正忠路75號五樓之6,64,6400500,6400500-019,22鄰,正忠路,,,,,,75號五樓之6,120.33017616975,22.6425813253396
高雄市三民區寶興里22鄰正忠路75號五樓之7,64,6400500,6400500-019,22鄰,正忠路,,,,,,75號五樓之7,120.33017616975,22.6425813253396
高雄市三民區寶興里22鄰正忠路75號五樓之8,64,6400500,6400500-019,22鄰,正忠路,,,,,,75號五樓之8,120.33017616975,22.6425813253396
高雄市三民區寶興里22鄰正忠路75號六樓之1,64,6400500,6400500-019,22鄰,正忠路,,,,,,75號六樓之1,120.33017616975,22.6425813253396
高雄市三民區寶興里22鄰正忠路75號六樓之2,64,6400500,6400500-019,22鄰,正忠路,,,,,,75號六樓之2,120.33017616975,22.6425813253396
高雄市三民區寶興里22鄰正忠路75號六樓之3,64,6400500,6400500-019,22鄰,正忠路,,,,,,75號六樓之3,120.33017616975,22.6425813253396
高雄市三民區寶興里22鄰正忠路75號六樓之4,64,6400500,6400500-019,22鄰,正忠路,,,,,,75號六樓之4,120.33017616975,22.6425813253396
高雄市三民區寶興里22鄰正忠路75號六樓之5,64,6400500,6400500-019,22鄰,正忠路,,,,,,75號六樓之5,120.33017616975,22.6425813253396
高雄市三民區寶興里22鄰正忠路75號六樓之6,64,6400500,6400500-019,22鄰,正忠路,,,,,,75號六樓之6,120.33017616975,22.6425813253396
高雄市三民區寶興里22鄰正忠路75號六樓之7,64,6400500,6400500-019,22鄰,正忠路,,,,,,75號六樓之7,120.33017616975,22.6425813253396
高雄市三民區寶興里22鄰正忠路75號七樓之1,64,6400500,6400500-019,22鄰,正忠路,,,,,,75號七樓之1,120.33017616975,22.6425813253396
高雄市三民區寶興里22鄰正忠路75號七樓之2,64,6400500,6400500-019,22鄰,正忠路,,,,,,75號七樓之2,120.33017616975,22.6425813253396
高雄市三民區寶興里22鄰正忠路75號七樓之3,64,6400500,6400500-019,22鄰,正忠路,,,,,,75號七樓之3,120.33017616975,22.6425813253396
高雄市三民區寶興里22鄰正忠路75號七樓之4,64,6400500,6400500-019,22鄰,正忠路,,,,,,75號七樓之4,120.33017616975,22.6425813253396
高雄市三民區寶興里22鄰正忠路75號七樓之5,64,6400500,6400500-019,22鄰,正忠路,,,,,,75號七樓之5,120.33017616975,22.6425813253396
高雄市三民區寶興里22鄰正忠路75號七樓之6,64,6400500,6400500-019,22鄰,正忠路,,,,,,75號七樓之6,120.33017616975,22.6425813253396
高雄市三民區寶興里22鄰正忠路75號七樓之7,64,6400500,6400500-019,22鄰,正忠路,,,,,,75號七樓之7,120.33017616975,22.6425813253396
高雄市三民區寶興里22鄰正忠路75號八樓之1,64,6400500,6400500-019,22鄰,正忠路,,,,,,75號八樓之1,120.33017616975,22.6425813253396
高雄市三民區寶興里22鄰正忠路75號八樓之2,64,6400500,6400500-019,22鄰,正忠路,,,,,,75號八樓之2,120.33017616975,22.6425813253396
高雄市三民區寶興里22鄰正忠路75號八樓之3,64,6400500,6400500-019,22鄰,正忠路,,,,,,75號八樓之3,120.33017616975,22.6425813253396
高雄市三民區寶興里22鄰正忠路75號八樓之4,64,6400500,6400500-019,22鄰,正忠路,,,,,,75號八樓之4,120.33017616975,22.6425813253396
高雄市三民區寶興里22鄰正忠路75號八樓之5,64,6400500,6400500-019,22鄰,正忠路,,,,,,75號八樓之5,120.33017616975,22.6425813253396
高雄市三民區寶興里22鄰正忠路75號八樓之6,64,6400500,6400500-019,22鄰,正忠路,,,,,,75號八樓之6,120.33017616975,22.6425813253396
高雄市三民區寶興里22鄰正忠路75號八樓之7,64,6400500,6400500-019,22鄰,正忠路,,,,,,75號八樓之7,120.33017616975,22.6425813253396
高雄市三民區寶興里22鄰正忠路75號八樓之8,64,6400500,6400500-019,22鄰,正忠路,,,,,,75號八樓之8,120.33017616975,22.6425813253396
高雄市三民區寶興里22鄰正忠路75號九樓之1,64,6400500,6400500-019,22鄰,正忠路,,,,,,75號九樓之1,120.33017616975,22.6425813253396
高雄市三民區寶興里22鄰正忠路75號九樓之2,64,6400500,6400500-019,22鄰,正忠路,,,,,,75號九樓之2,120.33017616975,22.6425813253396
高雄市三民區寶興里22鄰正忠路75號九樓之3,64,6400500,6400500-019,22鄰,正忠路,,,,,,75號九樓之3,120.33017616975,22.6425813253396
高雄市三民區寶興里22鄰正忠路75號九樓之4,64,6400500,6400500-019,22鄰,正忠路,,,,,,75號九樓之4,120.33017616975,22.6425813253396
高雄市三民區寶興里22鄰正忠路75號九樓之5,64,6400500,6400500-019,22鄰,正忠路,,,,,,75號九樓之5,120.33017616975,22.6425813253396
高雄市三民區寶興里22鄰正忠路75號九樓之6,64,6400500,6400500-019,22鄰,正忠路,,,,,,75號九樓之6,120.33017616975,22.6425813253396
高雄市三民區寶興里22鄰正忠路75號九樓之7,64,6400500,6400500-019,22鄰,正忠路,,,,,,75號九樓之7,120.33017616975,22.6425813253396
高雄市三民區寶興里22鄰正忠路75號九樓之8,64,6400500,6400500-019,22鄰,正忠路,,,,,,75號九樓之8,120.33017616975,22.6425813253396
高雄市三民區寶興里22鄰正忠路75號十一樓之1,64,6400500,6400500-019,22鄰,正忠路,,,,,,75號十一樓之1,120.33017616975,22.6425813253396
高雄市三民區寶興里22鄰正忠路75號十一樓之2,64,6400500,6400500-019,22鄰,正忠路,,,,,,75號十一樓之2,120.33017616975,22.6425813253396
高雄市三民區寶興里22鄰正忠路75號十一樓之3,64,6400500,6400500-019,22鄰,正忠路,,,,,,75號十一樓之3,120.33017616975,22.6425813253396
高雄市三民區寶興里22鄰正忠路75號十一樓之4,64,6400500,6400500-019,22鄰,正忠路,,,,,,75號十一樓之4,120.33017616975,22.6425813253396
高雄市三民區寶興里22鄰正忠路75號十一樓之5,64,6400500,6400500-019,22鄰,正忠路,,,,,,75號十一樓之5,120.33017616975,22.6425813253396
高雄市三民區寶興里22鄰正忠路75號十一樓之6,64,6400500,6400500-019,22鄰,正忠路,,,,,,75號十一樓之6,120.33017616975,22.6425813253396
高雄市三民區寶興里22鄰正忠路75號十一樓之7,64,6400500,6400500-019,22鄰,正忠路,,,,,,75號十一樓之7,120.33017616975,22.6425813253396
高雄市三民區寶興里22鄰正忠路75號十一樓之8,64,6400500,6400500-019,22鄰,正忠路,,,,,,75號十一樓之8,120.33017616975,22.6425813253396
高雄市三民區寶興里22鄰正忠路75號十二樓之1,64,6400500,6400500-019,22鄰,正忠路,,,,,,75號十二樓之1,120.33017616975,22.6425813253396
高雄市三民區寶興里22鄰正忠路75號十二樓之2,64,6400500,6400500-019,22鄰,正忠路,,,,,,75號十二樓之2,120.33017616975,22.6425813253396
高雄市三民區寶興里22鄰正忠路75號十二樓之3,64,6400500,6400500-019,22鄰,正忠路,,,,,,75號十二樓之3,120.33017616975,22.6425813253396
高雄市三民區寶興里22鄰正忠路75號十二樓之4,64,6400500,6400500-019,22鄰,正忠路,,,,,,75號十二樓之4,120.33017616975,22.6425813253396
高雄市三民區寶興里22鄰正忠路75號十二樓之5,64,6400500,6400500-019,22鄰,正忠路,,,,,,75號十二樓之5,120.33017616975,22.6425813253396
高雄市三民區寶興里22鄰正忠路75號十二樓之6,64,6400500,6400500-019,22鄰,正忠路,,,,,,75號十二樓之6,120.33017616975,22.6425813253396
高雄市三民區寶興里22鄰正忠路75號十二樓之7,64,6400500,6400500-019,22鄰,正忠路,,,,,,75號十二樓之7,120.33017616975,22.6425813253396
高雄市三民區寶興里22鄰正忠路75號十二樓之8,64,6400500,6400500-019,22鄰,正忠路,,,,,,75號十二樓之8,120.33017616975,22.6425813253396
高雄市三民區寶興里22鄰正忠路77號,64,6400500,6400500-019,22鄰,正忠路,,,,,,77號,120.330190456486,22.6426445999583
高雄市三民區寶興里22鄰正忠路79號,64,6400500,6400500-019,22鄰,正忠路,,,,,,79號,120.330185416916,22.6426807017221
高雄市三民區寶興里22鄰正忠路81號,64,6400500,6400500-019,22鄰,正忠路,,,,,,81號,120.33019404151,22.642707829867
高雄市三民區寶興里22鄰正忠路83號,64,6400500,6400500-019,22鄰,正忠路,,,,,,83號,120.330200730067,22.6427349499231
高雄市三民區寶興里22鄰正忠路85號,64,6400500,6400500-019,22鄰,正忠路,,,,,,85號,120.330210239934,22.6427801522049
高雄市三民區寶興里22鄰正忠路85號二樓之1,64,6400500,6400500-019,22鄰,正忠路,,,,,,85號二樓之1,120.330210239934,22.6427801522049
高雄市三民區寶興里22鄰正忠路85號二樓之2,64,6400500,6400500-019,22鄰,正忠路,,,,,,85號二樓之2,120.330210239934,22.6427801522049
高雄市三民區寶興里22鄰正忠路85號三樓,64,6400500,6400500-019,22鄰,正忠路,,,,,,85號三樓,120.330210239934,22.6427801522049
高雄市三民區寶興里22鄰正忠路85號四樓,64,6400500,6400500-019,22鄰,正忠路,,,,,,85號四樓,120.330210239934,22.6427801522049
高雄市三民區寶興里22鄰正忠路85號五樓,64,6400500,6400500-019,22鄰,正忠路,,,,,,85號五樓,120.330210239934,22.6427801522049
