FULL_ADDR,COUNTY,TOWN,VILLAGE,NEIGHBORHOOD,ROAD,SECTION,LANE,ALLEY,SUB_ALLEY,TONG,NUMBER,X,Y
高雄市仁武區文武里51鄰文學三街70巷6號,64,6401700,6401700-007,51鄰,文學三街,,70巷,,,,6號,120.351648747867,22.6981048625722
高雄市仁武區文武里51鄰文學三街70巷8號,64,6401700,6401700-007,51鄰,文學三街,,70巷,,,,8號,120.351592987481,22.6980821502738
高雄市仁武區文武里34鄰文學三街167號,64,6401700,6401700-007,34鄰,文學三街,,,,,,167號,120.352145679674,22.6978533842373
高雄市仁武區文武里46鄰文學三街171之1號,64,6401700,6401700-007,46鄰,文學三街,,,,,,171之1號,120.35239577681,22.695780954088
高雄市仁武區文武里46鄰文學三街180號,64,6401700,6401700-007,46鄰,文學三街,,,,,,180號,120.351886268901,22.695345419162
高雄市仁武區文武里46鄰文學三街182號,64,6401700,6401700-007,46鄰,文學三街,,,,,,182號,120.351899967122,22.6953093519406
高雄市仁武區文武里46鄰文學三街186號,64,6401700,6401700-007,46鄰,文學三街,,,,,,186號,120.351920012334,22.6952688853899
高雄市仁武區文武里46鄰文學三街188號,64,6401700,6401700-007,46鄰,文學三街,,,,,,188號,120.351938542371,22.6952194723335
