FULL_ADDR,COUNTY,TOWN,VILLAGE,NEIGHBORHOOD,ROAD,SECTION,LANE,ALLEY,SUB_ALLEY,TONG,NUMBER,X,Y
高雄市三民區寶珠里15鄰正忠路355號十三樓之2,64,6400500,6400500-029,15鄰,正忠路,,,,,,355號十三樓之2,120.330000931485,22.6480726502439
高雄市三民區寶珠里15鄰正忠路355號十三樓之3,64,6400500,6400500-029,15鄰,正忠路,,,,,,355號十三樓之3,120.329872159143,22.6480834003343
高雄市三民區寶珠里15鄰正忠路355號十三樓之5,64,6400500,6400500-029,15鄰,正忠路,,,,,,355號十三樓之5,120.329774697781,22.6480978032111
高雄市三民區寶珠里15鄰正忠路355號十三樓之6,64,6400500,6400500-029,15鄰,正忠路,,,,,,355號十三樓之6,120.329770718898,22.6479754206172
高雄市三民區寶珠里15鄰正忠路355號十四樓之1,64,6400500,6400500-029,15鄰,正忠路,,,,,,355號十四樓之1,120.329995105195,22.647970037159
高雄市三民區寶珠里15鄰正忠路355號十四樓之2,64,6400500,6400500-029,15鄰,正忠路,,,,,,355號十四樓之2,120.330000931485,22.6480726502439
高雄市三民區寶珠里15鄰正忠路355號十四樓之3,64,6400500,6400500-029,15鄰,正忠路,,,,,,355號十四樓之3,120.329872159143,22.6480834003343
高雄市三民區寶珠里15鄰正忠路355號十四樓之5,64,6400500,6400500-029,15鄰,正忠路,,,,,,355號十四樓之5,120.329774697781,22.6480978032111
高雄市三民區寶珠里15鄰正忠路355號十四樓之6,64,6400500,6400500-029,15鄰,正忠路,,,,,,355號十四樓之6,120.329770718898,22.6479754206172
高雄市三民區寶珠里28鄰正忠路356號,64,6400500,6400500-029,28鄰,正忠路,,,,,,356號,120.330345449022,22.6482173438274
高雄市三民區寶珠里28鄰正忠路358號,64,6400500,6400500-029,28鄰,正忠路,,,,,,358號,120.330346246787,22.6482534699542
高雄市三民區寶珠里28鄰正忠路358號三樓,64,6400500,6400500-029,28鄰,正忠路,,,,,,358號三樓,120.330346246787,22.6482534699542
高雄市三民區寶珠里28鄰正忠路358號四樓,64,6400500,6400500-029,28鄰,正忠路,,,,,,358號四樓,120.330346246787,22.6482534699542
高雄市三民區寶珠里28鄰正忠路358號五樓,64,6400500,6400500-029,28鄰,正忠路,,,,,,358號五樓,120.330346246787,22.6482534699542
高雄市三民區寶珠里28鄰正忠路358號六樓,64,6400500,6400500-029,28鄰,正忠路,,,,,,358號六樓,120.330346246787,22.6482534699542
高雄市三民區寶珠里28鄰正忠路358號七樓,64,6400500,6400500-029,28鄰,正忠路,,,,,,358號七樓,120.330346246787,22.6482534699542
高雄市三民區寶珠里28鄰正忠路358號八樓,64,6400500,6400500-029,28鄰,正忠路,,,,,,358號八樓,120.330346246787,22.6482534699542
高雄市三民區寶珠里28鄰正忠路358號九樓,64,6400500,6400500-029,28鄰,正忠路,,,,,,358號九樓,120.330346246787,22.6482534699542
高雄市三民區寶珠里28鄰正忠路360號,64,6400500,6400500-029,28鄰,正忠路,,,,,,360號,120.330347973643,22.6482986396913
高雄市三民區寶珠里28鄰正忠路360號三樓,64,6400500,6400500-029,28鄰,正忠路,,,,,,360號三樓,120.330347973643,22.6482986396913
高雄市三民區寶珠里28鄰正忠路360號四樓,64,6400500,6400500-029,28鄰,正忠路,,,,,,360號四樓,120.330347973643,22.6482986396913
高雄市三民區寶珠里28鄰正忠路360號六樓,64,6400500,6400500-029,28鄰,正忠路,,,,,,360號六樓,120.330347973643,22.6482986396913
高雄市三民區寶珠里28鄰正忠路360號八樓,64,6400500,6400500-029,28鄰,正忠路,,,,,,360號八樓,120.330347973643,22.6482986396913
高雄市三民區寶珠里28鄰正忠路360之1號二樓,64,6400500,6400500-029,28鄰,正忠路,,,,,,360之1號二樓,120.330347973643,22.6482986396913
高雄市三民區寶珠里28鄰正忠路360之1號三樓,64,6400500,6400500-029,28鄰,正忠路,,,,,,360之1號三樓,120.330347973643,22.6482986396913
高雄市三民區寶珠里28鄰正忠路360之1號四樓,64,6400500,6400500-029,28鄰,正忠路,,,,,,360之1號四樓,120.330347973643,22.6482986396913
高雄市三民區寶珠里28鄰正忠路360之1號五樓,64,6400500,6400500-029,28鄰,正忠路,,,,,,360之1號五樓,120.330347973643,22.6482986396913
高雄市三民區寶珠里28鄰正忠路360之1號六樓,64,6400500,6400500-029,28鄰,正忠路,,,,,,360之1號六樓,120.330347973643,22.6482986396913
高雄市三民區寶珠里28鄰正忠路360之1號七樓,64,6400500,6400500-029,28鄰,正忠路,,,,,,360之1號七樓,120.330347973643,22.6482986396913
高雄市三民區寶珠里28鄰正忠路360之1號八樓,64,6400500,6400500-029,28鄰,正忠路,,,,,,360之1號八樓,120.330347973643,22.6482986396913
高雄市三民區寶珠里11鄰正忠路361巷1號,64,6400500,6400500-029,11鄰,正忠路,,361巷,,,,1號,120.329703685418,22.6481152967588
高雄市三民區寶珠里10鄰正忠路361巷2弄1號,64,6400500,6400500-029,10鄰,正忠路,,361巷,2弄,,,1號,120.32958906443,22.6482773699789
高雄市三民區寶珠里11鄰正忠路361巷2弄2號,64,6400500,6400500-029,11鄰,正忠路,,361巷,2弄,,,2號,120.329795533303,22.6482511773911
高雄市三民區寶珠里10鄰正忠路361巷2弄3號,64,6400500,6400500-029,10鄰,正忠路,,361巷,2弄,,,3號,120.329589929927,22.6483135325113
高雄市三民區寶珠里11鄰正忠路361巷2弄4號,64,6400500,6400500-029,11鄰,正忠路,,361巷,2弄,,,4號,120.329796330924,22.648287303517
高雄市三民區寶珠里10鄰正忠路361巷2弄5號,64,6400500,6400500-029,10鄰,正忠路,,361巷,2弄,,,5號,120.329590771334,22.6483406281226
高雄市三民區寶珠里11鄰正忠路361巷2弄6號,64,6400500,6400500-029,11鄰,正忠路,,361巷,2弄,,,6號,120.329797128546,22.6483234296427
高雄市三民區寶珠里10鄰正忠路361巷2弄7號,64,6400500,6400500-029,10鄰,正忠路,,361巷,2弄,,,7號,120.329590595978,22.6483767501788
高雄市三民區寶珠里11鄰正忠路361巷2弄8號,64,6400500,6400500-029,11鄰,正忠路,,361巷,2弄,,,8號,120.329797926168,22.6483595557683
高雄市三民區寶珠里10鄰正忠路361巷2弄9號,64,6400500,6400500-029,10鄰,正忠路,,361巷,2弄,,,9號,120.329591393501,22.6484128853343
高雄市三民區寶珠里11鄰正忠路361巷2弄10號,64,6400500,6400500-029,11鄰,正忠路,,361巷,2弄,,,10號,120.329798767615,22.6483866513793
高雄市三民區寶珠里10鄰正忠路361巷2弄11號,64,6400500,6400500-029,10鄰,正忠路,,361巷,2弄,,,11號,120.329590784553,22.6484381145558
高雄市三民區寶珠里11鄰正忠路361巷2弄12號,64,6400500,6400500-029,11鄰,正忠路,,361巷,2弄,,,12號,120.329800538162,22.6484227815724
高雄市三民區寶珠里10鄰正忠路361巷2弄13號,64,6400500,6400500-029,10鄰,正忠路,,361巷,2弄,,,13號,120.329587530595,22.6484710720225
高雄市三民區寶珠里11鄰正忠路361巷2弄14號,64,6400500,6400500-029,11鄰,正忠路,,361巷,2弄,,,14號,120.32980137961,22.6484498771833
高雄市三民區寶珠里10鄰正忠路361巷2弄15號,64,6400500,6400500-029,10鄰,正忠路,,361巷,2弄,,,15號,120.32959285712,22.6485122291257
高雄市三民區寶珠里11鄰正忠路361巷2弄16號,64,6400500,6400500-029,11鄰,正忠路,,361巷,2弄,,,16號,120.329802186918,22.6484860123795
高雄市三民區寶珠里10鄰正忠路361巷2弄17號,64,6400500,6400500-029,10鄰,正忠路,,361巷,2弄,,,17號,120.329592725602,22.6485393206673
高雄市三民區寶珠里10鄰正忠路361巷2弄17之1號,64,6400500,6400500-029,10鄰,正忠路,,361巷,2弄,,,17之1號,120.329497676131,22.6484757082321
高雄市三民區寶珠里10鄰正忠路361巷2弄17之2號,64,6400500,6400500-029,10鄰,正忠路,,361巷,2弄,,,17之2號,120.32944708405,22.6484754966024
高雄市三民區寶珠里11鄰正忠路361巷2弄18號,64,6400500,6400500-029,11鄰,正忠路,,361巷,2弄,,,18號,120.329802984541,22.6485221385044
高雄市三民區寶珠里10鄰正忠路361巷2弄19號,64,6400500,6400500-029,10鄰,正忠路,,361巷,2弄,,,19號,120.329595205985,22.6486296380124
高雄市三民區寶珠里10鄰正忠路361巷2弄19之1號,64,6400500,6400500-029,10鄰,正忠路,,361巷,2弄,,,19之1號,120.329497552872,22.6487014841726
高雄市三民區寶珠里10鄰正忠路361巷2弄19之2號,64,6400500,6400500-029,10鄰,正忠路,,361巷,2弄,,,19之2號,120.329446960708,22.6487012725408
高雄市三民區寶珠里11鄰正忠路361巷2弄20號,64,6400500,6400500-029,11鄰,正忠路,,361巷,2弄,,,20號,120.32980382599,22.6485492341149
高雄市三民區寶珠里10鄰正忠路361巷2弄21號,64,6400500,6400500-029,10鄰,正忠路,,361巷,2弄,,,21號,120.329596003554,22.6486657641364
高雄市三民區寶珠里11鄰正忠路361巷2弄22號,64,6400500,6400500-029,11鄰,正忠路,,361巷,2弄,,,22號,120.329804623613,22.6485853602395
高雄市三民區寶珠里10鄰正忠路361巷2弄23號,64,6400500,6400500-029,10鄰,正忠路,,361巷,2弄,,,23號,120.329595872036,22.6486928556775
高雄市三民區寶珠里11鄰正忠路361巷2弄24號,64,6400500,6400500-029,11鄰,正忠路,,361巷,2弄,,,24號,120.329805421236,22.648621486364
高雄市三民區寶珠里10鄰正忠路361巷2弄25號,64,6400500,6400500-029,10鄰,正忠路,,361巷,2弄,,,25號,120.32959666956,22.6487289908317
高雄市三民區寶珠里11鄰正忠路361巷2弄26號,64,6400500,6400500-029,11鄰,正忠路,,361巷,2弄,,,26號,120.329806262686,22.6486485819742
高雄市三民區寶珠里10鄰正忠路361巷2弄27號,64,6400500,6400500-029,10鄰,正忠路,,361巷,2弄,,,27號,120.329597467129,22.6487651169553
高雄市三民區寶珠里11鄰正忠路361巷2弄28號,64,6400500,6400500-029,11鄰,正忠路,,361巷,2弄,,,28號,120.329807060309,22.6486847080984
高雄市三民區寶珠里10鄰正忠路361巷2弄29號,64,6400500,6400500-029,10鄰,正忠路,,361巷,2弄,,,29號,120.329597335611,22.648792208496
高雄市三民區寶珠里11鄰正忠路361巷2弄30號,64,6400500,6400500-029,11鄰,正忠路,,361巷,2弄,,,30號,120.329807901759,22.6487118037083
高雄市三民區寶珠里10鄰正忠路361巷2弄31號,64,6400500,6400500-029,10鄰,正忠路,,361巷,2弄,,,31號,120.329598133179,22.6488283346193
高雄市三民區寶珠里11鄰正忠路361巷2弄32號,64,6400500,6400500-029,11鄰,正忠路,,361巷,2弄,,,32號,120.329808699383,22.6487479298323
高雄市三民區寶珠里10鄰正忠路361巷2弄33號,64,6400500,6400500-029,10鄰,正忠路,,361巷,2弄,,,33號,120.329598930748,22.6488644607424
高雄市三民區寶珠里11鄰正忠路361巷2弄34號,64,6400500,6400500-029,11鄰,正忠路,,361巷,2弄,,,34號,120.32981051376,22.6487750295098
高雄市三民區寶珠里10鄰正忠路361巷2弄35號,64,6400500,6400500-029,10鄰,正忠路,,361巷,2弄,,,35號,120.32959879923,22.6488915522829
高雄市三民區寶珠里11鄰正忠路361巷2弄36號,64,6400500,6400500-029,11鄰,正忠路,,361巷,2弄,,,36號,120.32981131134,22.648811164664
高雄市三民區寶珠里10鄰正忠路361巷2弄37號,64,6400500,6400500-029,10鄰,正忠路,,361巷,2弄,,,37號,120.329599606528,22.6489276784464
高雄市三民區寶珠里10鄰正忠路361巷2弄37之1號,64,6400500,6400500-029,10鄰,正忠路,,361巷,2弄,,,37之1號,120.329500665082,22.6488640497331
高雄市三民區寶珠里10鄰正忠路361巷2弄37之2號,64,6400500,6400500-029,10鄰,正忠路,,361巷,2弄,,,37之2號,120.329445198492,22.6488638177101
高雄市三民區寶珠里11鄰正忠路361巷2弄38號,64,6400500,6400500-029,11鄰,正忠路,,361巷,2弄,,,38號,120.329812108965,22.6488472907875
高雄市三民區寶珠里11鄰正忠路361巷2弄40號,64,6400500,6400500-029,11鄰,正忠路,,361巷,2弄,,,40號,120.329812950416,22.648874386397
高雄市三民區寶珠里11鄰正忠路361巷2弄42號,64,6400500,6400500-029,11鄰,正忠路,,361巷,2弄,,,42號,120.329813748041,22.6489105125202
高雄市三民區寶珠里11鄰正忠路361巷2弄44號,64,6400500,6400500-029,11鄰,正忠路,,361巷,2弄,,,44號,120.329814589492,22.6489376081294
高雄市三民區寶珠里11鄰正忠路361巷2弄46號,64,6400500,6400500-029,11鄰,正忠路,,361巷,2弄,,,46號,120.329815387117,22.6489737342524
高雄市三民區寶珠里10鄰正忠路361巷2弄47號,64,6400500,6400500-029,10鄰,正忠路,,361巷,2弄,,,47號,120.329601767803,22.6490015585848
高雄市三民區寶珠里10鄰正忠路361巷2弄47之1號,64,6400500,6400500-029,10鄰,正忠路,,361巷,2弄,,,47之1號,120.329504477372,22.6490808114287
高雄市三民區寶珠里10鄰正忠路361巷2弄47之2號,64,6400500,6400500-029,10鄰,正忠路,,361巷,2弄,,,47之2號,120.329449608326,22.6490877432472
高雄市三民區寶珠里11鄰正忠路361巷2弄48號,64,6400500,6400500-029,11鄰,正忠路,,361巷,2弄,,,48號,120.329816228569,22.6490008298614
高雄市三民區寶珠里10鄰正忠路361巷2弄49號,64,6400500,6400500-029,10鄰,正忠路,,361巷,2弄,,,49號,120.329600938584,22.649054122802
高雄市三民區寶珠里11鄰正忠路361巷2弄50號,64,6400500,6400500-029,11鄰,正忠路,,361巷,2弄,,,50號,120.329817026195,22.6490369559841
高雄市三民區寶珠里10鄰正忠路361巷2弄51號,64,6400500,6400500-029,10鄰,正忠路,,361巷,2弄,,,51號,120.329602752922,22.64908122248
高雄市三民區寶珠里11鄰正忠路361巷2弄52號,64,6400500,6400500-029,11鄰,正忠路,,361巷,2弄,,,52號,120.32981782382,22.6490730821066
高雄市三民區寶珠里10鄰正忠路361巷2弄53號,64,6400500,6400500-029,10鄰,正忠路,,361巷,2弄,,,53號,120.329603550492,22.6491173486021
高雄市三民區寶珠里11鄰正忠路361巷2弄54號,64,6400500,6400500-029,11鄰,正忠路,,361巷,2弄,,,54號,120.329818665272,22.6491001777154
高雄市三民區寶珠里10鄰正忠路361巷2弄55號,64,6400500,6400500-029,10鄰,正忠路,,361巷,2弄,,,55號,120.329603418972,22.6491444401417
高雄市三民區寶珠里11鄰正忠路361巷2弄56號,64,6400500,6400500-029,11鄰,正忠路,,361巷,2弄,,,56號,120.329819462855,22.6491363128681
高雄市三民區寶珠里10鄰正忠路361巷2弄57號,64,6400500,6400500-029,10鄰,正忠路,,361巷,2弄,,,57號,120.329604216542,22.6491805662634
高雄市三民區寶珠里11鄰正忠路361巷2弄58號,64,6400500,6400500-029,11鄰,正忠路,,361巷,2弄,,,58號,120.329821286966,22.6491634125852
高雄市三民區寶珠里10鄰正忠路361巷2弄59號,64,6400500,6400500-029,10鄰,正忠路,,361巷,2弄,,,59號,120.329604085022,22.6492076578028
高雄市三民區寶珠里11鄰正忠路361巷2弄60號,64,6400500,6400500-029,11鄰,正忠路,,361巷,2弄,,,60號,120.329822084593,22.6491995387071
高雄市三民區寶珠里10鄰正忠路361巷2弄61號,64,6400500,6400500-029,10鄰,正忠路,,361巷,2弄,,,61號,120.329604882592,22.6492437839243
高雄市三民區寶珠里11鄰正忠路361巷2弄62號,64,6400500,6400500-029,11鄰,正忠路,,361巷,2弄,,,62號,120.32982385515,22.6492356688968
高雄市三民區寶珠里10鄰正忠路361巷2弄63號,64,6400500,6400500-029,10鄰,正忠路,,361巷,2弄,,,63號,120.329605680162,22.6492799100456
高雄市三民區寶珠里11鄰正忠路361巷2弄64號,64,6400500,6400500-029,11鄰,正忠路,,361巷,2弄,,,64號,120.329823679847,22.6492717909506
高雄市三民區寶珠里10鄰正忠路361巷2弄65號,64,6400500,6400500-029,10鄰,正忠路,,361巷,2弄,,,65號,120.329605504802,22.6493160320977
高雄市三民區寶珠里11鄰正忠路361巷3號,64,6400500,6400500-029,11鄰,正忠路,,361巷,,,,3號,120.329666738472,22.648124209079
高雄市三民區寶珠里11鄰正忠路361巷4號,64,6400500,6400500-029,11鄰,正忠路,,361巷,,,,4號,120.329494442158,22.6483402252159
高雄市三民區寶珠里11鄰正忠路361巷5號,64,6400500,6400500-029,11鄰,正忠路,,361巷,,,,5號,120.329631669437,22.6481330931213
高雄市三民區寶珠里11鄰正忠路361巷6號,64,6400500,6400500-029,11鄰,正忠路,,361巷,,,,6號,120.329450660592,22.6483400420758
高雄市三民區寶珠里11鄰正忠路361巷7號,64,6400500,6400500-029,11鄰,正忠路,,361巷,,,,7號,120.329598546242,22.6481419852937
高雄市三民區寶珠里11鄰正忠路361巷9號,64,6400500,6400500-029,11鄰,正忠路,,361巷,,,,9號,120.329565457155,22.6481418469043
高雄市三民區寶珠里11鄰正忠路361巷11號,64,6400500,6400500-029,11鄰,正忠路,,361巷,,,,11號,120.329531361031,22.6481507349935
高雄市三民區寶珠里11鄰正忠路361巷13號,64,6400500,6400500-029,11鄰,正忠路,,361巷,,,,13號,120.329496335826,22.6481505884917
高雄市三民區寶珠里11鄰正忠路361巷15號,64,6400500,6400500-029,11鄰,正忠路,,361巷,,,,15號,120.329457375085,22.6481594562169
高雄市三民區寶珠里28鄰正忠路362號,64,6400500,6400500-029,28鄰,正忠路,,,,,,362號,120.330347764425,22.6483437923094
高雄市三民區寶珠里28鄰正忠路362之1號,64,6400500,6400500-029,28鄰,正忠路,,,,,,362之1號,120.330347545478,22.6483889448866
高雄市三民區寶珠里11鄰正忠路365號,64,6400500,6400500-029,11鄰,正忠路,,,,,,365號,120.329965753097,22.648224399547
高雄市三民區寶珠里28鄰正忠路366號,64,6400500,6400500-029,28鄰,正忠路,,,,,,366號,120.330385314373,22.6484252254585
高雄市三民區寶珠里11鄰正忠路367號,64,6400500,6400500-029,11鄰,正忠路,,,,,,367號,120.329966063893,22.6482846717245
高雄市三民區寶珠里28鄰正忠路368號,64,6400500,6400500-029,28鄰,正忠路,,,,,,368號,120.330402651378,22.6484695483024
高雄市三民區寶珠里11鄰正忠路369號,64,6400500,6400500-029,11鄰,正忠路,,,,,,369號,120.329966307959,22.6483226016761
高雄市三民區寶珠里28鄰正忠路370號,64,6400500,6400500-029,28鄰,正忠路,,,,,,370號,120.330402279599,22.6485181319062
高雄市三民區寶珠里11鄰正忠路371號,64,6400500,6400500-029,11鄰,正忠路,,,,,,371號,120.329966590898,22.6483605408206
高雄市三民區寶珠里28鄰正忠路372號,64,6400500,6400500-029,28鄰,正忠路,,,,,,372號,120.330401930684,22.6485640063958
高雄市三民區寶珠里11鄰正忠路373號,64,6400500,6400500-029,11鄰,正忠路,,,,,,373號,120.329966834964,22.6483984707718
高雄市三民區寶珠里11鄰正忠路375號,64,6400500,6400500-029,11鄰,正忠路,,,,,,375號,120.329967108217,22.6484364008448
高雄市三民區寶珠里28鄰正忠路376號,64,6400500,6400500-029,28鄰,正忠路,,,,,,376號,120.330401581724,22.6486098899156
高雄市三民區寶珠里11鄰正忠路377號,64,6400500,6400500-029,11鄰,正忠路,,,,,,377號,120.329967371741,22.648474330877
高雄市三民區寶珠里28鄰正忠路378號,64,6400500,6400500-029,28鄰,正忠路,,,,,,378號,120.33040081445,22.648655762657
高雄市三民區寶珠里11鄰正忠路379號,64,6400500,6400500-029,11鄰,正忠路,,,,,,379號,120.329967625536,22.6485122608683
高雄市三民區寶珠里28鄰正忠路380號,64,6400500,6400500-029,28鄰,正忠路,,,,,,380號,120.330400022155,22.6487027821923
高雄市三民區寶珠里11鄰正忠路381號,64,6400500,6400500-029,11鄰,正忠路,,,,,,381號,120.329967908518,22.6485501909815
高雄市三民區寶珠里28鄰正忠路382號,64,6400500,6400500-029,28鄰,正忠路,,,,,,382號,120.330399298393,22.6487477068917
高雄市三民區寶珠里11鄰正忠路383號,64,6400500,6400500-029,11鄰,正忠路,,,,,,383號,120.329968152583,22.6485881209318
高雄市三民區寶珠里11鄰正忠路385號,64,6400500,6400500-029,11鄰,正忠路,,,,,,385號,120.329968445294,22.6486260510853
高雄市三民區寶珠里28鄰正忠路386號,64,6400500,6400500-029,28鄰,正忠路,,,,,,386號,120.330399201148,22.6487898346916
高雄市三民區寶珠里11鄰正忠路387號,64,6400500,6400500-029,11鄰,正忠路,,,,,,387號,120.329968845027,22.6486639816859
高雄市三民區寶珠里28鄰正忠路388號,64,6400500,6400500-029,28鄰,正忠路,,,,,,388號,120.33039918813,22.6488306443612
高雄市三民區寶珠里11鄰正忠路389號,64,6400500,6400500-029,11鄰,正忠路,,,,,,389號,120.329969282537,22.6487021472424
高雄市三民區寶珠里28鄰正忠路390號,64,6400500,6400500-029,28鄰,正忠路,,,,,,390號,120.330399168851,22.6488727453943
高雄市三民區寶珠里11鄰正忠路391號,64,6400500,6400500-029,11鄰,正忠路,,,,,,391號,120.329969962272,22.6487405215173
高雄市三民區寶珠里28鄰正忠路392號,64,6400500,6400500-029,28鄰,正忠路,,,,,,392號,120.330375510348,22.6489121378046
高雄市三民區寶珠里11鄰正忠路393號,64,6400500,6400500-029,11鄰,正忠路,,,,,,393號,120.329970718443,22.6487831947235
高雄市三民區寶珠里11鄰正忠路395號,64,6400500,6400500-029,11鄰,正忠路,,,,,,395號,120.329979593686,22.6488208898299
高雄市三民區寶珠里28鄰正忠路396號,64,6400500,6400500-029,28鄰,正忠路,,,,,,396號,120.330376460871,22.6489528792531
高雄市三民區寶珠里11鄰正忠路397號,64,6400500,6400500-029,11鄰,正忠路,,,,,,397號,120.329980391311,22.6488570249841
高雄市三民區寶珠里28鄰正忠路398號,64,6400500,6400500-029,28鄰,正忠路,,,,,,398號,120.330377460304,22.6489935667215
高雄市三民區寶珠里11鄰正忠路399號,64,6400500,6400500-029,11鄰,正忠路,,,,,,399號,120.329982161907,22.6488931551744
高雄市三民區寶珠里28鄰正忠路400號,64,6400500,6400500-029,28鄰,正忠路,,,,,,400號,120.330378340308,22.6490548707736
高雄市三民區寶珠里11鄰正忠路401號,64,6400500,6400500-029,11鄰,正忠路,,,,,,401號,120.329982959577,22.6489292812978
高雄市三民區寶珠里28鄰正忠路402號,64,6400500,6400500-029,28鄰,正忠路,,,,,,402號,120.330499855768,22.6489958660586
高雄市三民區寶珠里11鄰正忠路403號,64,6400500,6400500-029,11鄰,正忠路,,,,,,403號,120.329983766976,22.6489654074617
高雄市三民區寶珠里11鄰正忠路405號,64,6400500,6400500-029,11鄰,正忠路,,,,,,405號,120.329985537574,22.6490015376515
高雄市三民區寶珠里11鄰正忠路407號,64,6400500,6400500-029,11鄰,正忠路,,,,,,407號,120.329986335244,22.6490376637744
高雄市三民區寶珠里11鄰正忠路409號,64,6400500,6400500-029,11鄰,正忠路,,,,,,409號,120.329987123448,22.6490737356734
高雄市三民區寶珠里11鄰正忠路411號,64,6400500,6400500-029,11鄰,正忠路,,,,,,411號,120.329983858914,22.6491048779328
高雄市三民區寶珠里11鄰正忠路413號,64,6400500,6400500-029,11鄰,正忠路,,,,,,413號,120.329996233704,22.649145215598
高雄市三民區寶珠里11鄰正忠路415號,64,6400500,6400500-029,11鄰,正忠路,,,,,,415號,120.329991471742,22.6491821854285
高雄市三民區寶珠里11鄰正忠路417號,64,6400500,6400500-029,11鄰,正忠路,,,,,,417號,120.329992181784,22.6492363725782
高雄市三民區寶珠里10鄰正忠路419巷1號,64,6400500,6400500-029,10鄰,正忠路,,419巷,,,,1號,120.329507492163,22.6492614379669
高雄市三民區寶珠里7鄰正忠路419巷2號,64,6400500,6400500-029,7鄰,正忠路,,419巷,,,,2號,120.329940756873,22.6494077408564
高雄市三民區寶珠里10鄰正忠路419巷3號,64,6400500,6400500-029,10鄰,正忠路,,419巷,,,,3號,120.329447170492,22.6492611856328
高雄市三民區寶珠里10鄰正忠路419巷3號二樓,64,6400500,6400500-029,10鄰,正忠路,,419巷,,,,3號二樓,120.329447170492,22.6492611856328
高雄市三民區寶珠里10鄰正忠路419巷3號四樓,64,6400500,6400500-029,10鄰,正忠路,,419巷,,,,3號四樓,120.329447170492,22.6492611856328
高雄市三民區寶珠里7鄰正忠路419巷6號,64,6400500,6400500-029,7鄰,正忠路,,419巷,,,,6號,120.32988506835,22.6494191124986
高雄市三民區寶珠里7鄰正忠路419巷8號,64,6400500,6400500-029,7鄰,正忠路,,419巷,,,,8號,120.329826329679,22.6494274641467
高雄市三民區寶珠里7鄰正忠路419巷10號,64,6400500,6400500-029,7鄰,正忠路,,419巷,,,,10號,120.329777655277,22.6494329951244
高雄市三民區寶珠里7鄰正忠路419巷12號,64,6400500,6400500-029,7鄰,正忠路,,419巷,,,,12號,120.329751813379,22.649443082726
高雄市三民區寶珠里7鄰正忠路419巷14號,64,6400500,6400500-029,7鄰,正忠路,,419巷,,,,14號,120.329713825217,22.649451954572
高雄市三民區寶珠里4鄰正忠路419巷18號,64,6400500,6400500-029,4鄰,正忠路,,419巷,,,,18號,120.329597063701,22.6494514662684
高雄市三民區寶珠里4鄰正忠路419巷20號,64,6400500,6400500-029,4鄰,正忠路,,419巷,,,,20號,120.329558102596,22.649460334008
高雄市三民區寶珠里4鄰正忠路419巷22號,64,6400500,6400500-029,4鄰,正忠路,,419巷,,,,22號,120.329519141487,22.6494692017379
高雄市三民區寶珠里4鄰正忠路419巷24號,64,6400500,6400500-029,4鄰,正忠路,,419巷,,,,24號,120.32947924156,22.649469034835
高雄市三民區寶珠里4鄰正忠路419巷26號,64,6400500,6400500-029,4鄰,正忠路,,419巷,,,,26號,120.329436388717,22.6494778862649
高雄市三民區寶珠里7鄰正忠路421號,64,6400500,6400500-029,7鄰,正忠路,,,,,,421號,120.330032562915,22.6493358790296
高雄市三民區寶珠里7鄰正忠路423號,64,6400500,6400500-029,7鄰,正忠路,,,,,,423號,120.33003627939,22.6493720173508
高雄市三民區寶珠里7鄰正忠路425號,64,6400500,6400500-029,7鄰,正忠路,,,,,,425號,120.330062618303,22.6493998607067
高雄市三民區寶珠里28鄰正忠路426之10號,64,6400500,6400500-029,28鄰,正忠路,,,,,,426之10號,120.330827091665,22.6490231054496
高雄市三民區寶珠里28鄰正忠路426之11號,64,6400500,6400500-029,28鄰,正忠路,,,,,,426之11號,120.330865035887,22.6490232638503
高雄市三民區寶珠里28鄰正忠路426之12號,64,6400500,6400500-029,28鄰,正忠路,,,,,,426之12號,120.330907854483,22.6490234425887
高雄市三民區寶珠里28鄰正忠路426之13號,64,6400500,6400500-029,28鄰,正忠路,,,,,,426之13號,120.330947788315,22.6490145785765
高雄市三民區寶珠里28鄰正忠路426之13號三樓,64,6400500,6400500-029,28鄰,正忠路,,,,,,426之13號三樓,120.330947788315,22.6490145785765
高雄市三民區寶珠里28鄰正忠路426之13號四樓,64,6400500,6400500-029,28鄰,正忠路,,,,,,426之13號四樓,120.330947788315,22.6490145785765
高雄市三民區寶珠里28鄰正忠路426之13號五樓,64,6400500,6400500-029,28鄰,正忠路,,,,,,426之13號五樓,120.330947788315,22.6490145785765
