FULL_ADDR,COUNTY,TOWN,VILLAGE,NEIGHBORHOOD,ROAD,SECTION,LANE,ALLEY,SUB_ALLEY,TONG,NUMBER,X,Y
高雄市三民區寶珠里37鄰正忠路269號地下二層,64,6400500,6400500-029,37鄰,正忠路,,,,,,269號地下二層,120.329954467166,22.6463734022349
高雄市三民區寶珠里37鄰正忠路269號十樓,64,6400500,6400500-029,37鄰,正忠路,,,,,,269號十樓,120.329954467166,22.6463734022349
高雄市三民區寶珠里37鄰正忠路269號二樓,64,6400500,6400500-029,37鄰,正忠路,,,,,,269號二樓,120.329954467166,22.6463734022349
高雄市三民區寶珠里37鄰正忠路269號三樓,64,6400500,6400500-029,37鄰,正忠路,,,,,,269號三樓,120.329954467166,22.6463734022349
高雄市三民區寶珠里37鄰正忠路269號四樓,64,6400500,6400500-029,37鄰,正忠路,,,,,,269號四樓,120.329954467166,22.6463734022349
高雄市三民區寶珠里37鄰正忠路269號五樓,64,6400500,6400500-029,37鄰,正忠路,,,,,,269號五樓,120.329954467166,22.6463734022349
高雄市三民區寶珠里37鄰正忠路269號六樓,64,6400500,6400500-029,37鄰,正忠路,,,,,,269號六樓,120.329954467166,22.6463734022349
高雄市三民區寶珠里37鄰正忠路269號七樓,64,6400500,6400500-029,37鄰,正忠路,,,,,,269號七樓,120.329954467166,22.6463734022349
高雄市三民區寶珠里37鄰正忠路269號八樓,64,6400500,6400500-029,37鄰,正忠路,,,,,,269號八樓,120.329954467166,22.6463734022349
高雄市三民區寶珠里37鄰正忠路269號九樓,64,6400500,6400500-029,37鄰,正忠路,,,,,,269號九樓,120.329954467166,22.6463734022349
高雄市三民區寶珠里37鄰正忠路269號十一樓,64,6400500,6400500-029,37鄰,正忠路,,,,,,269號十一樓,120.329954467166,22.6463734022349
高雄市三民區寶珠里38鄰正忠路269之1號十樓之1,64,6400500,6400500-029,38鄰,正忠路,,,,,,269之1號十樓之1,120.329954467166,22.6463734022349
高雄市三民區寶珠里38鄰正忠路269之1號十樓之2,64,6400500,6400500-029,38鄰,正忠路,,,,,,269之1號十樓之2,120.329954467166,22.6463734022349
高雄市三民區寶珠里38鄰正忠路269之1號十樓之3,64,6400500,6400500-029,38鄰,正忠路,,,,,,269之1號十樓之3,120.329954467166,22.6463734022349
高雄市三民區寶珠里38鄰正忠路269之1號十樓之4,64,6400500,6400500-029,38鄰,正忠路,,,,,,269之1號十樓之4,120.329954467166,22.6463734022349
高雄市三民區寶珠里38鄰正忠路269之1號二樓之1,64,6400500,6400500-029,38鄰,正忠路,,,,,,269之1號二樓之1,120.329954467166,22.6463734022349
高雄市三民區寶珠里38鄰正忠路269之1號二樓之2,64,6400500,6400500-029,38鄰,正忠路,,,,,,269之1號二樓之2,120.329954467166,22.6463734022349
高雄市三民區寶珠里38鄰正忠路269之1號二樓之3,64,6400500,6400500-029,38鄰,正忠路,,,,,,269之1號二樓之3,120.329954467166,22.6463734022349
高雄市三民區寶珠里38鄰正忠路269之1號三樓之1,64,6400500,6400500-029,38鄰,正忠路,,,,,,269之1號三樓之1,120.329954467166,22.6463734022349
高雄市三民區寶珠里38鄰正忠路269之1號三樓之2,64,6400500,6400500-029,38鄰,正忠路,,,,,,269之1號三樓之2,120.329954467166,22.6463734022349
高雄市三民區寶珠里38鄰正忠路269之1號三樓之3,64,6400500,6400500-029,38鄰,正忠路,,,,,,269之1號三樓之3,120.329954467166,22.6463734022349
高雄市三民區寶珠里38鄰正忠路269之1號三樓之4,64,6400500,6400500-029,38鄰,正忠路,,,,,,269之1號三樓之4,120.329954467166,22.6463734022349
高雄市三民區寶珠里38鄰正忠路269之1號四樓之1,64,6400500,6400500-029,38鄰,正忠路,,,,,,269之1號四樓之1,120.329954467166,22.6463734022349
高雄市三民區寶珠里38鄰正忠路269之1號四樓之2,64,6400500,6400500-029,38鄰,正忠路,,,,,,269之1號四樓之2,120.329954467166,22.6463734022349
高雄市三民區寶珠里38鄰正忠路269之1號四樓之3,64,6400500,6400500-029,38鄰,正忠路,,,,,,269之1號四樓之3,120.329954467166,22.6463734022349
高雄市三民區寶珠里38鄰正忠路269之1號四樓之4,64,6400500,6400500-029,38鄰,正忠路,,,,,,269之1號四樓之4,120.329954467166,22.6463734022349
高雄市三民區寶珠里38鄰正忠路269之1號五樓之1,64,6400500,6400500-029,38鄰,正忠路,,,,,,269之1號五樓之1,120.329954467166,22.6463734022349
高雄市三民區寶珠里38鄰正忠路269之1號五樓之2,64,6400500,6400500-029,38鄰,正忠路,,,,,,269之1號五樓之2,120.329954467166,22.6463734022349
高雄市三民區寶珠里38鄰正忠路269之1號五樓之3,64,6400500,6400500-029,38鄰,正忠路,,,,,,269之1號五樓之3,120.329954467166,22.6463734022349
高雄市三民區寶珠里38鄰正忠路269之1號五樓之4,64,6400500,6400500-029,38鄰,正忠路,,,,,,269之1號五樓之4,120.329954467166,22.6463734022349
高雄市三民區寶珠里38鄰正忠路269之1號六樓之1,64,6400500,6400500-029,38鄰,正忠路,,,,,,269之1號六樓之1,120.329954467166,22.6463734022349
高雄市三民區寶珠里38鄰正忠路269之1號六樓之2,64,6400500,6400500-029,38鄰,正忠路,,,,,,269之1號六樓之2,120.329954467166,22.6463734022349
高雄市三民區寶珠里38鄰正忠路269之1號六樓之3,64,6400500,6400500-029,38鄰,正忠路,,,,,,269之1號六樓之3,120.329954467166,22.6463734022349
高雄市三民區寶珠里38鄰正忠路269之1號六樓之4,64,6400500,6400500-029,38鄰,正忠路,,,,,,269之1號六樓之4,120.329954467166,22.6463734022349
高雄市三民區寶珠里38鄰正忠路269之1號七樓之1,64,6400500,6400500-029,38鄰,正忠路,,,,,,269之1號七樓之1,120.329954467166,22.6463734022349
高雄市三民區寶珠里38鄰正忠路269之1號七樓之2,64,6400500,6400500-029,38鄰,正忠路,,,,,,269之1號七樓之2,120.329954467166,22.6463734022349
高雄市三民區寶珠里38鄰正忠路269之1號七樓之3,64,6400500,6400500-029,38鄰,正忠路,,,,,,269之1號七樓之3,120.329954467166,22.6463734022349
高雄市三民區寶珠里38鄰正忠路269之1號七樓之4,64,6400500,6400500-029,38鄰,正忠路,,,,,,269之1號七樓之4,120.329954467166,22.6463734022349
高雄市三民區寶珠里38鄰正忠路269之1號八樓之1,64,6400500,6400500-029,38鄰,正忠路,,,,,,269之1號八樓之1,120.329954467166,22.6463734022349
高雄市三民區寶珠里38鄰正忠路269之1號八樓之2,64,6400500,6400500-029,38鄰,正忠路,,,,,,269之1號八樓之2,120.329954467166,22.6463734022349
高雄市三民區寶珠里38鄰正忠路269之1號八樓之3,64,6400500,6400500-029,38鄰,正忠路,,,,,,269之1號八樓之3,120.329954467166,22.6463734022349
高雄市三民區寶珠里38鄰正忠路269之1號八樓之4,64,6400500,6400500-029,38鄰,正忠路,,,,,,269之1號八樓之4,120.329954467166,22.6463734022349
高雄市三民區寶珠里38鄰正忠路269之1號九樓之1,64,6400500,6400500-029,38鄰,正忠路,,,,,,269之1號九樓之1,120.329954467166,22.6463734022349
高雄市三民區寶珠里38鄰正忠路269之1號九樓之2,64,6400500,6400500-029,38鄰,正忠路,,,,,,269之1號九樓之2,120.329954467166,22.6463734022349
高雄市三民區寶珠里38鄰正忠路269之1號九樓之3,64,6400500,6400500-029,38鄰,正忠路,,,,,,269之1號九樓之3,120.329954467166,22.6463734022349
高雄市三民區寶珠里38鄰正忠路269之1號九樓之4,64,6400500,6400500-029,38鄰,正忠路,,,,,,269之1號九樓之4,120.329954467166,22.6463734022349
高雄市三民區寶珠里38鄰正忠路269之1號十一樓之1,64,6400500,6400500-029,38鄰,正忠路,,,,,,269之1號十一樓之1,120.329954467166,22.6463734022349
高雄市三民區寶珠里38鄰正忠路269之1號十一樓之2,64,6400500,6400500-029,38鄰,正忠路,,,,,,269之1號十一樓之2,120.329954467166,22.6463734022349
高雄市三民區寶珠里38鄰正忠路269之1號十一樓之3,64,6400500,6400500-029,38鄰,正忠路,,,,,,269之1號十一樓之3,120.329954467166,22.6463734022349
高雄市三民區寶珠里38鄰正忠路269之1號十一樓之4,64,6400500,6400500-029,38鄰,正忠路,,,,,,269之1號十一樓之4,120.329954467166,22.6463734022349
高雄市三民區寶珠里38鄰正忠路269之1號十二樓之1,64,6400500,6400500-029,38鄰,正忠路,,,,,,269之1號十二樓之1,120.329954467166,22.6463734022349
高雄市三民區寶珠里38鄰正忠路269之1號十二樓之2,64,6400500,6400500-029,38鄰,正忠路,,,,,,269之1號十二樓之2,120.329954467166,22.6463734022349
高雄市三民區寶珠里38鄰正忠路269之1號十三樓之1,64,6400500,6400500-029,38鄰,正忠路,,,,,,269之1號十三樓之1,120.329954467166,22.6463734022349
高雄市三民區寶珠里38鄰正忠路269之1號十三樓之2,64,6400500,6400500-029,38鄰,正忠路,,,,,,269之1號十三樓之2,120.329954467166,22.6463734022349
高雄市三民區寶珠里38鄰正忠路269之1號十四樓之1,64,6400500,6400500-029,38鄰,正忠路,,,,,,269之1號十四樓之1,120.329954467166,22.6463734022349
高雄市三民區寶珠里38鄰正忠路269之1號十四樓之2,64,6400500,6400500-029,38鄰,正忠路,,,,,,269之1號十四樓之2,120.329954467166,22.6463734022349
高雄市三民區寶珠里38鄰正忠路269之1號十五樓之1,64,6400500,6400500-029,38鄰,正忠路,,,,,,269之1號十五樓之1,120.329954467166,22.6463734022349
高雄市三民區寶珠里38鄰正忠路269之1號十五樓之2,64,6400500,6400500-029,38鄰,正忠路,,,,,,269之1號十五樓之2,120.329954467166,22.6463734022349
高雄市三民區寶珠里38鄰正忠路269之1號十六樓之1,64,6400500,6400500-029,38鄰,正忠路,,,,,,269之1號十六樓之1,120.329954467166,22.6463734022349
高雄市三民區寶珠里38鄰正忠路269之1號十六樓之2,64,6400500,6400500-029,38鄰,正忠路,,,,,,269之1號十六樓之2,120.329954467166,22.6463734022349
高雄市三民區寶珠里38鄰正忠路269之1號十七樓之1,64,6400500,6400500-029,38鄰,正忠路,,,,,,269之1號十七樓之1,120.329954467166,22.6463734022349
高雄市三民區寶珠里38鄰正忠路269之1號十七樓之2,64,6400500,6400500-029,38鄰,正忠路,,,,,,269之1號十七樓之2,120.329954467166,22.6463734022349
高雄市三民區寶珠里38鄰正忠路269之1號十八樓之1,64,6400500,6400500-029,38鄰,正忠路,,,,,,269之1號十八樓之1,120.329954467166,22.6463734022349
高雄市三民區寶珠里38鄰正忠路269之1號十八樓之2,64,6400500,6400500-029,38鄰,正忠路,,,,,,269之1號十八樓之2,120.329954467166,22.6463734022349
高雄市三民區寶珠里38鄰正忠路269之1號十九樓之1,64,6400500,6400500-029,38鄰,正忠路,,,,,,269之1號十九樓之1,120.329954467166,22.6463734022349
高雄市三民區寶珠里38鄰正忠路269之1號十九樓之2,64,6400500,6400500-029,38鄰,正忠路,,,,,,269之1號十九樓之2,120.329954467166,22.6463734022349
高雄市三民區寶珠里38鄰正忠路269之1號二十樓之1,64,6400500,6400500-029,38鄰,正忠路,,,,,,269之1號二十樓之1,120.329954467166,22.6463734022349
高雄市三民區寶珠里38鄰正忠路269之1號二十樓之2,64,6400500,6400500-029,38鄰,正忠路,,,,,,269之1號二十樓之2,120.329954467166,22.6463734022349
高雄市三民區寶珠里38鄰正忠路269之1號二十一樓之1,64,6400500,6400500-029,38鄰,正忠路,,,,,,269之1號二十一樓之1,120.329954467166,22.6463734022349
高雄市三民區寶珠里38鄰正忠路269之1號二十一樓之2,64,6400500,6400500-029,38鄰,正忠路,,,,,,269之1號二十一樓之2,120.329954467166,22.6463734022349
高雄市三民區寶珠里38鄰正忠路269之2號十樓之1,64,6400500,6400500-029,38鄰,正忠路,,,,,,269之2號十樓之1,120.329954467166,22.6463734022349
高雄市三民區寶珠里38鄰正忠路269之2號十樓之2,64,6400500,6400500-029,38鄰,正忠路,,,,,,269之2號十樓之2,120.329954467166,22.6463734022349
高雄市三民區寶珠里38鄰正忠路269之2號二樓,64,6400500,6400500-029,38鄰,正忠路,,,,,,269之2號二樓,120.329954467166,22.6463734022349
高雄市三民區寶珠里38鄰正忠路269之2號三樓,64,6400500,6400500-029,38鄰,正忠路,,,,,,269之2號三樓,120.329954467166,22.6463734022349
高雄市三民區寶珠里38鄰正忠路269之2號四樓之1,64,6400500,6400500-029,38鄰,正忠路,,,,,,269之2號四樓之1,120.329954467166,22.6463734022349
高雄市三民區寶珠里38鄰正忠路269之2號四樓之2,64,6400500,6400500-029,38鄰,正忠路,,,,,,269之2號四樓之2,120.329954467166,22.6463734022349
高雄市三民區寶珠里38鄰正忠路269之2號五樓之1,64,6400500,6400500-029,38鄰,正忠路,,,,,,269之2號五樓之1,120.329954467166,22.6463734022349
高雄市三民區寶珠里38鄰正忠路269之2號五樓之2,64,6400500,6400500-029,38鄰,正忠路,,,,,,269之2號五樓之2,120.329954467166,22.6463734022349
高雄市三民區寶珠里38鄰正忠路269之2號六樓之1,64,6400500,6400500-029,38鄰,正忠路,,,,,,269之2號六樓之1,120.329954467166,22.6463734022349
高雄市三民區寶珠里38鄰正忠路269之2號六樓之2,64,6400500,6400500-029,38鄰,正忠路,,,,,,269之2號六樓之2,120.329954467166,22.6463734022349
高雄市三民區寶珠里38鄰正忠路269之2號七樓之1,64,6400500,6400500-029,38鄰,正忠路,,,,,,269之2號七樓之1,120.329954467166,22.6463734022349
高雄市三民區寶珠里38鄰正忠路269之2號七樓之2,64,6400500,6400500-029,38鄰,正忠路,,,,,,269之2號七樓之2,120.329954467166,22.6463734022349
高雄市三民區寶珠里38鄰正忠路269之2號八樓之1,64,6400500,6400500-029,38鄰,正忠路,,,,,,269之2號八樓之1,120.329954467166,22.6463734022349
高雄市三民區寶珠里38鄰正忠路269之2號八樓之2,64,6400500,6400500-029,38鄰,正忠路,,,,,,269之2號八樓之2,120.329954467166,22.6463734022349
高雄市三民區寶珠里38鄰正忠路269之2號九樓之1,64,6400500,6400500-029,38鄰,正忠路,,,,,,269之2號九樓之1,120.329954467166,22.6463734022349
高雄市三民區寶珠里38鄰正忠路269之2號九樓之2,64,6400500,6400500-029,38鄰,正忠路,,,,,,269之2號九樓之2,120.329954467166,22.6463734022349
高雄市三民區寶珠里38鄰正忠路269之2號十一樓,64,6400500,6400500-029,38鄰,正忠路,,,,,,269之2號十一樓,120.329954467166,22.6463734022349
高雄市三民區寶珠里38鄰正忠路269之2號十二樓,64,6400500,6400500-029,38鄰,正忠路,,,,,,269之2號十二樓,120.329954467166,22.6463734022349
高雄市三民區寶珠里38鄰正忠路269之2號十三樓,64,6400500,6400500-029,38鄰,正忠路,,,,,,269之2號十三樓,120.329954467166,22.6463734022349
高雄市三民區寶珠里38鄰正忠路269之2號十四樓,64,6400500,6400500-029,38鄰,正忠路,,,,,,269之2號十四樓,120.329954467166,22.6463734022349
高雄市三民區寶珠里38鄰正忠路269之2號十五樓,64,6400500,6400500-029,38鄰,正忠路,,,,,,269之2號十五樓,120.329954467166,22.6463734022349
高雄市三民區寶珠里38鄰正忠路269之2號十六樓,64,6400500,6400500-029,38鄰,正忠路,,,,,,269之2號十六樓,120.329954467166,22.6463734022349
高雄市三民區寶珠里38鄰正忠路269之2號十七樓,64,6400500,6400500-029,38鄰,正忠路,,,,,,269之2號十七樓,120.329954467166,22.6463734022349
高雄市三民區寶珠里38鄰正忠路269之2號十八樓,64,6400500,6400500-029,38鄰,正忠路,,,,,,269之2號十八樓,120.329954467166,22.6463734022349
高雄市三民區寶珠里38鄰正忠路269之2號十九樓,64,6400500,6400500-029,38鄰,正忠路,,,,,,269之2號十九樓,120.329954467166,22.6463734022349
高雄市三民區寶珠里38鄰正忠路269之2號二十樓,64,6400500,6400500-029,38鄰,正忠路,,,,,,269之2號二十樓,120.329954467166,22.6463734022349
高雄市三民區寶珠里16鄰正忠路303巷12弄2號,64,6400500,6400500-029,16鄰,正忠路,,303巷,12弄,,,2號,120.329485577613,22.6471480998859
高雄市三民區寶珠里16鄰正忠路303巷12弄2之1號,64,6400500,6400500-029,16鄰,正忠路,,303巷,12弄,,,2之1號,120.329488281902,22.6472023044194
高雄市三民區寶珠里16鄰正忠路303巷12弄4號,64,6400500,6400500-029,16鄰,正忠路,,303巷,12弄,,,4號,120.32949093759,22.6472564997186
高雄市三民區寶珠里16鄰正忠路303巷12弄6號,64,6400500,6400500-029,16鄰,正忠路,,303巷,12弄,,,6號,120.329489789301,22.6472926177095
高雄市三民區寶珠里16鄰正忠路303巷12弄8號,64,6400500,6400500-029,16鄰,正忠路,,303巷,12弄,,,8號,120.32950031601,22.6473287845338
高雄市三民區寶珠里16鄰正忠路303巷12弄10號,64,6400500,6400500-029,16鄰,正忠路,,303巷,12弄,,,10號,120.329505262409,22.6473540369945
高雄市三民區寶珠里16鄰正忠路303巷12弄12號,64,6400500,6400500-029,16鄰,正忠路,,303巷,12弄,,,12號,120.329505846612,22.6473920225554
高雄市三民區寶珠里16鄰正忠路303巷12弄14號,64,6400500,6400500-029,16鄰,正忠路,,303巷,12弄,,,14號,120.32950858995,22.6474281658539
高雄市三民區寶珠里16鄰正忠路303巷12弄16號,64,6400500,6400500-029,16鄰,正忠路,,303巷,12弄,,,16號,120.329511377175,22.6474552696069
高雄市三民區寶珠里16鄰正忠路303巷12弄18號,64,6400500,6400500-029,16鄰,正忠路,,303巷,12弄,,,18號,120.329514120559,22.6474914038746
高雄市三民區寶珠里16鄰正忠路303巷12弄20號,64,6400500,6400500-029,16鄰,正忠路,,303巷,12弄,,,20號,120.329515535259,22.6475246608228
高雄市三民區寶珠里16鄰正忠路303巷12弄22號,64,6400500,6400500-029,16鄰,正忠路,,303巷,12弄,,,22號,120.32952062409,22.6475546459641
高雄市三民區寶珠里16鄰正忠路303巷12弄24號,64,6400500,6400500-029,16鄰,正忠路,,303巷,12弄,,,24號,120.329523367478,22.6475907802314
高雄市三民區寶珠里16鄰正忠路303巷12弄26號,64,6400500,6400500-029,16鄰,正忠路,,303巷,12弄,,,26號,120.329525859544,22.6476185600515
高雄市三民區寶珠里16鄰正忠路303巷12弄28號,64,6400500,6400500-029,16鄰,正忠路,,303巷,12弄,,,28號,120.329529213732,22.6476511297474
高雄市三民區寶珠里16鄰正忠路303巷12弄30號,64,6400500,6400500-029,16鄰,正忠路,,303巷,12弄,,,30號,120.329530712411,22.6476811179334
高雄市三民區寶珠里16鄰正忠路303巷12弄32號,64,6400500,6400500-029,16鄰,正忠路,,303巷,12弄,,,32號,120.329530546774,22.6477172400328
高雄市三民區寶珠里39鄰正忠路313號,64,6400500,6400500-029,39鄰,正忠路,,,,,,313號,120.330028445451,22.6469697556791
高雄市三民區寶珠里39鄰正忠路313號十樓,64,6400500,6400500-029,39鄰,正忠路,,,,,,313號十樓,120.330028445451,22.6469697556791
高雄市三民區寶珠里39鄰正忠路313號三樓,64,6400500,6400500-029,39鄰,正忠路,,,,,,313號三樓,120.330028445451,22.6469697556791
高雄市三民區寶珠里39鄰正忠路313號四樓,64,6400500,6400500-029,39鄰,正忠路,,,,,,313號四樓,120.330028445451,22.6469697556791
高雄市三民區寶珠里39鄰正忠路313號五樓,64,6400500,6400500-029,39鄰,正忠路,,,,,,313號五樓,120.330028445451,22.6469697556791
高雄市三民區寶珠里39鄰正忠路313號六樓,64,6400500,6400500-029,39鄰,正忠路,,,,,,313號六樓,120.330028445451,22.6469697556791
高雄市三民區寶珠里39鄰正忠路313號七樓,64,6400500,6400500-029,39鄰,正忠路,,,,,,313號七樓,120.330028445451,22.6469697556791
高雄市三民區寶珠里39鄰正忠路313號八樓,64,6400500,6400500-029,39鄰,正忠路,,,,,,313號八樓,120.330028445451,22.6469697556791
高雄市三民區寶珠里39鄰正忠路313號九樓,64,6400500,6400500-029,39鄰,正忠路,,,,,,313號九樓,120.330028445451,22.6469697556791
高雄市三民區寶珠里39鄰正忠路313號十一樓,64,6400500,6400500-029,39鄰,正忠路,,,,,,313號十一樓,120.330028445451,22.6469697556791
高雄市三民區寶珠里39鄰正忠路313號十二樓,64,6400500,6400500-029,39鄰,正忠路,,,,,,313號十二樓,120.330028445451,22.6469697556791
高雄市三民區寶珠里15鄰正忠路315號,64,6400500,6400500-029,15鄰,正忠路,,,,,,315號,120.329959815717,22.6470778372273
高雄市三民區寶珠里13鄰正忠路316號,64,6400500,6400500-029,13鄰,正忠路,,,,,,316號,120.330376646606,22.6469982936331
高雄市三民區寶珠里15鄰正忠路317號,64,6400500,6400500-029,15鄰,正忠路,,,,,,317號,120.329958623741,22.6471229857414
高雄市三民區寶珠里13鄰正忠路318號,64,6400500,6400500-029,13鄰,正忠路,,,,,,318號,120.330373421324,22.6470615040904
高雄市三民區寶珠里15鄰正忠路319號,64,6400500,6400500-029,15鄰,正忠路,,,,,,319號,120.329957431764,22.6471681342552
高雄市三民區寶珠里13鄰正忠路320號,64,6400500,6400500-029,13鄰,正忠路,,,,,,320號,120.330373246183,22.6470976261581
高雄市三民區寶珠里15鄰正忠路321號,64,6400500,6400500-029,15鄰,正忠路,,,,,,321號,120.329959202345,22.6472042644527
高雄市三民區寶珠里13鄰正忠路322號,64,6400500,6400500-029,13鄰,正忠路,,,,,,322號,120.330368592996,22.6471422996537
高雄市三民區寶珠里15鄰正忠路323號,64,6400500,6400500-029,15鄰,正忠路,,,,,,323號,120.329962874903,22.6472494423297
高雄市三民區寶珠里13鄰正忠路324號,64,6400500,6400500-029,13鄰,正忠路,,,,,,324號,120.330370818714,22.6471969537152
高雄市三民區寶珠里15鄰正忠路325號,64,6400500,6400500-029,15鄰,正忠路,,,,,,325號,120.329962655841,22.6472945949095
高雄市三民區寶珠里13鄰正忠路326號,64,6400500,6400500-029,13鄰,正忠路,,,,,,326號,120.330367823323,22.6472288015111
高雄市三民區寶珠里15鄰正忠路327號,64,6400500,6400500-029,15鄰,正忠路,,,,,,327號,120.329965355529,22.6473397596889
高雄市三民區寶珠里13鄰正忠路328號,64,6400500,6400500-029,13鄰,正忠路,,,,,,328號,120.330371397559,22.6472782324301
高雄市三民區寶珠里15鄰正忠路329號,64,6400500,6400500-029,15鄰,正忠路,,,,,,329號,120.329969028135,22.6473849285346
高雄市三民區寶珠里13鄰正忠路330號,64,6400500,6400500-029,13鄰,正忠路,,,,,,330號,120.330371134801,22.6473324245607
高雄市三民區寶珠里15鄰正忠路331號,64,6400500,6400500-029,15鄰,正忠路,,,,,,331號,120.329978547977,22.6474301218202
高雄市三民區寶珠里13鄰正忠路332號,64,6400500,6400500-029,13鄰,正忠路,,,,,,332號,120.330356735532,22.647494917
高雄市三民區寶珠里15鄰正忠路333號,64,6400500,6400500-029,15鄰,正忠路,,,,,,333號,120.329988101906,22.6474662845487
高雄市三民區寶珠里13鄰正忠路334號,64,6400500,6400500-029,13鄰,正忠路,,,,,,334號,120.330356472809,22.6475491000984
高雄市三民區寶珠里15鄰正忠路335號,64,6400500,6400500-029,15鄰,正忠路,,,,,,335號,120.329998584948,22.6475114818587
高雄市三民區寶珠里13鄰正忠路336號,64,6400500,6400500-029,13鄰,正忠路,,,,,,336號,120.330356210085,22.6476032831965
高雄市三民區寶珠里15鄰正忠路337號,64,6400500,6400500-029,15鄰,正忠路,,,,,,337號,120.329998365851,22.6475566434678
高雄市三民區寶珠里13鄰正忠路338號,64,6400500,6400500-029,13鄰,正忠路,,,,,,338號,120.330366737044,22.6476394499686
高雄市三民區寶珠里15鄰正忠路339號,64,6400500,6400500-029,15鄰,正忠路,,,,,,339號,120.329989398107,22.6475981923535
高雄市三民區寶珠里13鄰正忠路340號,64,6400500,6400500-029,13鄰,正忠路,,,,,,340號,120.330365724134,22.6476858183775
高雄市三民區寶珠里15鄰正忠路341號,64,6400500,6400500-029,15鄰,正忠路,,,,,,341號,120.329998900662,22.6476469526908
高雄市三民區寶珠里13鄰正忠路342號,64,6400500,6400500-029,13鄰,正忠路,,,,,,342號,120.330366299131,22.6477297641615
高雄市三民區寶珠里15鄰正忠路343號,64,6400500,6400500-029,15鄰,正忠路,,,,,,343號,120.329997993373,22.6476895737965
高雄市三民區寶珠里13鄰正忠路344號,64,6400500,6400500-029,13鄰,正忠路,,,,,,344號,120.330366080196,22.6477749167423
高雄市三民區寶珠里15鄰正忠路345號,64,6400500,6400500-029,15鄰,正忠路,,,,,,345號,120.330003260145,22.6477390569462
高雄市三民區寶珠里13鄰正忠路346號,64,6400500,6400500-029,13鄰,正忠路,,,,,,346號,120.330361935538,22.6478330932528
高雄市三民區寶珠里15鄰正忠路347號,64,6400500,6400500-029,15鄰,正忠路,,,,,,347號,120.330007834085,22.6477869568275
高雄市三民區寶珠里28鄰正忠路348號,64,6400500,6400500-029,28鄰,正忠路,,,,,,348號,120.330354020602,22.6480548270602
高雄市三民區寶珠里15鄰正忠路349號,64,6400500,6400500-029,15鄰,正忠路,,,,,,349號,120.330012746941,22.6478432115212
高雄市三民區寶珠里28鄰正忠路350號,64,6400500,6400500-029,28鄰,正忠路,,,,,,350號,120.33034504536,22.6480999430593
高雄市三民區寶珠里28鄰正忠路350號三樓,64,6400500,6400500-029,28鄰,正忠路,,,,,,350號三樓,120.33034504536,22.6480999430593
高雄市三民區寶珠里28鄰正忠路350號四樓,64,6400500,6400500-029,28鄰,正忠路,,,,,,350號四樓,120.33034504536,22.6480999430593
高雄市三民區寶珠里28鄰正忠路350號五樓,64,6400500,6400500-029,28鄰,正忠路,,,,,,350號五樓,120.33034504536,22.6480999430593
高雄市三民區寶珠里28鄰正忠路350號六樓,64,6400500,6400500-029,28鄰,正忠路,,,,,,350號六樓,120.33034504536,22.6480999430593
高雄市三民區寶珠里28鄰正忠路350號七樓,64,6400500,6400500-029,28鄰,正忠路,,,,,,350號七樓,120.33034504536,22.6480999430593
高雄市三民區寶珠里28鄰正忠路350號八樓,64,6400500,6400500-029,28鄰,正忠路,,,,,,350號八樓,120.33034504536,22.6480999430593
高雄市三民區寶珠里28鄰正忠路350號九樓,64,6400500,6400500-029,28鄰,正忠路,,,,,,350號九樓,120.33034504536,22.6480999430593
高雄市三民區寶珠里16鄰正忠路351巷1號,64,6400500,6400500-029,16鄰,正忠路,,351巷,,,,1號,120.3296284609,22.647789904153
高雄市三民區寶珠里15鄰正忠路351巷1之1號十樓,64,6400500,6400500-029,15鄰,正忠路,,351巷,,,,1之1號十樓,120.329932472342,22.6478446640638
高雄市三民區寶珠里15鄰正忠路351巷1之1號二樓,64,6400500,6400500-029,15鄰,正忠路,,351巷,,,,1之1號二樓,120.329932472342,22.6478446640638
