FULL_ADDR,COUNTY,TOWN,VILLAGE,NEIGHBORHOOD,ROAD,SECTION,LANE,ALLEY,SUB_ALLEY,TONG,NUMBER,X,Y
高雄市左營區海勝里17鄰翠華路601巷66號七樓,64,6400300,6400300-032,17鄰,翠華路,,601巷,,,,66號七樓,120.290781121107,22.6734238307128
高雄市左營區海勝里17鄰翠華路601巷66號八樓,64,6400300,6400300-032,17鄰,翠華路,,601巷,,,,66號八樓,120.290781121107,22.6734238307128
高雄市左營區海勝里17鄰翠華路601巷66號九樓,64,6400300,6400300-032,17鄰,翠華路,,601巷,,,,66號九樓,120.290781121107,22.6734238307128
高雄市左營區海勝里17鄰翠華路601巷66號十一樓,64,6400300,6400300-032,17鄰,翠華路,,601巷,,,,66號十一樓,120.290781121107,22.6734238307128
高雄市左營區海勝里17鄰翠華路601巷66號十二樓,64,6400300,6400300-032,17鄰,翠華路,,601巷,,,,66號十二樓,120.290781121107,22.6734238307128
高雄市左營區海勝里17鄰翠華路601巷66號十三樓,64,6400300,6400300-032,17鄰,翠華路,,601巷,,,,66號十三樓,120.290781121107,22.6734238307128
高雄市左營區海勝里17鄰翠華路601巷66號十四樓,64,6400300,6400300-032,17鄰,翠華路,,601巷,,,,66號十四樓,120.290781121107,22.6734238307128
高雄市左營區海勝里14鄰翠華路601巷67號,64,6400300,6400300-032,14鄰,翠華路,,601巷,,,,67號,120.289819545112,22.6724717613484
高雄市左營區海勝里14鄰翠華路601巷67號十樓,64,6400300,6400300-032,14鄰,翠華路,,601巷,,,,67號十樓,120.289819545112,22.6724717613484
高雄市左營區海勝里14鄰翠華路601巷67號三樓,64,6400300,6400300-032,14鄰,翠華路,,601巷,,,,67號三樓,120.289819545112,22.6724717613484
高雄市左營區海勝里14鄰翠華路601巷67號四樓,64,6400300,6400300-032,14鄰,翠華路,,601巷,,,,67號四樓,120.289819545112,22.6724717613484
高雄市左營區海勝里14鄰翠華路601巷67號五樓,64,6400300,6400300-032,14鄰,翠華路,,601巷,,,,67號五樓,120.289819545112,22.6724717613484
高雄市左營區海勝里14鄰翠華路601巷67號六樓,64,6400300,6400300-032,14鄰,翠華路,,601巷,,,,67號六樓,120.289819545112,22.6724717613484
高雄市左營區海勝里14鄰翠華路601巷67號七樓,64,6400300,6400300-032,14鄰,翠華路,,601巷,,,,67號七樓,120.289819545112,22.6724717613484
高雄市左營區海勝里14鄰翠華路601巷67號八樓,64,6400300,6400300-032,14鄰,翠華路,,601巷,,,,67號八樓,120.289819545112,22.6724717613484
高雄市左營區海勝里14鄰翠華路601巷67號九樓,64,6400300,6400300-032,14鄰,翠華路,,601巷,,,,67號九樓,120.289819545112,22.6724717613484
高雄市左營區海勝里14鄰翠華路601巷67號十一樓,64,6400300,6400300-032,14鄰,翠華路,,601巷,,,,67號十一樓,120.289819545112,22.6724717613484
高雄市左營區海勝里14鄰翠華路601巷67號十二樓,64,6400300,6400300-032,14鄰,翠華路,,601巷,,,,67號十二樓,120.289819545112,22.6724717613484
高雄市左營區海勝里14鄰翠華路601巷67號十三樓,64,6400300,6400300-032,14鄰,翠華路,,601巷,,,,67號十三樓,120.289819545112,22.6724717613484
高雄市左營區海勝里14鄰翠華路601巷67號十四樓,64,6400300,6400300-032,14鄰,翠華路,,601巷,,,,67號十四樓,120.289819545112,22.6724717613484
高雄市左營區海勝里17鄰翠華路601巷68號,64,6400300,6400300-032,17鄰,翠華路,,601巷,,,,68號,120.29067311426,22.67352995883
高雄市左營區海勝里17鄰翠華路601巷68號十樓,64,6400300,6400300-032,17鄰,翠華路,,601巷,,,,68號十樓,120.29067311426,22.67352995883
高雄市左營區海勝里17鄰翠華路601巷68號三樓,64,6400300,6400300-032,17鄰,翠華路,,601巷,,,,68號三樓,120.29067311426,22.67352995883
高雄市左營區海勝里17鄰翠華路601巷68號四樓,64,6400300,6400300-032,17鄰,翠華路,,601巷,,,,68號四樓,120.29067311426,22.67352995883
高雄市左營區海勝里17鄰翠華路601巷68號五樓,64,6400300,6400300-032,17鄰,翠華路,,601巷,,,,68號五樓,120.29067311426,22.67352995883
高雄市左營區海勝里17鄰翠華路601巷68號六樓,64,6400300,6400300-032,17鄰,翠華路,,601巷,,,,68號六樓,120.29067311426,22.67352995883
高雄市左營區海勝里17鄰翠華路601巷68號七樓,64,6400300,6400300-032,17鄰,翠華路,,601巷,,,,68號七樓,120.29067311426,22.67352995883
高雄市左營區海勝里17鄰翠華路601巷68號八樓,64,6400300,6400300-032,17鄰,翠華路,,601巷,,,,68號八樓,120.29067311426,22.67352995883
高雄市左營區海勝里17鄰翠華路601巷68號九樓,64,6400300,6400300-032,17鄰,翠華路,,601巷,,,,68號九樓,120.29067311426,22.67352995883
高雄市左營區海勝里17鄰翠華路601巷68號十一樓,64,6400300,6400300-032,17鄰,翠華路,,601巷,,,,68號十一樓,120.29067311426,22.67352995883
高雄市左營區海勝里17鄰翠華路601巷68號十二樓,64,6400300,6400300-032,17鄰,翠華路,,601巷,,,,68號十二樓,120.29067311426,22.67352995883
高雄市左營區海勝里17鄰翠華路601巷68號十三樓,64,6400300,6400300-032,17鄰,翠華路,,601巷,,,,68號十三樓,120.29067311426,22.67352995883
高雄市左營區海勝里17鄰翠華路601巷68號十四樓,64,6400300,6400300-032,17鄰,翠華路,,601巷,,,,68號十四樓,120.29067311426,22.67352995883
高雄市左營區海勝里14鄰翠華路601巷69號,64,6400300,6400300-032,14鄰,翠華路,,601巷,,,,69號,120.289740160856,22.6723901337756
高雄市左營區海勝里14鄰翠華路601巷69號十樓,64,6400300,6400300-032,14鄰,翠華路,,601巷,,,,69號十樓,120.289740160856,22.6723901337756
高雄市左營區海勝里14鄰翠華路601巷69號三樓,64,6400300,6400300-032,14鄰,翠華路,,601巷,,,,69號三樓,120.289740160856,22.6723901337756
高雄市左營區海勝里14鄰翠華路601巷69號四樓,64,6400300,6400300-032,14鄰,翠華路,,601巷,,,,69號四樓,120.289740160856,22.6723901337756
高雄市左營區海勝里14鄰翠華路601巷69號五樓,64,6400300,6400300-032,14鄰,翠華路,,601巷,,,,69號五樓,120.289740160856,22.6723901337756
高雄市左營區海勝里14鄰翠華路601巷69號六樓,64,6400300,6400300-032,14鄰,翠華路,,601巷,,,,69號六樓,120.289740160856,22.6723901337756
高雄市左營區海勝里14鄰翠華路601巷69號七樓,64,6400300,6400300-032,14鄰,翠華路,,601巷,,,,69號七樓,120.289740160856,22.6723901337756
高雄市左營區海勝里14鄰翠華路601巷69號八樓,64,6400300,6400300-032,14鄰,翠華路,,601巷,,,,69號八樓,120.289740160856,22.6723901337756
高雄市左營區海勝里14鄰翠華路601巷69號九樓,64,6400300,6400300-032,14鄰,翠華路,,601巷,,,,69號九樓,120.289740160856,22.6723901337756
高雄市左營區海勝里14鄰翠華路601巷69號十一樓,64,6400300,6400300-032,14鄰,翠華路,,601巷,,,,69號十一樓,120.289740160856,22.6723901337756
高雄市左營區海勝里14鄰翠華路601巷69號十二樓,64,6400300,6400300-032,14鄰,翠華路,,601巷,,,,69號十二樓,120.289740160856,22.6723901337756
高雄市左營區海勝里14鄰翠華路601巷69號十三樓,64,6400300,6400300-032,14鄰,翠華路,,601巷,,,,69號十三樓,120.289740160856,22.6723901337756
高雄市左營區海勝里14鄰翠華路601巷69號十四樓,64,6400300,6400300-032,14鄰,翠華路,,601巷,,,,69號十四樓,120.289740160856,22.6723901337756
高雄市左營區海勝里20鄰翠華路601巷70號,64,6400300,6400300-032,20鄰,翠華路,,601巷,,,,70號,120.290552229013,22.673604684551
高雄市左營區海勝里20鄰翠華路601巷70號十樓,64,6400300,6400300-032,20鄰,翠華路,,601巷,,,,70號十樓,120.290552229013,22.673604684551
高雄市左營區海勝里20鄰翠華路601巷70號三樓,64,6400300,6400300-032,20鄰,翠華路,,601巷,,,,70號三樓,120.290552229013,22.673604684551
高雄市左營區海勝里20鄰翠華路601巷70號四樓,64,6400300,6400300-032,20鄰,翠華路,,601巷,,,,70號四樓,120.290552229013,22.673604684551
高雄市左營區海勝里20鄰翠華路601巷70號五樓,64,6400300,6400300-032,20鄰,翠華路,,601巷,,,,70號五樓,120.290552229013,22.673604684551
高雄市左營區海勝里20鄰翠華路601巷70號六樓,64,6400300,6400300-032,20鄰,翠華路,,601巷,,,,70號六樓,120.290552229013,22.673604684551
高雄市左營區海勝里20鄰翠華路601巷70號七樓,64,6400300,6400300-032,20鄰,翠華路,,601巷,,,,70號七樓,120.290552229013,22.673604684551
高雄市左營區海勝里20鄰翠華路601巷70號八樓,64,6400300,6400300-032,20鄰,翠華路,,601巷,,,,70號八樓,120.290552229013,22.673604684551
高雄市左營區海勝里20鄰翠華路601巷70號九樓,64,6400300,6400300-032,20鄰,翠華路,,601巷,,,,70號九樓,120.290552229013,22.673604684551
高雄市左營區海勝里20鄰翠華路601巷70號十一樓,64,6400300,6400300-032,20鄰,翠華路,,601巷,,,,70號十一樓,120.290552229013,22.673604684551
高雄市左營區海勝里20鄰翠華路601巷70號十二樓,64,6400300,6400300-032,20鄰,翠華路,,601巷,,,,70號十二樓,120.290552229013,22.673604684551
高雄市左營區海勝里20鄰翠華路601巷70號十三樓,64,6400300,6400300-032,20鄰,翠華路,,601巷,,,,70號十三樓,120.290552229013,22.673604684551
高雄市左營區海勝里20鄰翠華路601巷70號十四樓,64,6400300,6400300-032,20鄰,翠華路,,601巷,,,,70號十四樓,120.290552229013,22.673604684551
高雄市左營區海勝里14鄰翠華路601巷71號,64,6400300,6400300-032,14鄰,翠華路,,601巷,,,,71號,120.2896229158,22.6724799289971
高雄市左營區海勝里14鄰翠華路601巷71號十樓,64,6400300,6400300-032,14鄰,翠華路,,601巷,,,,71號十樓,120.2896229158,22.6724799289971
高雄市左營區海勝里14鄰翠華路601巷71號二樓,64,6400300,6400300-032,14鄰,翠華路,,601巷,,,,71號二樓,120.2896229158,22.6724799289971
高雄市左營區海勝里14鄰翠華路601巷71號三樓,64,6400300,6400300-032,14鄰,翠華路,,601巷,,,,71號三樓,120.2896229158,22.6724799289971
高雄市左營區海勝里14鄰翠華路601巷71號四樓,64,6400300,6400300-032,14鄰,翠華路,,601巷,,,,71號四樓,120.2896229158,22.6724799289971
高雄市左營區海勝里14鄰翠華路601巷71號五樓,64,6400300,6400300-032,14鄰,翠華路,,601巷,,,,71號五樓,120.2896229158,22.6724799289971
高雄市左營區海勝里14鄰翠華路601巷71號六樓,64,6400300,6400300-032,14鄰,翠華路,,601巷,,,,71號六樓,120.2896229158,22.6724799289971
高雄市左營區海勝里14鄰翠華路601巷71號七樓,64,6400300,6400300-032,14鄰,翠華路,,601巷,,,,71號七樓,120.2896229158,22.6724799289971
高雄市左營區海勝里14鄰翠華路601巷71號八樓,64,6400300,6400300-032,14鄰,翠華路,,601巷,,,,71號八樓,120.2896229158,22.6724799289971
高雄市左營區海勝里14鄰翠華路601巷71號九樓,64,6400300,6400300-032,14鄰,翠華路,,601巷,,,,71號九樓,120.2896229158,22.6724799289971
高雄市左營區海勝里14鄰翠華路601巷71號十一樓,64,6400300,6400300-032,14鄰,翠華路,,601巷,,,,71號十一樓,120.2896229158,22.6724799289971
高雄市左營區海勝里14鄰翠華路601巷71號十二樓,64,6400300,6400300-032,14鄰,翠華路,,601巷,,,,71號十二樓,120.2896229158,22.6724799289971
高雄市左營區海勝里14鄰翠華路601巷71號十三樓,64,6400300,6400300-032,14鄰,翠華路,,601巷,,,,71號十三樓,120.2896229158,22.6724799289971
高雄市左營區海勝里14鄰翠華路601巷71號十四樓,64,6400300,6400300-032,14鄰,翠華路,,601巷,,,,71號十四樓,120.2896229158,22.6724799289971
高雄市左營區海勝里20鄰翠華路601巷72號十樓,64,6400300,6400300-032,20鄰,翠華路,,601巷,,,,72號十樓,120.290514160086,22.6736350755193
高雄市左營區海勝里20鄰翠華路601巷72號二樓,64,6400300,6400300-032,20鄰,翠華路,,601巷,,,,72號二樓,120.290514160086,22.6736350755193
高雄市左營區海勝里20鄰翠華路601巷72號三樓,64,6400300,6400300-032,20鄰,翠華路,,601巷,,,,72號三樓,120.290514160086,22.6736350755193
高雄市左營區海勝里20鄰翠華路601巷72號四樓,64,6400300,6400300-032,20鄰,翠華路,,601巷,,,,72號四樓,120.290514160086,22.6736350755193
高雄市左營區海勝里20鄰翠華路601巷72號五樓,64,6400300,6400300-032,20鄰,翠華路,,601巷,,,,72號五樓,120.290514160086,22.6736350755193
高雄市左營區海勝里20鄰翠華路601巷72號六樓,64,6400300,6400300-032,20鄰,翠華路,,601巷,,,,72號六樓,120.290514160086,22.6736350755193
高雄市左營區海勝里20鄰翠華路601巷72號七樓,64,6400300,6400300-032,20鄰,翠華路,,601巷,,,,72號七樓,120.290514160086,22.6736350755193
高雄市左營區海勝里20鄰翠華路601巷72號八樓,64,6400300,6400300-032,20鄰,翠華路,,601巷,,,,72號八樓,120.290514160086,22.6736350755193
高雄市左營區海勝里20鄰翠華路601巷72號九樓,64,6400300,6400300-032,20鄰,翠華路,,601巷,,,,72號九樓,120.290514160086,22.6736350755193
高雄市左營區海勝里20鄰翠華路601巷72號十一樓,64,6400300,6400300-032,20鄰,翠華路,,601巷,,,,72號十一樓,120.290514160086,22.6736350755193
高雄市左營區海勝里20鄰翠華路601巷72號十二樓,64,6400300,6400300-032,20鄰,翠華路,,601巷,,,,72號十二樓,120.290514160086,22.6736350755193
高雄市左營區海勝里20鄰翠華路601巷72號十三樓,64,6400300,6400300-032,20鄰,翠華路,,601巷,,,,72號十三樓,120.290514160086,22.6736350755193
高雄市左營區海勝里20鄰翠華路601巷72號十四樓,64,6400300,6400300-032,20鄰,翠華路,,601巷,,,,72號十四樓,120.290514160086,22.6736350755193
高雄市左營區海勝里14鄰翠華路601巷73號,64,6400300,6400300-032,14鄰,翠華路,,601巷,,,,73號,120.289684000942,22.6723357010163
高雄市左營區海勝里14鄰翠華路601巷73號十樓,64,6400300,6400300-032,14鄰,翠華路,,601巷,,,,73號十樓,120.289684000942,22.6723357010163
高雄市左營區海勝里14鄰翠華路601巷73號三樓,64,6400300,6400300-032,14鄰,翠華路,,601巷,,,,73號三樓,120.289684000942,22.6723357010163
高雄市左營區海勝里14鄰翠華路601巷73號四樓,64,6400300,6400300-032,14鄰,翠華路,,601巷,,,,73號四樓,120.289684000942,22.6723357010163
高雄市左營區海勝里14鄰翠華路601巷73號五樓,64,6400300,6400300-032,14鄰,翠華路,,601巷,,,,73號五樓,120.289684000942,22.6723357010163
高雄市左營區海勝里14鄰翠華路601巷73號六樓,64,6400300,6400300-032,14鄰,翠華路,,601巷,,,,73號六樓,120.289684000942,22.6723357010163
高雄市左營區海勝里14鄰翠華路601巷73號七樓,64,6400300,6400300-032,14鄰,翠華路,,601巷,,,,73號七樓,120.289684000942,22.6723357010163
高雄市左營區海勝里14鄰翠華路601巷73號八樓,64,6400300,6400300-032,14鄰,翠華路,,601巷,,,,73號八樓,120.289684000942,22.6723357010163
高雄市左營區海勝里14鄰翠華路601巷73號九樓,64,6400300,6400300-032,14鄰,翠華路,,601巷,,,,73號九樓,120.289684000942,22.6723357010163
高雄市左營區海勝里14鄰翠華路601巷73號十一樓,64,6400300,6400300-032,14鄰,翠華路,,601巷,,,,73號十一樓,120.289684000942,22.6723357010163
高雄市左營區海勝里14鄰翠華路601巷73號十二樓,64,6400300,6400300-032,14鄰,翠華路,,601巷,,,,73號十二樓,120.289684000942,22.6723357010163
高雄市左營區海勝里14鄰翠華路601巷73號十三樓,64,6400300,6400300-032,14鄰,翠華路,,601巷,,,,73號十三樓,120.289684000942,22.6723357010163
高雄市左營區海勝里14鄰翠華路601巷73號十四樓,64,6400300,6400300-032,14鄰,翠華路,,601巷,,,,73號十四樓,120.289684000942,22.6723357010163
高雄市左營區海勝里14鄰翠華路601巷75號,64,6400300,6400300-032,14鄰,翠華路,,601巷,,,,75號,120.289567775541,22.6724164610729
高雄市左營區海勝里14鄰翠華路601巷75號十樓,64,6400300,6400300-032,14鄰,翠華路,,601巷,,,,75號十樓,120.289567775541,22.6724164610729
高雄市左營區海勝里14鄰翠華路601巷75號三樓,64,6400300,6400300-032,14鄰,翠華路,,601巷,,,,75號三樓,120.289567775541,22.6724164610729
高雄市左營區海勝里14鄰翠華路601巷75號四樓,64,6400300,6400300-032,14鄰,翠華路,,601巷,,,,75號四樓,120.289567775541,22.6724164610729
高雄市左營區海勝里14鄰翠華路601巷75號五樓,64,6400300,6400300-032,14鄰,翠華路,,601巷,,,,75號五樓,120.289567775541,22.6724164610729
高雄市左營區海勝里14鄰翠華路601巷75號六樓,64,6400300,6400300-032,14鄰,翠華路,,601巷,,,,75號六樓,120.289567775541,22.6724164610729
高雄市左營區海勝里14鄰翠華路601巷75號七樓,64,6400300,6400300-032,14鄰,翠華路,,601巷,,,,75號七樓,120.289567775541,22.6724164610729
高雄市左營區海勝里14鄰翠華路601巷75號八樓,64,6400300,6400300-032,14鄰,翠華路,,601巷,,,,75號八樓,120.289567775541,22.6724164610729
高雄市左營區海勝里14鄰翠華路601巷75號九樓,64,6400300,6400300-032,14鄰,翠華路,,601巷,,,,75號九樓,120.289567775541,22.6724164610729
高雄市左營區海勝里14鄰翠華路601巷75號十一樓,64,6400300,6400300-032,14鄰,翠華路,,601巷,,,,75號十一樓,120.289567775541,22.6724164610729
高雄市左營區海勝里14鄰翠華路601巷75號十二樓,64,6400300,6400300-032,14鄰,翠華路,,601巷,,,,75號十二樓,120.289567775541,22.6724164610729
高雄市左營區海勝里14鄰翠華路601巷75號十三樓,64,6400300,6400300-032,14鄰,翠華路,,601巷,,,,75號十三樓,120.289567775541,22.6724164610729
高雄市左營區海勝里14鄰翠華路601巷75號十四樓,64,6400300,6400300-032,14鄰,翠華路,,601巷,,,,75號十四樓,120.289567775541,22.6724164610729
高雄市左營區海勝里20鄰翠華路601巷76號,64,6400300,6400300-032,20鄰,翠華路,,601巷,,,,76號,120.29044523805,22.6736816300526
高雄市左營區海勝里20鄰翠華路601巷76號十樓,64,6400300,6400300-032,20鄰,翠華路,,601巷,,,,76號十樓,120.29044523805,22.6736816300526
高雄市左營區海勝里20鄰翠華路601巷76號二樓,64,6400300,6400300-032,20鄰,翠華路,,601巷,,,,76號二樓,120.29044523805,22.6736816300526
高雄市左營區海勝里20鄰翠華路601巷76號三樓,64,6400300,6400300-032,20鄰,翠華路,,601巷,,,,76號三樓,120.29044523805,22.6736816300526
高雄市左營區海勝里20鄰翠華路601巷76號四樓,64,6400300,6400300-032,20鄰,翠華路,,601巷,,,,76號四樓,120.29044523805,22.6736816300526
高雄市左營區海勝里20鄰翠華路601巷76號五樓,64,6400300,6400300-032,20鄰,翠華路,,601巷,,,,76號五樓,120.29044523805,22.6736816300526
高雄市左營區海勝里20鄰翠華路601巷76號六樓,64,6400300,6400300-032,20鄰,翠華路,,601巷,,,,76號六樓,120.29044523805,22.6736816300526
高雄市左營區海勝里20鄰翠華路601巷76號七樓,64,6400300,6400300-032,20鄰,翠華路,,601巷,,,,76號七樓,120.29044523805,22.6736816300526
高雄市左營區海勝里20鄰翠華路601巷76號八樓,64,6400300,6400300-032,20鄰,翠華路,,601巷,,,,76號八樓,120.29044523805,22.6736816300526
高雄市左營區海勝里20鄰翠華路601巷76號九樓,64,6400300,6400300-032,20鄰,翠華路,,601巷,,,,76號九樓,120.29044523805,22.6736816300526
高雄市左營區海勝里20鄰翠華路601巷76號十一樓,64,6400300,6400300-032,20鄰,翠華路,,601巷,,,,76號十一樓,120.29044523805,22.6736816300526
高雄市左營區海勝里20鄰翠華路601巷76號十二樓,64,6400300,6400300-032,20鄰,翠華路,,601巷,,,,76號十二樓,120.29044523805,22.6736816300526
高雄市左營區海勝里20鄰翠華路601巷76號十三樓,64,6400300,6400300-032,20鄰,翠華路,,601巷,,,,76號十三樓,120.29044523805,22.6736816300526
高雄市左營區海勝里20鄰翠華路601巷76號十四樓,64,6400300,6400300-032,20鄰,翠華路,,601巷,,,,76號十四樓,120.29044523805,22.6736816300526
高雄市左營區海勝里15鄰翠華路601巷77號,64,6400300,6400300-032,15鄰,翠華路,,601巷,,,,77號,120.289440008662,22.6726597299658
高雄市左營區海勝里15鄰翠華路601巷77號十樓,64,6400300,6400300-032,15鄰,翠華路,,601巷,,,,77號十樓,120.289440008662,22.6726597299658
高雄市左營區海勝里15鄰翠華路601巷77號三樓,64,6400300,6400300-032,15鄰,翠華路,,601巷,,,,77號三樓,120.289440008662,22.6726597299658
高雄市左營區海勝里15鄰翠華路601巷77號四樓,64,6400300,6400300-032,15鄰,翠華路,,601巷,,,,77號四樓,120.289440008662,22.6726597299658
高雄市左營區海勝里15鄰翠華路601巷77號五樓,64,6400300,6400300-032,15鄰,翠華路,,601巷,,,,77號五樓,120.289440008662,22.6726597299658
高雄市左營區海勝里15鄰翠華路601巷77號六樓,64,6400300,6400300-032,15鄰,翠華路,,601巷,,,,77號六樓,120.289440008662,22.6726597299658
高雄市左營區海勝里15鄰翠華路601巷77號七樓,64,6400300,6400300-032,15鄰,翠華路,,601巷,,,,77號七樓,120.289440008662,22.6726597299658
高雄市左營區海勝里15鄰翠華路601巷77號八樓,64,6400300,6400300-032,15鄰,翠華路,,601巷,,,,77號八樓,120.289440008662,22.6726597299658
高雄市左營區海勝里15鄰翠華路601巷77號九樓,64,6400300,6400300-032,15鄰,翠華路,,601巷,,,,77號九樓,120.289440008662,22.6726597299658
高雄市左營區海勝里15鄰翠華路601巷77號十一樓,64,6400300,6400300-032,15鄰,翠華路,,601巷,,,,77號十一樓,120.289440008662,22.6726597299658
高雄市左營區海勝里15鄰翠華路601巷77號十二樓,64,6400300,6400300-032,15鄰,翠華路,,601巷,,,,77號十二樓,120.289440008662,22.6726597299658
高雄市左營區海勝里15鄰翠華路601巷77號十三樓,64,6400300,6400300-032,15鄰,翠華路,,601巷,,,,77號十三樓,120.289440008662,22.6726597299658
高雄市左營區海勝里15鄰翠華路601巷77號十四樓,64,6400300,6400300-032,15鄰,翠華路,,601巷,,,,77號十四樓,120.289440008662,22.6726597299658
高雄市左營區海勝里20鄰翠華路601巷78號,64,6400300,6400300-032,20鄰,翠華路,,601巷,,,,78號,120.290363686601,22.6737543354447
高雄市左營區海勝里20鄰翠華路601巷78號十樓,64,6400300,6400300-032,20鄰,翠華路,,601巷,,,,78號十樓,120.290363686601,22.6737543354447
高雄市左營區海勝里20鄰翠華路601巷78號三樓,64,6400300,6400300-032,20鄰,翠華路,,601巷,,,,78號三樓,120.290363686601,22.6737543354447
高雄市左營區海勝里20鄰翠華路601巷78號四樓,64,6400300,6400300-032,20鄰,翠華路,,601巷,,,,78號四樓,120.290363686601,22.6737543354447
高雄市左營區海勝里20鄰翠華路601巷78號五樓,64,6400300,6400300-032,20鄰,翠華路,,601巷,,,,78號五樓,120.290363686601,22.6737543354447
高雄市左營區海勝里20鄰翠華路601巷78號六樓,64,6400300,6400300-032,20鄰,翠華路,,601巷,,,,78號六樓,120.290363686601,22.6737543354447
高雄市左營區海勝里20鄰翠華路601巷78號七樓,64,6400300,6400300-032,20鄰,翠華路,,601巷,,,,78號七樓,120.290363686601,22.6737543354447
高雄市左營區海勝里20鄰翠華路601巷78號八樓,64,6400300,6400300-032,20鄰,翠華路,,601巷,,,,78號八樓,120.290363686601,22.6737543354447
高雄市左營區海勝里20鄰翠華路601巷78號九樓,64,6400300,6400300-032,20鄰,翠華路,,601巷,,,,78號九樓,120.290363686601,22.6737543354447
高雄市左營區海勝里20鄰翠華路601巷78號十一樓,64,6400300,6400300-032,20鄰,翠華路,,601巷,,,,78號十一樓,120.290363686601,22.6737543354447
高雄市左營區海勝里20鄰翠華路601巷78號十二樓,64,6400300,6400300-032,20鄰,翠華路,,601巷,,,,78號十二樓,120.290363686601,22.6737543354447
高雄市左營區海勝里20鄰翠華路601巷78號十三樓,64,6400300,6400300-032,20鄰,翠華路,,601巷,,,,78號十三樓,120.290363686601,22.6737543354447
高雄市左營區海勝里20鄰翠華路601巷78號十四樓,64,6400300,6400300-032,20鄰,翠華路,,601巷,,,,78號十四樓,120.290363686601,22.6737543354447
高雄市左營區海勝里15鄰翠華路601巷79號,64,6400300,6400300-032,15鄰,翠華路,,601巷,,,,79號,120.289505909209,22.6727142060202
高雄市左營區海勝里15鄰翠華路601巷79號十樓,64,6400300,6400300-032,15鄰,翠華路,,601巷,,,,79號十樓,120.289505909209,22.6727142060202
高雄市左營區海勝里15鄰翠華路601巷79號二樓,64,6400300,6400300-032,15鄰,翠華路,,601巷,,,,79號二樓,120.289505909209,22.6727142060202
高雄市左營區海勝里15鄰翠華路601巷79號三樓,64,6400300,6400300-032,15鄰,翠華路,,601巷,,,,79號三樓,120.289505909209,22.6727142060202
高雄市左營區海勝里15鄰翠華路601巷79號四樓,64,6400300,6400300-032,15鄰,翠華路,,601巷,,,,79號四樓,120.289505909209,22.6727142060202
高雄市左營區海勝里15鄰翠華路601巷79號五樓,64,6400300,6400300-032,15鄰,翠華路,,601巷,,,,79號五樓,120.289505909209,22.6727142060202
高雄市左營區海勝里15鄰翠華路601巷79號六樓,64,6400300,6400300-032,15鄰,翠華路,,601巷,,,,79號六樓,120.289505909209,22.6727142060202
高雄市左營區海勝里15鄰翠華路601巷79號七樓,64,6400300,6400300-032,15鄰,翠華路,,601巷,,,,79號七樓,120.289505909209,22.6727142060202
高雄市左營區海勝里15鄰翠華路601巷79號八樓,64,6400300,6400300-032,15鄰,翠華路,,601巷,,,,79號八樓,120.289505909209,22.6727142060202
高雄市左營區海勝里15鄰翠華路601巷79號九樓,64,6400300,6400300-032,15鄰,翠華路,,601巷,,,,79號九樓,120.289505909209,22.6727142060202
高雄市左營區海勝里15鄰翠華路601巷79號十一樓,64,6400300,6400300-032,15鄰,翠華路,,601巷,,,,79號十一樓,120.289505909209,22.6727142060202
高雄市左營區海勝里15鄰翠華路601巷79號十二樓,64,6400300,6400300-032,15鄰,翠華路,,601巷,,,,79號十二樓,120.289505909209,22.6727142060202
高雄市左營區海勝里15鄰翠華路601巷79號十三樓,64,6400300,6400300-032,15鄰,翠華路,,601巷,,,,79號十三樓,120.289505909209,22.6727142060202
高雄市左營區海勝里15鄰翠華路601巷79號十四樓,64,6400300,6400300-032,15鄰,翠華路,,601巷,,,,79號十四樓,120.289505909209,22.6727142060202
