FULL_ADDR,COUNTY,TOWN,VILLAGE,NEIGHBORHOOD,ROAD,SECTION,LANE,ALLEY,SUB_ALLEY,TONG,NUMBER,X,Y
高雄市左營區海勝里11鄰翠華路601巷8號八樓,64,6400300,6400300-032,11鄰,翠華路,,601巷,,,,8號八樓,120.291175944557,22.6726944868362
高雄市左營區海勝里11鄰翠華路601巷8號九樓,64,6400300,6400300-032,11鄰,翠華路,,601巷,,,,8號九樓,120.291175944557,22.6726944868362
高雄市左營區海勝里11鄰翠華路601巷8號十一樓,64,6400300,6400300-032,11鄰,翠華路,,601巷,,,,8號十一樓,120.291175944557,22.6726944868362
高雄市左營區海勝里11鄰翠華路601巷8號十二樓,64,6400300,6400300-032,11鄰,翠華路,,601巷,,,,8號十二樓,120.291175944557,22.6726944868362
高雄市左營區海勝里11鄰翠華路601巷8號十三樓,64,6400300,6400300-032,11鄰,翠華路,,601巷,,,,8號十三樓,120.291175944557,22.6726944868362
高雄市左營區海勝里11鄰翠華路601巷8號十四樓,64,6400300,6400300-032,11鄰,翠華路,,601巷,,,,8號十四樓,120.291175944557,22.6726944868362
高雄市左營區海勝里11鄰翠華路601巷8號十五樓,64,6400300,6400300-032,11鄰,翠華路,,601巷,,,,8號十五樓,120.291175944557,22.6726944868362
高雄市左營區海勝里11鄰翠華路601巷8號十六樓,64,6400300,6400300-032,11鄰,翠華路,,601巷,,,,8號十六樓,120.291175944557,22.6726944868362
高雄市左營區海勝里7鄰翠華路601巷9號,64,6400300,6400300-032,7鄰,翠華路,,601巷,,,,9號,120.290424618549,22.6719506492531
高雄市左營區海勝里7鄰翠華路601巷9號十樓,64,6400300,6400300-032,7鄰,翠華路,,601巷,,,,9號十樓,120.290424618549,22.6719506492531
高雄市左營區海勝里7鄰翠華路601巷9號二樓,64,6400300,6400300-032,7鄰,翠華路,,601巷,,,,9號二樓,120.290424618549,22.6719506492531
高雄市左營區海勝里7鄰翠華路601巷9號三樓,64,6400300,6400300-032,7鄰,翠華路,,601巷,,,,9號三樓,120.290424618549,22.6719506492531
高雄市左營區海勝里7鄰翠華路601巷9號四樓,64,6400300,6400300-032,7鄰,翠華路,,601巷,,,,9號四樓,120.290424618549,22.6719506492531
高雄市左營區海勝里7鄰翠華路601巷9號五樓,64,6400300,6400300-032,7鄰,翠華路,,601巷,,,,9號五樓,120.290424618549,22.6719506492531
高雄市左營區海勝里7鄰翠華路601巷9號六樓,64,6400300,6400300-032,7鄰,翠華路,,601巷,,,,9號六樓,120.290424618549,22.6719506492531
高雄市左營區海勝里7鄰翠華路601巷9號七樓,64,6400300,6400300-032,7鄰,翠華路,,601巷,,,,9號七樓,120.290424618549,22.6719506492531
高雄市左營區海勝里7鄰翠華路601巷9號八樓,64,6400300,6400300-032,7鄰,翠華路,,601巷,,,,9號八樓,120.290424618549,22.6719506492531
高雄市左營區海勝里7鄰翠華路601巷9號九樓,64,6400300,6400300-032,7鄰,翠華路,,601巷,,,,9號九樓,120.290424618549,22.6719506492531
高雄市左營區海勝里7鄰翠華路601巷9號十一樓,64,6400300,6400300-032,7鄰,翠華路,,601巷,,,,9號十一樓,120.290424618549,22.6719506492531
高雄市左營區海勝里7鄰翠華路601巷9號十二樓,64,6400300,6400300-032,7鄰,翠華路,,601巷,,,,9號十二樓,120.290424618549,22.6719506492531
高雄市左營區海勝里7鄰翠華路601巷9號十三樓,64,6400300,6400300-032,7鄰,翠華路,,601巷,,,,9號十三樓,120.290424618549,22.6719506492531
高雄市左營區海勝里7鄰翠華路601巷9號十四樓,64,6400300,6400300-032,7鄰,翠華路,,601巷,,,,9號十四樓,120.290424618549,22.6719506492531
高雄市左營區海勝里7鄰翠華路601巷9號十五樓,64,6400300,6400300-032,7鄰,翠華路,,601巷,,,,9號十五樓,120.290424618549,22.6719506492531
高雄市左營區海勝里7鄰翠華路601巷9號十六樓,64,6400300,6400300-032,7鄰,翠華路,,601巷,,,,9號十六樓,120.290424618549,22.6719506492531
高雄市左營區海勝里11鄰翠華路601巷10號,64,6400300,6400300-032,11鄰,翠華路,,601巷,,,,10號,120.291271864782,22.67278523557
高雄市左營區海勝里11鄰翠華路601巷10號十樓,64,6400300,6400300-032,11鄰,翠華路,,601巷,,,,10號十樓,120.291271864782,22.67278523557
高雄市左營區海勝里11鄰翠華路601巷10號二樓,64,6400300,6400300-032,11鄰,翠華路,,601巷,,,,10號二樓,120.291271864782,22.67278523557
高雄市左營區海勝里11鄰翠華路601巷10號三樓,64,6400300,6400300-032,11鄰,翠華路,,601巷,,,,10號三樓,120.291271864782,22.67278523557
高雄市左營區海勝里11鄰翠華路601巷10號四樓,64,6400300,6400300-032,11鄰,翠華路,,601巷,,,,10號四樓,120.291271864782,22.67278523557
高雄市左營區海勝里11鄰翠華路601巷10號五樓,64,6400300,6400300-032,11鄰,翠華路,,601巷,,,,10號五樓,120.291271864782,22.67278523557
高雄市左營區海勝里11鄰翠華路601巷10號六樓,64,6400300,6400300-032,11鄰,翠華路,,601巷,,,,10號六樓,120.291271864782,22.67278523557
高雄市左營區海勝里11鄰翠華路601巷10號七樓,64,6400300,6400300-032,11鄰,翠華路,,601巷,,,,10號七樓,120.291271864782,22.67278523557
高雄市左營區海勝里11鄰翠華路601巷10號八樓,64,6400300,6400300-032,11鄰,翠華路,,601巷,,,,10號八樓,120.291271864782,22.67278523557
高雄市左營區海勝里11鄰翠華路601巷10號九樓,64,6400300,6400300-032,11鄰,翠華路,,601巷,,,,10號九樓,120.291271864782,22.67278523557
高雄市左營區海勝里11鄰翠華路601巷10號十一樓,64,6400300,6400300-032,11鄰,翠華路,,601巷,,,,10號十一樓,120.291271864782,22.67278523557
高雄市左營區海勝里11鄰翠華路601巷10號十二樓,64,6400300,6400300-032,11鄰,翠華路,,601巷,,,,10號十二樓,120.291271864782,22.67278523557
高雄市左營區海勝里11鄰翠華路601巷10號十三樓,64,6400300,6400300-032,11鄰,翠華路,,601巷,,,,10號十三樓,120.291271864782,22.67278523557
高雄市左營區海勝里11鄰翠華路601巷10號十四樓,64,6400300,6400300-032,11鄰,翠華路,,601巷,,,,10號十四樓,120.291271864782,22.67278523557
高雄市左營區海勝里11鄰翠華路601巷10號十五樓,64,6400300,6400300-032,11鄰,翠華路,,601巷,,,,10號十五樓,120.291271864782,22.67278523557
高雄市左營區海勝里11鄰翠華路601巷10號十六樓,64,6400300,6400300-032,11鄰,翠華路,,601巷,,,,10號十六樓,120.291271864782,22.67278523557
高雄市左營區海勝里7鄰翠華路601巷11號,64,6400300,6400300-032,7鄰,翠華路,,601巷,,,,11號,120.290366688467,22.6718600864118
高雄市左營區海勝里7鄰翠華路601巷11號十樓,64,6400300,6400300-032,7鄰,翠華路,,601巷,,,,11號十樓,120.290366688467,22.6718600864118
高雄市左營區海勝里7鄰翠華路601巷11號二樓,64,6400300,6400300-032,7鄰,翠華路,,601巷,,,,11號二樓,120.290366688467,22.6718600864118
高雄市左營區海勝里7鄰翠華路601巷11號三樓,64,6400300,6400300-032,7鄰,翠華路,,601巷,,,,11號三樓,120.290366688467,22.6718600864118
高雄市左營區海勝里7鄰翠華路601巷11號四樓,64,6400300,6400300-032,7鄰,翠華路,,601巷,,,,11號四樓,120.290366688467,22.6718600864118
高雄市左營區海勝里7鄰翠華路601巷11號五樓,64,6400300,6400300-032,7鄰,翠華路,,601巷,,,,11號五樓,120.290366688467,22.6718600864118
高雄市左營區海勝里7鄰翠華路601巷11號六樓,64,6400300,6400300-032,7鄰,翠華路,,601巷,,,,11號六樓,120.290366688467,22.6718600864118
高雄市左營區海勝里7鄰翠華路601巷11號七樓,64,6400300,6400300-032,7鄰,翠華路,,601巷,,,,11號七樓,120.290366688467,22.6718600864118
高雄市左營區海勝里7鄰翠華路601巷11號八樓,64,6400300,6400300-032,7鄰,翠華路,,601巷,,,,11號八樓,120.290366688467,22.6718600864118
高雄市左營區海勝里7鄰翠華路601巷11號九樓,64,6400300,6400300-032,7鄰,翠華路,,601巷,,,,11號九樓,120.290366688467,22.6718600864118
高雄市左營區海勝里7鄰翠華路601巷11號十一樓,64,6400300,6400300-032,7鄰,翠華路,,601巷,,,,11號十一樓,120.290366688467,22.6718600864118
高雄市左營區海勝里7鄰翠華路601巷11號十二樓,64,6400300,6400300-032,7鄰,翠華路,,601巷,,,,11號十二樓,120.290366688467,22.6718600864118
高雄市左營區海勝里7鄰翠華路601巷11號十三樓,64,6400300,6400300-032,7鄰,翠華路,,601巷,,,,11號十三樓,120.290366688467,22.6718600864118
高雄市左營區海勝里7鄰翠華路601巷11號十四樓,64,6400300,6400300-032,7鄰,翠華路,,601巷,,,,11號十四樓,120.290366688467,22.6718600864118
高雄市左營區海勝里7鄰翠華路601巷11號十五樓,64,6400300,6400300-032,7鄰,翠華路,,601巷,,,,11號十五樓,120.290366688467,22.6718600864118
高雄市左營區海勝里7鄰翠華路601巷11號十六樓,64,6400300,6400300-032,7鄰,翠華路,,601巷,,,,11號十六樓,120.290366688467,22.6718600864118
高雄市左營區海勝里12鄰翠華路601巷12號,64,6400300,6400300-032,12鄰,翠華路,,601巷,,,,12號,120.291350218807,22.6728668397838
高雄市左營區海勝里12鄰翠華路601巷12號十樓,64,6400300,6400300-032,12鄰,翠華路,,601巷,,,,12號十樓,120.291350218807,22.6728668397838
高雄市左營區海勝里12鄰翠華路601巷12號二樓,64,6400300,6400300-032,12鄰,翠華路,,601巷,,,,12號二樓,120.291350218807,22.6728668397838
高雄市左營區海勝里12鄰翠華路601巷12號三樓,64,6400300,6400300-032,12鄰,翠華路,,601巷,,,,12號三樓,120.291350218807,22.6728668397838
高雄市左營區海勝里12鄰翠華路601巷12號四樓,64,6400300,6400300-032,12鄰,翠華路,,601巷,,,,12號四樓,120.291350218807,22.6728668397838
高雄市左營區海勝里12鄰翠華路601巷12號五樓,64,6400300,6400300-032,12鄰,翠華路,,601巷,,,,12號五樓,120.291350218807,22.6728668397838
高雄市左營區海勝里12鄰翠華路601巷12號六樓,64,6400300,6400300-032,12鄰,翠華路,,601巷,,,,12號六樓,120.291350218807,22.6728668397838
高雄市左營區海勝里12鄰翠華路601巷12號七樓,64,6400300,6400300-032,12鄰,翠華路,,601巷,,,,12號七樓,120.291350218807,22.6728668397838
高雄市左營區海勝里12鄰翠華路601巷12號八樓,64,6400300,6400300-032,12鄰,翠華路,,601巷,,,,12號八樓,120.291350218807,22.6728668397838
高雄市左營區海勝里12鄰翠華路601巷12號九樓,64,6400300,6400300-032,12鄰,翠華路,,601巷,,,,12號九樓,120.291350218807,22.6728668397838
高雄市左營區海勝里12鄰翠華路601巷12號十一樓,64,6400300,6400300-032,12鄰,翠華路,,601巷,,,,12號十一樓,120.291350218807,22.6728668397838
高雄市左營區海勝里12鄰翠華路601巷12號十二樓,64,6400300,6400300-032,12鄰,翠華路,,601巷,,,,12號十二樓,120.291350218807,22.6728668397838
高雄市左營區海勝里12鄰翠華路601巷12號十三樓,64,6400300,6400300-032,12鄰,翠華路,,601巷,,,,12號十三樓,120.291350218807,22.6728668397838
高雄市左營區海勝里12鄰翠華路601巷12號十四樓,64,6400300,6400300-032,12鄰,翠華路,,601巷,,,,12號十四樓,120.291350218807,22.6728668397838
高雄市左營區海勝里12鄰翠華路601巷12號十五樓,64,6400300,6400300-032,12鄰,翠華路,,601巷,,,,12號十五樓,120.291350218807,22.6728668397838
高雄市左營區海勝里12鄰翠華路601巷12號十六樓,64,6400300,6400300-032,12鄰,翠華路,,601巷,,,,12號十六樓,120.291350218807,22.6728668397838
高雄市左營區海勝里7鄰翠華路601巷13號,64,6400300,6400300-032,7鄰,翠華路,,601巷,,,,13號,120.290289164511,22.6719861806029
高雄市左營區海勝里7鄰翠華路601巷13號十樓,64,6400300,6400300-032,7鄰,翠華路,,601巷,,,,13號十樓,120.290289164511,22.6719861806029
高雄市左營區海勝里7鄰翠華路601巷13號二樓,64,6400300,6400300-032,7鄰,翠華路,,601巷,,,,13號二樓,120.290289164511,22.6719861806029
高雄市左營區海勝里7鄰翠華路601巷13號三樓,64,6400300,6400300-032,7鄰,翠華路,,601巷,,,,13號三樓,120.290289164511,22.6719861806029
高雄市左營區海勝里7鄰翠華路601巷13號四樓,64,6400300,6400300-032,7鄰,翠華路,,601巷,,,,13號四樓,120.290289164511,22.6719861806029
高雄市左營區海勝里7鄰翠華路601巷13號五樓,64,6400300,6400300-032,7鄰,翠華路,,601巷,,,,13號五樓,120.290289164511,22.6719861806029
高雄市左營區海勝里7鄰翠華路601巷13號六樓,64,6400300,6400300-032,7鄰,翠華路,,601巷,,,,13號六樓,120.290289164511,22.6719861806029
高雄市左營區海勝里7鄰翠華路601巷13號七樓,64,6400300,6400300-032,7鄰,翠華路,,601巷,,,,13號七樓,120.290289164511,22.6719861806029
高雄市左營區海勝里7鄰翠華路601巷13號八樓,64,6400300,6400300-032,7鄰,翠華路,,601巷,,,,13號八樓,120.290289164511,22.6719861806029
高雄市左營區海勝里7鄰翠華路601巷13號九樓,64,6400300,6400300-032,7鄰,翠華路,,601巷,,,,13號九樓,120.290289164511,22.6719861806029
高雄市左營區海勝里7鄰翠華路601巷13號十一樓,64,6400300,6400300-032,7鄰,翠華路,,601巷,,,,13號十一樓,120.290289164511,22.6719861806029
高雄市左營區海勝里7鄰翠華路601巷13號十二樓,64,6400300,6400300-032,7鄰,翠華路,,601巷,,,,13號十二樓,120.290289164511,22.6719861806029
高雄市左營區海勝里7鄰翠華路601巷13號十三樓,64,6400300,6400300-032,7鄰,翠華路,,601巷,,,,13號十三樓,120.290289164511,22.6719861806029
高雄市左營區海勝里7鄰翠華路601巷13號十四樓,64,6400300,6400300-032,7鄰,翠華路,,601巷,,,,13號十四樓,120.290289164511,22.6719861806029
高雄市左營區海勝里7鄰翠華路601巷13號十五樓,64,6400300,6400300-032,7鄰,翠華路,,601巷,,,,13號十五樓,120.290289164511,22.6719861806029
高雄市左營區海勝里7鄰翠華路601巷13號十六樓,64,6400300,6400300-032,7鄰,翠華路,,601巷,,,,13號十六樓,120.290289164511,22.6719861806029
高雄市左營區海勝里12鄰翠華路601巷14號,64,6400300,6400300-032,12鄰,翠華路,,601巷,,,,14號,120.291406354799,22.6729393601973
高雄市左營區海勝里12鄰翠華路601巷14號十樓,64,6400300,6400300-032,12鄰,翠華路,,601巷,,,,14號十樓,120.291406354799,22.6729393601973
高雄市左營區海勝里12鄰翠華路601巷14號二樓,64,6400300,6400300-032,12鄰,翠華路,,601巷,,,,14號二樓,120.291406354799,22.6729393601973
高雄市左營區海勝里12鄰翠華路601巷14號三樓,64,6400300,6400300-032,12鄰,翠華路,,601巷,,,,14號三樓,120.291406354799,22.6729393601973
高雄市左營區海勝里12鄰翠華路601巷14號四樓,64,6400300,6400300-032,12鄰,翠華路,,601巷,,,,14號四樓,120.291406354799,22.6729393601973
高雄市左營區海勝里12鄰翠華路601巷14號五樓,64,6400300,6400300-032,12鄰,翠華路,,601巷,,,,14號五樓,120.291406354799,22.6729393601973
高雄市左營區海勝里12鄰翠華路601巷14號六樓,64,6400300,6400300-032,12鄰,翠華路,,601巷,,,,14號六樓,120.291406354799,22.6729393601973
高雄市左營區海勝里12鄰翠華路601巷14號七樓,64,6400300,6400300-032,12鄰,翠華路,,601巷,,,,14號七樓,120.291406354799,22.6729393601973
高雄市左營區海勝里12鄰翠華路601巷14號八樓,64,6400300,6400300-032,12鄰,翠華路,,601巷,,,,14號八樓,120.291406354799,22.6729393601973
高雄市左營區海勝里12鄰翠華路601巷14號九樓,64,6400300,6400300-032,12鄰,翠華路,,601巷,,,,14號九樓,120.291406354799,22.6729393601973
高雄市左營區海勝里12鄰翠華路601巷14號十一樓,64,6400300,6400300-032,12鄰,翠華路,,601巷,,,,14號十一樓,120.291406354799,22.6729393601973
高雄市左營區海勝里12鄰翠華路601巷14號十二樓,64,6400300,6400300-032,12鄰,翠華路,,601巷,,,,14號十二樓,120.291406354799,22.6729393601973
高雄市左營區海勝里12鄰翠華路601巷14號十三樓,64,6400300,6400300-032,12鄰,翠華路,,601巷,,,,14號十三樓,120.291406354799,22.6729393601973
高雄市左營區海勝里12鄰翠華路601巷14號十四樓,64,6400300,6400300-032,12鄰,翠華路,,601巷,,,,14號十四樓,120.291406354799,22.6729393601973
高雄市左營區海勝里12鄰翠華路601巷14號十五樓,64,6400300,6400300-032,12鄰,翠華路,,601巷,,,,14號十五樓,120.291406354799,22.6729393601973
高雄市左營區海勝里12鄰翠華路601巷14號十六樓,64,6400300,6400300-032,12鄰,翠華路,,601巷,,,,14號十六樓,120.291406354799,22.6729393601973
高雄市左營區海勝里7鄰翠華路601巷15號,64,6400300,6400300-032,7鄰,翠華路,,601巷,,,,15號,120.29024073304,22.6719408038681
高雄市左營區海勝里7鄰翠華路601巷15號十樓,64,6400300,6400300-032,7鄰,翠華路,,601巷,,,,15號十樓,120.29024073304,22.6719408038681
高雄市左營區海勝里7鄰翠華路601巷15號二樓,64,6400300,6400300-032,7鄰,翠華路,,601巷,,,,15號二樓,120.29024073304,22.6719408038681
高雄市左營區海勝里7鄰翠華路601巷15號三樓,64,6400300,6400300-032,7鄰,翠華路,,601巷,,,,15號三樓,120.29024073304,22.6719408038681
高雄市左營區海勝里7鄰翠華路601巷15號四樓,64,6400300,6400300-032,7鄰,翠華路,,601巷,,,,15號四樓,120.29024073304,22.6719408038681
高雄市左營區海勝里7鄰翠華路601巷15號五樓,64,6400300,6400300-032,7鄰,翠華路,,601巷,,,,15號五樓,120.29024073304,22.6719408038681
高雄市左營區海勝里7鄰翠華路601巷15號六樓,64,6400300,6400300-032,7鄰,翠華路,,601巷,,,,15號六樓,120.29024073304,22.6719408038681
高雄市左營區海勝里7鄰翠華路601巷15號七樓,64,6400300,6400300-032,7鄰,翠華路,,601巷,,,,15號七樓,120.29024073304,22.6719408038681
高雄市左營區海勝里7鄰翠華路601巷15號八樓,64,6400300,6400300-032,7鄰,翠華路,,601巷,,,,15號八樓,120.29024073304,22.6719408038681
高雄市左營區海勝里7鄰翠華路601巷15號九樓,64,6400300,6400300-032,7鄰,翠華路,,601巷,,,,15號九樓,120.29024073304,22.6719408038681
高雄市左營區海勝里7鄰翠華路601巷15號十一樓,64,6400300,6400300-032,7鄰,翠華路,,601巷,,,,15號十一樓,120.29024073304,22.6719408038681
高雄市左營區海勝里7鄰翠華路601巷15號十二樓,64,6400300,6400300-032,7鄰,翠華路,,601巷,,,,15號十二樓,120.29024073304,22.6719408038681
高雄市左營區海勝里7鄰翠華路601巷15號十三樓,64,6400300,6400300-032,7鄰,翠華路,,601巷,,,,15號十三樓,120.29024073304,22.6719408038681
高雄市左營區海勝里7鄰翠華路601巷15號十四樓,64,6400300,6400300-032,7鄰,翠華路,,601巷,,,,15號十四樓,120.29024073304,22.6719408038681
高雄市左營區海勝里7鄰翠華路601巷15號十五樓,64,6400300,6400300-032,7鄰,翠華路,,601巷,,,,15號十五樓,120.29024073304,22.6719408038681
高雄市左營區海勝里7鄰翠華路601巷15號十六樓,64,6400300,6400300-032,7鄰,翠華路,,601巷,,,,15號十六樓,120.29024073304,22.6719408038681
高雄市左營區海勝里12鄰翠華路601巷16號,64,6400300,6400300-032,12鄰,翠華路,,601巷,,,,16號,120.291231529227,22.6729746368533
高雄市左營區海勝里12鄰翠華路601巷16號十樓,64,6400300,6400300-032,12鄰,翠華路,,601巷,,,,16號十樓,120.291231529227,22.6729746368533
高雄市左營區海勝里12鄰翠華路601巷16號二樓,64,6400300,6400300-032,12鄰,翠華路,,601巷,,,,16號二樓,120.291231529227,22.6729746368533
高雄市左營區海勝里12鄰翠華路601巷16號三樓,64,6400300,6400300-032,12鄰,翠華路,,601巷,,,,16號三樓,120.291231529227,22.6729746368533
高雄市左營區海勝里12鄰翠華路601巷16號四樓,64,6400300,6400300-032,12鄰,翠華路,,601巷,,,,16號四樓,120.291231529227,22.6729746368533
高雄市左營區海勝里12鄰翠華路601巷16號五樓,64,6400300,6400300-032,12鄰,翠華路,,601巷,,,,16號五樓,120.291231529227,22.6729746368533
高雄市左營區海勝里12鄰翠華路601巷16號六樓,64,6400300,6400300-032,12鄰,翠華路,,601巷,,,,16號六樓,120.291231529227,22.6729746368533
高雄市左營區海勝里12鄰翠華路601巷16號七樓,64,6400300,6400300-032,12鄰,翠華路,,601巷,,,,16號七樓,120.291231529227,22.6729746368533
高雄市左營區海勝里12鄰翠華路601巷16號八樓,64,6400300,6400300-032,12鄰,翠華路,,601巷,,,,16號八樓,120.291231529227,22.6729746368533
高雄市左營區海勝里12鄰翠華路601巷16號九樓,64,6400300,6400300-032,12鄰,翠華路,,601巷,,,,16號九樓,120.291231529227,22.6729746368533
高雄市左營區海勝里12鄰翠華路601巷16號十一樓,64,6400300,6400300-032,12鄰,翠華路,,601巷,,,,16號十一樓,120.291231529227,22.6729746368533
高雄市左營區海勝里12鄰翠華路601巷16號十二樓,64,6400300,6400300-032,12鄰,翠華路,,601巷,,,,16號十二樓,120.291231529227,22.6729746368533
高雄市左營區海勝里12鄰翠華路601巷16號十三樓,64,6400300,6400300-032,12鄰,翠華路,,601巷,,,,16號十三樓,120.291231529227,22.6729746368533
高雄市左營區海勝里12鄰翠華路601巷16號十四樓,64,6400300,6400300-032,12鄰,翠華路,,601巷,,,,16號十四樓,120.291231529227,22.6729746368533
高雄市左營區海勝里12鄰翠華路601巷16號十五樓,64,6400300,6400300-032,12鄰,翠華路,,601巷,,,,16號十五樓,120.291231529227,22.6729746368533
高雄市左營區海勝里12鄰翠華路601巷16號十六樓,64,6400300,6400300-032,12鄰,翠華路,,601巷,,,,16號十六樓,120.291231529227,22.6729746368533
高雄市左營區海勝里7鄰翠華路601巷17號,64,6400300,6400300-032,7鄰,翠華路,,601巷,,,,17號,120.29015871528,22.6719946331324
高雄市左營區海勝里7鄰翠華路601巷17號十樓,64,6400300,6400300-032,7鄰,翠華路,,601巷,,,,17號十樓,120.29015871528,22.6719946331324
高雄市左營區海勝里7鄰翠華路601巷17號二樓,64,6400300,6400300-032,7鄰,翠華路,,601巷,,,,17號二樓,120.29015871528,22.6719946331324
高雄市左營區海勝里7鄰翠華路601巷17號三樓,64,6400300,6400300-032,7鄰,翠華路,,601巷,,,,17號三樓,120.29015871528,22.6719946331324
高雄市左營區海勝里7鄰翠華路601巷17號四樓,64,6400300,6400300-032,7鄰,翠華路,,601巷,,,,17號四樓,120.29015871528,22.6719946331324
高雄市左營區海勝里7鄰翠華路601巷17號五樓,64,6400300,6400300-032,7鄰,翠華路,,601巷,,,,17號五樓,120.29015871528,22.6719946331324
高雄市左營區海勝里7鄰翠華路601巷17號六樓,64,6400300,6400300-032,7鄰,翠華路,,601巷,,,,17號六樓,120.29015871528,22.6719946331324
高雄市左營區海勝里7鄰翠華路601巷17號七樓,64,6400300,6400300-032,7鄰,翠華路,,601巷,,,,17號七樓,120.29015871528,22.6719946331324
高雄市左營區海勝里7鄰翠華路601巷17號八樓,64,6400300,6400300-032,7鄰,翠華路,,601巷,,,,17號八樓,120.29015871528,22.6719946331324
高雄市左營區海勝里7鄰翠華路601巷17號九樓,64,6400300,6400300-032,7鄰,翠華路,,601巷,,,,17號九樓,120.29015871528,22.6719946331324
高雄市左營區海勝里7鄰翠華路601巷17號十一樓,64,6400300,6400300-032,7鄰,翠華路,,601巷,,,,17號十一樓,120.29015871528,22.6719946331324
高雄市左營區海勝里7鄰翠華路601巷17號十二樓,64,6400300,6400300-032,7鄰,翠華路,,601巷,,,,17號十二樓,120.29015871528,22.6719946331324
高雄市左營區海勝里7鄰翠華路601巷17號十三樓,64,6400300,6400300-032,7鄰,翠華路,,601巷,,,,17號十三樓,120.29015871528,22.6719946331324
高雄市左營區海勝里7鄰翠華路601巷17號十四樓,64,6400300,6400300-032,7鄰,翠華路,,601巷,,,,17號十四樓,120.29015871528,22.6719946331324
高雄市左營區海勝里7鄰翠華路601巷17號十五樓,64,6400300,6400300-032,7鄰,翠華路,,601巷,,,,17號十五樓,120.29015871528,22.6719946331324
高雄市左營區海勝里7鄰翠華路601巷17號十六樓,64,6400300,6400300-032,7鄰,翠華路,,601巷,,,,17號十六樓,120.29015871528,22.6719946331324
高雄市左營區海勝里12鄰翠華路601巷18號,64,6400300,6400300-032,12鄰,翠華路,,601巷,,,,18號,120.291292462671,22.6730471514441
高雄市左營區海勝里12鄰翠華路601巷18號十樓,64,6400300,6400300-032,12鄰,翠華路,,601巷,,,,18號十樓,120.291292462671,22.6730471514441
高雄市左營區海勝里12鄰翠華路601巷18號二樓,64,6400300,6400300-032,12鄰,翠華路,,601巷,,,,18號二樓,120.291292462671,22.6730471514441
高雄市左營區海勝里12鄰翠華路601巷18號三樓,64,6400300,6400300-032,12鄰,翠華路,,601巷,,,,18號三樓,120.291292462671,22.6730471514441
高雄市左營區海勝里12鄰翠華路601巷18號四樓,64,6400300,6400300-032,12鄰,翠華路,,601巷,,,,18號四樓,120.291292462671,22.6730471514441
高雄市左營區海勝里12鄰翠華路601巷18號五樓,64,6400300,6400300-032,12鄰,翠華路,,601巷,,,,18號五樓,120.291292462671,22.6730471514441
高雄市左營區海勝里12鄰翠華路601巷18號六樓,64,6400300,6400300-032,12鄰,翠華路,,601巷,,,,18號六樓,120.291292462671,22.6730471514441
高雄市左營區海勝里12鄰翠華路601巷18號七樓,64,6400300,6400300-032,12鄰,翠華路,,601巷,,,,18號七樓,120.291292462671,22.6730471514441
高雄市左營區海勝里12鄰翠華路601巷18號八樓,64,6400300,6400300-032,12鄰,翠華路,,601巷,,,,18號八樓,120.291292462671,22.6730471514441
高雄市左營區海勝里12鄰翠華路601巷18號九樓,64,6400300,6400300-032,12鄰,翠華路,,601巷,,,,18號九樓,120.291292462671,22.6730471514441
高雄市左營區海勝里12鄰翠華路601巷18號十一樓,64,6400300,6400300-032,12鄰,翠華路,,601巷,,,,18號十一樓,120.291292462671,22.6730471514441
高雄市左營區海勝里12鄰翠華路601巷18號十二樓,64,6400300,6400300-032,12鄰,翠華路,,601巷,,,,18號十二樓,120.291292462671,22.6730471514441
高雄市左營區海勝里12鄰翠華路601巷18號十三樓,64,6400300,6400300-032,12鄰,翠華路,,601巷,,,,18號十三樓,120.291292462671,22.6730471514441
高雄市左營區海勝里12鄰翠華路601巷18號十四樓,64,6400300,6400300-032,12鄰,翠華路,,601巷,,,,18號十四樓,120.291292462671,22.6730471514441
高雄市左營區海勝里12鄰翠華路601巷18號十五樓,64,6400300,6400300-032,12鄰,翠華路,,601巷,,,,18號十五樓,120.291292462671,22.6730471514441
