FULL_ADDR,COUNTY,TOWN,VILLAGE,NEIGHBORHOOD,ROAD,SECTION,LANE,ALLEY,SUB_ALLEY,TONG,NUMBER,X,Y
高雄市前鎮區瑞南里28鄰瑞士街1號,64,6400900,6400900-047,28鄰,瑞士街,,,,,,1號,120.325158204897,22.5988087540443
高雄市前鎮區瑞南里28鄰瑞士街2號,64,6400900,6400900-047,28鄰,瑞士街,,,,,,2號,120.325279953524,22.5985873982907
高雄市前鎮區瑞南里28鄰瑞士街3號,64,6400900,6400900-047,28鄰,瑞士街,,,,,,3號,120.325196142414,22.5988194252713
高雄市前鎮區瑞南里28鄰瑞士街5號,64,6400900,6400900-047,28鄰,瑞士街,,,,,,5號,120.32523343883,22.5988299312419
高雄市前鎮區瑞南里28鄰瑞士街6號,64,6400900,6400900-047,28鄰,瑞士街,,,,,,6號,120.325349457627,22.5985988342719
高雄市前鎮區瑞南里28鄰瑞士街7號,64,6400900,6400900-047,28鄰,瑞士街,,,,,,7號,120.325270745065,22.5988404191837
高雄市前鎮區瑞南里28鄰瑞士街8號,64,6400900,6400900-047,28鄰,瑞士街,,,,,,8號,120.325387588869,22.5986096597897
高雄市前鎮區瑞南里28鄰瑞士街9號,64,6400900,6400900-047,28鄰,瑞士街,,,,,,9號,120.325308051219,22.5988509251781
高雄市前鎮區瑞南里28鄰瑞士街10號,64,6400900,6400900-047,28鄰,瑞士街,,,,,,10號,120.325425739613,22.5986204763498
高雄市前鎮區瑞南里28鄰瑞士街11號,64,6400900,6400900-047,28鄰,瑞士街,,,,,,11號,120.325345357422,22.5988614221334
高雄市前鎮區瑞南里28鄰瑞士街12號,64,6400900,6400900-047,28鄰,瑞士街,,,,,,12號,120.325463870868,22.5986313018498
高雄市前鎮區瑞南里28鄰瑞士街13號,64,6400900,6400900-047,28鄰,瑞士街,,,,,,13號,120.325382663632,22.5988719190802
高雄市前鎮區瑞南里28鄰瑞士街15號,64,6400900,6400900-047,28鄰,瑞士街,,,,,,15號,120.325419960121,22.5988824159775
高雄市前鎮區瑞南里28鄰瑞士街16號,64,6400900,6400900-047,28鄰,瑞士街,,,,,,16號,120.325502011855,22.5986421273817
高雄市前鎮區瑞南里28鄰瑞士街17號,64,6400900,6400900-047,28鄰,瑞士街,,,,,,17號,120.325457266342,22.5988929129072
高雄市前鎮區瑞南里28鄰瑞士街18號,64,6400900,6400900-047,28鄰,瑞士街,,,,,,18號,120.325540152847,22.5986529529047
高雄市前鎮區瑞南里28鄰瑞士街19號,64,6400900,6400900-047,28鄰,瑞士街,,,,,,19號,120.325498674722,22.5989018647409
高雄市前鎮區瑞南里28鄰瑞士街20號,64,6400900,6400900-047,28鄰,瑞士街,,,,,,20號,120.325578293891,22.5986637693881
高雄市前鎮區瑞南里28鄰瑞士街21號十樓,64,6400900,6400900-047,28鄰,瑞士街,,,,,,21號十樓,120.325677526513,22.5989535132271
高雄市前鎮區瑞南里28鄰瑞士街21號二樓,64,6400900,6400900-047,28鄰,瑞士街,,,,,,21號二樓,120.325677526513,22.5989535132271
高雄市前鎮區瑞南里28鄰瑞士街21號三樓,64,6400900,6400900-047,28鄰,瑞士街,,,,,,21號三樓,120.325677526513,22.5989535132271
高雄市前鎮區瑞南里28鄰瑞士街21號四樓,64,6400900,6400900-047,28鄰,瑞士街,,,,,,21號四樓,120.325677526513,22.5989535132271
高雄市前鎮區瑞南里28鄰瑞士街21號五樓,64,6400900,6400900-047,28鄰,瑞士街,,,,,,21號五樓,120.325677526513,22.5989535132271
高雄市前鎮區瑞南里28鄰瑞士街21號六樓,64,6400900,6400900-047,28鄰,瑞士街,,,,,,21號六樓,120.325677526513,22.5989535132271
高雄市前鎮區瑞南里28鄰瑞士街21號七樓,64,6400900,6400900-047,28鄰,瑞士街,,,,,,21號七樓,120.325677526513,22.5989535132271
高雄市前鎮區瑞南里28鄰瑞士街21號八樓,64,6400900,6400900-047,28鄰,瑞士街,,,,,,21號八樓,120.325677526513,22.5989535132271
高雄市前鎮區瑞南里28鄰瑞士街21號九樓,64,6400900,6400900-047,28鄰,瑞士街,,,,,,21號九樓,120.325677526513,22.5989535132271
高雄市前鎮區瑞南里28鄰瑞士街21號十一樓,64,6400900,6400900-047,28鄰,瑞士街,,,,,,21號十一樓,120.325677526513,22.5989535132271
高雄市前鎮區瑞南里28鄰瑞士街21號十二樓,64,6400900,6400900-047,28鄰,瑞士街,,,,,,21號十二樓,120.325677526513,22.5989535132271
高雄市前鎮區瑞南里28鄰瑞士街21號十三樓,64,6400900,6400900-047,28鄰,瑞士街,,,,,,21號十三樓,120.325677526513,22.5989535132271
高雄市前鎮區瑞南里28鄰瑞士街21號十四樓,64,6400900,6400900-047,28鄰,瑞士街,,,,,,21號十四樓,120.325677526513,22.5989535132271
高雄市前鎮區瑞南里28鄰瑞士街21號十五樓,64,6400900,6400900-047,28鄰,瑞士街,,,,,,21號十五樓,120.325677526513,22.5989535132271
高雄市前鎮區瑞南里28鄰瑞士街22號,64,6400900,6400900-047,28鄰,瑞士街,,,,,,22號,120.325616434896,22.5986745948933
高雄市前鎮區瑞南里28鄰瑞士街23號十樓,64,6400900,6400900-047,28鄰,瑞士街,,,,,,23號十樓,120.325808521502,22.5990042381254
高雄市前鎮區瑞南里28鄰瑞士街23號二樓,64,6400900,6400900-047,28鄰,瑞士街,,,,,,23號二樓,120.325808521502,22.5990042381254
高雄市前鎮區瑞南里28鄰瑞士街23號三樓,64,6400900,6400900-047,28鄰,瑞士街,,,,,,23號三樓,120.325808521502,22.5990042381254
高雄市前鎮區瑞南里28鄰瑞士街23號四樓,64,6400900,6400900-047,28鄰,瑞士街,,,,,,23號四樓,120.325808521502,22.5990042381254
高雄市前鎮區瑞南里28鄰瑞士街23號五樓,64,6400900,6400900-047,28鄰,瑞士街,,,,,,23號五樓,120.325808521502,22.5990042381254
高雄市前鎮區瑞南里28鄰瑞士街23號六樓,64,6400900,6400900-047,28鄰,瑞士街,,,,,,23號六樓,120.325808521502,22.5990042381254
高雄市前鎮區瑞南里28鄰瑞士街23號七樓,64,6400900,6400900-047,28鄰,瑞士街,,,,,,23號七樓,120.325808521502,22.5990042381254
高雄市前鎮區瑞南里28鄰瑞士街23號八樓,64,6400900,6400900-047,28鄰,瑞士街,,,,,,23號八樓,120.325808521502,22.5990042381254
高雄市前鎮區瑞南里28鄰瑞士街23號九樓,64,6400900,6400900-047,28鄰,瑞士街,,,,,,23號九樓,120.325808521502,22.5990042381254
高雄市前鎮區瑞南里28鄰瑞士街23號十一樓,64,6400900,6400900-047,28鄰,瑞士街,,,,,,23號十一樓,120.325808521502,22.5990042381254
高雄市前鎮區瑞南里28鄰瑞士街23號十二樓,64,6400900,6400900-047,28鄰,瑞士街,,,,,,23號十二樓,120.325808521502,22.5990042381254
高雄市前鎮區瑞南里28鄰瑞士街23號十三樓,64,6400900,6400900-047,28鄰,瑞士街,,,,,,23號十三樓,120.325808521502,22.5990042381254
高雄市前鎮區瑞南里28鄰瑞士街23號十四樓,64,6400900,6400900-047,28鄰,瑞士街,,,,,,23號十四樓,120.325808521502,22.5990042381254
高雄市前鎮區瑞南里28鄰瑞士街23號十五樓,64,6400900,6400900-047,28鄰,瑞士街,,,,,,23號十五樓,120.325808521502,22.5990042381254
高雄市前鎮區瑞南里28鄰瑞士街25號十樓,64,6400900,6400900-047,28鄰,瑞士街,,,,,,25號十樓,120.32574456716,22.5991372995341
高雄市前鎮區瑞南里28鄰瑞士街25號二樓,64,6400900,6400900-047,28鄰,瑞士街,,,,,,25號二樓,120.32574456716,22.5991372995341
高雄市前鎮區瑞南里28鄰瑞士街25號三樓,64,6400900,6400900-047,28鄰,瑞士街,,,,,,25號三樓,120.32574456716,22.5991372995341
高雄市前鎮區瑞南里28鄰瑞士街25號四樓,64,6400900,6400900-047,28鄰,瑞士街,,,,,,25號四樓,120.32574456716,22.5991372995341
高雄市前鎮區瑞南里28鄰瑞士街25號五樓,64,6400900,6400900-047,28鄰,瑞士街,,,,,,25號五樓,120.32574456716,22.5991372995341
高雄市前鎮區瑞南里28鄰瑞士街25號六樓,64,6400900,6400900-047,28鄰,瑞士街,,,,,,25號六樓,120.32574456716,22.5991372995341
高雄市前鎮區瑞南里28鄰瑞士街25號七樓,64,6400900,6400900-047,28鄰,瑞士街,,,,,,25號七樓,120.32574456716,22.5991372995341
高雄市前鎮區瑞南里28鄰瑞士街25號八樓,64,6400900,6400900-047,28鄰,瑞士街,,,,,,25號八樓,120.32574456716,22.5991372995341
高雄市前鎮區瑞南里28鄰瑞士街25號九樓,64,6400900,6400900-047,28鄰,瑞士街,,,,,,25號九樓,120.32574456716,22.5991372995341
高雄市前鎮區瑞南里28鄰瑞士街25號十一樓,64,6400900,6400900-047,28鄰,瑞士街,,,,,,25號十一樓,120.32574456716,22.5991372995341
高雄市前鎮區瑞南里28鄰瑞士街25號十二樓,64,6400900,6400900-047,28鄰,瑞士街,,,,,,25號十二樓,120.32574456716,22.5991372995341
高雄市前鎮區瑞南里28鄰瑞士街25號十三樓,64,6400900,6400900-047,28鄰,瑞士街,,,,,,25號十三樓,120.32574456716,22.5991372995341
高雄市前鎮區瑞南里28鄰瑞士街25號十四樓,64,6400900,6400900-047,28鄰,瑞士街,,,,,,25號十四樓,120.32574456716,22.5991372995341
高雄市前鎮區瑞南里28鄰瑞士街25號十五樓,64,6400900,6400900-047,28鄰,瑞士街,,,,,,25號十五樓,120.32574456716,22.5991372995341
高雄市前鎮區瑞南里28鄰瑞士街26號,64,6400900,6400900-047,28鄰,瑞士街,,,,,,26號,120.325675621608,22.5986856713262
高雄市前鎮區瑞南里28鄰瑞士街27號十樓,64,6400900,6400900-047,28鄰,瑞士街,,,,,,27號十樓,120.325587168607,22.5991179990538
高雄市前鎮區瑞南里28鄰瑞士街27號二樓,64,6400900,6400900-047,28鄰,瑞士街,,,,,,27號二樓,120.325587168607,22.5991179990538
高雄市前鎮區瑞南里28鄰瑞士街27號三樓,64,6400900,6400900-047,28鄰,瑞士街,,,,,,27號三樓,120.325587168607,22.5991179990538
高雄市前鎮區瑞南里28鄰瑞士街27號四樓,64,6400900,6400900-047,28鄰,瑞士街,,,,,,27號四樓,120.325587168607,22.5991179990538
高雄市前鎮區瑞南里28鄰瑞士街27號五樓,64,6400900,6400900-047,28鄰,瑞士街,,,,,,27號五樓,120.325587168607,22.5991179990538
高雄市前鎮區瑞南里28鄰瑞士街27號六樓,64,6400900,6400900-047,28鄰,瑞士街,,,,,,27號六樓,120.325587168607,22.5991179990538
高雄市前鎮區瑞南里28鄰瑞士街27號七樓,64,6400900,6400900-047,28鄰,瑞士街,,,,,,27號七樓,120.325587168607,22.5991179990538
高雄市前鎮區瑞南里28鄰瑞士街27號八樓,64,6400900,6400900-047,28鄰,瑞士街,,,,,,27號八樓,120.325587168607,22.5991179990538
高雄市前鎮區瑞南里28鄰瑞士街27號九樓,64,6400900,6400900-047,28鄰,瑞士街,,,,,,27號九樓,120.325587168607,22.5991179990538
高雄市前鎮區瑞南里28鄰瑞士街27號十一樓,64,6400900,6400900-047,28鄰,瑞士街,,,,,,27號十一樓,120.325587168607,22.5991179990538
高雄市前鎮區瑞南里28鄰瑞士街27號十二樓,64,6400900,6400900-047,28鄰,瑞士街,,,,,,27號十二樓,120.325587168607,22.5991179990538
高雄市前鎮區瑞南里28鄰瑞士街27號十三樓,64,6400900,6400900-047,28鄰,瑞士街,,,,,,27號十三樓,120.325587168607,22.5991179990538
高雄市前鎮區瑞南里28鄰瑞士街27號十四樓,64,6400900,6400900-047,28鄰,瑞士街,,,,,,27號十四樓,120.325587168607,22.5991179990538
高雄市前鎮區瑞南里28鄰瑞士街27號十五樓,64,6400900,6400900-047,28鄰,瑞士街,,,,,,27號十五樓,120.325587168607,22.5991179990538
高雄市前鎮區瑞南里28鄰瑞士街28號,64,6400900,6400900-047,28鄰,瑞士街,,,,,,28號,120.325718947654,22.598756175699
高雄市前鎮區瑞南里28鄰瑞士街30號,64,6400900,6400900-047,28鄰,瑞士街,,,,,,30號,120.325800612655,22.5987629304419
高雄市前鎮區瑞南里28鄰瑞士街32號,64,6400900,6400900-047,28鄰,瑞士街,,,,,,32號,120.325862330218,22.5987715881623
高雄市前鎮區瑞南里28鄰瑞士街36號,64,6400900,6400900-047,28鄰,瑞士街,,,,,,36號,120.325936862906,22.5987849956451
高雄市前鎮區瑞南里28鄰瑞士街61號,64,6400900,6400900-047,28鄰,瑞士街,,,,,,61號,120.325350109846,22.5990677133851
高雄市前鎮區瑞南里28鄰瑞士街63號,64,6400900,6400900-047,28鄰,瑞士街,,,,,,63號,120.325312200986,22.599057132621
高雄市前鎮區瑞南里28鄰瑞士街65號,64,6400900,6400900-047,28鄰,瑞士街,,,,,,65號,120.325274894381,22.5990467079015
高雄市前鎮區瑞南里28鄰瑞士街67號,64,6400900,6400900-047,28鄰,瑞士街,,,,,,67號,120.325237587738,22.5990362922041
高雄市前鎮區瑞南里28鄰瑞士街69號,64,6400900,6400900-047,28鄰,瑞士街,,,,,,69號,120.3252002811,22.5990258764981
高雄市前鎮區瑞南里28鄰瑞士街71號,64,6400900,6400900-047,28鄰,瑞士街,,,,,,71號,120.325162974469,22.5990154607835
高雄市前鎮區瑞南里28鄰瑞士街73號,64,6400900,6400900-047,28鄰,瑞士街,,,,,,73號,120.325125667843,22.5990050450604
高雄市前鎮區瑞南里28鄰瑞士街75號,64,6400900,6400900-047,28鄰,瑞士街,,,,,,75號,120.325087759107,22.598994446183
高雄市前鎮區瑞南里28鄰瑞士街92號,64,6400900,6400900-047,28鄰,瑞士街,,,,,,92號,120.325215798084,22.5992904161424
高雄市前鎮區瑞南里28鄰瑞士街96號,64,6400900,6400900-047,28鄰,瑞士街,,,,,,96號,120.325155525391,22.5992786125124
高雄市前鎮區瑞南里28鄰瑞士街98號,64,6400900,6400900-047,28鄰,瑞士街,,,,,,98號,120.32511933946,22.5992617445135
高雄市前鎮區瑞南里28鄰瑞士街100號,64,6400900,6400900-047,28鄰,瑞士街,,,,,,100號,120.325083153583,22.599244867476
高雄市前鎮區瑞南里28鄰瑞士街102號,64,6400900,6400900-047,28鄰,瑞士街,,,,,,102號,120.325043209388,22.5992268367584
高雄市前鎮區瑞南里28鄰瑞士街106號,64,6400900,6400900-047,28鄰,瑞士街,,,,,,106號,120.324999085725,22.5992062598524
高雄市前鎮區瑞南里28鄰瑞士街108號,64,6400900,6400900-047,28鄰,瑞士街,,,,,,108號,120.324912516289,22.5991780450873
