FULL_ADDR,COUNTY,TOWN,VILLAGE,NEIGHBORHOOD,ROAD,SECTION,LANE,ALLEY,SUB_ALLEY,TONG,NUMBER,X,Y
高雄市鼓山區厚生里7鄰翠華路63巷37號三樓,64,6400200,6400200-014,7鄰,翠華路,,63巷,,,,37號三樓,120.279637857328,22.6469887131103
高雄市鼓山區厚生里7鄰翠華路63巷37號四樓,64,6400200,6400200-014,7鄰,翠華路,,63巷,,,,37號四樓,120.279637857328,22.6469887131103
高雄市鼓山區厚生里7鄰翠華路63巷37號五樓,64,6400200,6400200-014,7鄰,翠華路,,63巷,,,,37號五樓,120.279637857328,22.6469887131103
高雄市鼓山區厚生里7鄰翠華路63巷37號六樓,64,6400200,6400200-014,7鄰,翠華路,,63巷,,,,37號六樓,120.279637857328,22.6469887131103
高雄市鼓山區厚生里7鄰翠華路63巷37號七樓,64,6400200,6400200-014,7鄰,翠華路,,63巷,,,,37號七樓,120.279637857328,22.6469887131103
高雄市鼓山區厚生里7鄰翠華路63巷37號八樓,64,6400200,6400200-014,7鄰,翠華路,,63巷,,,,37號八樓,120.279637857328,22.6469887131103
高雄市鼓山區厚生里7鄰翠華路63巷37號九樓,64,6400200,6400200-014,7鄰,翠華路,,63巷,,,,37號九樓,120.279637857328,22.6469887131103
高雄市鼓山區厚生里7鄰翠華路63巷37號十一樓,64,6400200,6400200-014,7鄰,翠華路,,63巷,,,,37號十一樓,120.279637857328,22.6469887131103
高雄市鼓山區厚生里7鄰翠華路63巷37號十二樓,64,6400200,6400200-014,7鄰,翠華路,,63巷,,,,37號十二樓,120.279637857328,22.6469887131103
高雄市鼓山區厚生里7鄰翠華路63巷37號十三樓,64,6400200,6400200-014,7鄰,翠華路,,63巷,,,,37號十三樓,120.279637857328,22.6469887131103
高雄市鼓山區厚生里7鄰翠華路63巷37號十四樓,64,6400200,6400200-014,7鄰,翠華路,,63巷,,,,37號十四樓,120.279637857328,22.6469887131103
高雄市鼓山區厚生里7鄰翠華路63巷37號十五樓,64,6400200,6400200-014,7鄰,翠華路,,63巷,,,,37號十五樓,120.279637857328,22.6469887131103
高雄市鼓山區厚生里7鄰翠華路63巷38號,64,6400200,6400200-014,7鄰,翠華路,,63巷,,,,38號,120.280628253465,22.6471483159441
高雄市鼓山區厚生里7鄰翠華路63巷39號十樓,64,6400200,6400200-014,7鄰,翠華路,,63巷,,,,39號十樓,120.279638760411,22.6470990985732
高雄市鼓山區厚生里7鄰翠華路63巷39號二樓,64,6400200,6400200-014,7鄰,翠華路,,63巷,,,,39號二樓,120.279638760411,22.6470990985732
高雄市鼓山區厚生里7鄰翠華路63巷39號三樓,64,6400200,6400200-014,7鄰,翠華路,,63巷,,,,39號三樓,120.279638760411,22.6470990985732
高雄市鼓山區厚生里7鄰翠華路63巷39號四樓,64,6400200,6400200-014,7鄰,翠華路,,63巷,,,,39號四樓,120.279638760411,22.6470990985732
高雄市鼓山區厚生里7鄰翠華路63巷39號五樓,64,6400200,6400200-014,7鄰,翠華路,,63巷,,,,39號五樓,120.279638760411,22.6470990985732
高雄市鼓山區厚生里7鄰翠華路63巷39號六樓,64,6400200,6400200-014,7鄰,翠華路,,63巷,,,,39號六樓,120.279638760411,22.6470990985732
高雄市鼓山區厚生里7鄰翠華路63巷39號七樓,64,6400200,6400200-014,7鄰,翠華路,,63巷,,,,39號七樓,120.279638760411,22.6470990985732
高雄市鼓山區厚生里7鄰翠華路63巷39號八樓,64,6400200,6400200-014,7鄰,翠華路,,63巷,,,,39號八樓,120.279638760411,22.6470990985732
高雄市鼓山區厚生里7鄰翠華路63巷39號九樓,64,6400200,6400200-014,7鄰,翠華路,,63巷,,,,39號九樓,120.279638760411,22.6470990985732
高雄市鼓山區厚生里7鄰翠華路63巷39號十一樓,64,6400200,6400200-014,7鄰,翠華路,,63巷,,,,39號十一樓,120.279638760411,22.6470990985732
高雄市鼓山區厚生里7鄰翠華路63巷39號十二樓,64,6400200,6400200-014,7鄰,翠華路,,63巷,,,,39號十二樓,120.279638760411,22.6470990985732
高雄市鼓山區厚生里7鄰翠華路63巷39號十三樓,64,6400200,6400200-014,7鄰,翠華路,,63巷,,,,39號十三樓,120.279638760411,22.6470990985732
高雄市鼓山區厚生里7鄰翠華路63巷39號十四樓,64,6400200,6400200-014,7鄰,翠華路,,63巷,,,,39號十四樓,120.279638760411,22.6470990985732
高雄市鼓山區厚生里7鄰翠華路63巷39號十五樓,64,6400200,6400200-014,7鄰,翠華路,,63巷,,,,39號十五樓,120.279638760411,22.6470990985732
高雄市鼓山區厚生里7鄰翠華路63巷40號,64,6400200,6400200-014,7鄰,翠華路,,63巷,,,,40號,120.280628269945,22.6471862446742
高雄市鼓山區厚生里7鄰翠華路63巷41號,64,6400200,6400200-014,7鄰,翠華路,,63巷,,,,41號,120.279666140561,22.647193853594
高雄市鼓山區厚生里7鄰翠華路63巷41號十樓,64,6400200,6400200-014,7鄰,翠華路,,63巷,,,,41號十樓,120.279666140561,22.647193853594
高雄市鼓山區厚生里7鄰翠華路63巷41號二樓,64,6400200,6400200-014,7鄰,翠華路,,63巷,,,,41號二樓,120.279666140561,22.647193853594
高雄市鼓山區厚生里7鄰翠華路63巷41號三樓,64,6400200,6400200-014,7鄰,翠華路,,63巷,,,,41號三樓,120.279666140561,22.647193853594
高雄市鼓山區厚生里7鄰翠華路63巷41號四樓,64,6400200,6400200-014,7鄰,翠華路,,63巷,,,,41號四樓,120.279666140561,22.647193853594
高雄市鼓山區厚生里7鄰翠華路63巷41號五樓,64,6400200,6400200-014,7鄰,翠華路,,63巷,,,,41號五樓,120.279666140561,22.647193853594
高雄市鼓山區厚生里7鄰翠華路63巷41號六樓,64,6400200,6400200-014,7鄰,翠華路,,63巷,,,,41號六樓,120.279666140561,22.647193853594
高雄市鼓山區厚生里7鄰翠華路63巷41號七樓,64,6400200,6400200-014,7鄰,翠華路,,63巷,,,,41號七樓,120.279666140561,22.647193853594
高雄市鼓山區厚生里7鄰翠華路63巷41號八樓,64,6400200,6400200-014,7鄰,翠華路,,63巷,,,,41號八樓,120.279666140561,22.647193853594
高雄市鼓山區厚生里7鄰翠華路63巷41號九樓,64,6400200,6400200-014,7鄰,翠華路,,63巷,,,,41號九樓,120.279666140561,22.647193853594
高雄市鼓山區厚生里7鄰翠華路63巷41號十一樓,64,6400200,6400200-014,7鄰,翠華路,,63巷,,,,41號十一樓,120.279666140561,22.647193853594
高雄市鼓山區厚生里7鄰翠華路63巷41號十二樓,64,6400200,6400200-014,7鄰,翠華路,,63巷,,,,41號十二樓,120.279666140561,22.647193853594
高雄市鼓山區厚生里7鄰翠華路63巷41號十三樓,64,6400200,6400200-014,7鄰,翠華路,,63巷,,,,41號十三樓,120.279666140561,22.647193853594
高雄市鼓山區厚生里7鄰翠華路63巷41號十四樓,64,6400200,6400200-014,7鄰,翠華路,,63巷,,,,41號十四樓,120.279666140561,22.647193853594
高雄市鼓山區厚生里7鄰翠華路63巷41號十五樓,64,6400200,6400200-014,7鄰,翠華路,,63巷,,,,41號十五樓,120.279666140561,22.647193853594
高雄市鼓山區厚生里7鄰翠華路63巷42號,64,6400200,6400200-014,7鄰,翠華路,,63巷,,,,42號,120.280628310282,22.6472625536986
高雄市鼓山區厚生里7鄰翠華路63巷43號,64,6400200,6400200-014,7鄰,翠華路,,63巷,,,,43號,120.279662627993,22.6472741201193
高雄市鼓山區厚生里7鄰翠華路63巷43號十樓,64,6400200,6400200-014,7鄰,翠華路,,63巷,,,,43號十樓,120.279662627993,22.6472741201193
高雄市鼓山區厚生里7鄰翠華路63巷43號二樓,64,6400200,6400200-014,7鄰,翠華路,,63巷,,,,43號二樓,120.279662627993,22.6472741201193
高雄市鼓山區厚生里7鄰翠華路63巷43號三樓,64,6400200,6400200-014,7鄰,翠華路,,63巷,,,,43號三樓,120.279662627993,22.6472741201193
高雄市鼓山區厚生里7鄰翠華路63巷43號四樓,64,6400200,6400200-014,7鄰,翠華路,,63巷,,,,43號四樓,120.279662627993,22.6472741201193
高雄市鼓山區厚生里7鄰翠華路63巷43號五樓,64,6400200,6400200-014,7鄰,翠華路,,63巷,,,,43號五樓,120.279662627993,22.6472741201193
高雄市鼓山區厚生里7鄰翠華路63巷43號六樓,64,6400200,6400200-014,7鄰,翠華路,,63巷,,,,43號六樓,120.279662627993,22.6472741201193
高雄市鼓山區厚生里7鄰翠華路63巷43號七樓,64,6400200,6400200-014,7鄰,翠華路,,63巷,,,,43號七樓,120.279662627993,22.6472741201193
高雄市鼓山區厚生里7鄰翠華路63巷43號八樓,64,6400200,6400200-014,7鄰,翠華路,,63巷,,,,43號八樓,120.279662627993,22.6472741201193
高雄市鼓山區厚生里7鄰翠華路63巷43號九樓,64,6400200,6400200-014,7鄰,翠華路,,63巷,,,,43號九樓,120.279662627993,22.6472741201193
高雄市鼓山區厚生里7鄰翠華路63巷43號十一樓,64,6400200,6400200-014,7鄰,翠華路,,63巷,,,,43號十一樓,120.279662627993,22.6472741201193
高雄市鼓山區厚生里7鄰翠華路63巷43號十二樓,64,6400200,6400200-014,7鄰,翠華路,,63巷,,,,43號十二樓,120.279662627993,22.6472741201193
高雄市鼓山區厚生里7鄰翠華路63巷43號十三樓,64,6400200,6400200-014,7鄰,翠華路,,63巷,,,,43號十三樓,120.279662627993,22.6472741201193
高雄市鼓山區厚生里7鄰翠華路63巷43號十四樓,64,6400200,6400200-014,7鄰,翠華路,,63巷,,,,43號十四樓,120.279662627993,22.6472741201193
高雄市鼓山區厚生里7鄰翠華路63巷45號十樓,64,6400200,6400200-014,7鄰,翠華路,,63巷,,,,45號十樓,120.279662156184,22.6473515195366
高雄市鼓山區厚生里7鄰翠華路63巷45號二樓,64,6400200,6400200-014,7鄰,翠華路,,63巷,,,,45號二樓,120.279662156184,22.6473515195366
高雄市鼓山區厚生里7鄰翠華路63巷45號三樓,64,6400200,6400200-014,7鄰,翠華路,,63巷,,,,45號三樓,120.279662156184,22.6473515195366
高雄市鼓山區厚生里7鄰翠華路63巷45號四樓,64,6400200,6400200-014,7鄰,翠華路,,63巷,,,,45號四樓,120.279662156184,22.6473515195366
高雄市鼓山區厚生里7鄰翠華路63巷45號五樓,64,6400200,6400200-014,7鄰,翠華路,,63巷,,,,45號五樓,120.279662156184,22.6473515195366
高雄市鼓山區厚生里7鄰翠華路63巷45號六樓,64,6400200,6400200-014,7鄰,翠華路,,63巷,,,,45號六樓,120.279662156184,22.6473515195366
高雄市鼓山區厚生里7鄰翠華路63巷45號七樓,64,6400200,6400200-014,7鄰,翠華路,,63巷,,,,45號七樓,120.279662156184,22.6473515195366
高雄市鼓山區厚生里7鄰翠華路63巷45號八樓,64,6400200,6400200-014,7鄰,翠華路,,63巷,,,,45號八樓,120.279662156184,22.6473515195366
高雄市鼓山區厚生里7鄰翠華路63巷45號九樓,64,6400200,6400200-014,7鄰,翠華路,,63巷,,,,45號九樓,120.279662156184,22.6473515195366
高雄市鼓山區厚生里7鄰翠華路63巷45號十一樓,64,6400200,6400200-014,7鄰,翠華路,,63巷,,,,45號十一樓,120.279662156184,22.6473515195366
高雄市鼓山區厚生里7鄰翠華路63巷45號十二樓,64,6400200,6400200-014,7鄰,翠華路,,63巷,,,,45號十二樓,120.279662156184,22.6473515195366
高雄市鼓山區厚生里7鄰翠華路63巷45號十三樓,64,6400200,6400200-014,7鄰,翠華路,,63巷,,,,45號十三樓,120.279662156184,22.6473515195366
高雄市鼓山區厚生里7鄰翠華路63巷45號十四樓,64,6400200,6400200-014,7鄰,翠華路,,63巷,,,,45號十四樓,120.279662156184,22.6473515195366
高雄市鼓山區厚生里7鄰翠華路63巷46號,64,6400200,6400200-014,7鄰,翠華路,,63巷,,,,46號,120.280453172962,22.6472626345945
高雄市鼓山區厚生里7鄰翠華路63巷47號十樓,64,6400200,6400200-014,7鄰,翠華路,,63巷,,,,47號十樓,120.279759534293,22.6473519751522
高雄市鼓山區厚生里7鄰翠華路63巷47號二樓,64,6400200,6400200-014,7鄰,翠華路,,63巷,,,,47號二樓,120.279759534293,22.6473519751522
高雄市鼓山區厚生里7鄰翠華路63巷47號三樓,64,6400200,6400200-014,7鄰,翠華路,,63巷,,,,47號三樓,120.279759534293,22.6473519751522
高雄市鼓山區厚生里7鄰翠華路63巷47號四樓,64,6400200,6400200-014,7鄰,翠華路,,63巷,,,,47號四樓,120.279759534293,22.6473519751522
高雄市鼓山區厚生里7鄰翠華路63巷47號五樓,64,6400200,6400200-014,7鄰,翠華路,,63巷,,,,47號五樓,120.279759534293,22.6473519751522
高雄市鼓山區厚生里7鄰翠華路63巷47號六樓,64,6400200,6400200-014,7鄰,翠華路,,63巷,,,,47號六樓,120.279759534293,22.6473519751522
高雄市鼓山區厚生里7鄰翠華路63巷47號七樓,64,6400200,6400200-014,7鄰,翠華路,,63巷,,,,47號七樓,120.279759534293,22.6473519751522
高雄市鼓山區厚生里7鄰翠華路63巷47號八樓,64,6400200,6400200-014,7鄰,翠華路,,63巷,,,,47號八樓,120.279759534293,22.6473519751522
高雄市鼓山區厚生里7鄰翠華路63巷47號九樓,64,6400200,6400200-014,7鄰,翠華路,,63巷,,,,47號九樓,120.279759534293,22.6473519751522
高雄市鼓山區厚生里7鄰翠華路63巷47號十一樓,64,6400200,6400200-014,7鄰,翠華路,,63巷,,,,47號十一樓,120.279759534293,22.6473519751522
高雄市鼓山區厚生里7鄰翠華路63巷47號十二樓,64,6400200,6400200-014,7鄰,翠華路,,63巷,,,,47號十二樓,120.279759534293,22.6473519751522
高雄市鼓山區厚生里7鄰翠華路63巷47號十三樓,64,6400200,6400200-014,7鄰,翠華路,,63巷,,,,47號十三樓,120.279759534293,22.6473519751522
高雄市鼓山區厚生里7鄰翠華路63巷47號十四樓,64,6400200,6400200-014,7鄰,翠華路,,63巷,,,,47號十四樓,120.279759534293,22.6473519751522
高雄市鼓山區厚生里7鄰翠華路63巷48號,64,6400200,6400200-014,7鄰,翠華路,,63巷,,,,48號,120.280453158883,22.6472242543449
高雄市鼓山區厚生里7鄰翠華路63巷50號,64,6400200,6400200-014,7鄰,翠華路,,63巷,,,,50號,120.280453132722,22.6471863255726
高雄市鼓山區厚生里7鄰翠華路63巷52號,64,6400200,6400200-014,7鄰,翠華路,,63巷,,,,52號,120.280453116337,22.6471483878133
高雄市鼓山區厚生里7鄰翠華路63巷56號,64,6400200,6400200-014,7鄰,翠華路,,63巷,,,,56號,120.280453099905,22.6471104590842
高雄市鼓山區厚生里7鄰翠華路63巷58號,64,6400200,6400200-014,7鄰,翠華路,,63巷,,,,58號,120.280453077265,22.6470643846968
高雄市鼓山區厚生里7鄰翠華路63巷60號,64,6400200,6400200-014,7鄰,翠華路,,63巷,,,,60號,120.28033638446,22.6470643665732
高雄市鼓山區厚生里7鄰翠華路63巷62號,64,6400200,6400200-014,7鄰,翠華路,,63巷,,,,62號,120.280336338581,22.6471105128972
高雄市鼓山區厚生里7鄰翠華路63巷66號,64,6400200,6400200-014,7鄰,翠華路,,63巷,,,,66號,120.280336354981,22.6471484416255
高雄市鼓山區厚生里7鄰翠華路63巷68號,64,6400200,6400200-014,7鄰,翠華路,,63巷,,,,68號,120.28033638111,22.6471863703972
高雄市鼓山區厚生里7鄰翠華路63巷70號,64,6400200,6400200-014,7鄰,翠華路,,63巷,,,,70號,120.28033639751,22.6472242991251
高雄市鼓山區厚生里7鄰翠華路63巷72號,64,6400200,6400200-014,7鄰,翠華路,,63巷,,,,72號,120.280336421286,22.6472626794175
高雄市鼓山區厚生里7鄰翠華路63巷76號,64,6400200,6400200-014,7鄰,翠華路,,63巷,,,,76號,120.280161274246,22.6472627599507
高雄市鼓山區厚生里7鄰翠華路63巷78號,64,6400200,6400200-014,7鄰,翠華路,,63巷,,,,78號,120.280161260249,22.6472243797033
高雄市鼓山區厚生里7鄰翠華路63巷80號,64,6400200,6400200-014,7鄰,翠華路,,63巷,,,,80號,120.280161243897,22.6471864509766
高雄市鼓山區厚生里7鄰翠華路63巷82號,64,6400200,6400200-014,7鄰,翠華路,,63巷,,,,82號,120.280161227545,22.6471485222498
高雄市鼓山區厚生里7鄰翠華路63巷86號,64,6400200,6400200-014,7鄰,翠華路,,63巷,,,,86號,120.280161201464,22.6471105934791
高雄市鼓山區厚生里7鄰翠華路63巷88號,64,6400200,6400200-014,7鄰,翠華路,,63巷,,,,88號,120.280161187465,22.6470722132309
高雄市鼓山區厚生里7鄰翠華路63巷90號,64,6400200,6400200-014,7鄰,翠華路,,63巷,,,,90號,120.280177519109,22.6469758755408
高雄市鼓山區厚生里7鄰翠華路63巷92號,64,6400200,6400200-014,7鄰,翠華路,,63巷,,,,92號,120.280160370312,22.6469919272438
高雄市鼓山區厚生里7鄰翠華路63巷96號,64,6400200,6400200-014,7鄰,翠華路,,63巷,,,,96號,120.280119078311,22.6470014497463
高雄市鼓山區厚生里7鄰翠華路63巷98號,64,6400200,6400200-014,7鄰,翠華路,,63巷,,,,98號,120.280045759652,22.6470180348469
高雄市鼓山區厚生里7鄰翠華路63巷100號,64,6400200,6400200-014,7鄰,翠華路,,63巷,,,,100號,120.280032303333,22.647081631334
高雄市鼓山區厚生里7鄰翠華路63巷102號,64,6400200,6400200-014,7鄰,翠華路,,63巷,,,,102號,120.280031859906,22.6471181672781
高雄市鼓山區厚生里7鄰翠華路63巷106號,64,6400200,6400200-014,7鄰,翠華路,,63巷,,,,106號,120.280031593766,22.6471542886093
高雄市鼓山區厚生里7鄰翠華路63巷108號,64,6400200,6400200-014,7鄰,翠華路,,63巷,,,,108號,120.280031317897,22.6471904098965
高雄市鼓山區厚生里7鄰翠華路63巷110號,64,6400200,6400200-014,7鄰,翠華路,,63巷,,,,110號,120.28003105171,22.6472265402578
高雄市鼓山區厚生里7鄰翠華路63巷112號,64,6400200,6400200-014,7鄰,翠華路,,63巷,,,,112號,120.280030774145,22.6472629866398
高雄市鼓山區厚生里7鄰翠華路65號,64,6400200,6400200-014,7鄰,翠華路,,,,,,65號,120.280733504048,22.6467542850381
高雄市鼓山區厚生里7鄰翠華路66號,64,6400200,6400200-014,7鄰,翠華路,,,,,,66號,120.280735647427,22.646815368826
高雄市鼓山區厚生里7鄰翠華路67號,64,6400200,6400200-014,7鄰,翠華路,,,,,,67號,120.28073769261,22.6468523403831
高雄市鼓山區厚生里7鄰翠華路68號,64,6400200,6400200-014,7鄰,翠華路,,,,,,68號,120.280739747476,22.6468893210141
高雄市鼓山區厚生里7鄰翠華路69號,64,6400200,6400200-014,7鄰,翠華路,,,,,,69號,120.280741792661,22.6469262925709
高雄市鼓山區厚生里7鄰翠華路70號,64,6400200,6400200-014,7鄰,翠華路,,,,,,70號,120.2807438378,22.6469632731579
高雄市鼓山區厚生里7鄰翠華路71號,64,6400200,6400200-014,7鄰,翠華路,,,,,,71號,120.280750739047,22.6470000226755
高雄市鼓山區厚生里7鄰翠華路72號,64,6400200,6400200-014,7鄰,翠華路,,,,,,72號,120.280752784189,22.6470370032622
高雄市鼓山區厚生里7鄰翠華路73號,64,6400200,6400200-014,7鄰,翠華路,,,,,,73號,120.280754839107,22.6470739748619
高雄市鼓山區厚生里7鄰翠華路75號,64,6400200,6400200-014,7鄰,翠華路,,,,,,75號,120.280757477581,22.6471109852022
高雄市鼓山區厚生里7鄰翠華路76號,64,6400200,6400200-014,7鄰,翠華路,,,,,,76號,120.280758510668,22.6471480064007
高雄市鼓山區厚生里7鄰翠華路77號,64,6400200,6400200-014,7鄰,翠華路,,,,,,77號,120.280759543756,22.6471850275989
高雄市鼓山區厚生里7鄰翠華路78號,64,6400200,6400200-014,7鄰,翠華路,,,,,,78號,120.280760576844,22.647222048797
高雄市鼓山區厚生里7鄰翠華路79號,64,6400200,6400200-014,7鄰,翠華路,,,,,,79號,120.28076184601,22.6472604437104
高雄市鼓山區厚生里7鄰翠華路80號,64,6400200,6400200-014,7鄰,翠華路,,,,,,80號,120.280799465658,22.6473545310751
高雄市鼓山區厚生里4鄰翠華路100號,64,6400200,6400200-014,4鄰,翠華路,,,,,,100號,120.280831362253,22.6479049286584
高雄市鼓山區厚生里4鄰翠華路101號,64,6400200,6400200-014,4鄰,翠華路,,,,,,101號,120.280779761267,22.6479397721188
高雄市鼓山區厚生里4鄰翠華路102號,64,6400200,6400200-014,4鄰,翠華路,,,,,,102號,120.28078151897,22.6479759025322
高雄市鼓山區厚生里4鄰翠華路103號,64,6400200,6400200-014,4鄰,翠華路,,,,,,103號,120.280782303762,22.6480120285803
高雄市鼓山區厚生里4鄰翠華路104號,64,6400200,6400200-014,4鄰,翠華路,,,,,,104號,120.280783088555,22.6480481546282
高雄市鼓山區厚生里4鄰翠華路105巷1弄1號,64,6400200,6400200-014,4鄰,翠華路,,105巷,1弄,,,1號,120.280645992377,22.6480294781873
高雄市鼓山區厚生里8鄰翠華路105巷1號,64,6400200,6400200-014,8鄰,翠華路,,105巷,,,,1號,120.280719121814,22.6481408469933
高雄市鼓山區厚生里4鄰翠華路105巷1弄2號,64,6400200,6400200-014,4鄰,翠華路,,105巷,1弄,,,2號,120.280476884221,22.6479926057097
高雄市鼓山區厚生里4鄰翠華路105巷1弄3號,64,6400200,6400200-014,4鄰,翠華路,,105巷,1弄,,,3號,120.280654889693,22.6480024262203
高雄市鼓山區厚生里4鄰翠華路105巷1弄4號,64,6400200,6400200-014,4鄰,翠華路,,105巷,1弄,,,4號,120.280486754526,22.6479655490894
高雄市鼓山區厚生里4鄰翠華路105巷1弄5號,64,6400200,6400200-014,4鄰,翠華路,,105巷,1弄,,,5號,120.280663834044,22.6479663438322
高雄市鼓山區厚生里4鄰翠華路105巷1弄6號,64,6400200,6400200-014,4鄰,翠華路,,105巷,1弄,,,6號,120.280495698917,22.6479294667116
高雄市鼓山區厚生里4鄰翠華路105巷1弄7號,64,6400200,6400200-014,4鄰,翠華路,,105巷,1弄,,,7號,120.280672731353,22.6479392918638
高雄市鼓山區厚生里4鄰翠華路105巷1弄8號,64,6400200,6400200-014,4鄰,翠華路,,105巷,1弄,,,8號,120.280504643304,22.6478933843329
高雄市鼓山區厚生里4鄰翠華路105巷1弄9號,64,6400200,6400200-014,4鄰,翠華路,,105巷,1弄,,,9號,120.280683621515,22.6479032182058
高雄市鼓山區厚生里4鄰翠華路105巷1弄10號,64,6400200,6400200-014,4鄰,翠華路,,105巷,1弄,,,10號,120.280515486459,22.6478663411075
高雄市鼓山區厚生里4鄰翠華路105巷1弄11號,64,6400200,6400200-014,4鄰,翠華路,,105巷,1弄,,,11號,120.280695541346,22.6478581185355
高雄市鼓山區厚生里4鄰翠華路105巷1弄12號,64,6400200,6400200-014,4鄰,翠華路,,105巷,1弄,,,12號,120.280519566286,22.6478302368934
高雄市鼓山區厚生里4鄰翠華路105巷1弄14號,64,6400200,6400200-014,4鄰,翠華路,,105巷,1弄,,,14號,120.280533469298,22.6477761155054
高雄市鼓山區厚生里4鄰翠華路105巷1弄16號,64,6400200,6400200-014,4鄰,翠華路,,105巷,1弄,,,16號,120.28053365748,22.6477399938235
高雄市鼓山區厚生里4鄰翠華路105巷2弄1號,64,6400200,6400200-014,4鄰,翠華路,,105巷,2弄,,,1號,120.280397189892,22.6479741867056
高雄市鼓山區厚生里8鄰翠華路105巷2號,64,6400200,6400200-014,8鄰,翠華路,,105巷,,,,2號,120.280686825436,22.6481211959063
高雄市鼓山區厚生里4鄰翠華路105巷2弄2號,64,6400200,6400200-014,4鄰,翠華路,,105巷,2弄,,,2號,120.280228223122,22.6479102136793
高雄市鼓山區厚生里4鄰翠華路105巷2弄3號,64,6400200,6400200-014,4鄰,翠華路,,105巷,2弄,,,3號,120.280406134355,22.647938095303
高雄市鼓山區厚生里4鄰翠華路105巷2弄4號,64,6400200,6400200-014,4鄰,翠華路,,105巷,2弄,,,4號,120.280237167624,22.6478741222869
高雄市鼓山區厚生里4鄰翠華路105巷2弄5號,64,6400200,6400200-014,4鄰,翠華路,,105巷,2弄,,,5號,120.280415031712,22.6479110433502
高雄市鼓山區厚生里4鄰翠華路105巷2弄6號,64,6400200,6400200-014,4鄰,翠華路,,105巷,2弄,,,6號,120.280246065009,22.6478470703439
高雄市鼓山區厚生里4鄰翠華路105巷2弄7號,64,6400200,6400200-014,4鄰,翠華路,,105巷,2弄,,,7號,120.280424949028,22.6478749653438
高雄市鼓山區厚生里4鄰翠華路105巷2弄8號,64,6400200,6400200-014,4鄰,翠華路,,105巷,2弄,,,8號,120.280255009454,22.6478109879804
高雄市鼓山區厚生里4鄰翠華路105巷2弄9號,64,6400200,6400200-014,4鄰,翠華路,,105巷,2弄,,,9號,120.280435801926,22.6478479221678
高雄市鼓山區厚生里4鄰翠華路105巷2弄10號,64,6400200,6400200-014,4鄰,翠華路,,105巷,2弄,,,10號,120.280260812689,22.6477783773359
高雄市鼓山區厚生里4鄰翠華路105巷2弄11號,64,6400200,6400200-014,4鄰,翠華路,,105巷,2弄,,,11號,120.280446739193,22.6478028181067
高雄市鼓山區厚生里4鄰翠華路105巷2弄12號,64,6400200,6400200-014,4鄰,翠華路,,105巷,2弄,,,12號,120.280275817058,22.6477388363559
高雄市鼓山區厚生里4鄰翠華路105巷3弄1號,64,6400200,6400200-014,4鄰,翠華路,,105巷,3弄,,,1號,120.280145610147,22.6478917814464
高雄市鼓山區厚生里4鄰翠華路105巷3弄2號,64,6400200,6400200-014,4鄰,翠華路,,105巷,3弄,,,2號,120.279987204365,22.6478549474883
高雄市鼓山區厚生里4鄰翠華路105巷3弄3號,64,6400200,6400200-014,4鄰,翠華路,,105巷,3弄,,,3號,120.280155527579,22.647855694428
高雄市鼓山區厚生里8鄰翠華路105巷3號,64,6400200,6400200-014,8鄰,翠華路,,105巷,,,,3號,120.280652616093,22.6481139081934
高雄市鼓山區厚生里4鄰翠華路105巷3弄4號,64,6400200,6400200-014,4鄰,翠華路,,105巷,3弄,,,4號,120.279996101845,22.64782788653
高雄市鼓山區厚生里4鄰翠華路105巷3弄5號,64,6400200,6400200-014,4鄰,翠華路,,105巷,3弄,,,5號,120.280164424979,22.6478286424899
高雄市鼓山區厚生里4鄰翠華路105巷3弄6號,64,6400200,6400200-014,4鄰,翠華路,,105巷,3弄,,,6號,120.280005046354,22.647791804182
高雄市鼓山區厚生里4鄰翠華路105巷3弄7號,64,6400200,6400200-014,4鄰,翠華路,,105巷,3弄,,,7號,120.280176344971,22.647783542862
高雄市鼓山區厚生里4鄰翠華路105巷3弄8號,64,6400200,6400200-014,4鄰,翠華路,,105巷,3弄,,,8號,120.280013943778,22.6477647522527
高雄市鼓山區厚生里4鄰翠華路105巷3弄9號,64,6400200,6400200-014,4鄰,翠華路,,105巷,3弄,,,9號,120.280187235248,22.6477474692401
高雄市鼓山區厚生里4鄰翠華路105巷3弄10號,64,6400200,6400200-014,4鄰,翠華路,,105巷,3弄,,,10號,120.280027799902,22.6477196613325
高雄市鼓山區厚生里4鄰翠華路105巷3弄11號,64,6400200,6400200-014,4鄰,翠華路,,105巷,3弄,,,11號,120.280199098429,22.6477113999858
高雄市鼓山區厚生里4鄰翠華路105巷3弄12號,64,6400200,6400200-014,4鄰,翠華路,,105巷,3弄,,,12號,120.280034798577,22.6476835702425
高雄市鼓山區厚生里4鄰翠華路105巷4弄1號,64,6400200,6400200-014,4鄰,翠華路,,105巷,4弄,,,1號,120.279900699819,22.6478364976505
高雄市鼓山區厚生里4鄰翠華路105巷4弄2號,64,6400200,6400200-014,4鄰,翠華路,,105巷,4弄,,,2號,120.279720712287,22.6478019595968
高雄市鼓山區厚生里4鄰翠華路105巷4弄3號,64,6400200,6400200-014,4鄰,翠華路,,105巷,4弄,,,3號,120.279909607043,22.647809436741
高雄市鼓山區厚生里8鄰翠華路105巷4號,64,6400200,6400200-014,8鄰,翠華路,,105巷,,,,4號,120.28061854544,22.6480986741401
