FULL_ADDR,COUNTY,TOWN,VILLAGE,NEIGHBORHOOD,ROAD,SECTION,LANE,ALLEY,SUB_ALLEY,TONG,NUMBER,X,Y
高雄市鼓山區光榮里30鄰翠華路270號二樓之1,64,6400200,6400200-004,30鄰,翠華路,,,,,,270號二樓之1,120.281214569491,22.6551440639635
高雄市鼓山區光榮里30鄰翠華路270號二樓之2,64,6400200,6400200-004,30鄰,翠華路,,,,,,270號二樓之2,120.281214569491,22.6551440639635
高雄市鼓山區光榮里30鄰翠華路270號三樓之1,64,6400200,6400200-004,30鄰,翠華路,,,,,,270號三樓之1,120.281214569491,22.6551440639635
高雄市鼓山區光榮里30鄰翠華路270號三樓之2,64,6400200,6400200-004,30鄰,翠華路,,,,,,270號三樓之2,120.281214569491,22.6551440639635
高雄市鼓山區光榮里30鄰翠華路270號四樓之1,64,6400200,6400200-004,30鄰,翠華路,,,,,,270號四樓之1,120.281214569491,22.6551440639635
高雄市鼓山區光榮里30鄰翠華路270號四樓之2,64,6400200,6400200-004,30鄰,翠華路,,,,,,270號四樓之2,120.281214569491,22.6551440639635
高雄市鼓山區光榮里30鄰翠華路270號五樓之1,64,6400200,6400200-004,30鄰,翠華路,,,,,,270號五樓之1,120.281214569491,22.6551440639635
高雄市鼓山區光榮里30鄰翠華路270號五樓之2,64,6400200,6400200-004,30鄰,翠華路,,,,,,270號五樓之2,120.281214569491,22.6551440639635
高雄市鼓山區光榮里30鄰翠華路271號,64,6400200,6400200-004,30鄰,翠華路,,,,,,271號,120.281217536712,22.6551908559062
高雄市鼓山區光榮里30鄰翠華路272號,64,6400200,6400200-004,30鄰,翠華路,,,,,,272號,120.281222003783,22.6552485816311
高雄市鼓山區光榮里30鄰翠華路272號二樓之1,64,6400200,6400200-004,30鄰,翠華路,,,,,,272號二樓之1,120.281222003783,22.6552485816311
高雄市鼓山區光榮里30鄰翠華路272號二樓之2,64,6400200,6400200-004,30鄰,翠華路,,,,,,272號二樓之2,120.281222003783,22.6552485816311
高雄市鼓山區光榮里30鄰翠華路272號三樓之1,64,6400200,6400200-004,30鄰,翠華路,,,,,,272號三樓之1,120.281222003783,22.6552485816311
高雄市鼓山區光榮里30鄰翠華路272號三樓之2,64,6400200,6400200-004,30鄰,翠華路,,,,,,272號三樓之2,120.281222003783,22.6552485816311
高雄市鼓山區光榮里30鄰翠華路272號四樓之1,64,6400200,6400200-004,30鄰,翠華路,,,,,,272號四樓之1,120.281222003783,22.6552485816311
高雄市鼓山區光榮里30鄰翠華路272號四樓之2,64,6400200,6400200-004,30鄰,翠華路,,,,,,272號四樓之2,120.281222003783,22.6552485816311
高雄市鼓山區光榮里30鄰翠華路272號五樓之1,64,6400200,6400200-004,30鄰,翠華路,,,,,,272號五樓之1,120.281222003783,22.6552485816311
高雄市鼓山區光榮里30鄰翠華路272號五樓之2,64,6400200,6400200-004,30鄰,翠華路,,,,,,272號五樓之2,120.281222003783,22.6552485816311
高雄市鼓山區光榮里30鄰翠華路273號,64,6400200,6400200-004,30鄰,翠華路,,,,,,273號,120.281224978531,22.6552939287071
高雄市鼓山區光榮里30鄰翠華路274號,64,6400200,6400200-004,30鄰,翠華路,,,,,,274號,120.281230883424,22.6553558149671
高雄市鼓山區光榮里30鄰翠華路274號二樓之1,64,6400200,6400200-004,30鄰,翠華路,,,,,,274號二樓之1,120.281230883424,22.6553558149671
高雄市鼓山區光榮里30鄰翠華路274號二樓之2,64,6400200,6400200-004,30鄰,翠華路,,,,,,274號二樓之2,120.281230883424,22.6553558149671
高雄市鼓山區光榮里30鄰翠華路274號三樓之1,64,6400200,6400200-004,30鄰,翠華路,,,,,,274號三樓之1,120.281230883424,22.6553558149671
高雄市鼓山區光榮里30鄰翠華路274號三樓之2,64,6400200,6400200-004,30鄰,翠華路,,,,,,274號三樓之2,120.281230883424,22.6553558149671
高雄市鼓山區光榮里30鄰翠華路274號四樓之1,64,6400200,6400200-004,30鄰,翠華路,,,,,,274號四樓之1,120.281230883424,22.6553558149671
高雄市鼓山區光榮里30鄰翠華路274號四樓之2,64,6400200,6400200-004,30鄰,翠華路,,,,,,274號四樓之2,120.281230883424,22.6553558149671
高雄市鼓山區光榮里30鄰翠華路274號五樓之1,64,6400200,6400200-004,30鄰,翠華路,,,,,,274號五樓之1,120.281230883424,22.6553558149671
高雄市鼓山區光榮里30鄰翠華路274號五樓之2,64,6400200,6400200-004,30鄰,翠華路,,,,,,274號五樓之2,120.281230883424,22.6553558149671
高雄市鼓山區光榮里30鄰翠華路275號,64,6400200,6400200-004,30鄰,翠華路,,,,,,275號,120.281233857706,22.6554012523466
高雄市鼓山區光榮里30鄰翠華路276號,64,6400200,6400200-004,30鄰,翠華路,,,,,,276號,120.281233931876,22.6554617578607
高雄市鼓山區光榮里30鄰翠華路276號二樓之1,64,6400200,6400200-004,30鄰,翠華路,,,,,,276號二樓之1,120.281233931876,22.6554617578607
高雄市鼓山區光榮里30鄰翠華路276號二樓之2,64,6400200,6400200-004,30鄰,翠華路,,,,,,276號二樓之2,120.281233931876,22.6554617578607
高雄市鼓山區光榮里30鄰翠華路276號三樓之1,64,6400200,6400200-004,30鄰,翠華路,,,,,,276號三樓之1,120.281233931876,22.6554617578607
高雄市鼓山區光榮里30鄰翠華路276號三樓之2,64,6400200,6400200-004,30鄰,翠華路,,,,,,276號三樓之2,120.281233931876,22.6554617578607
高雄市鼓山區光榮里30鄰翠華路276號四樓之1,64,6400200,6400200-004,30鄰,翠華路,,,,,,276號四樓之1,120.281233931876,22.6554617578607
高雄市鼓山區光榮里30鄰翠華路276號四樓之2,64,6400200,6400200-004,30鄰,翠華路,,,,,,276號四樓之2,120.281233931876,22.6554617578607
高雄市鼓山區光榮里30鄰翠華路276號五樓之1,64,6400200,6400200-004,30鄰,翠華路,,,,,,276號五樓之1,120.281233931876,22.6554617578607
高雄市鼓山區光榮里30鄰翠華路276號五樓之2,64,6400200,6400200-004,30鄰,翠華路,,,,,,276號五樓之2,120.281233931876,22.6554617578607
高雄市鼓山區光榮里30鄰翠華路277號,64,6400200,6400200-004,30鄰,翠華路,,,,,,277號,120.28123690663,22.6555071049355
高雄市鼓山區光榮里30鄰翠華路278號十樓,64,6400200,6400200-004,30鄰,翠華路,,,,,,278號十樓,120.280722586197,22.6550887113556
高雄市鼓山區光榮里30鄰翠華路278號十樓之1,64,6400200,6400200-004,30鄰,翠華路,,,,,,278號十樓之1,120.280670780584,22.6550110412328
高雄市鼓山區光榮里30鄰翠華路278號二樓,64,6400200,6400200-004,30鄰,翠華路,,,,,,278號二樓,120.280722586197,22.6550887113556
高雄市鼓山區光榮里30鄰翠華路278號二樓之1,64,6400200,6400200-004,30鄰,翠華路,,,,,,278號二樓之1,120.280670780584,22.6550110412328
高雄市鼓山區光榮里30鄰翠華路278號三樓,64,6400200,6400200-004,30鄰,翠華路,,,,,,278號三樓,120.280722586197,22.6550887113556
高雄市鼓山區光榮里30鄰翠華路278號三樓之1,64,6400200,6400200-004,30鄰,翠華路,,,,,,278號三樓之1,120.280670780584,22.6550110412328
高雄市鼓山區光榮里30鄰翠華路278號四樓,64,6400200,6400200-004,30鄰,翠華路,,,,,,278號四樓,120.280722586197,22.6550887113556
高雄市鼓山區光榮里30鄰翠華路278號四樓之1,64,6400200,6400200-004,30鄰,翠華路,,,,,,278號四樓之1,120.280670780584,22.6550110412328
高雄市鼓山區光榮里30鄰翠華路278號五樓,64,6400200,6400200-004,30鄰,翠華路,,,,,,278號五樓,120.280722586197,22.6550887113556
高雄市鼓山區光榮里30鄰翠華路278號五樓之1,64,6400200,6400200-004,30鄰,翠華路,,,,,,278號五樓之1,120.280670780584,22.6550110412328
高雄市鼓山區光榮里30鄰翠華路278號六樓,64,6400200,6400200-004,30鄰,翠華路,,,,,,278號六樓,120.280722586197,22.6550887113556
高雄市鼓山區光榮里30鄰翠華路278號六樓之1,64,6400200,6400200-004,30鄰,翠華路,,,,,,278號六樓之1,120.280670780584,22.6550110412328
高雄市鼓山區光榮里30鄰翠華路278號七樓,64,6400200,6400200-004,30鄰,翠華路,,,,,,278號七樓,120.280722586197,22.6550887113556
高雄市鼓山區光榮里30鄰翠華路278號七樓之1,64,6400200,6400200-004,30鄰,翠華路,,,,,,278號七樓之1,120.280670780584,22.6550110412328
高雄市鼓山區光榮里30鄰翠華路278號八樓,64,6400200,6400200-004,30鄰,翠華路,,,,,,278號八樓,120.280722586197,22.6550887113556
高雄市鼓山區光榮里30鄰翠華路278號八樓之1,64,6400200,6400200-004,30鄰,翠華路,,,,,,278號八樓之1,120.280670780584,22.6550110412328
高雄市鼓山區光榮里30鄰翠華路278號九樓,64,6400200,6400200-004,30鄰,翠華路,,,,,,278號九樓,120.280722586197,22.6550887113556
高雄市鼓山區光榮里30鄰翠華路278號九樓之1,64,6400200,6400200-004,30鄰,翠華路,,,,,,278號九樓之1,120.280670780584,22.6550110412328
高雄市鼓山區光榮里30鄰翠華路278號十一樓,64,6400200,6400200-004,30鄰,翠華路,,,,,,278號十一樓,120.280722586197,22.6550887113556
高雄市鼓山區光榮里30鄰翠華路278號十一樓之1,64,6400200,6400200-004,30鄰,翠華路,,,,,,278號十一樓之1,120.280670780584,22.6550110412328
高雄市鼓山區光榮里30鄰翠華路278號十二樓,64,6400200,6400200-004,30鄰,翠華路,,,,,,278號十二樓,120.280722586197,22.6550887113556
高雄市鼓山區光榮里30鄰翠華路278號十二樓之1,64,6400200,6400200-004,30鄰,翠華路,,,,,,278號十二樓之1,120.280670780584,22.6550110412328
高雄市鼓山區光榮里30鄰翠華路278號十三樓,64,6400200,6400200-004,30鄰,翠華路,,,,,,278號十三樓,120.280722586197,22.6550887113556
高雄市鼓山區光榮里30鄰翠華路278號十三樓之1,64,6400200,6400200-004,30鄰,翠華路,,,,,,278號十三樓之1,120.280670780584,22.6550110412328
高雄市鼓山區光榮里30鄰翠華路278號十四樓,64,6400200,6400200-004,30鄰,翠華路,,,,,,278號十四樓,120.280722586197,22.6550887113556
高雄市鼓山區光榮里30鄰翠華路278號十五樓,64,6400200,6400200-004,30鄰,翠華路,,,,,,278號十五樓,120.280722586197,22.6550887113556
高雄市鼓山區光榮里30鄰翠華路278號十五樓之1,64,6400200,6400200-004,30鄰,翠華路,,,,,,278號十五樓之1,120.280670780584,22.6550110412328
高雄市鼓山區光榮里30鄰翠華路278號十六樓,64,6400200,6400200-004,30鄰,翠華路,,,,,,278號十六樓,120.280722586197,22.6550887113556
高雄市鼓山區光榮里30鄰翠華路278號十六樓之1,64,6400200,6400200-004,30鄰,翠華路,,,,,,278號十六樓之1,120.280670780584,22.6550110412328
高雄市鼓山區光榮里30鄰翠華路278號十七樓,64,6400200,6400200-004,30鄰,翠華路,,,,,,278號十七樓,120.280722586197,22.6550887113556
高雄市鼓山區光榮里30鄰翠華路278號十七樓之1,64,6400200,6400200-004,30鄰,翠華路,,,,,,278號十七樓之1,120.280670780584,22.6550110412328
高雄市鼓山區光榮里30鄰翠華路278號十八樓,64,6400200,6400200-004,30鄰,翠華路,,,,,,278號十八樓,120.280722586197,22.6550887113556
高雄市鼓山區光榮里30鄰翠華路278號十八樓之1,64,6400200,6400200-004,30鄰,翠華路,,,,,,278號十八樓之1,120.280670780584,22.6550110412328
高雄市鼓山區光榮里30鄰翠華路278號十九樓,64,6400200,6400200-004,30鄰,翠華路,,,,,,278號十九樓,120.280722586197,22.6550887113556
高雄市鼓山區光榮里30鄰翠華路278號十九樓之1,64,6400200,6400200-004,30鄰,翠華路,,,,,,278號十九樓之1,120.280670780584,22.6550110412328
高雄市鼓山區光榮里30鄰翠華路278號二十樓,64,6400200,6400200-004,30鄰,翠華路,,,,,,278號二十樓,120.280722586197,22.6550887113556
高雄市鼓山區光榮里30鄰翠華路278號二十樓之1,64,6400200,6400200-004,30鄰,翠華路,,,,,,278號二十樓之1,120.280670780584,22.6550110412328
高雄市鼓山區光榮里30鄰翠華路278號二十一樓,64,6400200,6400200-004,30鄰,翠華路,,,,,,278號二十一樓,120.280722586197,22.6550887113556
高雄市鼓山區光榮里30鄰翠華路278號二十一樓之1,64,6400200,6400200-004,30鄰,翠華路,,,,,,278號二十一樓之1,120.280670780584,22.6550110412328
高雄市鼓山區光榮里30鄰翠華路278號二十二樓,64,6400200,6400200-004,30鄰,翠華路,,,,,,278號二十二樓,120.280722586197,22.6550887113556
高雄市鼓山區光榮里30鄰翠華路278號二十二樓之1,64,6400200,6400200-004,30鄰,翠華路,,,,,,278號二十二樓之1,120.280670780584,22.6550110412328
高雄市鼓山區光榮里30鄰翠華路278號二十三樓,64,6400200,6400200-004,30鄰,翠華路,,,,,,278號二十三樓,120.280722586197,22.6550887113556
高雄市鼓山區光榮里30鄰翠華路278號二十三樓之1,64,6400200,6400200-004,30鄰,翠華路,,,,,,278號二十三樓之1,120.280670780584,22.6550110412328
高雄市鼓山區光榮里30鄰翠華路278號二十四樓,64,6400200,6400200-004,30鄰,翠華路,,,,,,278號二十四樓,120.280722586197,22.6550887113556
高雄市鼓山區光榮里30鄰翠華路278號二十四樓之1,64,6400200,6400200-004,30鄰,翠華路,,,,,,278號二十四樓之1,120.280670780584,22.6550110412328
高雄市鼓山區光榮里30鄰翠華路278號二十五樓,64,6400200,6400200-004,30鄰,翠華路,,,,,,278號二十五樓,120.280722586197,22.6550887113556
高雄市鼓山區光榮里30鄰翠華路278號二十五樓之1,64,6400200,6400200-004,30鄰,翠華路,,,,,,278號二十五樓之1,120.280670780584,22.6550110412328
高雄市鼓山區光榮里30鄰翠華路279號十樓,64,6400200,6400200-004,30鄰,翠華路,,,,,,279號十樓,120.280829095534,22.6553246628747
高雄市鼓山區光榮里30鄰翠華路279號十樓之1,64,6400200,6400200-004,30鄰,翠華路,,,,,,279號十樓之1,120.280774011661,22.6552244195748
高雄市鼓山區光榮里30鄰翠華路279號二樓,64,6400200,6400200-004,30鄰,翠華路,,,,,,279號二樓,120.280829095534,22.6553246628747
高雄市鼓山區光榮里30鄰翠華路279號二樓之1,64,6400200,6400200-004,30鄰,翠華路,,,,,,279號二樓之1,120.280774011661,22.6552244195748
高雄市鼓山區光榮里30鄰翠華路279號三樓,64,6400200,6400200-004,30鄰,翠華路,,,,,,279號三樓,120.280829095534,22.6553246628747
高雄市鼓山區光榮里30鄰翠華路279號三樓之1,64,6400200,6400200-004,30鄰,翠華路,,,,,,279號三樓之1,120.280774011661,22.6552244195748
高雄市鼓山區光榮里30鄰翠華路279號四樓,64,6400200,6400200-004,30鄰,翠華路,,,,,,279號四樓,120.280829095534,22.6553246628747
高雄市鼓山區光榮里30鄰翠華路279號四樓之1,64,6400200,6400200-004,30鄰,翠華路,,,,,,279號四樓之1,120.280774011661,22.6552244195748
高雄市鼓山區光榮里30鄰翠華路279號五樓,64,6400200,6400200-004,30鄰,翠華路,,,,,,279號五樓,120.280829095534,22.6553246628747
高雄市鼓山區光榮里30鄰翠華路279號五樓之1,64,6400200,6400200-004,30鄰,翠華路,,,,,,279號五樓之1,120.280774011661,22.6552244195748
高雄市鼓山區光榮里30鄰翠華路279號六樓,64,6400200,6400200-004,30鄰,翠華路,,,,,,279號六樓,120.280829095534,22.6553246628747
高雄市鼓山區光榮里30鄰翠華路279號六樓之1,64,6400200,6400200-004,30鄰,翠華路,,,,,,279號六樓之1,120.280774011661,22.6552244195748
高雄市鼓山區光榮里30鄰翠華路279號七樓,64,6400200,6400200-004,30鄰,翠華路,,,,,,279號七樓,120.280829095534,22.6553246628747
高雄市鼓山區光榮里30鄰翠華路279號七樓之1,64,6400200,6400200-004,30鄰,翠華路,,,,,,279號七樓之1,120.280774011661,22.6552244195748
高雄市鼓山區光榮里30鄰翠華路279號八樓,64,6400200,6400200-004,30鄰,翠華路,,,,,,279號八樓,120.280829095534,22.6553246628747
高雄市鼓山區光榮里30鄰翠華路279號八樓之1,64,6400200,6400200-004,30鄰,翠華路,,,,,,279號八樓之1,120.280774011661,22.6552244195748
高雄市鼓山區光榮里30鄰翠華路279號九樓,64,6400200,6400200-004,30鄰,翠華路,,,,,,279號九樓,120.280829095534,22.6553246628747
高雄市鼓山區光榮里30鄰翠華路279號九樓之1,64,6400200,6400200-004,30鄰,翠華路,,,,,,279號九樓之1,120.280774011661,22.6552244195748
高雄市鼓山區光榮里30鄰翠華路279號十一樓,64,6400200,6400200-004,30鄰,翠華路,,,,,,279號十一樓,120.280829095534,22.6553246628747
高雄市鼓山區光榮里30鄰翠華路279號十一樓之1,64,6400200,6400200-004,30鄰,翠華路,,,,,,279號十一樓之1,120.280774011661,22.6552244195748
高雄市鼓山區光榮里30鄰翠華路279號十二樓,64,6400200,6400200-004,30鄰,翠華路,,,,,,279號十二樓,120.280829095534,22.6553246628747
高雄市鼓山區光榮里30鄰翠華路279號十二樓之1,64,6400200,6400200-004,30鄰,翠華路,,,,,,279號十二樓之1,120.280774011661,22.6552244195748
高雄市鼓山區光榮里30鄰翠華路279號十三樓,64,6400200,6400200-004,30鄰,翠華路,,,,,,279號十三樓,120.280829095534,22.6553246628747
高雄市鼓山區光榮里30鄰翠華路279號十三樓之1,64,6400200,6400200-004,30鄰,翠華路,,,,,,279號十三樓之1,120.280774011661,22.6552244195748
高雄市鼓山區光榮里30鄰翠華路279號十四樓,64,6400200,6400200-004,30鄰,翠華路,,,,,,279號十四樓,120.280829095534,22.6553246628747
高雄市鼓山區光榮里30鄰翠華路279號十五樓,64,6400200,6400200-004,30鄰,翠華路,,,,,,279號十五樓,120.280829095534,22.6553246628747
高雄市鼓山區光榮里30鄰翠華路279號十五樓之1,64,6400200,6400200-004,30鄰,翠華路,,,,,,279號十五樓之1,120.280774011661,22.6552244195748
高雄市鼓山區光榮里30鄰翠華路279號十六樓,64,6400200,6400200-004,30鄰,翠華路,,,,,,279號十六樓,120.280829095534,22.6553246628747
高雄市鼓山區光榮里30鄰翠華路279號十六樓之1,64,6400200,6400200-004,30鄰,翠華路,,,,,,279號十六樓之1,120.280774011661,22.6552244195748
高雄市鼓山區光榮里30鄰翠華路279號十七樓,64,6400200,6400200-004,30鄰,翠華路,,,,,,279號十七樓,120.280829095534,22.6553246628747
高雄市鼓山區光榮里30鄰翠華路279號十七樓之1,64,6400200,6400200-004,30鄰,翠華路,,,,,,279號十七樓之1,120.280774011661,22.6552244195748
高雄市鼓山區光榮里30鄰翠華路279號十八樓,64,6400200,6400200-004,30鄰,翠華路,,,,,,279號十八樓,120.280829095534,22.6553246628747
高雄市鼓山區光榮里30鄰翠華路279號十八樓之1,64,6400200,6400200-004,30鄰,翠華路,,,,,,279號十八樓之1,120.280774011661,22.6552244195748
高雄市鼓山區光榮里30鄰翠華路279號十九樓,64,6400200,6400200-004,30鄰,翠華路,,,,,,279號十九樓,120.280829095534,22.6553246628747
高雄市鼓山區光榮里30鄰翠華路279號十九樓之1,64,6400200,6400200-004,30鄰,翠華路,,,,,,279號十九樓之1,120.280774011661,22.6552244195748
高雄市鼓山區光榮里30鄰翠華路279號二十樓,64,6400200,6400200-004,30鄰,翠華路,,,,,,279號二十樓,120.280829095534,22.6553246628747
高雄市鼓山區光榮里30鄰翠華路279號二十樓之1,64,6400200,6400200-004,30鄰,翠華路,,,,,,279號二十樓之1,120.280774011661,22.6552244195748
高雄市鼓山區光榮里30鄰翠華路279號二十一樓,64,6400200,6400200-004,30鄰,翠華路,,,,,,279號二十一樓,120.280774011661,22.6552244195748
高雄市鼓山區光榮里30鄰翠華路279號二十一樓之1,64,6400200,6400200-004,30鄰,翠華路,,,,,,279號二十一樓之1,120.280774011661,22.6552244195748
高雄市鼓山區光榮里30鄰翠華路279號二十二樓,64,6400200,6400200-004,30鄰,翠華路,,,,,,279號二十二樓,120.280829095534,22.6553246628747
高雄市鼓山區光榮里30鄰翠華路279號二十二樓之1,64,6400200,6400200-004,30鄰,翠華路,,,,,,279號二十二樓之1,120.280774011661,22.6552244195748
高雄市鼓山區光榮里30鄰翠華路279號二十三樓,64,6400200,6400200-004,30鄰,翠華路,,,,,,279號二十三樓,120.280829095534,22.6553246628747
高雄市鼓山區光榮里30鄰翠華路279號二十三樓之1,64,6400200,6400200-004,30鄰,翠華路,,,,,,279號二十三樓之1,120.280774011661,22.6552244195748
高雄市鼓山區光榮里30鄰翠華路279號二十四樓,64,6400200,6400200-004,30鄰,翠華路,,,,,,279號二十四樓,120.280829095534,22.6553246628747
高雄市鼓山區光榮里30鄰翠華路279號二十四樓之1,64,6400200,6400200-004,30鄰,翠華路,,,,,,279號二十四樓之1,120.280774011661,22.6552244195748
高雄市鼓山區光榮里30鄰翠華路279號二十五樓,64,6400200,6400200-004,30鄰,翠華路,,,,,,279號二十五樓,120.280829095534,22.6553246628747
高雄市鼓山區光榮里30鄰翠華路279號二十五樓之1,64,6400200,6400200-004,30鄰,翠華路,,,,,,279號二十五樓之1,120.280774011661,22.6552244195748
高雄市鼓山區光榮里30鄰翠華路280號,64,6400200,6400200-004,30鄰,翠華路,,,,,,280號,120.281185365603,22.6556326703516
高雄市鼓山區光榮里30鄰翠華路280號十樓,64,6400200,6400200-004,30鄰,翠華路,,,,,,280號十樓,120.281185365603,22.6556326703516
高雄市鼓山區光榮里30鄰翠華路280號二樓,64,6400200,6400200-004,30鄰,翠華路,,,,,,280號二樓,120.281185365603,22.6556326703516
高雄市鼓山區光榮里30鄰翠華路280號三樓,64,6400200,6400200-004,30鄰,翠華路,,,,,,280號三樓,120.281185365603,22.6556326703516
高雄市鼓山區光榮里30鄰翠華路280號四樓,64,6400200,6400200-004,30鄰,翠華路,,,,,,280號四樓,120.281185365603,22.6556326703516
高雄市鼓山區光榮里30鄰翠華路280號五樓,64,6400200,6400200-004,30鄰,翠華路,,,,,,280號五樓,120.281185365603,22.6556326703516
高雄市鼓山區光榮里30鄰翠華路280號六樓,64,6400200,6400200-004,30鄰,翠華路,,,,,,280號六樓,120.281185365603,22.6556326703516
高雄市鼓山區光榮里30鄰翠華路280號七樓,64,6400200,6400200-004,30鄰,翠華路,,,,,,280號七樓,120.281185365603,22.6556326703516
高雄市鼓山區光榮里30鄰翠華路280號八樓,64,6400200,6400200-004,30鄰,翠華路,,,,,,280號八樓,120.281185365603,22.6556326703516
高雄市鼓山區光榮里30鄰翠華路280號九樓,64,6400200,6400200-004,30鄰,翠華路,,,,,,280號九樓,120.281185365603,22.6556326703516
高雄市鼓山區光榮里30鄰翠華路280號十一樓,64,6400200,6400200-004,30鄰,翠華路,,,,,,280號十一樓,120.281185365603,22.6556326703516
高雄市鼓山區光榮里30鄰翠華路280號十二樓,64,6400200,6400200-004,30鄰,翠華路,,,,,,280號十二樓,120.281185365603,22.6556326703516
高雄市鼓山區光榮里30鄰翠華路280號十三樓,64,6400200,6400200-004,30鄰,翠華路,,,,,,280號十三樓,120.281185365603,22.6556326703516
高雄市鼓山區光榮里30鄰翠華路280號十四樓,64,6400200,6400200-004,30鄰,翠華路,,,,,,280號十四樓,120.281185365603,22.6556326703516
高雄市鼓山區光榮里30鄰翠華路280號十五樓,64,6400200,6400200-004,30鄰,翠華路,,,,,,280號十五樓,120.281185365603,22.6556326703516
高雄市鼓山區光榮里30鄰翠華路280號十六樓,64,6400200,6400200-004,30鄰,翠華路,,,,,,280號十六樓,120.281185365603,22.6556326703516
高雄市鼓山區光榮里30鄰翠華路280號十七樓,64,6400200,6400200-004,30鄰,翠華路,,,,,,280號十七樓,120.281185365603,22.6556326703516
高雄市鼓山區光榮里30鄰翠華路280號十八樓,64,6400200,6400200-004,30鄰,翠華路,,,,,,280號十八樓,120.281185365603,22.6556326703516
高雄市鼓山區光榮里30鄰翠華路280號十九樓,64,6400200,6400200-004,30鄰,翠華路,,,,,,280號十九樓,120.281185365603,22.6556326703516
高雄市鼓山區光榮里30鄰翠華路280號二十樓,64,6400200,6400200-004,30鄰,翠華路,,,,,,280號二十樓,120.281185365603,22.6556326703516
高雄市鼓山區光榮里30鄰翠華路280號二十一樓,64,6400200,6400200-004,30鄰,翠華路,,,,,,280號二十一樓,120.281185365603,22.6556326703516
高雄市鼓山區光榮里30鄰翠華路280號二十二樓,64,6400200,6400200-004,30鄰,翠華路,,,,,,280號二十二樓,120.281185365603,22.6556326703516
高雄市鼓山區光榮里30鄰翠華路280號二十三樓,64,6400200,6400200-004,30鄰,翠華路,,,,,,280號二十三樓,120.281185365603,22.6556326703516
高雄市鼓山區光榮里30鄰翠華路280號二十四樓,64,6400200,6400200-004,30鄰,翠華路,,,,,,280號二十四樓,120.281185365603,22.6556326703516
高雄市鼓山區光榮里30鄰翠華路280號二十五樓,64,6400200,6400200-004,30鄰,翠華路,,,,,,280號二十五樓,120.281185365603,22.6556326703516
高雄市鼓山區光榮里30鄰翠華路280號二十六樓,64,6400200,6400200-004,30鄰,翠華路,,,,,,280號二十六樓,120.281185365603,22.6556326703516
高雄市鼓山區光榮里30鄰翠華路280號二十七樓,64,6400200,6400200-004,30鄰,翠華路,,,,,,280號二十七樓,120.281185365603,22.6556326703516
高雄市鼓山區光榮里30鄰翠華路280號二十八樓,64,6400200,6400200-004,30鄰,翠華路,,,,,,280號二十八樓,120.281185365603,22.6556326703516
高雄市鼓山區光榮里30鄰翠華路281號,64,6400200,6400200-004,30鄰,翠華路,,,,,,281號,120.28126412123,22.6558135638169
高雄市鼓山區光榮里30鄰翠華路282號,64,6400200,6400200-004,30鄰,翠華路,,,,,,282號,120.281265434579,22.6558565825679
高雄市鼓山區光榮里30鄰翠華路282號之5,64,6400200,6400200-004,30鄰,翠華路,,,,,,282號之5,120.28124247577,22.656250169625
高雄市鼓山區光榮里23鄰翠華路295號,64,6400200,6400200-004,23鄰,翠華路,,,,,,295號,120.281295131951,22.6567888115306
高雄市鼓山區光榮里23鄰翠華路295號二樓,64,6400200,6400200-004,23鄰,翠華路,,,,,,295號二樓,120.281295131951,22.6567888115306
高雄市鼓山區光榮里23鄰翠華路295號二樓之1,64,6400200,6400200-004,23鄰,翠華路,,,,,,295號二樓之1,120.281295131951,22.6567888115306
高雄市鼓山區光榮里23鄰翠華路295號三樓,64,6400200,6400200-004,23鄰,翠華路,,,,,,295號三樓,120.281295131951,22.6567888115306
高雄市鼓山區光榮里23鄰翠華路295號三樓之1,64,6400200,6400200-004,23鄰,翠華路,,,,,,295號三樓之1,120.281295131951,22.6567888115306
高雄市鼓山區光榮里23鄰翠華路295號四樓,64,6400200,6400200-004,23鄰,翠華路,,,,,,295號四樓,120.281295131951,22.6567888115306
