FULL_ADDR,COUNTY,TOWN,VILLAGE,NEIGHBORHOOD,ROAD,SECTION,LANE,ALLEY,SUB_ALLEY,TONG,NUMBER,X,Y
高雄市左營區福山里27鄰重義路1號,64,6400300,6400300-044,27鄰,重義路,,,,,,1號,120.313740407278,22.6850199434681
高雄市左營區福山里27鄰重義路1號十樓,64,6400300,6400300-044,27鄰,重義路,,,,,,1號十樓,120.313740407278,22.6850199434681
高雄市左營區福山里27鄰重義路1號二樓,64,6400300,6400300-044,27鄰,重義路,,,,,,1號二樓,120.313740407278,22.6850199434681
高雄市左營區福山里27鄰重義路1號三樓,64,6400300,6400300-044,27鄰,重義路,,,,,,1號三樓,120.313740407278,22.6850199434681
高雄市左營區福山里27鄰重義路1號四樓,64,6400300,6400300-044,27鄰,重義路,,,,,,1號四樓,120.313740407278,22.6850199434681
高雄市左營區福山里27鄰重義路1號五樓,64,6400300,6400300-044,27鄰,重義路,,,,,,1號五樓,120.313740407278,22.6850199434681
高雄市左營區福山里27鄰重義路1號六樓,64,6400300,6400300-044,27鄰,重義路,,,,,,1號六樓,120.313740407278,22.6850199434681
高雄市左營區福山里27鄰重義路1號七樓,64,6400300,6400300-044,27鄰,重義路,,,,,,1號七樓,120.313740407278,22.6850199434681
高雄市左營區福山里27鄰重義路1號八樓,64,6400300,6400300-044,27鄰,重義路,,,,,,1號八樓,120.313740407278,22.6850199434681
高雄市左營區福山里27鄰重義路1號九樓,64,6400300,6400300-044,27鄰,重義路,,,,,,1號九樓,120.313740407278,22.6850199434681
高雄市左營區福山里27鄰重義路1號十一樓,64,6400300,6400300-044,27鄰,重義路,,,,,,1號十一樓,120.313740407278,22.6850199434681
高雄市左營區福山里27鄰重義路1號十二樓,64,6400300,6400300-044,27鄰,重義路,,,,,,1號十二樓,120.313740407278,22.6850199434681
高雄市左營區福山里27鄰重義路1號十三樓,64,6400300,6400300-044,27鄰,重義路,,,,,,1號十三樓,120.313740407278,22.6850199434681
高雄市左營區福山里27鄰重義路1號十四樓,64,6400300,6400300-044,27鄰,重義路,,,,,,1號十四樓,120.313740407278,22.6850199434681
高雄市左營區福山里27鄰重義路3號,64,6400300,6400300-044,27鄰,重義路,,,,,,3號,120.313687646671,22.6850655929247
高雄市左營區福山里27鄰重義路3號十樓,64,6400300,6400300-044,27鄰,重義路,,,,,,3號十樓,120.313687646671,22.6850655929247
高雄市左營區福山里27鄰重義路3號二樓,64,6400300,6400300-044,27鄰,重義路,,,,,,3號二樓,120.313687646671,22.6850655929247
高雄市左營區福山里27鄰重義路3號三樓,64,6400300,6400300-044,27鄰,重義路,,,,,,3號三樓,120.313687646671,22.6850655929247
高雄市左營區福山里27鄰重義路3號四樓,64,6400300,6400300-044,27鄰,重義路,,,,,,3號四樓,120.313687646671,22.6850655929247
高雄市左營區福山里27鄰重義路3號五樓,64,6400300,6400300-044,27鄰,重義路,,,,,,3號五樓,120.313687646671,22.6850655929247
高雄市左營區福山里27鄰重義路3號六樓,64,6400300,6400300-044,27鄰,重義路,,,,,,3號六樓,120.313687646671,22.6850655929247
高雄市左營區福山里27鄰重義路3號七樓,64,6400300,6400300-044,27鄰,重義路,,,,,,3號七樓,120.313687646671,22.6850655929247
高雄市左營區福山里27鄰重義路3號八樓,64,6400300,6400300-044,27鄰,重義路,,,,,,3號八樓,120.313687646671,22.6850655929247
高雄市左營區福山里27鄰重義路3號九樓,64,6400300,6400300-044,27鄰,重義路,,,,,,3號九樓,120.313687646671,22.6850655929247
高雄市左營區福山里27鄰重義路3號十一樓,64,6400300,6400300-044,27鄰,重義路,,,,,,3號十一樓,120.313687646671,22.6850655929247
高雄市左營區福山里27鄰重義路3號十二樓,64,6400300,6400300-044,27鄰,重義路,,,,,,3號十二樓,120.313687646671,22.6850655929247
高雄市左營區福山里27鄰重義路3號十三樓,64,6400300,6400300-044,27鄰,重義路,,,,,,3號十三樓,120.313687646671,22.6850655929247
高雄市左營區福山里27鄰重義路3號十四樓,64,6400300,6400300-044,27鄰,重義路,,,,,,3號十四樓,120.313687646671,22.6850655929247
高雄市左營區福山里27鄰重義路3號十五樓,64,6400300,6400300-044,27鄰,重義路,,,,,,3號十五樓,120.313687646671,22.6850655929247
高雄市左營區福山里27鄰重義路5號,64,6400300,6400300-044,27鄰,重義路,,,,,,5號,120.313642520273,22.6851299143243
高雄市左營區福山里27鄰重義路5號十樓之1,64,6400300,6400300-044,27鄰,重義路,,,,,,5號十樓之1,120.313631779601,22.6851155366578
高雄市左營區福山里27鄰重義路5號十樓之2,64,6400300,6400300-044,27鄰,重義路,,,,,,5號十樓之2,120.313548648749,22.6850549639529
高雄市左營區福山里27鄰重義路5號二樓之1,64,6400300,6400300-044,27鄰,重義路,,,,,,5號二樓之1,120.313631779601,22.6851155366578
高雄市左營區福山里27鄰重義路5號二樓之2,64,6400300,6400300-044,27鄰,重義路,,,,,,5號二樓之2,120.313548648749,22.6850549639529
高雄市左營區福山里27鄰重義路5號三樓之1,64,6400300,6400300-044,27鄰,重義路,,,,,,5號三樓之1,120.313631779601,22.6851155366578
高雄市左營區福山里27鄰重義路5號三樓之2,64,6400300,6400300-044,27鄰,重義路,,,,,,5號三樓之2,120.313548648749,22.6850549639529
高雄市左營區福山里27鄰重義路5號四樓之1,64,6400300,6400300-044,27鄰,重義路,,,,,,5號四樓之1,120.313631779601,22.6851155366578
高雄市左營區福山里27鄰重義路5號四樓之2,64,6400300,6400300-044,27鄰,重義路,,,,,,5號四樓之2,120.313548648749,22.6850549639529
高雄市左營區福山里27鄰重義路5號五樓之1,64,6400300,6400300-044,27鄰,重義路,,,,,,5號五樓之1,120.313631779601,22.6851155366578
高雄市左營區福山里27鄰重義路5號五樓之2,64,6400300,6400300-044,27鄰,重義路,,,,,,5號五樓之2,120.313548648749,22.6850549639529
高雄市左營區福山里27鄰重義路5號六樓之1,64,6400300,6400300-044,27鄰,重義路,,,,,,5號六樓之1,120.313631779601,22.6851155366578
高雄市左營區福山里27鄰重義路5號六樓之2,64,6400300,6400300-044,27鄰,重義路,,,,,,5號六樓之2,120.313548648749,22.6850549639529
高雄市左營區福山里27鄰重義路5號七樓之1,64,6400300,6400300-044,27鄰,重義路,,,,,,5號七樓之1,120.313631779601,22.6851155366578
高雄市左營區福山里27鄰重義路5號七樓之2,64,6400300,6400300-044,27鄰,重義路,,,,,,5號七樓之2,120.313548648749,22.6850549639529
高雄市左營區福山里27鄰重義路5號八樓之1,64,6400300,6400300-044,27鄰,重義路,,,,,,5號八樓之1,120.313631779601,22.6851155366578
高雄市左營區福山里27鄰重義路5號八樓之2,64,6400300,6400300-044,27鄰,重義路,,,,,,5號八樓之2,120.313548648749,22.6850549639529
高雄市左營區福山里27鄰重義路5號九樓之1,64,6400300,6400300-044,27鄰,重義路,,,,,,5號九樓之1,120.313631779601,22.6851155366578
高雄市左營區福山里27鄰重義路5號九樓之2,64,6400300,6400300-044,27鄰,重義路,,,,,,5號九樓之2,120.313548648749,22.6850549639529
高雄市左營區福山里27鄰重義路5號十一樓之1,64,6400300,6400300-044,27鄰,重義路,,,,,,5號十一樓之1,120.313631779601,22.6851155366578
高雄市左營區福山里27鄰重義路5號十一樓之2,64,6400300,6400300-044,27鄰,重義路,,,,,,5號十一樓之2,120.313548648749,22.6850549639529
高雄市左營區福山里27鄰重義路5號十二樓之1,64,6400300,6400300-044,27鄰,重義路,,,,,,5號十二樓之1,120.313631779601,22.6851155366578
高雄市左營區福山里27鄰重義路5號十二樓之2,64,6400300,6400300-044,27鄰,重義路,,,,,,5號十二樓之2,120.313548648749,22.6850549639529
高雄市左營區福山里27鄰重義路5號十三樓之1,64,6400300,6400300-044,27鄰,重義路,,,,,,5號十三樓之1,120.313631779601,22.6851155366578
高雄市左營區福山里27鄰重義路5號十三樓之2,64,6400300,6400300-044,27鄰,重義路,,,,,,5號十三樓之2,120.313548648749,22.6850549639529
高雄市左營區福山里27鄰重義路5號十四樓之1,64,6400300,6400300-044,27鄰,重義路,,,,,,5號十四樓之1,120.313631779601,22.6851155366578
高雄市左營區福山里27鄰重義路5號十四樓之2,64,6400300,6400300-044,27鄰,重義路,,,,,,5號十四樓之2,120.313548648749,22.6850549639529
高雄市左營區福山里27鄰重義路11號,64,6400300,6400300-044,27鄰,重義路,,,,,,11號,120.313057858772,22.6856496843887
高雄市左營區福山里26鄰重義路20號,64,6400300,6400300-044,26鄰,重義路,,,,,,20號,120.313400457902,22.6857391576342
高雄市左營區福山里26鄰重義路20號十樓,64,6400300,6400300-044,26鄰,重義路,,,,,,20號十樓,120.313400457902,22.6857391576342
高雄市左營區福山里26鄰重義路20號三樓,64,6400300,6400300-044,26鄰,重義路,,,,,,20號三樓,120.313400457902,22.6857391576342
高雄市左營區福山里26鄰重義路20號四樓,64,6400300,6400300-044,26鄰,重義路,,,,,,20號四樓,120.313400457902,22.6857391576342
高雄市左營區福山里26鄰重義路20號五樓,64,6400300,6400300-044,26鄰,重義路,,,,,,20號五樓,120.313400457902,22.6857391576342
高雄市左營區福山里26鄰重義路20號六樓,64,6400300,6400300-044,26鄰,重義路,,,,,,20號六樓,120.313400457902,22.6857391576342
高雄市左營區福山里26鄰重義路20號七樓,64,6400300,6400300-044,26鄰,重義路,,,,,,20號七樓,120.313400457902,22.6857391576342
高雄市左營區福山里26鄰重義路20號八樓,64,6400300,6400300-044,26鄰,重義路,,,,,,20號八樓,120.313400457902,22.6857391576342
高雄市左營區福山里26鄰重義路20號九樓,64,6400300,6400300-044,26鄰,重義路,,,,,,20號九樓,120.313400457902,22.6857391576342
高雄市左營區福山里26鄰重義路20號十一樓,64,6400300,6400300-044,26鄰,重義路,,,,,,20號十一樓,120.313400457902,22.6857391576342
高雄市左營區福山里26鄰重義路20號十二樓,64,6400300,6400300-044,26鄰,重義路,,,,,,20號十二樓,120.313400457902,22.6857391576342
高雄市左營區福山里26鄰重義路20號十三樓,64,6400300,6400300-044,26鄰,重義路,,,,,,20號十三樓,120.313400457902,22.6857391576342
高雄市左營區福山里26鄰重義路20號十四樓,64,6400300,6400300-044,26鄰,重義路,,,,,,20號十四樓,120.313400457902,22.6857391576342
高雄市左營區福山里26鄰重義路20號十五樓,64,6400300,6400300-044,26鄰,重義路,,,,,,20號十五樓,120.313400457902,22.6857391576342
高雄市左營區福山里26鄰重義路22號,64,6400300,6400300-044,26鄰,重義路,,,,,,22號,120.313310297193,22.6858491613983
高雄市左營區福山里26鄰重義路22號十樓,64,6400300,6400300-044,26鄰,重義路,,,,,,22號十樓,120.313310297193,22.6858491613983
高雄市左營區福山里26鄰重義路22號三樓,64,6400300,6400300-044,26鄰,重義路,,,,,,22號三樓,120.313310297193,22.6858491613983
高雄市左營區福山里26鄰重義路22號四樓,64,6400300,6400300-044,26鄰,重義路,,,,,,22號四樓,120.313310297193,22.6858491613983
高雄市左營區福山里26鄰重義路22號五樓,64,6400300,6400300-044,26鄰,重義路,,,,,,22號五樓,120.313310297193,22.6858491613983
高雄市左營區福山里26鄰重義路22號六樓,64,6400300,6400300-044,26鄰,重義路,,,,,,22號六樓,120.313310297193,22.6858491613983
高雄市左營區福山里26鄰重義路22號七樓,64,6400300,6400300-044,26鄰,重義路,,,,,,22號七樓,120.313310297193,22.6858491613983
高雄市左營區福山里26鄰重義路22號八樓,64,6400300,6400300-044,26鄰,重義路,,,,,,22號八樓,120.313310297193,22.6858491613983
高雄市左營區福山里26鄰重義路22號九樓,64,6400300,6400300-044,26鄰,重義路,,,,,,22號九樓,120.313310297193,22.6858491613983
高雄市左營區福山里26鄰重義路22號十一樓,64,6400300,6400300-044,26鄰,重義路,,,,,,22號十一樓,120.313310297193,22.6858491613983
高雄市左營區福山里26鄰重義路22號十二樓,64,6400300,6400300-044,26鄰,重義路,,,,,,22號十二樓,120.313310297193,22.6858491613983
高雄市左營區福山里26鄰重義路22號十三樓,64,6400300,6400300-044,26鄰,重義路,,,,,,22號十三樓,120.313310297193,22.6858491613983
高雄市左營區福山里26鄰重義路22號十四樓,64,6400300,6400300-044,26鄰,重義路,,,,,,22號十四樓,120.313310297193,22.6858491613983
高雄市左營區福山里26鄰重義路22號十五樓,64,6400300,6400300-044,26鄰,重義路,,,,,,22號十五樓,120.313310297193,22.6858491613983
高雄市左營區菜公里33鄰重義路51號,64,6400300,6400300-043,33鄰,重義路,,,,,,51號,120.311708108741,22.6865936927058
高雄市左營區菜公里33鄰重義路51號十樓,64,6400300,6400300-043,33鄰,重義路,,,,,,51號十樓,120.311708108741,22.6865936927058
高雄市左營區菜公里33鄰重義路51號三樓,64,6400300,6400300-043,33鄰,重義路,,,,,,51號三樓,120.311708108741,22.6865936927058
高雄市左營區菜公里33鄰重義路51號四樓,64,6400300,6400300-043,33鄰,重義路,,,,,,51號四樓,120.311708108741,22.6865936927058
高雄市左營區菜公里33鄰重義路51號五樓,64,6400300,6400300-043,33鄰,重義路,,,,,,51號五樓,120.311708108741,22.6865936927058
高雄市左營區菜公里33鄰重義路51號六樓,64,6400300,6400300-043,33鄰,重義路,,,,,,51號六樓,120.311708108741,22.6865936927058
高雄市左營區菜公里33鄰重義路51號七樓,64,6400300,6400300-043,33鄰,重義路,,,,,,51號七樓,120.311708108741,22.6865936927058
高雄市左營區菜公里33鄰重義路51號八樓,64,6400300,6400300-043,33鄰,重義路,,,,,,51號八樓,120.311708108741,22.6865936927058
高雄市左營區菜公里33鄰重義路51號九樓,64,6400300,6400300-043,33鄰,重義路,,,,,,51號九樓,120.311708108741,22.6865936927058
高雄市左營區菜公里33鄰重義路51號十一樓,64,6400300,6400300-043,33鄰,重義路,,,,,,51號十一樓,120.311708108741,22.6865936927058
高雄市左營區菜公里33鄰重義路51號十二樓,64,6400300,6400300-043,33鄰,重義路,,,,,,51號十二樓,120.311708108741,22.6865936927058
高雄市左營區菜公里33鄰重義路51號十三樓,64,6400300,6400300-043,33鄰,重義路,,,,,,51號十三樓,120.311708108741,22.6865936927058
高雄市左營區菜公里33鄰重義路51號十四樓,64,6400300,6400300-043,33鄰,重義路,,,,,,51號十四樓,120.311708108741,22.6865936927058
高雄市左營區菜公里33鄰重義路51號十五樓,64,6400300,6400300-043,33鄰,重義路,,,,,,51號十五樓,120.311708108741,22.6865936927058
高雄市左營區菜公里33鄰重義路51號十六樓,64,6400300,6400300-043,33鄰,重義路,,,,,,51號十六樓,120.311708108741,22.6865936927058
高雄市左營區菜公里33鄰重義路51號十七樓,64,6400300,6400300-043,33鄰,重義路,,,,,,51號十七樓,120.311708108741,22.6865936927058
高雄市左營區菜公里33鄰重義路51號十八樓,64,6400300,6400300-043,33鄰,重義路,,,,,,51號十八樓,120.311708108741,22.6865936927058
高雄市左營區菜公里33鄰重義路51號十九樓,64,6400300,6400300-043,33鄰,重義路,,,,,,51號十九樓,120.311708108741,22.6865936927058
高雄市左營區菜公里33鄰重義路51號二十樓,64,6400300,6400300-043,33鄰,重義路,,,,,,51號二十樓,120.311708108741,22.6865936927058
高雄市左營區菜公里33鄰重義路51號二十一樓,64,6400300,6400300-043,33鄰,重義路,,,,,,51號二十一樓,120.311708108741,22.6865936927058
高雄市左營區菜公里33鄰重義路51號二十二樓,64,6400300,6400300-043,33鄰,重義路,,,,,,51號二十二樓,120.311708108741,22.6865936927058
高雄市左營區菜公里33鄰重義路53號,64,6400300,6400300-043,33鄰,重義路,,,,,,53號,120.311708108741,22.6865936927058
高雄市左營區菜公里33鄰重義路55號,64,6400300,6400300-043,33鄰,重義路,,,,,,55號,120.311708108741,22.6865936927058
高雄市左營區菜公里33鄰重義路57號,64,6400300,6400300-043,33鄰,重義路,,,,,,57號,120.311708108741,22.6865936927058
高雄市左營區菜公里33鄰重義路57號十樓,64,6400300,6400300-043,33鄰,重義路,,,,,,57號十樓,120.311708108741,22.6865936927058
高雄市左營區菜公里33鄰重義路57號三樓,64,6400300,6400300-043,33鄰,重義路,,,,,,57號三樓,120.311708108741,22.6865936927058
高雄市左營區菜公里33鄰重義路57號四樓,64,6400300,6400300-043,33鄰,重義路,,,,,,57號四樓,120.311708108741,22.6865936927058
高雄市左營區菜公里33鄰重義路57號五樓,64,6400300,6400300-043,33鄰,重義路,,,,,,57號五樓,120.311708108741,22.6865936927058
高雄市左營區菜公里33鄰重義路57號六樓,64,6400300,6400300-043,33鄰,重義路,,,,,,57號六樓,120.311708108741,22.6865936927058
高雄市左營區菜公里33鄰重義路57號七樓,64,6400300,6400300-043,33鄰,重義路,,,,,,57號七樓,120.311708108741,22.6865936927058
高雄市左營區菜公里33鄰重義路57號八樓,64,6400300,6400300-043,33鄰,重義路,,,,,,57號八樓,120.311708108741,22.6865936927058
高雄市左營區菜公里33鄰重義路57號九樓,64,6400300,6400300-043,33鄰,重義路,,,,,,57號九樓,120.311708108741,22.6865936927058
高雄市左營區菜公里33鄰重義路57號十一樓,64,6400300,6400300-043,33鄰,重義路,,,,,,57號十一樓,120.311708108741,22.6865936927058
高雄市左營區菜公里33鄰重義路57號十二樓,64,6400300,6400300-043,33鄰,重義路,,,,,,57號十二樓,120.311708108741,22.6865936927058
高雄市左營區菜公里33鄰重義路57號十三樓,64,6400300,6400300-043,33鄰,重義路,,,,,,57號十三樓,120.311708108741,22.6865936927058
高雄市左營區菜公里33鄰重義路57號十四樓,64,6400300,6400300-043,33鄰,重義路,,,,,,57號十四樓,120.311708108741,22.6865936927058
高雄市左營區菜公里33鄰重義路57號十五樓,64,6400300,6400300-043,33鄰,重義路,,,,,,57號十五樓,120.311708108741,22.6865936927058
高雄市左營區菜公里33鄰重義路57號十六樓,64,6400300,6400300-043,33鄰,重義路,,,,,,57號十六樓,120.311708108741,22.6865936927058
高雄市左營區菜公里33鄰重義路57號十七樓,64,6400300,6400300-043,33鄰,重義路,,,,,,57號十七樓,120.311708108741,22.6865936927058
高雄市左營區菜公里33鄰重義路57號十八樓,64,6400300,6400300-043,33鄰,重義路,,,,,,57號十八樓,120.311708108741,22.6865936927058
高雄市左營區菜公里33鄰重義路57號十九樓,64,6400300,6400300-043,33鄰,重義路,,,,,,57號十九樓,120.311708108741,22.6865936927058
高雄市左營區菜公里33鄰重義路57號二十樓,64,6400300,6400300-043,33鄰,重義路,,,,,,57號二十樓,120.311708108741,22.6865936927058
高雄市左營區菜公里33鄰重義路57號二十一樓,64,6400300,6400300-043,33鄰,重義路,,,,,,57號二十一樓,120.311708108741,22.6865936927058
高雄市左營區菜公里33鄰重義路57號二十二樓,64,6400300,6400300-043,33鄰,重義路,,,,,,57號二十二樓,120.311708108741,22.6865936927058
高雄市左營區菜公里33鄰重義路59號,64,6400300,6400300-043,33鄰,重義路,,,,,,59號,120.311708108741,22.6865936927058
高雄市左營區菜公里33鄰重義路59號十樓,64,6400300,6400300-043,33鄰,重義路,,,,,,59號十樓,120.311708108741,22.6865936927058
高雄市左營區菜公里33鄰重義路59號三樓,64,6400300,6400300-043,33鄰,重義路,,,,,,59號三樓,120.311708108741,22.6865936927058
高雄市左營區菜公里33鄰重義路59號四樓,64,6400300,6400300-043,33鄰,重義路,,,,,,59號四樓,120.311708108741,22.6865936927058
高雄市左營區菜公里33鄰重義路59號五樓,64,6400300,6400300-043,33鄰,重義路,,,,,,59號五樓,120.311708108741,22.6865936927058
高雄市左營區菜公里33鄰重義路59號六樓,64,6400300,6400300-043,33鄰,重義路,,,,,,59號六樓,120.311708108741,22.6865936927058
高雄市左營區菜公里33鄰重義路59號七樓,64,6400300,6400300-043,33鄰,重義路,,,,,,59號七樓,120.311708108741,22.6865936927058
高雄市左營區菜公里33鄰重義路59號八樓,64,6400300,6400300-043,33鄰,重義路,,,,,,59號八樓,120.311708108741,22.6865936927058
高雄市左營區菜公里33鄰重義路59號九樓,64,6400300,6400300-043,33鄰,重義路,,,,,,59號九樓,120.311708108741,22.6865936927058
高雄市左營區菜公里33鄰重義路59號十一樓,64,6400300,6400300-043,33鄰,重義路,,,,,,59號十一樓,120.311708108741,22.6865936927058
高雄市左營區菜公里33鄰重義路59號十二樓,64,6400300,6400300-043,33鄰,重義路,,,,,,59號十二樓,120.311708108741,22.6865936927058
高雄市左營區菜公里33鄰重義路59號十三樓,64,6400300,6400300-043,33鄰,重義路,,,,,,59號十三樓,120.311708108741,22.6865936927058
高雄市左營區菜公里33鄰重義路59號十四樓,64,6400300,6400300-043,33鄰,重義路,,,,,,59號十四樓,120.311708108741,22.6865936927058
高雄市左營區菜公里33鄰重義路59號十五樓,64,6400300,6400300-043,33鄰,重義路,,,,,,59號十五樓,120.311708108741,22.6865936927058
高雄市左營區菜公里33鄰重義路59號十六樓,64,6400300,6400300-043,33鄰,重義路,,,,,,59號十六樓,120.311708108741,22.6865936927058
高雄市左營區菜公里33鄰重義路59號十七樓,64,6400300,6400300-043,33鄰,重義路,,,,,,59號十七樓,120.311708108741,22.6865936927058
高雄市左營區菜公里33鄰重義路59號十八樓,64,6400300,6400300-043,33鄰,重義路,,,,,,59號十八樓,120.311708108741,22.6865936927058
高雄市左營區菜公里33鄰重義路59號十九樓,64,6400300,6400300-043,33鄰,重義路,,,,,,59號十九樓,120.311708108741,22.6865936927058
高雄市左營區菜公里33鄰重義路59號二十樓,64,6400300,6400300-043,33鄰,重義路,,,,,,59號二十樓,120.311708108741,22.6865936927058
高雄市左營區菜公里33鄰重義路59號二十一樓,64,6400300,6400300-043,33鄰,重義路,,,,,,59號二十一樓,120.311708108741,22.6865936927058
高雄市左營區菜公里33鄰重義路59號二十二樓,64,6400300,6400300-043,33鄰,重義路,,,,,,59號二十二樓,120.311708108741,22.6865936927058
高雄市左營區菜公里33鄰重義路59之1號七樓,64,6400300,6400300-043,33鄰,重義路,,,,,,59之1號七樓,120.311708108741,22.6865936927058
高雄市左營區菜公里33鄰重義路59之1號十一樓,64,6400300,6400300-043,33鄰,重義路,,,,,,59之1號十一樓,120.311708108741,22.6865936927058
高雄市左營區菜公里33鄰重義路59之1號十二樓,64,6400300,6400300-043,33鄰,重義路,,,,,,59之1號十二樓,120.311708108741,22.6865936927058
高雄市左營區菜公里33鄰重義路59之1號十三樓,64,6400300,6400300-043,33鄰,重義路,,,,,,59之1號十三樓,120.311708108741,22.6865936927058
高雄市左營區菜公里33鄰重義路59之1號十九樓,64,6400300,6400300-043,33鄰,重義路,,,,,,59之1號十九樓,120.311708108741,22.6865936927058
高雄市左營區菜公里33鄰重義路59之1號二十樓,64,6400300,6400300-043,33鄰,重義路,,,,,,59之1號二十樓,120.311708108741,22.6865936927058
高雄市左營區菜公里33鄰重義路59之1號二十一樓,64,6400300,6400300-043,33鄰,重義路,,,,,,59之1號二十一樓,120.311708108741,22.6865936927058
高雄市左營區菜公里33鄰重義路59之1號二十二樓,64,6400300,6400300-043,33鄰,重義路,,,,,,59之1號二十二樓,120.311708108741,22.6865936927058
高雄市左營區菜公里33鄰重義路107號,64,6400300,6400300-043,33鄰,重義路,,,,,,107號,120.311402871895,22.6871233811165
高雄市左營區菜公里33鄰重義路109號,64,6400300,6400300-043,33鄰,重義路,,,,,,109號,120.31137512142,22.6871495318483
高雄市左營區菜公里33鄰重義路111號,64,6400300,6400300-043,33鄰,重義路,,,,,,111號,120.311347791439,22.6871752780055
高雄市左營區菜公里33鄰重義路113號,64,6400300,6400300-043,33鄰,重義路,,,,,,113號,120.311320364444,22.687200960526
高雄市左營區菜公里33鄰重義路115號,64,6400300,6400300-043,33鄰,重義路,,,,,,115號,120.31129312257,22.6872265986848
高雄市左營區菜公里33鄰重義路117號,64,6400300,6400300-043,33鄰,重義路,,,,,,117號,120.31126511952,22.6872526489727
高雄市左營區菜公里33鄰重義路133號,64,6400300,6400300-043,33鄰,重義路,,,,,,133號,120.311083169598,22.687400148987
高雄市左營區菜公里31鄰重義路160號,64,6400300,6400300-043,31鄰,重義路,,,,,,160號,120.3114802394,22.6874980606071
高雄市左營區菜公里31鄰重義路162號,64,6400300,6400300-043,31鄰,重義路,,,,,,162號,120.311435240094,22.6875365723345
高雄市左營區菜公里31鄰重義路166號,64,6400300,6400300-043,31鄰,重義路,,,,,,166號,120.311404212213,22.6875622393782
高雄市左營區菜公里31鄰重義路168號,64,6400300,6400300-043,31鄰,重義路,,,,,,168號,120.311363837832,22.6875964182152
