FULL_ADDR,COUNTY,TOWN,VILLAGE,NEIGHBORHOOD,ROAD,SECTION,LANE,ALLEY,SUB_ALLEY,TONG,NUMBER,X,Y
新北市板橋區重慶里4鄰國慶路126巷4號二樓,65,6500100,6500100-080,4鄰,國慶路,,126巷,,,,4號二樓,121.460726394267,24.9956529369368
新北市板橋區重慶里4鄰國慶路126巷4號三樓,65,6500100,6500100-080,4鄰,國慶路,,126巷,,,,4號三樓,121.460726394267,24.9956529369368
新北市板橋區重慶里4鄰國慶路126巷4號四樓,65,6500100,6500100-080,4鄰,國慶路,,126巷,,,,4號四樓,121.460726394267,24.9956529369368
新北市板橋區重慶里4鄰國慶路126巷5號,65,6500100,6500100-080,4鄰,國慶路,,126巷,,,,5號,121.460854530281,24.9955737121719
新北市板橋區重慶里4鄰國慶路126巷5號二樓,65,6500100,6500100-080,4鄰,國慶路,,126巷,,,,5號二樓,121.460854530281,24.9955737121719
新北市板橋區重慶里4鄰國慶路126巷5號三樓,65,6500100,6500100-080,4鄰,國慶路,,126巷,,,,5號三樓,121.460854530281,24.9955737121719
新北市板橋區重慶里4鄰國慶路126巷5號四樓,65,6500100,6500100-080,4鄰,國慶路,,126巷,,,,5號四樓,121.460854530281,24.9955737121719
新北市板橋區重慶里4鄰國慶路126巷6號,65,6500100,6500100-080,4鄰,國慶路,,126巷,,,,6號,121.460734052975,24.9955979730176
新北市板橋區重慶里4鄰國慶路126巷6號二樓,65,6500100,6500100-080,4鄰,國慶路,,126巷,,,,6號二樓,121.460734052975,24.9955979730176
新北市板橋區重慶里4鄰國慶路126巷6號三樓,65,6500100,6500100-080,4鄰,國慶路,,126巷,,,,6號三樓,121.460734052975,24.9955979730176
新北市板橋區重慶里4鄰國慶路126巷6號四樓,65,6500100,6500100-080,4鄰,國慶路,,126巷,,,,6號四樓,121.460734052975,24.9955979730176
新北市板橋區重慶里4鄰國慶路127號,65,6500100,6500100-080,4鄰,國慶路,,,,,,127號,121.460751551885,24.9960165329322
新北市板橋區重慶里4鄰國慶路128號,65,6500100,6500100-080,4鄰,國慶路,,,,,,128號,121.460797767912,24.9958151476407
新北市板橋區重慶里4鄰國慶路128號二樓,65,6500100,6500100-080,4鄰,國慶路,,,,,,128號二樓,121.460797767912,24.9958151476407
新北市板橋區重慶里4鄰國慶路128號三樓,65,6500100,6500100-080,4鄰,國慶路,,,,,,128號三樓,121.460797767912,24.9958151476407
新北市板橋區重慶里4鄰國慶路128號四樓,65,6500100,6500100-080,4鄰,國慶路,,,,,,128號四樓,121.460797767912,24.9958151476407
新北市板橋區重慶里4鄰國慶路130號,65,6500100,6500100-080,4鄰,國慶路,,,,,,130號,121.460884341269,24.9958363783323
新北市板橋區重慶里4鄰國慶路131號,65,6500100,6500100-080,4鄰,國慶路,,,,,,131號,121.460853637328,24.9960371242526
新北市板橋區重慶里4鄰國慶路131號二樓,65,6500100,6500100-080,4鄰,國慶路,,,,,,131號二樓,121.460853637328,24.9960371242526
新北市板橋區重慶里4鄰國慶路131號三樓,65,6500100,6500100-080,4鄰,國慶路,,,,,,131號三樓,121.460853637328,24.9960371242526
新北市板橋區重慶里4鄰國慶路131號四樓,65,6500100,6500100-080,4鄰,國慶路,,,,,,131號四樓,121.460853637328,24.9960371242526
新北市板橋區重慶里4鄰國慶路132號,65,6500100,6500100-080,4鄰,國慶路,,,,,,132號,121.461424190987,24.9958998028519
新北市板橋區重慶里4鄰國慶路133號,65,6500100,6500100-080,4鄰,國慶路,,,,,,133號,121.460907196647,24.9960441998572
新北市板橋區重慶里4鄰國慶路133號二樓,65,6500100,6500100-080,4鄰,國慶路,,,,,,133號二樓,121.460907196647,24.9960441998572
新北市板橋區重慶里4鄰國慶路133號三樓,65,6500100,6500100-080,4鄰,國慶路,,,,,,133號三樓,121.460907196647,24.9960441998572
新北市板橋區重慶里4鄰國慶路133號四樓,65,6500100,6500100-080,4鄰,國慶路,,,,,,133號四樓,121.460907196647,24.9960441998572
新北市板橋區重慶里4鄰國慶路135號,65,6500100,6500100-080,4鄰,國慶路,,,,,,135號,121.460962621634,24.996052682575
新北市板橋區重慶里4鄰國慶路135號二樓,65,6500100,6500100-080,4鄰,國慶路,,,,,,135號二樓,121.460962621634,24.996052682575
新北市板橋區重慶里4鄰國慶路135號三樓,65,6500100,6500100-080,4鄰,國慶路,,,,,,135號三樓,121.460962621634,24.996052682575
新北市板橋區重慶里4鄰國慶路135號四樓,65,6500100,6500100-080,4鄰,國慶路,,,,,,135號四樓,121.460962621634,24.996052682575
新北市板橋區重慶里4鄰國慶路137號,65,6500100,6500100-080,4鄰,國慶路,,,,,,137號,121.461016480746,24.9960654973397
新北市板橋區重慶里4鄰國慶路137號二樓,65,6500100,6500100-080,4鄰,國慶路,,,,,,137號二樓,121.461016480746,24.9960654973397
新北市板橋區重慶里4鄰國慶路137號三樓,65,6500100,6500100-080,4鄰,國慶路,,,,,,137號三樓,121.461016480746,24.9960654973397
新北市板橋區重慶里4鄰國慶路137號四樓,65,6500100,6500100-080,4鄰,國慶路,,,,,,137號四樓,121.461016480746,24.9960654973397
新北市板橋區重慶里4鄰國慶路139號,65,6500100,6500100-080,4鄰,國慶路,,,,,,139號,121.461068739715,24.9960739898282
新北市板橋區重慶里4鄰國慶路139號二樓,65,6500100,6500100-080,4鄰,國慶路,,,,,,139號二樓,121.461068739715,24.9960739898282
新北市板橋區重慶里4鄰國慶路139號三樓,65,6500100,6500100-080,4鄰,國慶路,,,,,,139號三樓,121.461068739715,24.9960739898282
新北市板橋區重慶里4鄰國慶路139號四樓,65,6500100,6500100-080,4鄰,國慶路,,,,,,139號四樓,121.461068739715,24.9960739898282
新北市板橋區重慶里4鄰國慶路141號,65,6500100,6500100-080,4鄰,國慶路,,,,,,141號,121.461141585703,24.9960853020965
新北市板橋區重慶里4鄰國慶路141號二樓,65,6500100,6500100-080,4鄰,國慶路,,,,,,141號二樓,121.461141585703,24.9960853020965
新北市板橋區重慶里4鄰國慶路141號三樓,65,6500100,6500100-080,4鄰,國慶路,,,,,,141號三樓,121.461141585703,24.9960853020965
新北市板橋區重慶里4鄰國慶路141號四樓,65,6500100,6500100-080,4鄰,國慶路,,,,,,141號四樓,121.461141585703,24.9960853020965
新北市板橋區重慶里4鄰國慶路143號,65,6500100,6500100-080,4鄰,國慶路,,,,,,143號,121.461203346195,24.9960952077931
新北市板橋區重慶里4鄰國慶路143號二樓,65,6500100,6500100-080,4鄰,國慶路,,,,,,143號二樓,121.461203346195,24.9960952077931
新北市板橋區重慶里4鄰國慶路143號三樓,65,6500100,6500100-080,4鄰,國慶路,,,,,,143號三樓,121.461203346195,24.9960952077931
新北市板橋區重慶里4鄰國慶路143號四樓,65,6500100,6500100-080,4鄰,國慶路,,,,,,143號四樓,121.461203346195,24.9960952077931
新北市板橋區重慶里4鄰國慶路145號,65,6500100,6500100-080,4鄰,國慶路,,,,,,145號,121.461263540822,24.9961094455341
新北市板橋區重慶里4鄰國慶路145號二樓,65,6500100,6500100-080,4鄰,國慶路,,,,,,145號二樓,121.461263540822,24.9961094455341
新北市板橋區重慶里4鄰國慶路145號三樓,65,6500100,6500100-080,4鄰,國慶路,,,,,,145號三樓,121.461263540822,24.9961094455341
新北市板橋區重慶里4鄰國慶路145號四樓,65,6500100,6500100-080,4鄰,國慶路,,,,,,145號四樓,121.461263540822,24.9961094455341
新北市板橋區重慶里4鄰國慶路147號,65,6500100,6500100-080,4鄰,國慶路,,,,,,147號,121.461320554261,24.9961193649963
新北市板橋區重慶里4鄰國慶路147號二樓,65,6500100,6500100-080,4鄰,國慶路,,,,,,147號二樓,121.461320554261,24.9961193649963
新北市板橋區重慶里4鄰國慶路147號三樓,65,6500100,6500100-080,4鄰,國慶路,,,,,,147號三樓,121.461320554261,24.9961193649963
新北市板橋區重慶里4鄰國慶路147號四樓,65,6500100,6500100-080,4鄰,國慶路,,,,,,147號四樓,121.461320554261,24.9961193649963
新北市板橋區重慶里5鄰國慶路149巷1弄1號,65,6500100,6500100-080,5鄰,國慶路,,149巷,1弄,,,1號,121.461250315803,24.9964727595474
新北市板橋區重慶里5鄰國慶路149巷1弄1號二樓,65,6500100,6500100-080,5鄰,國慶路,,149巷,1弄,,,1號二樓,121.461250315803,24.9964727595474
新北市板橋區重慶里5鄰國慶路149巷1弄1號三樓,65,6500100,6500100-080,5鄰,國慶路,,149巷,1弄,,,1號三樓,121.461250315803,24.9964727595474
新北市板橋區重慶里5鄰國慶路149巷1弄1號四樓,65,6500100,6500100-080,5鄰,國慶路,,149巷,1弄,,,1號四樓,121.461250315803,24.9964727595474
新北市板橋區重慶里5鄰國慶路149巷1弄1號五樓,65,6500100,6500100-080,5鄰,國慶路,,149巷,1弄,,,1號五樓,121.461250315803,24.9964727595474
新北市板橋區重慶里5鄰國慶路149巷1弄2號,65,6500100,6500100-080,5鄰,國慶路,,149巷,1弄,,,2號,121.461221521467,24.9965976492009
新北市板橋區重慶里5鄰國慶路149巷1弄2號二樓,65,6500100,6500100-080,5鄰,國慶路,,149巷,1弄,,,2號二樓,121.461221521467,24.9965976492009
新北市板橋區重慶里5鄰國慶路149巷1弄2號三樓,65,6500100,6500100-080,5鄰,國慶路,,149巷,1弄,,,2號三樓,121.461221521467,24.9965976492009
新北市板橋區重慶里5鄰國慶路149巷1弄2號四樓,65,6500100,6500100-080,5鄰,國慶路,,149巷,1弄,,,2號四樓,121.461221521467,24.9965976492009
新北市板橋區重慶里5鄰國慶路149巷1弄2號五樓,65,6500100,6500100-080,5鄰,國慶路,,149巷,1弄,,,2號五樓,121.461221521467,24.9965976492009
新北市板橋區重慶里5鄰國慶路149巷1弄3號,65,6500100,6500100-080,5鄰,國慶路,,149巷,1弄,,,3號,121.461180038496,24.9964591100983
新北市板橋區重慶里5鄰國慶路149巷1弄3號二樓,65,6500100,6500100-080,5鄰,國慶路,,149巷,1弄,,,3號二樓,121.461180038496,24.9964591100983
新北市板橋區重慶里5鄰國慶路149巷1弄3號三樓,65,6500100,6500100-080,5鄰,國慶路,,149巷,1弄,,,3號三樓,121.461180038496,24.9964591100983
新北市板橋區重慶里5鄰國慶路149巷1弄3號四樓,65,6500100,6500100-080,5鄰,國慶路,,149巷,1弄,,,3號四樓,121.461180038496,24.9964591100983
新北市板橋區重慶里5鄰國慶路149巷1弄3號五樓,65,6500100,6500100-080,5鄰,國慶路,,149巷,1弄,,,3號五樓,121.461180038496,24.9964591100983
新北市板橋區重慶里5鄰國慶路149巷1弄4號,65,6500100,6500100-080,5鄰,國慶路,,149巷,1弄,,,4號,121.461139527882,24.9965808364614
新北市板橋區重慶里5鄰國慶路149巷1弄4號二樓,65,6500100,6500100-080,5鄰,國慶路,,149巷,1弄,,,4號二樓,121.461139527882,24.9965808364614
新北市板橋區重慶里5鄰國慶路149巷1弄4號三樓,65,6500100,6500100-080,5鄰,國慶路,,149巷,1弄,,,4號三樓,121.461139527882,24.9965808364614
新北市板橋區重慶里5鄰國慶路149巷1弄4號四樓,65,6500100,6500100-080,5鄰,國慶路,,149巷,1弄,,,4號四樓,121.461139527882,24.9965808364614
新北市板橋區重慶里5鄰國慶路149巷1弄4號五樓,65,6500100,6500100-080,5鄰,國慶路,,149巷,1弄,,,4號五樓,121.461139527882,24.9965808364614
新北市板橋區重慶里5鄰國慶路149巷1弄5號,65,6500100,6500100-080,5鄰,國慶路,,149巷,1弄,,,5號,121.461096888011,24.9964455014162
新北市板橋區重慶里5鄰國慶路149巷1弄5號二樓,65,6500100,6500100-080,5鄰,國慶路,,149巷,1弄,,,5號二樓,121.461096888011,24.9964455014162
新北市板橋區重慶里5鄰國慶路149巷1弄5號三樓,65,6500100,6500100-080,5鄰,國慶路,,149巷,1弄,,,5號三樓,121.461096888011,24.9964455014162
新北市板橋區重慶里5鄰國慶路149巷1弄5號四樓,65,6500100,6500100-080,5鄰,國慶路,,149巷,1弄,,,5號四樓,121.461096888011,24.9964455014162
新北市板橋區重慶里5鄰國慶路149巷1弄5號五樓,65,6500100,6500100-080,5鄰,國慶路,,149巷,1弄,,,5號五樓,121.461096888011,24.9964455014162
新北市板橋區重慶里5鄰國慶路149巷1弄6號,65,6500100,6500100-080,5鄰,國慶路,,149巷,1弄,,,6號,121.46105169163,24.9965661751458
新北市板橋區重慶里5鄰國慶路149巷1弄6號二樓,65,6500100,6500100-080,5鄰,國慶路,,149巷,1弄,,,6號二樓,121.46105169163,24.9965661751458
新北市板橋區重慶里5鄰國慶路149巷1弄6號三樓,65,6500100,6500100-080,5鄰,國慶路,,149巷,1弄,,,6號三樓,121.46105169163,24.9965661751458
新北市板橋區重慶里5鄰國慶路149巷1弄6號四樓,65,6500100,6500100-080,5鄰,國慶路,,149巷,1弄,,,6號四樓,121.46105169163,24.9965661751458
新北市板橋區重慶里5鄰國慶路149巷1弄6號五樓,65,6500100,6500100-080,5鄰,國慶路,,149巷,1弄,,,6號五樓,121.46105169163,24.9965661751458
新北市板橋區重慶里5鄰國慶路149巷1弄7號,65,6500100,6500100-080,5鄰,國慶路,,149巷,1弄,,,7號,121.46103832295,24.9964339489633
新北市板橋區重慶里5鄰國慶路149巷1弄7號二樓,65,6500100,6500100-080,5鄰,國慶路,,149巷,1弄,,,7號二樓,121.46103832295,24.9964339489633
新北市板橋區重慶里5鄰國慶路149巷1弄7號三樓,65,6500100,6500100-080,5鄰,國慶路,,149巷,1弄,,,7號三樓,121.46103832295,24.9964339489633
新北市板橋區重慶里5鄰國慶路149巷1弄7號四樓,65,6500100,6500100-080,5鄰,國慶路,,149巷,1弄,,,7號四樓,121.46103832295,24.9964339489633
新北市板橋區重慶里5鄰國慶路149巷1弄7號五樓,65,6500100,6500100-080,5鄰,國慶路,,149巷,1弄,,,7號五樓,121.46103832295,24.9964339489633
新北市板橋區重慶里5鄰國慶路149巷1弄8號,65,6500100,6500100-080,5鄰,國慶路,,149巷,1弄,,,8號,121.460990984533,24.9965386313468
新北市板橋區重慶里5鄰國慶路149巷1弄8號二樓,65,6500100,6500100-080,5鄰,國慶路,,149巷,1弄,,,8號二樓,121.460990984533,24.9965386313468
新北市板橋區重慶里5鄰國慶路149巷1弄8號三樓,65,6500100,6500100-080,5鄰,國慶路,,149巷,1弄,,,8號三樓,121.460990984533,24.9965386313468
新北市板橋區重慶里5鄰國慶路149巷1弄8號四樓,65,6500100,6500100-080,5鄰,國慶路,,149巷,1弄,,,8號四樓,121.460990984533,24.9965386313468
新北市板橋區重慶里5鄰國慶路149巷1弄8號五樓,65,6500100,6500100-080,5鄰,國慶路,,149巷,1弄,,,8號五樓,121.460990984533,24.9965386313468
新北市板橋區重慶里5鄰國慶路149巷1弄9號,65,6500100,6500100-080,5鄰,國慶路,,149巷,1弄,,,9號,121.460966936146,24.9964194957301
新北市板橋區重慶里5鄰國慶路149巷1弄9號二樓,65,6500100,6500100-080,5鄰,國慶路,,149巷,1弄,,,9號二樓,121.460966936146,24.9964194957301
新北市板橋區重慶里5鄰國慶路149巷1弄9號三樓,65,6500100,6500100-080,5鄰,國慶路,,149巷,1弄,,,9號三樓,121.460966936146,24.9964194957301
新北市板橋區重慶里5鄰國慶路149巷1弄9號四樓,65,6500100,6500100-080,5鄰,國慶路,,149巷,1弄,,,9號四樓,121.460966936146,24.9964194957301
新北市板橋區重慶里5鄰國慶路149巷1弄9號五樓,65,6500100,6500100-080,5鄰,國慶路,,149巷,1弄,,,9號五樓,121.460966936146,24.9964194957301
新北市板橋區重慶里5鄰國慶路149巷1弄10號,65,6500100,6500100-080,5鄰,國慶路,,149巷,1弄,,,10號,121.460922809407,24.996530308219
新北市板橋區重慶里5鄰國慶路149巷1弄10號二樓,65,6500100,6500100-080,5鄰,國慶路,,149巷,1弄,,,10號二樓,121.460922809407,24.996530308219
新北市板橋區重慶里5鄰國慶路149巷1弄10號三樓,65,6500100,6500100-080,5鄰,國慶路,,149巷,1弄,,,10號三樓,121.460922809407,24.996530308219
新北市板橋區重慶里5鄰國慶路149巷1弄10號四樓,65,6500100,6500100-080,5鄰,國慶路,,149巷,1弄,,,10號四樓,121.460922809407,24.996530308219
新北市板橋區重慶里5鄰國慶路149巷1弄10號五樓,65,6500100,6500100-080,5鄰,國慶路,,149巷,1弄,,,10號五樓,121.460922809407,24.996530308219
新北市板橋區重慶里5鄰國慶路149巷1弄11號,65,6500100,6500100-080,5鄰,國慶路,,149巷,1弄,,,11號,121.460894258655,24.9964066625083
新北市板橋區重慶里5鄰國慶路149巷1弄11號二樓,65,6500100,6500100-080,5鄰,國慶路,,149巷,1弄,,,11號二樓,121.460894258655,24.9964066625083
新北市板橋區重慶里5鄰國慶路149巷1弄11號三樓,65,6500100,6500100-080,5鄰,國慶路,,149巷,1弄,,,11號三樓,121.460894258655,24.9964066625083
新北市板橋區重慶里5鄰國慶路149巷1弄11號四樓,65,6500100,6500100-080,5鄰,國慶路,,149巷,1弄,,,11號四樓,121.460894258655,24.9964066625083
新北市板橋區重慶里5鄰國慶路149巷1弄11號五樓,65,6500100,6500100-080,5鄰,國慶路,,149巷,1弄,,,11號五樓,121.460894258655,24.9964066625083
新北市板橋區重慶里5鄰國慶路149巷1弄12號,65,6500100,6500100-080,5鄰,國慶路,,149巷,1弄,,,12號,121.460868934973,24.996520874531
新北市板橋區重慶里5鄰國慶路149巷1弄12號二樓,65,6500100,6500100-080,5鄰,國慶路,,149巷,1弄,,,12號二樓,121.460868934973,24.996520874531
新北市板橋區重慶里5鄰國慶路149巷1弄12號三樓,65,6500100,6500100-080,5鄰,國慶路,,149巷,1弄,,,12號三樓,121.460868934973,24.996520874531
新北市板橋區重慶里5鄰國慶路149巷1弄12號四樓,65,6500100,6500100-080,5鄰,國慶路,,149巷,1弄,,,12號四樓,121.460868934973,24.996520874531
新北市板橋區重慶里5鄰國慶路149巷1弄12號五樓,65,6500100,6500100-080,5鄰,國慶路,,149巷,1弄,,,12號五樓,121.460868934973,24.996520874531
新北市板橋區重慶里5鄰國慶路149巷2弄1號,65,6500100,6500100-080,5鄰,國慶路,,149巷,2弄,,,1號,121.461364093257,24.9966254924889
新北市板橋區重慶里5鄰國慶路149巷2弄1號二樓,65,6500100,6500100-080,5鄰,國慶路,,149巷,2弄,,,1號二樓,121.461364093257,24.9966254924889
新北市板橋區重慶里5鄰國慶路149巷2弄1號三樓,65,6500100,6500100-080,5鄰,國慶路,,149巷,2弄,,,1號三樓,121.461364093257,24.9966254924889
新北市板橋區重慶里5鄰國慶路149巷2弄1號四樓,65,6500100,6500100-080,5鄰,國慶路,,149巷,2弄,,,1號四樓,121.461364093257,24.9966254924889
新北市板橋區重慶里5鄰國慶路149巷2弄1號五樓,65,6500100,6500100-080,5鄰,國慶路,,149巷,2弄,,,1號五樓,121.461364093257,24.9966254924889
新北市板橋區重慶里6鄰國慶路149巷2弄2號,65,6500100,6500100-080,6鄰,國慶路,,149巷,2弄,,,2號,121.461409896629,24.996515434849
新北市板橋區重慶里6鄰國慶路149巷2弄2號二樓,65,6500100,6500100-080,6鄰,國慶路,,149巷,2弄,,,2號二樓,121.461409896629,24.996515434849
新北市板橋區重慶里6鄰國慶路149巷2弄2號三樓,65,6500100,6500100-080,6鄰,國慶路,,149巷,2弄,,,2號三樓,121.461409896629,24.996515434849
新北市板橋區重慶里6鄰國慶路149巷2弄2號四樓,65,6500100,6500100-080,6鄰,國慶路,,149巷,2弄,,,2號四樓,121.461409896629,24.996515434849
新北市板橋區重慶里6鄰國慶路149巷2弄2號五樓,65,6500100,6500100-080,6鄰,國慶路,,149巷,2弄,,,2號五樓,121.461409896629,24.996515434849
新北市板橋區重慶里6鄰國慶路149巷2弄3號,65,6500100,6500100-080,6鄰,國慶路,,149巷,2弄,,,3號,121.461425627405,24.9966206024787
新北市板橋區重慶里6鄰國慶路149巷2弄3號二樓,65,6500100,6500100-080,6鄰,國慶路,,149巷,2弄,,,3號二樓,121.461425627405,24.9966206024787
新北市板橋區重慶里6鄰國慶路149巷2弄3號三樓,65,6500100,6500100-080,6鄰,國慶路,,149巷,2弄,,,3號三樓,121.461425627405,24.9966206024787
新北市板橋區重慶里6鄰國慶路149巷2弄3號四樓,65,6500100,6500100-080,6鄰,國慶路,,149巷,2弄,,,3號四樓,121.461425627405,24.9966206024787
新北市板橋區重慶里6鄰國慶路149巷2弄3號五樓,65,6500100,6500100-080,6鄰,國慶路,,149巷,2弄,,,3號五樓,121.461425627405,24.9966206024787
新北市板橋區重慶里6鄰國慶路149巷2弄4號,65,6500100,6500100-080,6鄰,國慶路,,149巷,2弄,,,4號,121.461449816807,24.9965123597193
新北市板橋區重慶里6鄰國慶路149巷2弄4號二樓,65,6500100,6500100-080,6鄰,國慶路,,149巷,2弄,,,4號二樓,121.461449816807,24.9965123597193
新北市板橋區重慶里6鄰國慶路149巷2弄4號三樓,65,6500100,6500100-080,6鄰,國慶路,,149巷,2弄,,,4號三樓,121.461449816807,24.9965123597193
新北市板橋區重慶里6鄰國慶路149巷2弄4號四樓,65,6500100,6500100-080,6鄰,國慶路,,149巷,2弄,,,4號四樓,121.461449816807,24.9965123597193
新北市板橋區重慶里6鄰國慶路149巷2弄4號五樓,65,6500100,6500100-080,6鄰,國慶路,,149巷,2弄,,,4號五樓,121.461449816807,24.9965123597193
新北市板橋區重慶里6鄰國慶路149巷2弄5號,65,6500100,6500100-080,6鄰,國慶路,,149巷,2弄,,,5號,121.461488830041,24.9966515898375
新北市板橋區重慶里6鄰國慶路149巷2弄5號二樓,65,6500100,6500100-080,6鄰,國慶路,,149巷,2弄,,,5號二樓,121.461488830041,24.9966515898375
新北市板橋區重慶里6鄰國慶路149巷2弄5號三樓,65,6500100,6500100-080,6鄰,國慶路,,149巷,2弄,,,5號三樓,121.461488830041,24.9966515898375
新北市板橋區重慶里6鄰國慶路149巷2弄5號四樓,65,6500100,6500100-080,6鄰,國慶路,,149巷,2弄,,,5號四樓,121.461488830041,24.9966515898375
新北市板橋區重慶里6鄰國慶路149巷2弄5號五樓,65,6500100,6500100-080,6鄰,國慶路,,149巷,2弄,,,5號五樓,121.461488830041,24.9966515898375
新北市板橋區重慶里6鄰國慶路149巷2弄6號,65,6500100,6500100-080,6鄰,國慶路,,149巷,2弄,,,6號,121.461514595685,24.9965227082343
新北市板橋區重慶里6鄰國慶路149巷2弄6號二樓,65,6500100,6500100-080,6鄰,國慶路,,149巷,2弄,,,6號二樓,121.461514595685,24.9965227082343
新北市板橋區重慶里6鄰國慶路149巷2弄6號三樓,65,6500100,6500100-080,6鄰,國慶路,,149巷,2弄,,,6號三樓,121.461514595685,24.9965227082343
新北市板橋區重慶里6鄰國慶路149巷2弄6號四樓,65,6500100,6500100-080,6鄰,國慶路,,149巷,2弄,,,6號四樓,121.461514595685,24.9965227082343
新北市板橋區重慶里6鄰國慶路149巷2弄6號五樓,65,6500100,6500100-080,6鄰,國慶路,,149巷,2弄,,,6號五樓,121.461514595685,24.9965227082343
新北市板橋區重慶里6鄰國慶路149巷2弄7號,65,6500100,6500100-080,6鄰,國慶路,,149巷,2弄,,,7號,121.461553799775,24.9966424666296
新北市板橋區重慶里6鄰國慶路149巷2弄7號二樓,65,6500100,6500100-080,6鄰,國慶路,,149巷,2弄,,,7號二樓,121.461553799775,24.9966424666296
新北市板橋區重慶里6鄰國慶路149巷2弄7號三樓,65,6500100,6500100-080,6鄰,國慶路,,149巷,2弄,,,7號三樓,121.461553799775,24.9966424666296
新北市板橋區重慶里6鄰國慶路149巷2弄7號四樓,65,6500100,6500100-080,6鄰,國慶路,,149巷,2弄,,,7號四樓,121.461553799775,24.9966424666296
新北市板橋區重慶里6鄰國慶路149巷2弄7號五樓,65,6500100,6500100-080,6鄰,國慶路,,149巷,2弄,,,7號五樓,121.461553799775,24.9966424666296
新北市板橋區重慶里6鄰國慶路149巷2弄8號,65,6500100,6500100-080,6鄰,國慶路,,149巷,2弄,,,8號,121.461592169284,24.9965385233224
新北市板橋區重慶里6鄰國慶路149巷2弄8號二樓,65,6500100,6500100-080,6鄰,國慶路,,149巷,2弄,,,8號二樓,121.461592169284,24.9965385233224
新北市板橋區重慶里6鄰國慶路149巷2弄8號三樓,65,6500100,6500100-080,6鄰,國慶路,,149巷,2弄,,,8號三樓,121.461592169284,24.9965385233224
新北市板橋區重慶里6鄰國慶路149巷2弄8號四樓,65,6500100,6500100-080,6鄰,國慶路,,149巷,2弄,,,8號四樓,121.461592169284,24.9965385233224
新北市板橋區重慶里6鄰國慶路149巷2弄8號五樓,65,6500100,6500100-080,6鄰,國慶路,,149巷,2弄,,,8號五樓,121.461592169284,24.9965385233224
新北市板橋區重慶里6鄰國慶路149巷2弄9號,65,6500100,6500100-080,6鄰,國慶路,,149巷,2弄,,,9號,121.461688927023,24.9966591729457
新北市板橋區重慶里6鄰國慶路149巷2弄9號二樓,65,6500100,6500100-080,6鄰,國慶路,,149巷,2弄,,,9號二樓,121.461688927023,24.9966591729457
新北市板橋區重慶里6鄰國慶路149巷2弄9號三樓,65,6500100,6500100-080,6鄰,國慶路,,149巷,2弄,,,9號三樓,121.461688927023,24.9966591729457
新北市板橋區重慶里6鄰國慶路149巷2弄9號四樓,65,6500100,6500100-080,6鄰,國慶路,,149巷,2弄,,,9號四樓,121.461688927023,24.9966591729457
新北市板橋區重慶里6鄰國慶路149巷2弄9號五樓,65,6500100,6500100-080,6鄰,國慶路,,149巷,2弄,,,9號五樓,121.461688927023,24.9966591729457
新北市板橋區重慶里6鄰國慶路149巷2弄10號,65,6500100,6500100-080,6鄰,國慶路,,149巷,2弄,,,10號,121.461650985696,24.9965589919263
新北市板橋區重慶里6鄰國慶路149巷2弄10號二樓,65,6500100,6500100-080,6鄰,國慶路,,149巷,2弄,,,10號二樓,121.461650985696,24.9965589919263
新北市板橋區重慶里6鄰國慶路149巷2弄10號三樓,65,6500100,6500100-080,6鄰,國慶路,,149巷,2弄,,,10號三樓,121.461650985696,24.9965589919263
新北市板橋區重慶里6鄰國慶路149巷2弄10號四樓,65,6500100,6500100-080,6鄰,國慶路,,149巷,2弄,,,10號四樓,121.461650985696,24.9965589919263
新北市板橋區重慶里6鄰國慶路149巷2弄10號五樓,65,6500100,6500100-080,6鄰,國慶路,,149巷,2弄,,,10號五樓,121.461650985696,24.9965589919263
新北市板橋區重慶里6鄰國慶路149巷2弄11號,65,6500100,6500100-080,6鄰,國慶路,,149巷,2弄,,,11號,121.461777314817,24.996676913495
新北市板橋區重慶里6鄰國慶路149巷2弄11號二樓,65,6500100,6500100-080,6鄰,國慶路,,149巷,2弄,,,11號二樓,121.461777314817,24.996676913495
新北市板橋區重慶里6鄰國慶路149巷2弄11號三樓,65,6500100,6500100-080,6鄰,國慶路,,149巷,2弄,,,11號三樓,121.461777314817,24.996676913495
新北市板橋區重慶里6鄰國慶路149巷2弄11號四樓,65,6500100,6500100-080,6鄰,國慶路,,149巷,2弄,,,11號四樓,121.461777314817,24.996676913495
新北市板橋區重慶里6鄰國慶路149巷2弄11號五樓,65,6500100,6500100-080,6鄰,國慶路,,149巷,2弄,,,11號五樓,121.461777314817,24.996676913495
新北市板橋區重慶里6鄰國慶路149巷2弄12號,65,6500100,6500100-080,6鄰,國慶路,,149巷,2弄,,,12號,121.461723730652,24.9965498038914
