FULL_ADDR,COUNTY,TOWN,VILLAGE,NEIGHBORHOOD,ROAD,SECTION,LANE,ALLEY,SUB_ALLEY,TONG,NUMBER,X,Y
新北市板橋區重慶里36鄰國慶路158巷11弄7號五樓,65,6500100,6500100-080,36鄰,國慶路,,158巷,11弄,,,7號五樓,121.462297888055,24.9959415337163
新北市板橋區重慶里36鄰國慶路158巷11弄9號,65,6500100,6500100-080,36鄰,國慶路,,158巷,11弄,,,9號,121.46237394241,24.9959514360411
新北市板橋區重慶里36鄰國慶路158巷11弄9號二樓,65,6500100,6500100-080,36鄰,國慶路,,158巷,11弄,,,9號二樓,121.46237394241,24.9959514360411
新北市板橋區重慶里36鄰國慶路158巷11弄9號三樓,65,6500100,6500100-080,36鄰,國慶路,,158巷,11弄,,,9號三樓,121.46237394241,24.9959514360411
新北市板橋區重慶里36鄰國慶路158巷11弄9號四樓,65,6500100,6500100-080,36鄰,國慶路,,158巷,11弄,,,9號四樓,121.46237394241,24.9959514360411
新北市板橋區重慶里36鄰國慶路158巷11弄9號五樓,65,6500100,6500100-080,36鄰,國慶路,,158巷,11弄,,,9號五樓,121.46237394241,24.9959514360411
新北市板橋區重慶里36鄰國慶路158巷11弄11號,65,6500100,6500100-080,36鄰,國慶路,,158巷,11弄,,,11號,121.462395008126,24.9958590094048
新北市板橋區重慶里36鄰國慶路158巷11弄11號二樓,65,6500100,6500100-080,36鄰,國慶路,,158巷,11弄,,,11號二樓,121.462395008126,24.9958590094048
新北市板橋區重慶里36鄰國慶路158巷11弄11號三樓,65,6500100,6500100-080,36鄰,國慶路,,158巷,11弄,,,11號三樓,121.462395008126,24.9958590094048
新北市板橋區重慶里36鄰國慶路158巷11弄11號四樓,65,6500100,6500100-080,36鄰,國慶路,,158巷,11弄,,,11號四樓,121.462395008126,24.9958590094048
新北市板橋區重慶里36鄰國慶路158巷11弄11號五樓,65,6500100,6500100-080,36鄰,國慶路,,158巷,11弄,,,11號五樓,121.462395008126,24.9958590094048
新北市板橋區重慶里36鄰國慶路158巷11弄13號,65,6500100,6500100-080,36鄰,國慶路,,158巷,11弄,,,13號,121.462432705793,24.9957163523492
新北市板橋區重慶里36鄰國慶路158巷11弄13號二樓,65,6500100,6500100-080,36鄰,國慶路,,158巷,11弄,,,13號二樓,121.462432705793,24.9957163523492
新北市板橋區重慶里36鄰國慶路158巷11弄13號三樓,65,6500100,6500100-080,36鄰,國慶路,,158巷,11弄,,,13號三樓,121.462432705793,24.9957163523492
新北市板橋區重慶里36鄰國慶路158巷11弄13號四樓,65,6500100,6500100-080,36鄰,國慶路,,158巷,11弄,,,13號四樓,121.462432705793,24.9957163523492
新北市板橋區重慶里36鄰國慶路158巷11弄13號五樓,65,6500100,6500100-080,36鄰,國慶路,,158巷,11弄,,,13號五樓,121.462432705793,24.9957163523492
新北市板橋區重慶里36鄰國慶路158巷11弄15號,65,6500100,6500100-080,36鄰,國慶路,,158巷,11弄,,,15號,121.462512692353,24.9957287738894
新北市板橋區重慶里36鄰國慶路158巷11弄15號二樓,65,6500100,6500100-080,36鄰,國慶路,,158巷,11弄,,,15號二樓,121.462512692353,24.9957287738894
新北市板橋區重慶里36鄰國慶路158巷11弄15號三樓,65,6500100,6500100-080,36鄰,國慶路,,158巷,11弄,,,15號三樓,121.462512692353,24.9957287738894
新北市板橋區重慶里36鄰國慶路158巷11弄15號四樓,65,6500100,6500100-080,36鄰,國慶路,,158巷,11弄,,,15號四樓,121.462512692353,24.9957287738894
新北市板橋區重慶里36鄰國慶路158巷11弄15號五樓,65,6500100,6500100-080,36鄰,國慶路,,158巷,11弄,,,15號五樓,121.462512692353,24.9957287738894
新北市板橋區重慶里4鄰國慶路159號,65,6500100,6500100-080,4鄰,國慶路,,,,,,159號,121.461721235015,24.9961902411076
新北市板橋區重慶里4鄰國慶路159號二樓,65,6500100,6500100-080,4鄰,國慶路,,,,,,159號二樓,121.461721235015,24.9961902411076
新北市板橋區重慶里4鄰國慶路159號三樓,65,6500100,6500100-080,4鄰,國慶路,,,,,,159號三樓,121.461721235015,24.9961902411076
新北市板橋區重慶里4鄰國慶路159號四樓,65,6500100,6500100-080,4鄰,國慶路,,,,,,159號四樓,121.461721235015,24.9961902411076
新北市板橋區重慶里4鄰國慶路159號五樓,65,6500100,6500100-080,4鄰,國慶路,,,,,,159號五樓,121.461721235015,24.9961902411076
新北市板橋區重慶里36鄰國慶路160號,65,6500100,6500100-080,36鄰,國慶路,,,,,,160號,121.462084759584,24.996059297852
新北市板橋區重慶里36鄰國慶路160號二樓,65,6500100,6500100-080,36鄰,國慶路,,,,,,160號二樓,121.462084759584,24.996059297852
新北市板橋區重慶里36鄰國慶路160號三樓,65,6500100,6500100-080,36鄰,國慶路,,,,,,160號三樓,121.462084759584,24.996059297852
新北市板橋區重慶里36鄰國慶路160號四樓,65,6500100,6500100-080,36鄰,國慶路,,,,,,160號四樓,121.462084759584,24.996059297852
新北市板橋區重慶里36鄰國慶路160號五樓,65,6500100,6500100-080,36鄰,國慶路,,,,,,160號五樓,121.462084759584,24.996059297852
新北市板橋區重慶里4鄰國慶路161之6號,65,6500100,6500100-080,4鄰,國慶路,,,,,,161之6號,121.461873864569,24.9963758330859
新北市板橋區重慶里4鄰國慶路161之5號,65,6500100,6500100-080,4鄰,國慶路,,,,,,161之5號,121.461892285365,24.9962228842802
新北市板橋區重慶里4鄰國慶路161號,65,6500100,6500100-080,4鄰,國慶路,,,,,,161號,121.461816269783,24.9962101386113
新北市板橋區重慶里4鄰國慶路161之5號二樓,65,6500100,6500100-080,4鄰,國慶路,,,,,,161之5號二樓,121.461892285365,24.9962228842802
新北市板橋區重慶里4鄰國慶路161之6號二樓,65,6500100,6500100-080,4鄰,國慶路,,,,,,161之6號二樓,121.461873864569,24.9963758330859
新北市板橋區重慶里4鄰國慶路161號二樓,65,6500100,6500100-080,4鄰,國慶路,,,,,,161號二樓,121.461816269783,24.9962101386113
新北市板橋區重慶里4鄰國慶路161號三樓,65,6500100,6500100-080,4鄰,國慶路,,,,,,161號三樓,121.461816269783,24.9962101386113
新北市板橋區重慶里4鄰國慶路161之6號三樓,65,6500100,6500100-080,4鄰,國慶路,,,,,,161之6號三樓,121.461873864569,24.9963758330859
新北市板橋區重慶里4鄰國慶路161之5號三樓,65,6500100,6500100-080,4鄰,國慶路,,,,,,161之5號三樓,121.461892285365,24.9962228842802
新北市板橋區重慶里4鄰國慶路161之5號四樓,65,6500100,6500100-080,4鄰,國慶路,,,,,,161之5號四樓,121.461892285365,24.9962228842802
新北市板橋區重慶里4鄰國慶路161之6號四樓,65,6500100,6500100-080,4鄰,國慶路,,,,,,161之6號四樓,121.461873864569,24.9963758330859
新北市板橋區重慶里4鄰國慶路161號四樓,65,6500100,6500100-080,4鄰,國慶路,,,,,,161號四樓,121.461816269783,24.9962101386113
新北市板橋區重慶里4鄰國慶路161號五樓,65,6500100,6500100-080,4鄰,國慶路,,,,,,161號五樓,121.461816269783,24.9962101386113
新北市板橋區重慶里4鄰國慶路161之6號五樓,65,6500100,6500100-080,4鄰,國慶路,,,,,,161之6號五樓,121.461873864569,24.9963758330859
新北市板橋區重慶里4鄰國慶路161之5號五樓,65,6500100,6500100-080,4鄰,國慶路,,,,,,161之5號五樓,121.461892285365,24.9962228842802
新北市板橋區重慶里4鄰國慶路161之5號六樓,65,6500100,6500100-080,4鄰,國慶路,,,,,,161之5號六樓,121.461892285365,24.9962228842802
新北市板橋區重慶里4鄰國慶路161之6號六樓,65,6500100,6500100-080,4鄰,國慶路,,,,,,161之6號六樓,121.461873864569,24.9963758330859
新北市板橋區重慶里4鄰國慶路161之6號七樓,65,6500100,6500100-080,4鄰,國慶路,,,,,,161之6號七樓,121.461873864569,24.9963758330859
新北市板橋區重慶里4鄰國慶路161之5號七樓,65,6500100,6500100-080,4鄰,國慶路,,,,,,161之5號七樓,121.461892285365,24.9962228842802
新北市板橋區重慶里36鄰國慶路162號,65,6500100,6500100-080,36鄰,國慶路,,,,,,162號,121.462149718532,24.9960778476512
新北市板橋區重慶里36鄰國慶路162號二樓,65,6500100,6500100-080,36鄰,國慶路,,,,,,162號二樓,121.462149718532,24.9960778476512
新北市板橋區重慶里36鄰國慶路162號三樓,65,6500100,6500100-080,36鄰,國慶路,,,,,,162號三樓,121.462149718532,24.9960778476512
新北市板橋區重慶里36鄰國慶路162號四樓,65,6500100,6500100-080,36鄰,國慶路,,,,,,162號四樓,121.462149718532,24.9960778476512
新北市板橋區重慶里36鄰國慶路162號五樓,65,6500100,6500100-080,36鄰,國慶路,,,,,,162號五樓,121.462149718532,24.9960778476512
新北市板橋區重慶里4鄰國慶路163號,65,6500100,6500100-080,4鄰,國慶路,,,,,,163號,121.461987330972,24.9962456670522
新北市板橋區重慶里4鄰國慶路163號二樓,65,6500100,6500100-080,4鄰,國慶路,,,,,,163號二樓,121.461987330972,24.9962456670522
新北市板橋區重慶里4鄰國慶路163號三樓,65,6500100,6500100-080,4鄰,國慶路,,,,,,163號三樓,121.461987330972,24.9962456670522
新北市板橋區重慶里4鄰國慶路163號四樓,65,6500100,6500100-080,4鄰,國慶路,,,,,,163號四樓,121.461987330972,24.9962456670522
新北市板橋區重慶里4鄰國慶路163號五樓,65,6500100,6500100-080,4鄰,國慶路,,,,,,163號五樓,121.461987330972,24.9962456670522
新北市板橋區重慶里36鄰國慶路164號,65,6500100,6500100-080,36鄰,國慶路,,,,,,164號,121.46222099778,24.9960934914714
新北市板橋區重慶里36鄰國慶路164號二樓,65,6500100,6500100-080,36鄰,國慶路,,,,,,164號二樓,121.46222099778,24.9960934914714
新北市板橋區重慶里36鄰國慶路164號三樓,65,6500100,6500100-080,36鄰,國慶路,,,,,,164號三樓,121.46222099778,24.9960934914714
新北市板橋區重慶里36鄰國慶路164號四樓,65,6500100,6500100-080,36鄰,國慶路,,,,,,164號四樓,121.46222099778,24.9960934914714
新北市板橋區重慶里36鄰國慶路164號五樓,65,6500100,6500100-080,36鄰,國慶路,,,,,,164號五樓,121.46222099778,24.9960934914714
新北市板橋區重慶里4鄰國慶路165號,65,6500100,6500100-080,4鄰,國慶路,,,,,,165號,121.462080782807,24.9962655702039
新北市板橋區重慶里4鄰國慶路165號二樓,65,6500100,6500100-080,4鄰,國慶路,,,,,,165號二樓,121.462080782807,24.9962655702039
新北市板橋區重慶里4鄰國慶路165號三樓,65,6500100,6500100-080,4鄰,國慶路,,,,,,165號三樓,121.462080782807,24.9962655702039
新北市板橋區重慶里4鄰國慶路165號四樓,65,6500100,6500100-080,4鄰,國慶路,,,,,,165號四樓,121.462080782807,24.9962655702039
新北市板橋區重慶里4鄰國慶路165號五樓,65,6500100,6500100-080,4鄰,國慶路,,,,,,165號五樓,121.462080782807,24.9962655702039
新北市板橋區重慶里36鄰國慶路166號,65,6500100,6500100-080,36鄰,國慶路,,,,,,166號,121.462306520241,24.9961090919023
新北市板橋區重慶里36鄰國慶路166號二樓,65,6500100,6500100-080,36鄰,國慶路,,,,,,166號二樓,121.462306520241,24.9961090919023
新北市板橋區重慶里36鄰國慶路166號三樓,65,6500100,6500100-080,36鄰,國慶路,,,,,,166號三樓,121.462306520241,24.9961090919023
新北市板橋區重慶里36鄰國慶路166號四樓,65,6500100,6500100-080,36鄰,國慶路,,,,,,166號四樓,121.462306520241,24.9961090919023
新北市板橋區重慶里36鄰國慶路166號五樓,65,6500100,6500100-080,36鄰,國慶路,,,,,,166號五樓,121.462306520241,24.9961090919023
新北市板橋區重慶里19鄰國慶路167巷1號,65,6500100,6500100-080,19鄰,國慶路,,167巷,,,,1號,121.462015132149,24.9964703340765
新北市板橋區重慶里19鄰國慶路167巷1號二樓,65,6500100,6500100-080,19鄰,國慶路,,167巷,,,,1號二樓,121.462015132149,24.9964703340765
新北市板橋區重慶里19鄰國慶路167巷1號三樓,65,6500100,6500100-080,19鄰,國慶路,,167巷,,,,1號三樓,121.462015132149,24.9964703340765
新北市板橋區重慶里19鄰國慶路167巷1號四樓,65,6500100,6500100-080,19鄰,國慶路,,167巷,,,,1號四樓,121.462015132149,24.9964703340765
新北市板橋區重慶里19鄰國慶路167巷1號五樓,65,6500100,6500100-080,19鄰,國慶路,,167巷,,,,1號五樓,121.462015132149,24.9964703340765
新北市板橋區重慶里19鄰國慶路167巷2號,65,6500100,6500100-080,19鄰,國慶路,,167巷,,,,2號,121.462194570624,24.9964423066426
新北市板橋區重慶里19鄰國慶路167巷2號二樓,65,6500100,6500100-080,19鄰,國慶路,,167巷,,,,2號二樓,121.462194570624,24.9964423066426
新北市板橋區重慶里19鄰國慶路167巷2號三樓,65,6500100,6500100-080,19鄰,國慶路,,167巷,,,,2號三樓,121.462194570624,24.9964423066426
新北市板橋區重慶里19鄰國慶路167巷2號四樓,65,6500100,6500100-080,19鄰,國慶路,,167巷,,,,2號四樓,121.462194570624,24.9964423066426
新北市板橋區重慶里19鄰國慶路167巷2號五樓,65,6500100,6500100-080,19鄰,國慶路,,167巷,,,,2號五樓,121.462194570624,24.9964423066426
新北市板橋區重慶里19鄰國慶路167巷3號,65,6500100,6500100-080,19鄰,國慶路,,167巷,,,,3號,121.461991919456,24.9965524589276
新北市板橋區重慶里19鄰國慶路167巷3號二樓,65,6500100,6500100-080,19鄰,國慶路,,167巷,,,,3號二樓,121.461991919456,24.9965524589276
新北市板橋區重慶里19鄰國慶路167巷3號三樓,65,6500100,6500100-080,19鄰,國慶路,,167巷,,,,3號三樓,121.461991919456,24.9965524589276
新北市板橋區重慶里19鄰國慶路167巷3號四樓,65,6500100,6500100-080,19鄰,國慶路,,167巷,,,,3號四樓,121.461991919456,24.9965524589276
新北市板橋區重慶里19鄰國慶路167巷3號五樓,65,6500100,6500100-080,19鄰,國慶路,,167巷,,,,3號五樓,121.461991919456,24.9965524589276
新北市板橋區重慶里19鄰國慶路167巷4號,65,6500100,6500100-080,19鄰,國慶路,,167巷,,,,4號,121.462168000971,24.9965287204113
新北市板橋區重慶里19鄰國慶路167巷4號二樓,65,6500100,6500100-080,19鄰,國慶路,,167巷,,,,4號二樓,121.462168000971,24.9965287204113
新北市板橋區重慶里19鄰國慶路167巷4號三樓,65,6500100,6500100-080,19鄰,國慶路,,167巷,,,,4號三樓,121.462168000971,24.9965287204113
新北市板橋區重慶里19鄰國慶路167巷4號四樓,65,6500100,6500100-080,19鄰,國慶路,,167巷,,,,4號四樓,121.462168000971,24.9965287204113
新北市板橋區重慶里19鄰國慶路167巷4號五樓,65,6500100,6500100-080,19鄰,國慶路,,167巷,,,,4號五樓,121.462168000971,24.9965287204113
新北市板橋區重慶里19鄰國慶路167巷5號,65,6500100,6500100-080,19鄰,國慶路,,167巷,,,,5號,121.461966739972,24.996623893274
新北市板橋區重慶里19鄰國慶路167巷5號二樓,65,6500100,6500100-080,19鄰,國慶路,,167巷,,,,5號二樓,121.461966739972,24.996623893274
新北市板橋區重慶里19鄰國慶路167巷5號三樓,65,6500100,6500100-080,19鄰,國慶路,,167巷,,,,5號三樓,121.461966739972,24.996623893274
新北市板橋區重慶里19鄰國慶路167巷5號四樓,65,6500100,6500100-080,19鄰,國慶路,,167巷,,,,5號四樓,121.461966739972,24.996623893274
新北市板橋區重慶里19鄰國慶路167巷5號五樓,65,6500100,6500100-080,19鄰,國慶路,,167巷,,,,5號五樓,121.461966739972,24.996623893274
新北市板橋區重慶里19鄰國慶路167巷6號,65,6500100,6500100-080,19鄰,國慶路,,167巷,,,,6號,121.462138959017,24.9966144385578
新北市板橋區重慶里19鄰國慶路167巷6號二樓,65,6500100,6500100-080,19鄰,國慶路,,167巷,,,,6號二樓,121.462138959017,24.9966144385578
新北市板橋區重慶里19鄰國慶路167巷6號三樓,65,6500100,6500100-080,19鄰,國慶路,,167巷,,,,6號三樓,121.462138959017,24.9966144385578
新北市板橋區重慶里19鄰國慶路167巷6號四樓,65,6500100,6500100-080,19鄰,國慶路,,167巷,,,,6號四樓,121.462138959017,24.9966144385578
新北市板橋區重慶里19鄰國慶路167巷6號五樓,65,6500100,6500100-080,19鄰,國慶路,,167巷,,,,6號五樓,121.462138959017,24.9966144385578
新北市板橋區重慶里19鄰國慶路167巷7號,65,6500100,6500100-080,19鄰,國慶路,,167巷,,,,7號,121.461939601989,24.9966953345997
新北市板橋區重慶里19鄰國慶路167巷7號二樓,65,6500100,6500100-080,19鄰,國慶路,,167巷,,,,7號二樓,121.461939601989,24.9966953345997
新北市板橋區重慶里19鄰國慶路167巷7號三樓,65,6500100,6500100-080,19鄰,國慶路,,167巷,,,,7號三樓,121.461939601989,24.9966953345997
新北市板橋區重慶里19鄰國慶路167巷7號四樓,65,6500100,6500100-080,19鄰,國慶路,,167巷,,,,7號四樓,121.461939601989,24.9966953345997
新北市板橋區重慶里19鄰國慶路167巷7號五樓,65,6500100,6500100-080,19鄰,國慶路,,167巷,,,,7號五樓,121.461939601989,24.9966953345997
新北市板橋區重慶里19鄰國慶路167巷8號,65,6500100,6500100-080,19鄰,國慶路,,167巷,,,,8號,121.462115750431,24.9966894347492
新北市板橋區重慶里19鄰國慶路167巷8號二樓,65,6500100,6500100-080,19鄰,國慶路,,167巷,,,,8號二樓,121.462115750431,24.9966894347492
新北市板橋區重慶里19鄰國慶路167巷8號三樓,65,6500100,6500100-080,19鄰,國慶路,,167巷,,,,8號三樓,121.462115750431,24.9966894347492
新北市板橋區重慶里19鄰國慶路167巷8號四樓,65,6500100,6500100-080,19鄰,國慶路,,167巷,,,,8號四樓,121.462115750431,24.9966894347492
新北市板橋區重慶里19鄰國慶路167巷8號五樓,65,6500100,6500100-080,19鄰,國慶路,,167巷,,,,8號五樓,121.462115750431,24.9966894347492
新北市板橋區重慶里19鄰國慶路167巷9號,65,6500100,6500100-080,19鄰,國慶路,,167巷,,,,9號,121.461916591648,24.9967537029153
新北市板橋區重慶里19鄰國慶路167巷9號二樓,65,6500100,6500100-080,19鄰,國慶路,,167巷,,,,9號二樓,121.461916591648,24.9967537029153
新北市板橋區重慶里19鄰國慶路167巷9號三樓,65,6500100,6500100-080,19鄰,國慶路,,167巷,,,,9號三樓,121.461916591648,24.9967537029153
新北市板橋區重慶里19鄰國慶路167巷9號四樓,65,6500100,6500100-080,19鄰,國慶路,,167巷,,,,9號四樓,121.461916591648,24.9967537029153
新北市板橋區重慶里19鄰國慶路167巷9號五樓,65,6500100,6500100-080,19鄰,國慶路,,167巷,,,,9號五樓,121.461916591648,24.9967537029153
新北市板橋區重慶里19鄰國慶路167巷10號,65,6500100,6500100-080,19鄰,國慶路,,167巷,,,,10號,121.462085702057,24.9967675091278
新北市板橋區重慶里19鄰國慶路167巷10號二樓,65,6500100,6500100-080,19鄰,國慶路,,167巷,,,,10號二樓,121.462085702057,24.9967675091278
新北市板橋區重慶里19鄰國慶路167巷10號三樓,65,6500100,6500100-080,19鄰,國慶路,,167巷,,,,10號三樓,121.462085702057,24.9967675091278
新北市板橋區重慶里19鄰國慶路167巷10號四樓,65,6500100,6500100-080,19鄰,國慶路,,167巷,,,,10號四樓,121.462085702057,24.9967675091278
新北市板橋區重慶里19鄰國慶路167巷10號五樓,65,6500100,6500100-080,19鄰,國慶路,,167巷,,,,10號五樓,121.462085702057,24.9967675091278
新北市板橋區重慶里19鄰國慶路167巷11號,65,6500100,6500100-080,19鄰,國慶路,,167巷,,,,11號,121.461898986829,24.9968011023396
新北市板橋區重慶里19鄰國慶路167巷11號二樓,65,6500100,6500100-080,19鄰,國慶路,,167巷,,,,11號二樓,121.461898986829,24.9968011023396
新北市板橋區重慶里19鄰國慶路167巷11號三樓,65,6500100,6500100-080,19鄰,國慶路,,167巷,,,,11號三樓,121.461898986829,24.9968011023396
新北市板橋區重慶里19鄰國慶路167巷11號四樓,65,6500100,6500100-080,19鄰,國慶路,,167巷,,,,11號四樓,121.461898986829,24.9968011023396
新北市板橋區重慶里19鄰國慶路167巷11號五樓,65,6500100,6500100-080,19鄰,國慶路,,167巷,,,,11號五樓,121.461898986829,24.9968011023396
新北市板橋區重慶里19鄰國慶路167巷12號,65,6500100,6500100-080,19鄰,國慶路,,167巷,,,,12號,121.462061363266,24.9968454664574
新北市板橋區重慶里19鄰國慶路167巷12號二樓,65,6500100,6500100-080,19鄰,國慶路,,167巷,,,,12號二樓,121.462061363266,24.9968454664574
新北市板橋區重慶里19鄰國慶路167巷12號三樓,65,6500100,6500100-080,19鄰,國慶路,,167巷,,,,12號三樓,121.462061363266,24.9968454664574
新北市板橋區重慶里19鄰國慶路167巷12號四樓,65,6500100,6500100-080,19鄰,國慶路,,167巷,,,,12號四樓,121.462061363266,24.9968454664574
新北市板橋區重慶里19鄰國慶路167巷12號五樓,65,6500100,6500100-080,19鄰,國慶路,,167巷,,,,12號五樓,121.462061363266,24.9968454664574
新北市板橋區重慶里8鄰國慶路167巷13號,65,6500100,6500100-080,8鄰,國慶路,,167巷,,,,13號,121.461768009059,24.9970778132698
新北市板橋區重慶里8鄰國慶路167巷13號二樓,65,6500100,6500100-080,8鄰,國慶路,,167巷,,,,13號二樓,121.461768009059,24.9970778132698
新北市板橋區重慶里8鄰國慶路167巷13號三樓,65,6500100,6500100-080,8鄰,國慶路,,167巷,,,,13號三樓,121.461768009059,24.9970778132698
新北市板橋區重慶里8鄰國慶路167巷13號四樓,65,6500100,6500100-080,8鄰,國慶路,,167巷,,,,13號四樓,121.461768009059,24.9970778132698
新北市板橋區重慶里8鄰國慶路167巷13號五樓,65,6500100,6500100-080,8鄰,國慶路,,167巷,,,,13號五樓,121.461768009059,24.9970778132698
新北市板橋區重慶里8鄰國慶路167巷15號,65,6500100,6500100-080,8鄰,國慶路,,167巷,,,,15號,121.461755309148,24.9971865386294
新北市板橋區重慶里8鄰國慶路167巷15號二樓,65,6500100,6500100-080,8鄰,國慶路,,167巷,,,,15號二樓,121.461755309148,24.9971865386294
新北市板橋區重慶里8鄰國慶路167巷15號三樓,65,6500100,6500100-080,8鄰,國慶路,,167巷,,,,15號三樓,121.461755309148,24.9971865386294
新北市板橋區重慶里8鄰國慶路167巷15號四樓,65,6500100,6500100-080,8鄰,國慶路,,167巷,,,,15號四樓,121.461755309148,24.9971865386294
新北市板橋區重慶里8鄰國慶路167巷15號五樓,65,6500100,6500100-080,8鄰,國慶路,,167巷,,,,15號五樓,121.461755309148,24.9971865386294
新北市板橋區重慶里8鄰國慶路167巷17號,65,6500100,6500100-080,8鄰,國慶路,,167巷,,,,17號,121.461737350915,24.997290503488
新北市板橋區重慶里8鄰國慶路167巷17號二樓,65,6500100,6500100-080,8鄰,國慶路,,167巷,,,,17號二樓,121.461737350915,24.997290503488
新北市板橋區重慶里8鄰國慶路167巷17號三樓,65,6500100,6500100-080,8鄰,國慶路,,167巷,,,,17號三樓,121.461737350915,24.997290503488
新北市板橋區重慶里8鄰國慶路167巷17號四樓,65,6500100,6500100-080,8鄰,國慶路,,167巷,,,,17號四樓,121.461737350915,24.997290503488
新北市板橋區重慶里8鄰國慶路167巷17號五樓,65,6500100,6500100-080,8鄰,國慶路,,167巷,,,,17號五樓,121.461737350915,24.997290503488
新北市板橋區重慶里8鄰國慶路167巷19號,65,6500100,6500100-080,8鄰,國慶路,,167巷,,,,19號,121.461728466753,24.9973681645196
新北市板橋區重慶里8鄰國慶路167巷19號二樓,65,6500100,6500100-080,8鄰,國慶路,,167巷,,,,19號二樓,121.461728466753,24.9973681645196
新北市板橋區重慶里8鄰國慶路167巷19號三樓,65,6500100,6500100-080,8鄰,國慶路,,167巷,,,,19號三樓,121.461728466753,24.9973681645196
新北市板橋區重慶里8鄰國慶路167巷19號四樓,65,6500100,6500100-080,8鄰,國慶路,,167巷,,,,19號四樓,121.461728466753,24.9973681645196
新北市板橋區重慶里8鄰國慶路167巷19號五樓,65,6500100,6500100-080,8鄰,國慶路,,167巷,,,,19號五樓,121.461728466753,24.9973681645196
新北市板橋區重慶里8鄰國慶路167巷21號,65,6500100,6500100-080,8鄰,國慶路,,167巷,,,,21號,121.461694714208,24.9974542619342
新北市板橋區重慶里8鄰國慶路167巷21號二樓,65,6500100,6500100-080,8鄰,國慶路,,167巷,,,,21號二樓,121.461694714208,24.9974542619342
新北市板橋區重慶里8鄰國慶路167巷21號三樓,65,6500100,6500100-080,8鄰,國慶路,,167巷,,,,21號三樓,121.461694714208,24.9974542619342
新北市板橋區重慶里8鄰國慶路167巷21號四樓,65,6500100,6500100-080,8鄰,國慶路,,167巷,,,,21號四樓,121.461694714208,24.9974542619342
新北市板橋區重慶里8鄰國慶路167巷21號五樓,65,6500100,6500100-080,8鄰,國慶路,,167巷,,,,21號五樓,121.461694714208,24.9974542619342
新北市板橋區重慶里24鄰國慶路167巷23號,65,6500100,6500100-080,24鄰,國慶路,,167巷,,,,23號,121.461664091554,24.9976765065585
新北市板橋區重慶里24鄰國慶路167巷23號二樓,65,6500100,6500100-080,24鄰,國慶路,,167巷,,,,23號二樓,121.461664091554,24.9976765065585
新北市板橋區重慶里24鄰國慶路167巷23號三樓,65,6500100,6500100-080,24鄰,國慶路,,167巷,,,,23號三樓,121.461664091554,24.9976765065585
新北市板橋區重慶里24鄰國慶路167巷23號四樓,65,6500100,6500100-080,24鄰,國慶路,,167巷,,,,23號四樓,121.461664091554,24.9976765065585
新北市板橋區重慶里24鄰國慶路167巷23號五樓,65,6500100,6500100-080,24鄰,國慶路,,167巷,,,,23號五樓,121.461664091554,24.9976765065585
新北市板橋區重慶里24鄰國慶路167巷25號,65,6500100,6500100-080,24鄰,國慶路,,167巷,,,,25號,121.461656465377,24.9977398314182
新北市板橋區重慶里24鄰國慶路167巷25號二樓,65,6500100,6500100-080,24鄰,國慶路,,167巷,,,,25號二樓,121.461656465377,24.9977398314182
新北市板橋區重慶里24鄰國慶路167巷25號三樓,65,6500100,6500100-080,24鄰,國慶路,,167巷,,,,25號三樓,121.461656465377,24.9977398314182
新北市板橋區重慶里24鄰國慶路167巷25號四樓,65,6500100,6500100-080,24鄰,國慶路,,167巷,,,,25號四樓,121.461656465377,24.9977398314182
新北市板橋區重慶里24鄰國慶路167巷25號五樓,65,6500100,6500100-080,24鄰,國慶路,,167巷,,,,25號五樓,121.461656465377,24.9977398314182
新北市板橋區重慶里24鄰國慶路167巷27號,65,6500100,6500100-080,24鄰,國慶路,,167巷,,,,27號,121.461639754144,24.9978270721713
新北市板橋區重慶里24鄰國慶路167巷27號二樓,65,6500100,6500100-080,24鄰,國慶路,,167巷,,,,27號二樓,121.461639754144,24.9978270721713
