FULL_ADDR,COUNTY,TOWN,VILLAGE,NEIGHBORHOOD,ROAD,SECTION,LANE,ALLEY,SUB_ALLEY,TONG,NUMBER,X,Y
新北市板橋區重慶里20鄰國慶路196巷6號七樓之2,65,6500100,6500100-080,20鄰,國慶路,,196巷,,,,6號七樓之2,121.463411003436,24.9962665147775
新北市板橋區重慶里20鄰國慶路196巷6號七樓之1,65,6500100,6500100-080,20鄰,國慶路,,196巷,,,,6號七樓之1,121.463411003436,24.9962665147775
新北市板橋區重慶里20鄰國慶路196巷6號八樓,65,6500100,6500100-080,20鄰,國慶路,,196巷,,,,6號八樓,121.463411003436,24.9962665147775
新北市板橋區重慶里20鄰國慶路196巷6號八樓之2,65,6500100,6500100-080,20鄰,國慶路,,196巷,,,,6號八樓之2,121.463411003436,24.9962665147775
新北市板橋區重慶里20鄰國慶路196巷6號八樓之1,65,6500100,6500100-080,20鄰,國慶路,,196巷,,,,6號八樓之1,121.463411003436,24.9962665147775
新北市板橋區重慶里20鄰國慶路196巷6號九樓之2,65,6500100,6500100-080,20鄰,國慶路,,196巷,,,,6號九樓之2,121.463411003436,24.9962665147775
新北市板橋區重慶里20鄰國慶路196巷6號九樓之1,65,6500100,6500100-080,20鄰,國慶路,,196巷,,,,6號九樓之1,121.463411003436,24.9962665147775
新北市板橋區重慶里20鄰國慶路196巷6號九樓,65,6500100,6500100-080,20鄰,國慶路,,196巷,,,,6號九樓,121.463411003436,24.9962665147775
新北市板橋區重慶里20鄰國慶路196巷6號十樓之1,65,6500100,6500100-080,20鄰,國慶路,,196巷,,,,6號十樓之1,121.463411003436,24.9962665147775
新北市板橋區重慶里20鄰國慶路196巷6號十樓,65,6500100,6500100-080,20鄰,國慶路,,196巷,,,,6號十樓,121.463411003436,24.9962665147775
新北市板橋區重慶里20鄰國慶路196巷6號十樓之2,65,6500100,6500100-080,20鄰,國慶路,,196巷,,,,6號十樓之2,121.463411003436,24.9962665147775
新北市板橋區重慶里20鄰國慶路196巷6號十一樓,65,6500100,6500100-080,20鄰,國慶路,,196巷,,,,6號十一樓,121.463411003436,24.9962665147775
新北市板橋區重慶里20鄰國慶路196巷6號十一樓之1,65,6500100,6500100-080,20鄰,國慶路,,196巷,,,,6號十一樓之1,121.463411003436,24.9962665147775
新北市板橋區重慶里20鄰國慶路196巷6號十一樓之2,65,6500100,6500100-080,20鄰,國慶路,,196巷,,,,6號十一樓之2,121.463411003436,24.9962665147775
新北市板橋區重慶里20鄰國慶路196巷6號十二樓之1,65,6500100,6500100-080,20鄰,國慶路,,196巷,,,,6號十二樓之1,121.463411003436,24.9962665147775
新北市板橋區重慶里20鄰國慶路196巷6號十二樓之2,65,6500100,6500100-080,20鄰,國慶路,,196巷,,,,6號十二樓之2,121.463411003436,24.9962665147775
新北市板橋區重慶里20鄰國慶路196巷6號十二樓,65,6500100,6500100-080,20鄰,國慶路,,196巷,,,,6號十二樓,121.463411003436,24.9962665147775
新北市板橋區重慶里32鄰國慶路197號,65,6500100,6500100-080,32鄰,國慶路,,,,,,197號,121.463158294463,24.9966757715908
新北市板橋區重慶里32鄰國慶路197號二樓之1,65,6500100,6500100-080,32鄰,國慶路,,,,,,197號二樓之1,121.463158294463,24.9966757715908
新北市板橋區重慶里32鄰國慶路197號二樓,65,6500100,6500100-080,32鄰,國慶路,,,,,,197號二樓,121.463158294463,24.9966757715908
新北市板橋區重慶里32鄰國慶路197號三樓之1,65,6500100,6500100-080,32鄰,國慶路,,,,,,197號三樓之1,121.463158294463,24.9966757715908
新北市板橋區重慶里32鄰國慶路197號三樓,65,6500100,6500100-080,32鄰,國慶路,,,,,,197號三樓,121.463158294463,24.9966757715908
新北市板橋區重慶里32鄰國慶路197號四樓之1,65,6500100,6500100-080,32鄰,國慶路,,,,,,197號四樓之1,121.463158294463,24.9966757715908
新北市板橋區重慶里32鄰國慶路197號四樓,65,6500100,6500100-080,32鄰,國慶路,,,,,,197號四樓,121.463158294463,24.9966757715908
新北市板橋區重慶里32鄰國慶路197號五樓之1,65,6500100,6500100-080,32鄰,國慶路,,,,,,197號五樓之1,121.463158294463,24.9966757715908
新北市板橋區重慶里32鄰國慶路197號五樓,65,6500100,6500100-080,32鄰,國慶路,,,,,,197號五樓,121.463158294463,24.9966757715908
新北市板橋區重慶里32鄰國慶路197號六樓之1,65,6500100,6500100-080,32鄰,國慶路,,,,,,197號六樓之1,121.463158294463,24.9966757715908
新北市板橋區重慶里32鄰國慶路197號六樓,65,6500100,6500100-080,32鄰,國慶路,,,,,,197號六樓,121.463158294463,24.9966757715908
新北市板橋區重慶里32鄰國慶路197號七樓之1,65,6500100,6500100-080,32鄰,國慶路,,,,,,197號七樓之1,121.463158294463,24.9966757715908
新北市板橋區重慶里32鄰國慶路197號七樓,65,6500100,6500100-080,32鄰,國慶路,,,,,,197號七樓,121.463158294463,24.9966757715908
新北市板橋區重慶里32鄰國慶路197號八樓,65,6500100,6500100-080,32鄰,國慶路,,,,,,197號八樓,121.463158294463,24.9966757715908
新北市板橋區重慶里32鄰國慶路197號八樓之1,65,6500100,6500100-080,32鄰,國慶路,,,,,,197號八樓之1,121.463158294463,24.9966757715908
新北市板橋區重慶里32鄰國慶路197號九樓,65,6500100,6500100-080,32鄰,國慶路,,,,,,197號九樓,121.463158294463,24.9966757715908
新北市板橋區重慶里32鄰國慶路197號九樓之1,65,6500100,6500100-080,32鄰,國慶路,,,,,,197號九樓之1,121.463158294463,24.9966757715908
新北市板橋區重慶里32鄰國慶路199號,65,6500100,6500100-080,32鄰,國慶路,,,,,,199號,121.463197833386,24.9967353663995
新北市板橋區重慶里32鄰國慶路199號二樓之1,65,6500100,6500100-080,32鄰,國慶路,,,,,,199號二樓之1,121.463197833386,24.9967353663995
新北市板橋區重慶里32鄰國慶路199號二樓之2,65,6500100,6500100-080,32鄰,國慶路,,,,,,199號二樓之2,121.463197833386,24.9967353663995
新北市板橋區重慶里32鄰國慶路199號二樓,65,6500100,6500100-080,32鄰,國慶路,,,,,,199號二樓,121.463197833386,24.9967353663995
新北市板橋區重慶里32鄰國慶路199號三樓之1,65,6500100,6500100-080,32鄰,國慶路,,,,,,199號三樓之1,121.463197833386,24.9967353663995
新北市板橋區重慶里32鄰國慶路199號三樓之2,65,6500100,6500100-080,32鄰,國慶路,,,,,,199號三樓之2,121.463197833386,24.9967353663995
新北市板橋區重慶里32鄰國慶路199號三樓,65,6500100,6500100-080,32鄰,國慶路,,,,,,199號三樓,121.463197833386,24.9967353663995
新北市板橋區重慶里32鄰國慶路199號四樓之2,65,6500100,6500100-080,32鄰,國慶路,,,,,,199號四樓之2,121.463197833386,24.9967353663995
新北市板橋區重慶里32鄰國慶路199號四樓,65,6500100,6500100-080,32鄰,國慶路,,,,,,199號四樓,121.463197833386,24.9967353663995
新北市板橋區重慶里32鄰國慶路199號四樓之1,65,6500100,6500100-080,32鄰,國慶路,,,,,,199號四樓之1,121.463197833386,24.9967353663995
新北市板橋區重慶里32鄰國慶路199號五樓,65,6500100,6500100-080,32鄰,國慶路,,,,,,199號五樓,121.463197833386,24.9967353663995
新北市板橋區重慶里32鄰國慶路199號五樓之1,65,6500100,6500100-080,32鄰,國慶路,,,,,,199號五樓之1,121.463197833386,24.9967353663995
新北市板橋區重慶里32鄰國慶路199號五樓之2,65,6500100,6500100-080,32鄰,國慶路,,,,,,199號五樓之2,121.463197833386,24.9967353663995
新北市板橋區重慶里32鄰國慶路199號六樓之1,65,6500100,6500100-080,32鄰,國慶路,,,,,,199號六樓之1,121.463197833386,24.9967353663995
新北市板橋區重慶里32鄰國慶路199號六樓之2,65,6500100,6500100-080,32鄰,國慶路,,,,,,199號六樓之2,121.463197833386,24.9967353663995
新北市板橋區重慶里32鄰國慶路199號六樓,65,6500100,6500100-080,32鄰,國慶路,,,,,,199號六樓,121.463197833386,24.9967353663995
新北市板橋區重慶里32鄰國慶路199號七樓之1,65,6500100,6500100-080,32鄰,國慶路,,,,,,199號七樓之1,121.463197833386,24.9967353663995
新北市板橋區重慶里32鄰國慶路199號七樓,65,6500100,6500100-080,32鄰,國慶路,,,,,,199號七樓,121.463197833386,24.9967353663995
新北市板橋區重慶里32鄰國慶路199號七樓之2,65,6500100,6500100-080,32鄰,國慶路,,,,,,199號七樓之2,121.463197833386,24.9967353663995
新北市板橋區重慶里32鄰國慶路199號八樓之1,65,6500100,6500100-080,32鄰,國慶路,,,,,,199號八樓之1,121.463197833386,24.9967353663995
新北市板橋區重慶里32鄰國慶路199號八樓,65,6500100,6500100-080,32鄰,國慶路,,,,,,199號八樓,121.463197833386,24.9967353663995
新北市板橋區重慶里32鄰國慶路199號八樓之2,65,6500100,6500100-080,32鄰,國慶路,,,,,,199號八樓之2,121.463197833386,24.9967353663995
新北市板橋區重慶里32鄰國慶路199號九樓,65,6500100,6500100-080,32鄰,國慶路,,,,,,199號九樓,121.463197833386,24.9967353663995
新北市板橋區重慶里32鄰國慶路199號九樓之1,65,6500100,6500100-080,32鄰,國慶路,,,,,,199號九樓之1,121.463197833386,24.9967353663995
新北市板橋區重慶里32鄰國慶路199號九樓之2,65,6500100,6500100-080,32鄰,國慶路,,,,,,199號九樓之2,121.463197833386,24.9967353663995
新北市板橋區重慶里34鄰國慶路201號,65,6500100,6500100-080,34鄰,國慶路,,,,,,201號,121.463329957929,24.9969255492196
新北市板橋區重慶里34鄰國慶路201號二樓之3,65,6500100,6500100-080,34鄰,國慶路,,,,,,201號二樓之3,121.463329957929,24.9969255492196
新北市板橋區重慶里34鄰國慶路201號二樓之2,65,6500100,6500100-080,34鄰,國慶路,,,,,,201號二樓之2,121.463329957929,24.9969255492196
新北市板橋區重慶里34鄰國慶路201號二樓之1,65,6500100,6500100-080,34鄰,國慶路,,,,,,201號二樓之1,121.463329957929,24.9969255492196
新北市板橋區重慶里34鄰國慶路201號二樓,65,6500100,6500100-080,34鄰,國慶路,,,,,,201號二樓,121.463329957929,24.9969255492196
新北市板橋區重慶里34鄰國慶路201號三樓之3,65,6500100,6500100-080,34鄰,國慶路,,,,,,201號三樓之3,121.463329957929,24.9969255492196
新北市板橋區重慶里34鄰國慶路201號三樓之2,65,6500100,6500100-080,34鄰,國慶路,,,,,,201號三樓之2,121.463329957929,24.9969255492196
新北市板橋區重慶里34鄰國慶路201號三樓之1,65,6500100,6500100-080,34鄰,國慶路,,,,,,201號三樓之1,121.463329957929,24.9969255492196
新北市板橋區重慶里34鄰國慶路201號三樓,65,6500100,6500100-080,34鄰,國慶路,,,,,,201號三樓,121.463329957929,24.9969255492196
新北市板橋區重慶里34鄰國慶路201號四樓,65,6500100,6500100-080,34鄰,國慶路,,,,,,201號四樓,121.463329957929,24.9969255492196
新北市板橋區重慶里34鄰國慶路201號四樓之1,65,6500100,6500100-080,34鄰,國慶路,,,,,,201號四樓之1,121.463329957929,24.9969255492196
新北市板橋區重慶里34鄰國慶路201號四樓之2,65,6500100,6500100-080,34鄰,國慶路,,,,,,201號四樓之2,121.463329957929,24.9969255492196
新北市板橋區重慶里34鄰國慶路201號四樓之3,65,6500100,6500100-080,34鄰,國慶路,,,,,,201號四樓之3,121.463329957929,24.9969255492196
新北市板橋區重慶里34鄰國慶路201號五樓,65,6500100,6500100-080,34鄰,國慶路,,,,,,201號五樓,121.463329957929,24.9969255492196
新北市板橋區重慶里34鄰國慶路201號五樓之1,65,6500100,6500100-080,34鄰,國慶路,,,,,,201號五樓之1,121.463329957929,24.9969255492196
新北市板橋區重慶里34鄰國慶路201號五樓之3,65,6500100,6500100-080,34鄰,國慶路,,,,,,201號五樓之3,121.463329957929,24.9969255492196
新北市板橋區重慶里34鄰國慶路201號五樓之2,65,6500100,6500100-080,34鄰,國慶路,,,,,,201號五樓之2,121.463329957929,24.9969255492196
新北市板橋區重慶里34鄰國慶路201號六樓之1,65,6500100,6500100-080,34鄰,國慶路,,,,,,201號六樓之1,121.463329957929,24.9969255492196
新北市板橋區重慶里34鄰國慶路201號六樓之3,65,6500100,6500100-080,34鄰,國慶路,,,,,,201號六樓之3,121.463329957929,24.9969255492196
新北市板橋區重慶里34鄰國慶路201號六樓,65,6500100,6500100-080,34鄰,國慶路,,,,,,201號六樓,121.463329957929,24.9969255492196
新北市板橋區重慶里34鄰國慶路201號六樓之2,65,6500100,6500100-080,34鄰,國慶路,,,,,,201號六樓之2,121.463329957929,24.9969255492196
新北市板橋區重慶里34鄰國慶路201號七樓之3,65,6500100,6500100-080,34鄰,國慶路,,,,,,201號七樓之3,121.463329957929,24.9969255492196
新北市板橋區重慶里34鄰國慶路201號七樓之2,65,6500100,6500100-080,34鄰,國慶路,,,,,,201號七樓之2,121.463329957929,24.9969255492196
新北市板橋區重慶里34鄰國慶路201號七樓之1,65,6500100,6500100-080,34鄰,國慶路,,,,,,201號七樓之1,121.463329957929,24.9969255492196
新北市板橋區重慶里34鄰國慶路201號七樓,65,6500100,6500100-080,34鄰,國慶路,,,,,,201號七樓,121.463329957929,24.9969255492196
新北市板橋區重慶里34鄰國慶路203號,65,6500100,6500100-080,34鄰,國慶路,,,,,,203號,121.463355306254,24.9969751560452
新北市板橋區重慶里34鄰國慶路205號,65,6500100,6500100-080,34鄰,國慶路,,,,,,205號,121.463383585447,24.9970299223789
新北市板橋區重慶里34鄰國慶路206號,65,6500100,6500100-080,34鄰,國慶路,,,,,,206號,121.463587997599,24.9969591437101
新北市板橋區重慶里34鄰國慶路206號二樓之1,65,6500100,6500100-080,34鄰,國慶路,,,,,,206號二樓之1,121.463587997599,24.9969591437101
新北市板橋區重慶里34鄰國慶路206號二樓,65,6500100,6500100-080,34鄰,國慶路,,,,,,206號二樓,121.463587997599,24.9969591437101
新北市板橋區重慶里34鄰國慶路206號二樓之2,65,6500100,6500100-080,34鄰,國慶路,,,,,,206號二樓之2,121.463587997599,24.9969591437101
新北市板橋區重慶里34鄰國慶路206號三樓之2,65,6500100,6500100-080,34鄰,國慶路,,,,,,206號三樓之2,121.463587997599,24.9969591437101
新北市板橋區重慶里34鄰國慶路206號三樓之3,65,6500100,6500100-080,34鄰,國慶路,,,,,,206號三樓之3,121.463587997599,24.9969591437101
新北市板橋區重慶里34鄰國慶路206號三樓之1,65,6500100,6500100-080,34鄰,國慶路,,,,,,206號三樓之1,121.463587997599,24.9969591437101
新北市板橋區重慶里34鄰國慶路206號三樓,65,6500100,6500100-080,34鄰,國慶路,,,,,,206號三樓,121.463587997599,24.9969591437101
新北市板橋區重慶里34鄰國慶路206號四樓之2,65,6500100,6500100-080,34鄰,國慶路,,,,,,206號四樓之2,121.463587997599,24.9969591437101
新北市板橋區重慶里34鄰國慶路206號四樓之3,65,6500100,6500100-080,34鄰,國慶路,,,,,,206號四樓之3,121.463587997599,24.9969591437101
新北市板橋區重慶里34鄰國慶路206號四樓,65,6500100,6500100-080,34鄰,國慶路,,,,,,206號四樓,121.463587997599,24.9969591437101
新北市板橋區重慶里34鄰國慶路206號四樓之1,65,6500100,6500100-080,34鄰,國慶路,,,,,,206號四樓之1,121.463587997599,24.9969591437101
新北市板橋區重慶里34鄰國慶路206號五樓,65,6500100,6500100-080,34鄰,國慶路,,,,,,206號五樓,121.463587997599,24.9969591437101
新北市板橋區重慶里34鄰國慶路206號五樓之3,65,6500100,6500100-080,34鄰,國慶路,,,,,,206號五樓之3,121.463587997599,24.9969591437101
新北市板橋區重慶里34鄰國慶路206號五樓之2,65,6500100,6500100-080,34鄰,國慶路,,,,,,206號五樓之2,121.463587997599,24.9969591437101
新北市板橋區重慶里34鄰國慶路206號五樓之1,65,6500100,6500100-080,34鄰,國慶路,,,,,,206號五樓之1,121.463587997599,24.9969591437101
新北市板橋區重慶里34鄰國慶路206號六樓之2,65,6500100,6500100-080,34鄰,國慶路,,,,,,206號六樓之2,121.463587997599,24.9969591437101
新北市板橋區重慶里34鄰國慶路206號六樓,65,6500100,6500100-080,34鄰,國慶路,,,,,,206號六樓,121.463587997599,24.9969591437101
新北市板橋區重慶里34鄰國慶路206號六樓之3,65,6500100,6500100-080,34鄰,國慶路,,,,,,206號六樓之3,121.463587997599,24.9969591437101
新北市板橋區重慶里34鄰國慶路206號六樓之1,65,6500100,6500100-080,34鄰,國慶路,,,,,,206號六樓之1,121.463587997599,24.9969591437101
新北市板橋區重慶里34鄰國慶路206號七樓,65,6500100,6500100-080,34鄰,國慶路,,,,,,206號七樓,121.463587997599,24.9969591437101
新北市板橋區重慶里34鄰國慶路206號七樓之2,65,6500100,6500100-080,34鄰,國慶路,,,,,,206號七樓之2,121.463587997599,24.9969591437101
新北市板橋區重慶里34鄰國慶路206號七樓之1,65,6500100,6500100-080,34鄰,國慶路,,,,,,206號七樓之1,121.463587997599,24.9969591437101
新北市板橋區重慶里34鄰國慶路206號七樓之3,65,6500100,6500100-080,34鄰,國慶路,,,,,,206號七樓之3,121.463587997599,24.9969591437101
新北市板橋區重慶里34鄰國慶路206號八樓之2,65,6500100,6500100-080,34鄰,國慶路,,,,,,206號八樓之2,121.463587997599,24.9969591437101
新北市板橋區重慶里34鄰國慶路206號八樓之3,65,6500100,6500100-080,34鄰,國慶路,,,,,,206號八樓之3,121.463587997599,24.9969591437101
新北市板橋區重慶里34鄰國慶路206號八樓之1,65,6500100,6500100-080,34鄰,國慶路,,,,,,206號八樓之1,121.463587997599,24.9969591437101
新北市板橋區重慶里34鄰國慶路206號八樓,65,6500100,6500100-080,34鄰,國慶路,,,,,,206號八樓,121.463587997599,24.9969591437101
新北市板橋區重慶里34鄰國慶路206號九樓之2,65,6500100,6500100-080,34鄰,國慶路,,,,,,206號九樓之2,121.463587997599,24.9969591437101
新北市板橋區重慶里34鄰國慶路206號九樓之3,65,6500100,6500100-080,34鄰,國慶路,,,,,,206號九樓之3,121.463587997599,24.9969591437101
新北市板橋區重慶里34鄰國慶路206號九樓之1,65,6500100,6500100-080,34鄰,國慶路,,,,,,206號九樓之1,121.463587997599,24.9969591437101
新北市板橋區重慶里34鄰國慶路206號九樓,65,6500100,6500100-080,34鄰,國慶路,,,,,,206號九樓,121.463587997599,24.9969591437101
新北市板橋區重慶里34鄰國慶路206號十樓之3,65,6500100,6500100-080,34鄰,國慶路,,,,,,206號十樓之3,121.463587997599,24.9969591437101
新北市板橋區重慶里34鄰國慶路206號十樓之2,65,6500100,6500100-080,34鄰,國慶路,,,,,,206號十樓之2,121.463587997599,24.9969591437101
新北市板橋區重慶里34鄰國慶路206號十樓,65,6500100,6500100-080,34鄰,國慶路,,,,,,206號十樓,121.463587997599,24.9969591437101
新北市板橋區重慶里34鄰國慶路206號十樓之1,65,6500100,6500100-080,34鄰,國慶路,,,,,,206號十樓之1,121.463587997599,24.9969591437101
新北市板橋區重慶里34鄰國慶路206號十一樓之1,65,6500100,6500100-080,34鄰,國慶路,,,,,,206號十一樓之1,121.463587997599,24.9969591437101
新北市板橋區重慶里34鄰國慶路206號十一樓之3,65,6500100,6500100-080,34鄰,國慶路,,,,,,206號十一樓之3,121.463587997599,24.9969591437101
新北市板橋區重慶里34鄰國慶路206號十一樓,65,6500100,6500100-080,34鄰,國慶路,,,,,,206號十一樓,121.463587997599,24.9969591437101
新北市板橋區重慶里34鄰國慶路206號十一樓之2,65,6500100,6500100-080,34鄰,國慶路,,,,,,206號十一樓之2,121.463587997599,24.9969591437101
新北市板橋區重慶里34鄰國慶路207號,65,6500100,6500100-080,34鄰,國慶路,,,,,,207號,121.463401865959,24.9970896691073
新北市板橋區重慶里34鄰國慶路208號,65,6500100,6500100-080,34鄰,國慶路,,,,,,208號,121.463596754232,24.9970083480742
新北市板橋區重慶里34鄰國慶路208號地下室,65,6500100,6500100-080,34鄰,國慶路,,,,,,208號地下室,121.463596754232,24.9970083480742
新北市板橋區重慶里34鄰國慶路209號,65,6500100,6500100-080,34鄰,國慶路,,,,,,209號,121.463420474275,24.9971491204926
新北市板橋區重慶里34鄰國慶路210號,65,6500100,6500100-080,34鄰,國慶路,,,,,,210號,121.463615658292,24.9970660714196
新北市板橋區重慶里34鄰國慶路211號,65,6500100,6500100-080,34鄰,國慶路,,,,,,211號,121.46343377004,24.9972099607092
新北市板橋區重慶里34鄰國慶路211號二樓之1,65,6500100,6500100-080,34鄰,國慶路,,,,,,211號二樓之1,121.46343377004,24.9972099607092
新北市板橋區重慶里34鄰國慶路211號二樓,65,6500100,6500100-080,34鄰,國慶路,,,,,,211號二樓,121.46343377004,24.9972099607092
新北市板橋區重慶里34鄰國慶路211號三樓,65,6500100,6500100-080,34鄰,國慶路,,,,,,211號三樓,121.46343377004,24.9972099607092
新北市板橋區重慶里34鄰國慶路211號三樓之1,65,6500100,6500100-080,34鄰,國慶路,,,,,,211號三樓之1,121.46343377004,24.9972099607092
新北市板橋區重慶里34鄰國慶路211號四樓之1,65,6500100,6500100-080,34鄰,國慶路,,,,,,211號四樓之1,121.46343377004,24.9972099607092
新北市板橋區重慶里34鄰國慶路211號四樓,65,6500100,6500100-080,34鄰,國慶路,,,,,,211號四樓,121.46343377004,24.9972099607092
新北市板橋區重慶里34鄰國慶路211號五樓,65,6500100,6500100-080,34鄰,國慶路,,,,,,211號五樓,121.46343377004,24.9972099607092
新北市板橋區重慶里34鄰國慶路211號五樓之1,65,6500100,6500100-080,34鄰,國慶路,,,,,,211號五樓之1,121.46343377004,24.9972099607092
新北市板橋區重慶里34鄰國慶路211號六樓之1,65,6500100,6500100-080,34鄰,國慶路,,,,,,211號六樓之1,121.46343377004,24.9972099607092
新北市板橋區重慶里34鄰國慶路211號六樓,65,6500100,6500100-080,34鄰,國慶路,,,,,,211號六樓,121.46343377004,24.9972099607092
新北市板橋區重慶里34鄰國慶路211號七樓之1,65,6500100,6500100-080,34鄰,國慶路,,,,,,211號七樓之1,121.46343377004,24.9972099607092
新北市板橋區重慶里34鄰國慶路211號七樓,65,6500100,6500100-080,34鄰,國慶路,,,,,,211號七樓,121.46343377004,24.9972099607092
新北市板橋區重慶里34鄰國慶路212號,65,6500100,6500100-080,34鄰,國慶路,,,,,,212號,121.463639009974,24.9971424376659
新北市板橋區重慶里34鄰國慶路213巷1號,65,6500100,6500100-080,34鄰,國慶路,,213巷,,,,1號,121.463310399091,24.9972316045545
新北市板橋區重慶里34鄰國慶路213巷1號二樓,65,6500100,6500100-080,34鄰,國慶路,,213巷,,,,1號二樓,121.463310399091,24.9972316045545
新北市板橋區重慶里34鄰國慶路213巷1號三樓,65,6500100,6500100-080,34鄰,國慶路,,213巷,,,,1號三樓,121.463310399091,24.9972316045545
新北市板橋區重慶里34鄰國慶路213巷1號四樓,65,6500100,6500100-080,34鄰,國慶路,,213巷,,,,1號四樓,121.463310399091,24.9972316045545
新北市板橋區重慶里34鄰國慶路213巷1號五樓,65,6500100,6500100-080,34鄰,國慶路,,213巷,,,,1號五樓,121.463310399091,24.9972316045545
新北市板橋區重慶里34鄰國慶路213巷1號六樓,65,6500100,6500100-080,34鄰,國慶路,,213巷,,,,1號六樓,121.463310399091,24.9972316045545
新北市板橋區重慶里34鄰國慶路213巷1號七樓,65,6500100,6500100-080,34鄰,國慶路,,213巷,,,,1號七樓,121.463310399091,24.9972316045545
新北市板橋區重慶里35鄰國慶路213巷3號,65,6500100,6500100-080,35鄰,國慶路,,213巷,,,,3號,121.46322777335,24.9972151408747
新北市板橋區重慶里35鄰國慶路213巷3號二樓,65,6500100,6500100-080,35鄰,國慶路,,213巷,,,,3號二樓,121.46322777335,24.9972151408747
新北市板橋區重慶里35鄰國慶路213巷3號三樓,65,6500100,6500100-080,35鄰,國慶路,,213巷,,,,3號三樓,121.46322777335,24.9972151408747
新北市板橋區重慶里35鄰國慶路213巷3號四樓,65,6500100,6500100-080,35鄰,國慶路,,213巷,,,,3號四樓,121.46322777335,24.9972151408747
新北市板橋區重慶里35鄰國慶路213巷3號五樓,65,6500100,6500100-080,35鄰,國慶路,,213巷,,,,3號五樓,121.46322777335,24.9972151408747
新北市板橋區重慶里35鄰國慶路213巷3號六樓,65,6500100,6500100-080,35鄰,國慶路,,213巷,,,,3號六樓,121.46322777335,24.9972151408747
新北市板橋區重慶里35鄰國慶路213巷3號七樓,65,6500100,6500100-080,35鄰,國慶路,,213巷,,,,3號七樓,121.46322777335,24.9972151408747
新北市板橋區重慶里35鄰國慶路213巷3號八樓,65,6500100,6500100-080,35鄰,國慶路,,213巷,,,,3號八樓,121.46322777335,24.9972151408747
新北市板橋區重慶里35鄰國慶路213巷3號九樓,65,6500100,6500100-080,35鄰,國慶路,,213巷,,,,3號九樓,121.46322777335,24.9972151408747
新北市板橋區重慶里35鄰國慶路213巷3號十樓,65,6500100,6500100-080,35鄰,國慶路,,213巷,,,,3號十樓,121.46322777335,24.9972151408747
新北市板橋區重慶里35鄰國慶路213巷3號十一樓,65,6500100,6500100-080,35鄰,國慶路,,213巷,,,,3號十一樓,121.46322777335,24.9972151408747
新北市板橋區重慶里35鄰國慶路213巷3號十二樓,65,6500100,6500100-080,35鄰,國慶路,,213巷,,,,3號十二樓,121.46322777335,24.9972151408747
新北市板橋區重慶里35鄰國慶路213巷3號十三樓,65,6500100,6500100-080,35鄰,國慶路,,213巷,,,,3號十三樓,121.46322777335,24.9972151408747
新北市板橋區重慶里35鄰國慶路213巷3號十四樓,65,6500100,6500100-080,35鄰,國慶路,,213巷,,,,3號十四樓,121.46322777335,24.9972151408747
新北市板橋區重慶里35鄰國慶路213巷3號十五樓,65,6500100,6500100-080,35鄰,國慶路,,213巷,,,,3號十五樓,121.46322777335,24.9972151408747
新北市板橋區重慶里35鄰國慶路213巷5號二樓,65,6500100,6500100-080,35鄰,國慶路,,213巷,,,,5號二樓,121.463170052073,24.9971997939715
新北市板橋區重慶里35鄰國慶路213巷5號三樓,65,6500100,6500100-080,35鄰,國慶路,,213巷,,,,5號三樓,121.463170052073,24.9971997939715
新北市板橋區重慶里35鄰國慶路213巷5號四樓,65,6500100,6500100-080,35鄰,國慶路,,213巷,,,,5號四樓,121.463170052073,24.9971997939715
新北市板橋區重慶里35鄰國慶路213巷5號五樓,65,6500100,6500100-080,35鄰,國慶路,,213巷,,,,5號五樓,121.463170052073,24.9971997939715
新北市板橋區重慶里35鄰國慶路213巷5號六樓,65,6500100,6500100-080,35鄰,國慶路,,213巷,,,,5號六樓,121.463170052073,24.9971997939715
