FULL_ADDR,COUNTY,TOWN,VILLAGE,NEIGHBORHOOD,ROAD,SECTION,LANE,ALLEY,SUB_ALLEY,TONG,NUMBER,X,Y
新北市萬里區龜吼里9鄰翡翠路1之1號,65,6502800,6502800-002,9鄰,翡翠路,,,,,,1之1號,121.684921979224,25.188330019327
新北市萬里區龜吼里9鄰翡翠路17號,65,6502800,6502800-002,9鄰,翡翠路,,,,,,17號,121.683930178208,25.1885015466158
新北市萬里區龜吼里9鄰翡翠路17號十五樓,65,6502800,6502800-002,9鄰,翡翠路,,,,,,17號十五樓,121.683930178208,25.1885015466158
新北市萬里區龜吼里9鄰翡翠路17號十六樓,65,6502800,6502800-002,9鄰,翡翠路,,,,,,17號十六樓,121.683924813412,25.1885063974655
新北市萬里區龜吼里9鄰翡翠路17號十七樓,65,6502800,6502800-002,9鄰,翡翠路,,,,,,17號十七樓,121.68393285984,25.1885063972822
新北市萬里區龜吼里9鄰翡翠路17號十八樓,65,6502800,6502800-002,9鄰,翡翠路,,,,,,17號十八樓,121.683924812761,25.1885039708119
新北市萬里區龜吼里9鄰翡翠路18號,65,6502800,6502800-002,9鄰,翡翠路,,,,,,18號,121.683930178208,25.1885015466158
