FULL_ADDR,COUNTY,TOWN,VILLAGE,NEIGHBORHOOD,ROAD,SECTION,LANE,ALLEY,SUB_ALLEY,TONG,NUMBER,X,Y
臺中市梧棲區草湳里13鄰南環路2號,66,6601400,草湳里,13鄰,南環路,,,,,,2號,120.510071338104,24.231042283219
臺中市梧棲區草湳里13鄰南環路12號,66,6601400,草湳里,13鄰,南環路,,,,,,12號,120.507864851176,24.231446278393
臺中市梧棲區草湳里13鄰南環路22號,66,6601400,草湳里,13鄰,南環路,,,,,,22號,120.503834831639,24.232277876163
臺中市潭子區潭秀里5鄰南環路2號,66,6601700,潭秀里,5鄰,南環路,,,,,,2號,120.704432216605,24.216422735522
臺中市潭子區潭秀里5鄰南環路5號,66,6601700,潭秀里,5鄰,南環路,,,,,,5號,120.704469531788,24.216606751655
臺中市潭子區潭秀里5鄰南環路6號,66,6601700,潭秀里,5鄰,南環路,,,,,,6號,120.704546032985,24.216513402275
