FULL_ADDR,COUNTY,TOWN,VILLAGE,NEIGHBORHOOD,ROAD,SECTION,LANE,ALLEY,SUB_ALLEY,TONG,NUMBER,X,Y
臺中市南屯區大誠里6鄰大墩三街35號,66,6600700,大誠里,6鄰,大墩三街,,,,,,35號,120.652690011241,24.139369435991
臺中市南屯區大誠里5鄰大墩三街109號二樓之1,66,6600700,大誠里,5鄰,大墩三街,,,,,,109號二樓之1,120.650403509567,24.139257626346
臺中市南屯區大誠里5鄰大墩三街109號二樓之2,66,6600700,大誠里,5鄰,大墩三街,,,,,,109號二樓之2,120.650403509567,24.139257626346
臺中市南屯區大誠里5鄰大墩三街109號二樓之3,66,6600700,大誠里,5鄰,大墩三街,,,,,,109號二樓之3,120.650403509567,24.139257626346
臺中市南屯區大誠里5鄰大墩三街109號二樓之5,66,6600700,大誠里,5鄰,大墩三街,,,,,,109號二樓之5,120.650403509567,24.139257626346
臺中市南屯區大誠里5鄰大墩三街109號二樓之6,66,6600700,大誠里,5鄰,大墩三街,,,,,,109號二樓之6,120.650403509567,24.139257626346
臺中市南屯區大誠里5鄰大墩三街109號三樓之1,66,6600700,大誠里,5鄰,大墩三街,,,,,,109號三樓之1,120.650403509567,24.139257626346
臺中市南屯區大誠里5鄰大墩三街109號三樓之2,66,6600700,大誠里,5鄰,大墩三街,,,,,,109號三樓之2,120.650403509567,24.139257626346
臺中市南屯區大誠里5鄰大墩三街109號三樓之3,66,6600700,大誠里,5鄰,大墩三街,,,,,,109號三樓之3,120.650403509567,24.139257626346
臺中市南屯區大誠里5鄰大墩三街109號三樓之5,66,6600700,大誠里,5鄰,大墩三街,,,,,,109號三樓之5,120.650403509567,24.139257626346
臺中市南屯區大誠里5鄰大墩三街109號三樓之6,66,6600700,大誠里,5鄰,大墩三街,,,,,,109號三樓之6,120.650403509567,24.139257626346
臺中市南屯區大誠里5鄰大墩三街109號四樓之1,66,6600700,大誠里,5鄰,大墩三街,,,,,,109號四樓之1,120.650403509567,24.139257626346
臺中市南屯區大誠里5鄰大墩三街109號四樓之2,66,6600700,大誠里,5鄰,大墩三街,,,,,,109號四樓之2,120.650403509567,24.139257626346
臺中市南屯區大誠里5鄰大墩三街109號四樓之3,66,6600700,大誠里,5鄰,大墩三街,,,,,,109號四樓之3,120.650403509567,24.139257626346
臺中市南屯區大誠里5鄰大墩三街109號四樓之5,66,6600700,大誠里,5鄰,大墩三街,,,,,,109號四樓之5,120.650403509567,24.139257626346
臺中市南屯區大誠里5鄰大墩三街109號四樓之6,66,6600700,大誠里,5鄰,大墩三街,,,,,,109號四樓之6,120.650403509567,24.139257626346
臺中市南屯區大誠里5鄰大墩三街109號五樓之1,66,6600700,大誠里,5鄰,大墩三街,,,,,,109號五樓之1,120.650403509567,24.139257626346
臺中市南屯區大誠里5鄰大墩三街109號五樓之2,66,6600700,大誠里,5鄰,大墩三街,,,,,,109號五樓之2,120.650403509567,24.139257626346
臺中市南屯區大誠里5鄰大墩三街109號五樓之3,66,6600700,大誠里,5鄰,大墩三街,,,,,,109號五樓之3,120.650403509567,24.139257626346
臺中市南屯區大誠里5鄰大墩三街109號五樓之5,66,6600700,大誠里,5鄰,大墩三街,,,,,,109號五樓之5,120.650403509567,24.139257626346
臺中市南屯區大誠里5鄰大墩三街109號五樓之6,66,6600700,大誠里,5鄰,大墩三街,,,,,,109號五樓之6,120.650403509567,24.139257626346
臺中市南屯區大誠里7鄰大墩三街1號,66,6600700,大誠里,7鄰,大墩三街,,,,,,1號,120.65356495049,24.13938082341
臺中市南屯區大誠里4鄰大墩三街2號,66,6600700,大誠里,4鄰,大墩三街,,,,,,2號,120.653878791397,24.13961187278
臺中市南屯區大誠里7鄰大墩三街3號,66,6600700,大誠里,7鄰,大墩三街,,,,,,3號,120.65349238537,24.139362600122
臺中市南屯區大誠里7鄰大墩三街5號,66,6600700,大誠里,7鄰,大墩三街,,,,,,5號,120.653451069856,24.13932251556
臺中市南屯區大誠里4鄰大墩三街6號,66,6600700,大誠里,4鄰,大墩三街,,,,,,6號,120.653686920245,24.139613694984
臺中市南屯區大誠里7鄰大墩三街7號,66,6600700,大誠里,7鄰,大墩三街,,,,,,7號,120.653406302941,24.139321772855
臺中市南屯區大誠里4鄰大墩三街10號,66,6600700,大誠里,4鄰,大墩三街,,,,,,10號,120.653612604938,24.139624180965
臺中市南屯區大誠里7鄰大墩三街11號,66,6600700,大誠里,7鄰,大墩三街,,,,,,11號,120.653310816863,24.139411307322
臺中市南屯區大誠里7鄰大墩三街11之1號二樓,66,6600700,大誠里,7鄰,大墩三街,,,,,,11之1號二樓,120.653310816863,24.139411307322
臺中市南屯區大誠里7鄰大墩三街11之1號三樓,66,6600700,大誠里,7鄰,大墩三街,,,,,,11之1號三樓,120.653310816863,24.139411307322
臺中市南屯區大誠里7鄰大墩三街11號三樓,66,6600700,大誠里,7鄰,大墩三街,,,,,,11號三樓,120.653310816863,24.139411307322
臺中市南屯區大誠里7鄰大墩三街11之1號四樓,66,6600700,大誠里,7鄰,大墩三街,,,,,,11之1號四樓,120.653310816863,24.139411307322
臺中市南屯區大誠里7鄰大墩三街11號四樓,66,6600700,大誠里,7鄰,大墩三街,,,,,,11號四樓,120.653310816863,24.139411307322
臺中市南屯區大誠里7鄰大墩三街11號五樓,66,6600700,大誠里,7鄰,大墩三街,,,,,,11號五樓,120.653310816863,24.139411307322
臺中市南屯區大誠里7鄰大墩三街11之1號五樓,66,6600700,大誠里,7鄰,大墩三街,,,,,,11之1號五樓,120.653310816863,24.139411307322
臺中市南屯區大誠里7鄰大墩三街11號六樓,66,6600700,大誠里,7鄰,大墩三街,,,,,,11號六樓,120.653310816863,24.139411307322
臺中市南屯區大誠里7鄰大墩三街11之1號六樓,66,6600700,大誠里,7鄰,大墩三街,,,,,,11之1號六樓,120.653310816863,24.139411307322
臺中市南屯區大誠里7鄰大墩三街11之1號七樓,66,6600700,大誠里,7鄰,大墩三街,,,,,,11之1號七樓,120.653310816863,24.139411307322
臺中市南屯區大誠里7鄰大墩三街11號七樓,66,6600700,大誠里,7鄰,大墩三街,,,,,,11號七樓,120.653310816863,24.139411307322
臺中市南屯區大誠里7鄰大墩三街11號八樓,66,6600700,大誠里,7鄰,大墩三街,,,,,,11號八樓,120.653310816863,24.139411307322
臺中市南屯區大誠里7鄰大墩三街11之1號八樓,66,6600700,大誠里,7鄰,大墩三街,,,,,,11之1號八樓,120.653310816863,24.139411307322
臺中市南屯區大誠里7鄰大墩三街11之1號九樓,66,6600700,大誠里,7鄰,大墩三街,,,,,,11之1號九樓,120.653310816863,24.139411307322
臺中市南屯區大誠里7鄰大墩三街11號九樓,66,6600700,大誠里,7鄰,大墩三街,,,,,,11號九樓,120.653310816863,24.139411307322
臺中市南屯區大誠里7鄰大墩三街11之1號十樓,66,6600700,大誠里,7鄰,大墩三街,,,,,,11之1號十樓,120.653310816863,24.139411307322
臺中市南屯區大誠里7鄰大墩三街11號十樓,66,6600700,大誠里,7鄰,大墩三街,,,,,,11號十樓,120.653310816863,24.139411307322
臺中市南屯區大誠里7鄰大墩三街11號十一樓,66,6600700,大誠里,7鄰,大墩三街,,,,,,11號十一樓,120.653310816863,24.139411307322
臺中市南屯區大誠里7鄰大墩三街11之1號十一樓,66,6600700,大誠里,7鄰,大墩三街,,,,,,11之1號十一樓,120.653310816863,24.139411307322
臺中市南屯區大誠里7鄰大墩三街11之1號十二樓,66,6600700,大誠里,7鄰,大墩三街,,,,,,11之1號十二樓,120.653310816863,24.139411307322
臺中市南屯區大誠里7鄰大墩三街11號十二樓,66,6600700,大誠里,7鄰,大墩三街,,,,,,11號十二樓,120.653310816863,24.139411307322
臺中市南屯區大誠里7鄰大墩三街11之1號十三樓,66,6600700,大誠里,7鄰,大墩三街,,,,,,11之1號十三樓,120.653310816863,24.139411307322
臺中市南屯區大誠里7鄰大墩三街11號十三樓,66,6600700,大誠里,7鄰,大墩三街,,,,,,11號十三樓,120.653310816863,24.139411307322
臺中市南屯區大誠里7鄰大墩三街11之1號十四樓,66,6600700,大誠里,7鄰,大墩三街,,,,,,11之1號十四樓,120.653310816863,24.139411307322
臺中市南屯區大誠里7鄰大墩三街11號十四樓,66,6600700,大誠里,7鄰,大墩三街,,,,,,11號十四樓,120.653310816863,24.139411307322
臺中市南屯區大誠里4鄰大墩三街12號,66,6600700,大誠里,4鄰,大墩三街,,,,,,12號,120.653565497168,24.139615758087
臺中市南屯區大誠里4鄰大墩三街16號,66,6600700,大誠里,4鄰,大墩三街,,,,,,16號,120.653522502886,24.139614766617
臺中市南屯區大誠里4鄰大墩三街18號,66,6600700,大誠里,4鄰,大墩三街,,,,,,18號,120.653479507645,24.139613766103
臺中市南屯區大誠里4鄰大墩三街20號,66,6600700,大誠里,4鄰,大墩三街,,,,,,20號,120.653435921088,24.139612755206
臺中市南屯區大誠里4鄰大墩三街22號,66,6600700,大誠里,4鄰,大墩三街,,,,,,22號,120.653390663798,24.139611749532
臺中市南屯區大誠里4鄰大墩三街26號,66,6600700,大誠里,4鄰,大墩三街,,,,,,26號,120.653345316601,24.139607231243
臺中市南屯區大誠里3鄰大墩三街28號,66,6600700,大誠里,3鄰,大墩三街,,,,,,28號,120.652649006232,24.139636971227
臺中市南屯區大誠里3鄰大墩三街30號,66,6600700,大誠里,3鄰,大墩三街,,,,,,30號,120.652601190459,24.139636058821
臺中市南屯區大誠里3鄰大墩三街32號,66,6600700,大誠里,3鄰,大墩三街,,,,,,32號,120.652552488192,24.139635135353
臺中市南屯區大誠里3鄰大墩三街36號,66,6600700,大誠里,3鄰,大墩三街,,,,,,36號,120.652503392599,24.139634120681
臺中市南屯區大誠里6鄰大墩三街37號,66,6600700,大誠里,6鄰,大墩三街,,,,,,37號,120.652639639612,24.139316698615
臺中市南屯區大誠里3鄰大墩三街38號,66,6600700,大誠里,3鄰,大墩三街,,,,,,38號,120.652454297031,24.139633096963
臺中市南屯區大誠里6鄰大墩三街39號,66,6600700,大誠里,6鄰,大墩三街,,,,,,39號,120.652595104357,24.139303053325
臺中市南屯區大誠里3鄰大墩三街40號,66,6600700,大誠里,3鄰,大墩三街,,,,,,40號,120.652405299832,24.139632082484
臺中市南屯區大誠里6鄰大墩三街41號,66,6600700,大誠里,6鄰,大墩三街,,,,,,41號,120.65254964212,24.139304746698
臺中市南屯區大誠里3鄰大墩三街42號,66,6600700,大誠里,3鄰,大墩三街,,,,,,42號,120.652356007456,24.139631067316
臺中市南屯區大誠里6鄰大墩三街43號,66,6600700,大誠里,6鄰,大墩三街,,,,,,43號,120.652505467723,24.139303210499
臺中市南屯區大誠里6鄰大墩三街45號,66,6600700,大誠里,6鄰,大墩三街,,,,,,45號,120.652461291398,24.139302387597
臺中市南屯區大誠里3鄰大墩三街46號,66,6600700,大誠里,3鄰,大墩三街,,,,,,46號,120.652300027549,24.139629224265
臺中市南屯區大誠里6鄰大墩三街47號,66,6600700,大誠里,6鄰,大墩三街,,,,,,47號,120.652415146246,24.139301921373
臺中市南屯區大誠里3鄰大墩三街48號,66,6600700,大誠里,3鄰,大墩三街,,,,,,48號,120.652239124062,24.139628462523
臺中市南屯區大誠里6鄰大墩三街49號,66,6600700,大誠里,6鄰,大墩三街,,,,,,49號,120.652369886897,24.139301357829
臺中市南屯區大誠里3鄰大墩三街50號,66,6600700,大誠里,3鄰,大墩三街,,,,,,50號,120.652157167946,24.139626018488
臺中市南屯區大誠里6鄰大墩三街51號,66,6600700,大誠里,6鄰,大墩三街,,,,,,51號,120.652323349623,24.139300719126
臺中市南屯區大誠里3鄰大墩三街62號,66,6600700,大誠里,3鄰,大墩三街,,,,,,62號,120.651869964145,24.139624280327
臺中市南屯區大誠里6鄰大墩三街65號,66,6600700,大誠里,6鄰,大墩三街,,,,,,65號,120.651659498024,24.139298745385
臺中市南屯區大誠里3鄰大墩三街66號,66,6600700,大誠里,3鄰,大墩三街,,,,,,66號,120.651822640368,24.139622998597
臺中市南屯區大誠里3鄰大墩三街68號,66,6600700,大誠里,3鄰,大墩三街,,,,,,68號,120.651775414986,24.139621717077
臺中市南屯區大誠里3鄰大墩三街70號,66,6600700,大誠里,3鄰,大墩三街,,,,,,70號,120.651730452395,24.139620530998
臺中市南屯區大誠里3鄰大墩三街72號,66,6600700,大誠里,3鄰,大墩三街,,,,,,72號,120.651684799104,24.139620426845
臺中市南屯區大誠里3鄰大墩三街76號,66,6600700,大誠里,3鄰,大墩三街,,,,,,76號,120.651592857874,24.139529815682
臺中市南屯區大誠里3鄰大墩三街76之1號,66,6600700,大誠里,3鄰,大墩三街,,,,,,76之1號,120.651598222083,24.139579994725
臺中市南屯區大誠里3鄰大墩三街76之2號,66,6600700,大誠里,3鄰,大墩三街,,,,,,76之2號,120.651592857962,24.13962527346
臺中市南屯區大誠里3鄰大墩三街76之3號,66,6600700,大誠里,3鄰,大墩三街,,,,,,76之3號,120.651588834597,24.139681571003
臺中市南屯區大誠里3鄰大墩三街78號,66,6600700,大誠里,3鄰,大墩三街,,,,,,78號,120.651437289361,24.13953225966
臺中市南屯區大誠里3鄰大墩三街78之1號,66,6600700,大誠里,3鄰,大墩三街,,,,,,78之1號,120.651433265902,24.139578769436
臺中市南屯區大誠里3鄰大墩三街78之2號,66,6600700,大誠里,3鄰,大墩三街,,,,,,78之2號,120.651430583912,24.139624054289
臺中市南屯區大誠里3鄰大墩三街78之3號,66,6600700,大誠里,3鄰,大墩三街,,,,,,78之3號,120.651431924527,24.139681574001
臺中市南屯區大誠里5鄰大墩三街91號地下一層1號,66,6600700,大誠里,5鄰,大墩三街,,,,,,91號地下一層1號,120.650960162868,24.139319631091
臺中市南屯區大誠里5鄰大墩三街91號地下一層,66,6600700,大誠里,5鄰,大墩三街,,,,,,91號地下一層,120.650960162868,24.139319631091
臺中市南屯區大誠里5鄰大墩三街91號,66,6600700,大誠里,5鄰,大墩三街,,,,,,91號,120.650960162868,24.139319631091
臺中市南屯區大誠里5鄰大墩三街91號二樓,66,6600700,大誠里,5鄰,大墩三街,,,,,,91號二樓,120.650960162868,24.139319631091
臺中市南屯區大誠里5鄰大墩三街91號三樓,66,6600700,大誠里,5鄰,大墩三街,,,,,,91號三樓,120.650960162868,24.139319631091
臺中市南屯區大誠里5鄰大墩三街91號四樓,66,6600700,大誠里,5鄰,大墩三街,,,,,,91號四樓,120.650960162868,24.139319631091
臺中市南屯區大誠里5鄰大墩三街91號五樓,66,6600700,大誠里,5鄰,大墩三街,,,,,,91號五樓,120.650960162868,24.139319631091
臺中市南屯區大誠里5鄰大墩三街91號六樓,66,6600700,大誠里,5鄰,大墩三街,,,,,,91號六樓,120.650960162868,24.139319631091
臺中市南屯區大誠里5鄰大墩三街91號七樓,66,6600700,大誠里,5鄰,大墩三街,,,,,,91號七樓,120.650960162868,24.139319631091
臺中市南屯區大誠里5鄰大墩三街93號,66,6600700,大誠里,5鄰,大墩三街,,,,,,93號,120.650884264718,24.139383980939
臺中市南屯區大誠里5鄰大墩三街95號,66,6600700,大誠里,5鄰,大墩三街,,,,,,95號,120.65082963766,24.139368804165
臺中市南屯區大誠里3鄰大墩三街96號,66,6600700,大誠里,3鄰,大墩三街,,,,,,96號,120.64807193121,24.139573667393
臺中市南屯區大誠里5鄰大墩三街97號,66,6600700,大誠里,5鄰,大墩三街,,,,,,97號,120.650776795269,24.139367103172
臺中市南屯區大誠里5鄰大墩三街99號,66,6600700,大誠里,5鄰,大墩三街,,,,,,99號,120.650731258505,24.139358547575
臺中市南屯區大誠里5鄰大墩三街101號,66,6600700,大誠里,5鄰,大墩三街,,,,,,101號,120.650676599682,24.139355072649
臺中市南屯區大誠里5鄰大墩三街105號,66,6600700,大誠里,5鄰,大墩三街,,,,,,105號,120.650624176209,24.139310375028
臺中市南屯區大誠里5鄰大墩三街105號二樓,66,6600700,大誠里,5鄰,大墩三街,,,,,,105號二樓,120.650624176209,24.139310375028
臺中市南屯區大誠里5鄰大墩三街105號四樓,66,6600700,大誠里,5鄰,大墩三街,,,,,,105號四樓,120.650624176209,24.139310375028
臺中市南屯區大誠里5鄰大墩三街105號六樓,66,6600700,大誠里,5鄰,大墩三街,,,,,,105號六樓,120.650624176209,24.139310375028
臺中市南屯區大誠里5鄰大墩三街107號,66,6600700,大誠里,5鄰,大墩三街,,,,,,107號,120.650563871886,24.139306435676
臺中市南屯區大誠里5鄰大墩三街107號二樓,66,6600700,大誠里,5鄰,大墩三街,,,,,,107號二樓,120.650563871886,24.139306435676
臺中市南屯區大誠里5鄰大墩三街107號三樓,66,6600700,大誠里,5鄰,大墩三街,,,,,,107號三樓,120.650563871886,24.139306435676
臺中市南屯區大誠里5鄰大墩三街107號四樓,66,6600700,大誠里,5鄰,大墩三街,,,,,,107號四樓,120.650563871886,24.139306435676
臺中市南屯區大誠里5鄰大墩三街107號五樓,66,6600700,大誠里,5鄰,大墩三街,,,,,,107號五樓,120.650563871886,24.139306435676
臺中市南屯區大誠里5鄰大墩三街107號六樓,66,6600700,大誠里,5鄰,大墩三街,,,,,,107號六樓,120.650563871886,24.139306435676
臺中市南屯區大誠里5鄰大墩三街107號七樓,66,6600700,大誠里,5鄰,大墩三街,,,,,,107號七樓,120.650563871886,24.139306435676
臺中市南屯區大誠里3鄰大墩三街118號,66,6600700,大誠里,3鄰,大墩三街,,,,,,118號,120.650531707871,24.139574035688
臺中市南屯區大誠里3鄰大墩三街120號,66,6600700,大誠里,3鄰,大墩三街,,,,,,120號,120.650475948452,24.139577248882
臺中市南屯區大誠里3鄰大墩三街122號,66,6600700,大誠里,3鄰,大墩三街,,,,,,122號,120.650430814217,24.139607357584
臺中市南屯區大誠里3鄰大墩三街126號,66,6600700,大誠里,3鄰,大墩三街,,,,,,126號,120.650368925139,24.139607215862
臺中市南屯區同心里20鄰大墩三街125號,66,6600700,同心里,20鄰,大墩三街,,,,,,125號,120.64963728162,24.139363101817
臺中市南屯區同心里20鄰大墩三街127號,66,6600700,同心里,20鄰,大墩三街,,,,,,127號,120.649572908406,24.13935820466
臺中市南屯區同心里20鄰大墩三街129號,66,6600700,同心里,20鄰,大墩三街,,,,,,129號,120.649500488818,24.139355754002
臺中市南屯區同心里20鄰大墩三街131號,66,6600700,同心里,20鄰,大墩三街,,,,,,131號,120.649406611625,24.139353308211
臺中市南屯區同心里20鄰大墩三街133號十樓之1,66,6600700,同心里,20鄰,大墩三街,,,,,,133號十樓之1,120.64932078082,24.139348415846
臺中市南屯區同心里20鄰大墩三街133號十樓之2,66,6600700,同心里,20鄰,大墩三街,,,,,,133號十樓之2,120.64932078082,24.139348415846
臺中市南屯區同心里20鄰大墩三街133號十樓之3,66,6600700,同心里,20鄰,大墩三街,,,,,,133號十樓之3,120.64932078082,24.139348415846
臺中市南屯區同心里20鄰大墩三街133號十樓之5,66,6600700,同心里,20鄰,大墩三街,,,,,,133號十樓之5,120.64932078082,24.139348415846
臺中市南屯區同心里20鄰大墩三街133號四樓之1,66,6600700,同心里,20鄰,大墩三街,,,,,,133號四樓之1,120.64932078082,24.139348415846
臺中市南屯區同心里20鄰大墩三街133號四樓之2,66,6600700,同心里,20鄰,大墩三街,,,,,,133號四樓之2,120.64932078082,24.139348415846
臺中市南屯區同心里20鄰大墩三街133號四樓之3,66,6600700,同心里,20鄰,大墩三街,,,,,,133號四樓之3,120.64932078082,24.139348415846
臺中市南屯區同心里20鄰大墩三街133號四樓之5,66,6600700,同心里,20鄰,大墩三街,,,,,,133號四樓之5,120.64932078082,24.139348415846
臺中市南屯區同心里20鄰大墩三街133號五樓之1,66,6600700,同心里,20鄰,大墩三街,,,,,,133號五樓之1,120.64932078082,24.139348415846
臺中市南屯區同心里20鄰大墩三街133號五樓之2,66,6600700,同心里,20鄰,大墩三街,,,,,,133號五樓之2,120.64932078082,24.139348415846
臺中市南屯區同心里20鄰大墩三街133號五樓之3,66,6600700,同心里,20鄰,大墩三街,,,,,,133號五樓之3,120.64932078082,24.139348415846
臺中市南屯區同心里20鄰大墩三街133號五樓之5,66,6600700,同心里,20鄰,大墩三街,,,,,,133號五樓之5,120.64932078082,24.139348415846
臺中市南屯區同心里20鄰大墩三街133號六樓之1,66,6600700,同心里,20鄰,大墩三街,,,,,,133號六樓之1,120.64932078082,24.139348415846
臺中市南屯區同心里20鄰大墩三街133號六樓之2,66,6600700,同心里,20鄰,大墩三街,,,,,,133號六樓之2,120.64932078082,24.139348415846
臺中市南屯區同心里20鄰大墩三街133號六樓之3,66,6600700,同心里,20鄰,大墩三街,,,,,,133號六樓之3,120.64932078082,24.139348415846
臺中市南屯區同心里20鄰大墩三街133號六樓之5,66,6600700,同心里,20鄰,大墩三街,,,,,,133號六樓之5,120.64932078082,24.139348415846
臺中市南屯區同心里20鄰大墩三街133號七樓之1,66,6600700,同心里,20鄰,大墩三街,,,,,,133號七樓之1,120.64932078082,24.139348415846
臺中市南屯區同心里20鄰大墩三街133號七樓之2,66,6600700,同心里,20鄰,大墩三街,,,,,,133號七樓之2,120.64932078082,24.139348415846
臺中市南屯區同心里20鄰大墩三街133號七樓之3,66,6600700,同心里,20鄰,大墩三街,,,,,,133號七樓之3,120.64932078082,24.139348415846
臺中市南屯區同心里20鄰大墩三街133號七樓之5,66,6600700,同心里,20鄰,大墩三街,,,,,,133號七樓之5,120.64932078082,24.139348415846
臺中市南屯區同心里20鄰大墩三街133號八樓之1,66,6600700,同心里,20鄰,大墩三街,,,,,,133號八樓之1,120.64932078082,24.139348415846
臺中市南屯區同心里20鄰大墩三街133號八樓之2,66,6600700,同心里,20鄰,大墩三街,,,,,,133號八樓之2,120.64932078082,24.139348415846
臺中市南屯區同心里20鄰大墩三街133號八樓之3,66,6600700,同心里,20鄰,大墩三街,,,,,,133號八樓之3,120.64932078082,24.139348415846
臺中市南屯區同心里20鄰大墩三街133號八樓之5,66,6600700,同心里,20鄰,大墩三街,,,,,,133號八樓之5,120.64932078082,24.139348415846
臺中市南屯區同心里20鄰大墩三街133號九樓之1,66,6600700,同心里,20鄰,大墩三街,,,,,,133號九樓之1,120.64932078082,24.139348415846
臺中市南屯區同心里20鄰大墩三街133號九樓之2,66,6600700,同心里,20鄰,大墩三街,,,,,,133號九樓之2,120.64932078082,24.139348415846
臺中市南屯區同心里20鄰大墩三街133號九樓之3,66,6600700,同心里,20鄰,大墩三街,,,,,,133號九樓之3,120.64932078082,24.139348415846
臺中市南屯區同心里20鄰大墩三街133號九樓之5,66,6600700,同心里,20鄰,大墩三街,,,,,,133號九樓之5,120.64932078082,24.139348415846
臺中市南屯區同心里20鄰大墩三街133號十一樓之1,66,6600700,同心里,20鄰,大墩三街,,,,,,133號十一樓之1,120.64932078082,24.139348415846
臺中市南屯區同心里20鄰大墩三街133號十一樓之2,66,6600700,同心里,20鄰,大墩三街,,,,,,133號十一樓之2,120.64932078082,24.139348415846
臺中市南屯區同心里20鄰大墩三街133號十一樓之3,66,6600700,同心里,20鄰,大墩三街,,,,,,133號十一樓之3,120.64932078082,24.139348415846
臺中市南屯區同心里20鄰大墩三街133號十一樓之5,66,6600700,同心里,20鄰,大墩三街,,,,,,133號十一樓之5,120.64932078082,24.139348415846
臺中市南屯區同心里20鄰大墩三街133號十二樓之1,66,6600700,同心里,20鄰,大墩三街,,,,,,133號十二樓之1,120.64932078082,24.139348415846
臺中市南屯區同心里20鄰大墩三街133號十二樓之2,66,6600700,同心里,20鄰,大墩三街,,,,,,133號十二樓之2,120.64932078082,24.139348415846
臺中市南屯區同心里20鄰大墩三街133號十二樓之3,66,6600700,同心里,20鄰,大墩三街,,,,,,133號十二樓之3,120.64932078082,24.139348415846
臺中市南屯區同心里20鄰大墩三街133號十二樓之5,66,6600700,同心里,20鄰,大墩三街,,,,,,133號十二樓之5,120.64932078082,24.139348415846
臺中市南屯區同心里20鄰大墩三街133號十三樓之1,66,6600700,同心里,20鄰,大墩三街,,,,,,133號十三樓之1,120.64932078082,24.139348415846
臺中市南屯區同心里20鄰大墩三街133號十三樓之2,66,6600700,同心里,20鄰,大墩三街,,,,,,133號十三樓之2,120.64932078082,24.139348415846
臺中市南屯區同心里20鄰大墩三街133號十三樓之3,66,6600700,同心里,20鄰,大墩三街,,,,,,133號十三樓之3,120.64932078082,24.139348415846
臺中市南屯區同心里20鄰大墩三街133號十三樓之5,66,6600700,同心里,20鄰,大墩三街,,,,,,133號十三樓之5,120.64932078082,24.139348415846
臺中市南屯區同心里20鄰大墩三街133號十四樓之1,66,6600700,同心里,20鄰,大墩三街,,,,,,133號十四樓之1,120.64932078082,24.139348415846
臺中市南屯區同心里20鄰大墩三街133號十四樓之2,66,6600700,同心里,20鄰,大墩三街,,,,,,133號十四樓之2,120.64932078082,24.139348415846
臺中市南屯區同心里20鄰大墩三街133號十四樓之3,66,6600700,同心里,20鄰,大墩三街,,,,,,133號十四樓之3,120.64932078082,24.139348415846
臺中市南屯區同心里20鄰大墩三街133號十四樓之5,66,6600700,同心里,20鄰,大墩三街,,,,,,133號十四樓之5,120.64932078082,24.139348415846
臺中市南屯區同心里20鄰大墩三街133號十五樓之1,66,6600700,同心里,20鄰,大墩三街,,,,,,133號十五樓之1,120.64932078082,24.139348415846
臺中市南屯區同心里20鄰大墩三街133號十五樓之2,66,6600700,同心里,20鄰,大墩三街,,,,,,133號十五樓之2,120.64932078082,24.139348415846
臺中市南屯區同心里20鄰大墩三街133號十五樓之3,66,6600700,同心里,20鄰,大墩三街,,,,,,133號十五樓之3,120.64932078082,24.139348415846
臺中市南屯區同心里20鄰大墩三街133號十五樓之5,66,6600700,同心里,20鄰,大墩三街,,,,,,133號十五樓之5,120.64932078082,24.139348415846
臺中市南屯區同心里20鄰大墩三街133號十六樓之1,66,6600700,同心里,20鄰,大墩三街,,,,,,133號十六樓之1,120.64932078082,24.139348415846
臺中市南屯區同心里20鄰大墩三街133號十六樓之2,66,6600700,同心里,20鄰,大墩三街,,,,,,133號十六樓之2,120.64932078082,24.139348415846
臺中市南屯區同心里20鄰大墩三街133號十六樓之3,66,6600700,同心里,20鄰,大墩三街,,,,,,133號十六樓之3,120.64932078082,24.139348415846
