FULL_ADDR,COUNTY,TOWN,VILLAGE,NEIGHBORHOOD,ROAD,SECTION,LANE,ALLEY,SUB_ALLEY,TONG,NUMBER,X,Y
臺中市大里區仁化里28鄰工業六路28號,66,6602800,仁化里,28鄰,工業六路,,,,,,28號,120.716468372628,24.096495269882
臺中市大里區仁化里28鄰工業六路2號,66,6602800,仁化里,28鄰,工業六路,,,,,,2號,120.716852330932,24.095572979112
臺中市大里區仁化里28鄰工業六路6號,66,6602800,仁化里,28鄰,工業六路,,,,,,6號,120.716797345377,24.095676525647
臺中市大里區仁化里28鄰工業六路8號,66,6602800,仁化里,28鄰,工業六路,,,,,,8號,120.71671861102,24.095731061766
臺中市大里區仁化里28鄰工業六路12號,66,6602800,仁化里,28鄰,工業六路,,,,,,12號,120.716641253229,24.095886404519
臺中市大里區仁化里28鄰工業六路21號,66,6602800,仁化里,28鄰,工業六路,,,,,,21號,120.716070819745,24.096440743951
臺中市大里區仁化里28鄰工業六路21號二樓,66,6602800,仁化里,28鄰,工業六路,,,,,,21號二樓,120.716070819745,24.096440743951
臺中市大里區仁化里28鄰工業六路21號三樓,66,6602800,仁化里,28鄰,工業六路,,,,,,21號三樓,120.716070819745,24.096440743951
臺中市大里區仁化里28鄰工業六路21號四樓,66,6602800,仁化里,28鄰,工業六路,,,,,,21號四樓,120.716070819745,24.096440743951
臺中市大里區仁化里28鄰工業六路23號,66,6602800,仁化里,28鄰,工業六路,,,,,,23號,120.715996357163,24.096531531593
臺中市大里區仁化里28鄰工業六路23號二樓,66,6602800,仁化里,28鄰,工業六路,,,,,,23號二樓,120.715996357163,24.096531531593
臺中市大里區仁化里28鄰工業六路23號三樓,66,6602800,仁化里,28鄰,工業六路,,,,,,23號三樓,120.715996357163,24.096531531593
臺中市大里區仁化里28鄰工業六路23號四樓,66,6602800,仁化里,28鄰,工業六路,,,,,,23號四樓,120.715996357163,24.096531531593
臺中市大里區仁化里28鄰工業六路25號,66,6602800,仁化里,28鄰,工業六路,,,,,,25號,120.716174010676,24.096480664888
臺中市大里區仁化里28鄰工業六路25號二樓,66,6602800,仁化里,28鄰,工業六路,,,,,,25號二樓,120.716174010676,24.096480664888
臺中市大里區仁化里28鄰工業六路25號三樓,66,6602800,仁化里,28鄰,工業六路,,,,,,25號三樓,120.716174010676,24.096480664888
臺中市大里區仁化里28鄰工業六路25號四樓,66,6602800,仁化里,28鄰,工業六路,,,,,,25號四樓,120.716174010676,24.096480664888
臺中市大里區仁化里28鄰工業六路27號,66,6602800,仁化里,28鄰,工業六路,,,,,,27號,120.716102587769,24.096575792332
臺中市大里區仁化里28鄰工業六路27號二樓,66,6602800,仁化里,28鄰,工業六路,,,,,,27號二樓,120.716102587769,24.096575792332
臺中市大里區仁化里28鄰工業六路27號三樓,66,6602800,仁化里,28鄰,工業六路,,,,,,27號三樓,120.716102587769,24.096575792332
臺中市大里區仁化里28鄰工業六路27號四樓,66,6602800,仁化里,28鄰,工業六路,,,,,,27號四樓,120.716102587769,24.096575792332
