FULL_ADDR,COUNTY,TOWN,VILLAGE,NEIGHBORHOOD,ROAD,SECTION,LANE,ALLEY,SUB_ALLEY,TONG,NUMBER,X,Y
臺中市南屯區同心里20鄰大墩三街133號十六樓之5,66,6600700,同心里,20鄰,大墩三街,,,,,,133號十六樓之5,120.64932078082,24.139348415846
臺中市南屯區同心里20鄰大墩三街133號十七樓之1,66,6600700,同心里,20鄰,大墩三街,,,,,,133號十七樓之1,120.64932078082,24.139348415846
臺中市南屯區同心里20鄰大墩三街133號十七樓之2,66,6600700,同心里,20鄰,大墩三街,,,,,,133號十七樓之2,120.64932078082,24.139348415846
臺中市南屯區同心里20鄰大墩三街133號十七樓之3,66,6600700,同心里,20鄰,大墩三街,,,,,,133號十七樓之3,120.64932078082,24.139348415846
臺中市南屯區同心里20鄰大墩三街133號十七樓之5,66,6600700,同心里,20鄰,大墩三街,,,,,,133號十七樓之5,120.64932078082,24.139348415846
臺中市南屯區同心里20鄰大墩三街133號十八樓之1,66,6600700,同心里,20鄰,大墩三街,,,,,,133號十八樓之1,120.64932078082,24.139348415846
臺中市南屯區同心里20鄰大墩三街133號十八樓之2,66,6600700,同心里,20鄰,大墩三街,,,,,,133號十八樓之2,120.64932078082,24.139348415846
臺中市南屯區同心里20鄰大墩三街133號十八樓之3,66,6600700,同心里,20鄰,大墩三街,,,,,,133號十八樓之3,120.64932078082,24.139348415846
臺中市南屯區同心里20鄰大墩三街133號十八樓之5,66,6600700,同心里,20鄰,大墩三街,,,,,,133號十八樓之5,120.64932078082,24.139348415846
臺中市南屯區同心里20鄰大墩三街133號十九樓之1,66,6600700,同心里,20鄰,大墩三街,,,,,,133號十九樓之1,120.64932078082,24.139348415846
臺中市南屯區同心里20鄰大墩三街133號十九樓之2,66,6600700,同心里,20鄰,大墩三街,,,,,,133號十九樓之2,120.64932078082,24.139348415846
臺中市南屯區同心里20鄰大墩三街133號十九樓之3,66,6600700,同心里,20鄰,大墩三街,,,,,,133號十九樓之3,120.64932078082,24.139348415846
臺中市南屯區同心里20鄰大墩三街133號十九樓之5,66,6600700,同心里,20鄰,大墩三街,,,,,,133號十九樓之5,120.64932078082,24.139348415846
臺中市南屯區同心里20鄰大墩三街133號二十樓之1,66,6600700,同心里,20鄰,大墩三街,,,,,,133號二十樓之1,120.64932078082,24.139348415846
臺中市南屯區同心里20鄰大墩三街133號二十樓之2,66,6600700,同心里,20鄰,大墩三街,,,,,,133號二十樓之2,120.64932078082,24.139348415846
臺中市南屯區同心里20鄰大墩三街133號二十樓之3,66,6600700,同心里,20鄰,大墩三街,,,,,,133號二十樓之3,120.64932078082,24.139348415846
臺中市南屯區同心里20鄰大墩三街133號二十樓之5,66,6600700,同心里,20鄰,大墩三街,,,,,,133號二十樓之5,120.64932078082,24.139348415846
臺中市南屯區同心里20鄰大墩三街133號二十一樓之1,66,6600700,同心里,20鄰,大墩三街,,,,,,133號二十一樓之1,120.64932078082,24.139348415846
臺中市南屯區同心里20鄰大墩三街133號二十一樓之2,66,6600700,同心里,20鄰,大墩三街,,,,,,133號二十一樓之2,120.64932078082,24.139348415846
臺中市南屯區同心里20鄰大墩三街133號二十一樓之3,66,6600700,同心里,20鄰,大墩三街,,,,,,133號二十一樓之3,120.64932078082,24.139348415846
臺中市南屯區同心里20鄰大墩三街133號二十一樓之5,66,6600700,同心里,20鄰,大墩三街,,,,,,133號二十一樓之5,120.64932078082,24.139348415846
臺中市南屯區同心里20鄰大墩三街133號二十二樓之1,66,6600700,同心里,20鄰,大墩三街,,,,,,133號二十二樓之1,120.64932078082,24.139348415846
臺中市南屯區同心里20鄰大墩三街133號二十二樓之2,66,6600700,同心里,20鄰,大墩三街,,,,,,133號二十二樓之2,120.64932078082,24.139348415846
臺中市南屯區同心里20鄰大墩三街133號二十二樓之3,66,6600700,同心里,20鄰,大墩三街,,,,,,133號二十二樓之3,120.64932078082,24.139348415846
臺中市南屯區同心里20鄰大墩三街133號二十二樓之5,66,6600700,同心里,20鄰,大墩三街,,,,,,133號二十二樓之5,120.64932078082,24.139348415846
臺中市南屯區同心里20鄰大墩三街133號二十三樓之1,66,6600700,同心里,20鄰,大墩三街,,,,,,133號二十三樓之1,120.64932078082,24.139348415846
臺中市南屯區同心里20鄰大墩三街133號二十三樓之2,66,6600700,同心里,20鄰,大墩三街,,,,,,133號二十三樓之2,120.64932078082,24.139348415846
臺中市南屯區同心里20鄰大墩三街133號二十三樓之3,66,6600700,同心里,20鄰,大墩三街,,,,,,133號二十三樓之3,120.64932078082,24.139348415846
臺中市南屯區同心里20鄰大墩三街133號二十三樓之5,66,6600700,同心里,20鄰,大墩三街,,,,,,133號二十三樓之5,120.64932078082,24.139348415846
臺中市南屯區同心里20鄰大墩三街133號二十四樓之1,66,6600700,同心里,20鄰,大墩三街,,,,,,133號二十四樓之1,120.64932078082,24.139348415846
臺中市南屯區同心里20鄰大墩三街133號二十四樓之2,66,6600700,同心里,20鄰,大墩三街,,,,,,133號二十四樓之2,120.64932078082,24.139348415846
臺中市南屯區同心里20鄰大墩三街133號二十四樓之3,66,6600700,同心里,20鄰,大墩三街,,,,,,133號二十四樓之3,120.64932078082,24.139348415846
臺中市南屯區同心里20鄰大墩三街133號二十四樓之5,66,6600700,同心里,20鄰,大墩三街,,,,,,133號二十四樓之5,120.64932078082,24.139348415846
臺中市南屯區同心里20鄰大墩三街135號十樓之1,66,6600700,同心里,20鄰,大墩三街,,,,,,135號十樓之1,120.649226903662,24.139345960916
臺中市南屯區同心里20鄰大墩三街135號十樓之2,66,6600700,同心里,20鄰,大墩三街,,,,,,135號十樓之2,120.649226903662,24.139345960916
臺中市南屯區同心里20鄰大墩三街135號十樓之3,66,6600700,同心里,20鄰,大墩三街,,,,,,135號十樓之3,120.649226903662,24.139345960916
臺中市南屯區同心里20鄰大墩三街135號十樓之5,66,6600700,同心里,20鄰,大墩三街,,,,,,135號十樓之5,120.649226903662,24.139345960916
臺中市南屯區同心里20鄰大墩三街135號四樓之1,66,6600700,同心里,20鄰,大墩三街,,,,,,135號四樓之1,120.649226903662,24.139345960916
臺中市南屯區同心里20鄰大墩三街135號四樓之2,66,6600700,同心里,20鄰,大墩三街,,,,,,135號四樓之2,120.649226903662,24.139345960916
臺中市南屯區同心里20鄰大墩三街135號四樓之3,66,6600700,同心里,20鄰,大墩三街,,,,,,135號四樓之3,120.649226903662,24.139345960916
臺中市南屯區同心里20鄰大墩三街135號四樓之5,66,6600700,同心里,20鄰,大墩三街,,,,,,135號四樓之5,120.649226903662,24.139345960916
臺中市南屯區同心里20鄰大墩三街135號五樓之1,66,6600700,同心里,20鄰,大墩三街,,,,,,135號五樓之1,120.649226903662,24.139345960916
臺中市南屯區同心里20鄰大墩三街135號五樓之2,66,6600700,同心里,20鄰,大墩三街,,,,,,135號五樓之2,120.649226903662,24.139345960916
臺中市南屯區同心里20鄰大墩三街135號五樓之3,66,6600700,同心里,20鄰,大墩三街,,,,,,135號五樓之3,120.649226903662,24.139345960916
臺中市南屯區同心里20鄰大墩三街135號五樓之5,66,6600700,同心里,20鄰,大墩三街,,,,,,135號五樓之5,120.649226903662,24.139345960916
臺中市南屯區同心里20鄰大墩三街135號六樓之1,66,6600700,同心里,20鄰,大墩三街,,,,,,135號六樓之1,120.649226903662,24.139345960916
臺中市南屯區同心里20鄰大墩三街135號六樓之2,66,6600700,同心里,20鄰,大墩三街,,,,,,135號六樓之2,120.649226903662,24.139345960916
臺中市南屯區同心里20鄰大墩三街135號六樓之3,66,6600700,同心里,20鄰,大墩三街,,,,,,135號六樓之3,120.649226903662,24.139345960916
臺中市南屯區同心里20鄰大墩三街135號六樓之5,66,6600700,同心里,20鄰,大墩三街,,,,,,135號六樓之5,120.649226903662,24.139345960916
臺中市南屯區同心里20鄰大墩三街135號七樓之1,66,6600700,同心里,20鄰,大墩三街,,,,,,135號七樓之1,120.649226903662,24.139345960916
臺中市南屯區同心里20鄰大墩三街135號七樓之2,66,6600700,同心里,20鄰,大墩三街,,,,,,135號七樓之2,120.649226903662,24.139345960916
臺中市南屯區同心里20鄰大墩三街135號七樓之3,66,6600700,同心里,20鄰,大墩三街,,,,,,135號七樓之3,120.649226903662,24.139345960916
臺中市南屯區同心里20鄰大墩三街135號七樓之5,66,6600700,同心里,20鄰,大墩三街,,,,,,135號七樓之5,120.649226903662,24.139345960916
臺中市南屯區同心里20鄰大墩三街135號八樓之1,66,6600700,同心里,20鄰,大墩三街,,,,,,135號八樓之1,120.649226903662,24.139345960916
臺中市南屯區同心里20鄰大墩三街135號八樓之2,66,6600700,同心里,20鄰,大墩三街,,,,,,135號八樓之2,120.649226903662,24.139345960916
臺中市南屯區同心里20鄰大墩三街135號八樓之3,66,6600700,同心里,20鄰,大墩三街,,,,,,135號八樓之3,120.649226903662,24.139345960916
臺中市南屯區同心里20鄰大墩三街135號八樓之5,66,6600700,同心里,20鄰,大墩三街,,,,,,135號八樓之5,120.649226903662,24.139345960916
臺中市南屯區同心里20鄰大墩三街135號九樓之1,66,6600700,同心里,20鄰,大墩三街,,,,,,135號九樓之1,120.649226903662,24.139345960916
臺中市南屯區同心里20鄰大墩三街135號九樓之2,66,6600700,同心里,20鄰,大墩三街,,,,,,135號九樓之2,120.649226903662,24.139345960916
臺中市南屯區同心里20鄰大墩三街135號九樓之3,66,6600700,同心里,20鄰,大墩三街,,,,,,135號九樓之3,120.649226903662,24.139345960916
臺中市南屯區同心里20鄰大墩三街135號九樓之5,66,6600700,同心里,20鄰,大墩三街,,,,,,135號九樓之5,120.649226903662,24.139345960916
臺中市南屯區同心里20鄰大墩三街135號十一樓之1,66,6600700,同心里,20鄰,大墩三街,,,,,,135號十一樓之1,120.649226903662,24.139345960916
臺中市南屯區同心里20鄰大墩三街135號十一樓之2,66,6600700,同心里,20鄰,大墩三街,,,,,,135號十一樓之2,120.649226903662,24.139345960916
臺中市南屯區同心里20鄰大墩三街135號十一樓之3,66,6600700,同心里,20鄰,大墩三街,,,,,,135號十一樓之3,120.649226903662,24.139345960916
臺中市南屯區同心里20鄰大墩三街135號十一樓之5,66,6600700,同心里,20鄰,大墩三街,,,,,,135號十一樓之5,120.649226903662,24.139345960916
臺中市南屯區同心里20鄰大墩三街135號十二樓之1,66,6600700,同心里,20鄰,大墩三街,,,,,,135號十二樓之1,120.649226903662,24.139345960916
臺中市南屯區同心里20鄰大墩三街135號十二樓之2,66,6600700,同心里,20鄰,大墩三街,,,,,,135號十二樓之2,120.649226903662,24.139345960916
臺中市南屯區同心里20鄰大墩三街135號十二樓之3,66,6600700,同心里,20鄰,大墩三街,,,,,,135號十二樓之3,120.649226903662,24.139345960916
臺中市南屯區同心里20鄰大墩三街135號十二樓之5,66,6600700,同心里,20鄰,大墩三街,,,,,,135號十二樓之5,120.649226903662,24.139345960916
臺中市南屯區同心里20鄰大墩三街135號十三樓之1,66,6600700,同心里,20鄰,大墩三街,,,,,,135號十三樓之1,120.649226903662,24.139345960916
臺中市南屯區同心里20鄰大墩三街135號十三樓之2,66,6600700,同心里,20鄰,大墩三街,,,,,,135號十三樓之2,120.649226903662,24.139345960916
臺中市南屯區同心里20鄰大墩三街135號十三樓之3,66,6600700,同心里,20鄰,大墩三街,,,,,,135號十三樓之3,120.649226903662,24.139345960916
臺中市南屯區同心里20鄰大墩三街135號十三樓之5,66,6600700,同心里,20鄰,大墩三街,,,,,,135號十三樓之5,120.649226903662,24.139345960916
臺中市南屯區同心里20鄰大墩三街135號十四樓之1,66,6600700,同心里,20鄰,大墩三街,,,,,,135號十四樓之1,120.649226903662,24.139345960916
臺中市南屯區同心里20鄰大墩三街135號十四樓之2,66,6600700,同心里,20鄰,大墩三街,,,,,,135號十四樓之2,120.649226903662,24.139345960916
臺中市南屯區同心里20鄰大墩三街135號十四樓之3,66,6600700,同心里,20鄰,大墩三街,,,,,,135號十四樓之3,120.649226903662,24.139345960916
臺中市南屯區同心里20鄰大墩三街135號十四樓之5,66,6600700,同心里,20鄰,大墩三街,,,,,,135號十四樓之5,120.649226903662,24.139345960916
臺中市南屯區同心里20鄰大墩三街135號十五樓之1,66,6600700,同心里,20鄰,大墩三街,,,,,,135號十五樓之1,120.649226903662,24.139345960916
臺中市南屯區同心里20鄰大墩三街135號十五樓之2,66,6600700,同心里,20鄰,大墩三街,,,,,,135號十五樓之2,120.649226903662,24.139345960916
臺中市南屯區同心里20鄰大墩三街135號十五樓之3,66,6600700,同心里,20鄰,大墩三街,,,,,,135號十五樓之3,120.649226903662,24.139345960916
臺中市南屯區同心里20鄰大墩三街135號十五樓之5,66,6600700,同心里,20鄰,大墩三街,,,,,,135號十五樓之5,120.649226903662,24.139345960916
臺中市南屯區同心里20鄰大墩三街135號十六樓之1,66,6600700,同心里,20鄰,大墩三街,,,,,,135號十六樓之1,120.649226903662,24.139345960916
臺中市南屯區同心里20鄰大墩三街135號十六樓之2,66,6600700,同心里,20鄰,大墩三街,,,,,,135號十六樓之2,120.649226903662,24.139345960916
臺中市南屯區同心里20鄰大墩三街135號十六樓之3,66,6600700,同心里,20鄰,大墩三街,,,,,,135號十六樓之3,120.649226903662,24.139345960916
臺中市南屯區同心里20鄰大墩三街135號十六樓之5,66,6600700,同心里,20鄰,大墩三街,,,,,,135號十六樓之5,120.649226903662,24.139345960916
臺中市南屯區同心里20鄰大墩三街135號十七樓之1,66,6600700,同心里,20鄰,大墩三街,,,,,,135號十七樓之1,120.649226903662,24.139345960916
臺中市南屯區同心里20鄰大墩三街135號十七樓之2,66,6600700,同心里,20鄰,大墩三街,,,,,,135號十七樓之2,120.649226903662,24.139345960916
臺中市南屯區同心里20鄰大墩三街135號十七樓之3,66,6600700,同心里,20鄰,大墩三街,,,,,,135號十七樓之3,120.649226903662,24.139345960916
臺中市南屯區同心里20鄰大墩三街135號十七樓之5,66,6600700,同心里,20鄰,大墩三街,,,,,,135號十七樓之5,120.649226903662,24.139345960916
臺中市南屯區同心里20鄰大墩三街135號十八樓之1,66,6600700,同心里,20鄰,大墩三街,,,,,,135號十八樓之1,120.649226903662,24.139345960916
臺中市南屯區同心里20鄰大墩三街135號十八樓之2,66,6600700,同心里,20鄰,大墩三街,,,,,,135號十八樓之2,120.649226903662,24.139345960916
臺中市南屯區同心里20鄰大墩三街135號十八樓之3,66,6600700,同心里,20鄰,大墩三街,,,,,,135號十八樓之3,120.649226903662,24.139345960916
臺中市南屯區同心里20鄰大墩三街135號十八樓之5,66,6600700,同心里,20鄰,大墩三街,,,,,,135號十八樓之5,120.649226903662,24.139345960916
臺中市南屯區同心里20鄰大墩三街135號十九樓之1,66,6600700,同心里,20鄰,大墩三街,,,,,,135號十九樓之1,120.649226903662,24.139345960916
臺中市南屯區同心里20鄰大墩三街135號十九樓之2,66,6600700,同心里,20鄰,大墩三街,,,,,,135號十九樓之2,120.649226903662,24.139345960916
臺中市南屯區同心里20鄰大墩三街135號十九樓之3,66,6600700,同心里,20鄰,大墩三街,,,,,,135號十九樓之3,120.649226903662,24.139345960916
臺中市南屯區同心里20鄰大墩三街135號十九樓之5,66,6600700,同心里,20鄰,大墩三街,,,,,,135號十九樓之5,120.649226903662,24.139345960916
臺中市南屯區同心里20鄰大墩三街135號二十樓之1,66,6600700,同心里,20鄰,大墩三街,,,,,,135號二十樓之1,120.649226903662,24.139345960916
臺中市南屯區同心里20鄰大墩三街135號二十樓之2,66,6600700,同心里,20鄰,大墩三街,,,,,,135號二十樓之2,120.649226903662,24.139345960916
臺中市南屯區同心里20鄰大墩三街135號二十樓之3,66,6600700,同心里,20鄰,大墩三街,,,,,,135號二十樓之3,120.649226903662,24.139345960916
臺中市南屯區同心里20鄰大墩三街135號二十樓之5,66,6600700,同心里,20鄰,大墩三街,,,,,,135號二十樓之5,120.649226903662,24.139345960916
臺中市南屯區同心里20鄰大墩三街135號二十一樓之1,66,6600700,同心里,20鄰,大墩三街,,,,,,135號二十一樓之1,120.649226903662,24.139345960916
臺中市南屯區同心里20鄰大墩三街135號二十一樓之2,66,6600700,同心里,20鄰,大墩三街,,,,,,135號二十一樓之2,120.649226903662,24.139345960916
臺中市南屯區同心里20鄰大墩三街135號二十一樓之3,66,6600700,同心里,20鄰,大墩三街,,,,,,135號二十一樓之3,120.649226903662,24.139345960916
臺中市南屯區同心里20鄰大墩三街135號二十一樓之5,66,6600700,同心里,20鄰,大墩三街,,,,,,135號二十一樓之5,120.649226903662,24.139345960916
臺中市南屯區同心里20鄰大墩三街135號二十二樓之1,66,6600700,同心里,20鄰,大墩三街,,,,,,135號二十二樓之1,120.649226903662,24.139345960916
臺中市南屯區同心里20鄰大墩三街135號二十二樓之2,66,6600700,同心里,20鄰,大墩三街,,,,,,135號二十二樓之2,120.649226903662,24.139345960916
臺中市南屯區同心里20鄰大墩三街135號二十二樓之3,66,6600700,同心里,20鄰,大墩三街,,,,,,135號二十二樓之3,120.649226903662,24.139345960916
臺中市南屯區同心里20鄰大墩三街135號二十二樓之5,66,6600700,同心里,20鄰,大墩三街,,,,,,135號二十二樓之5,120.649226903662,24.139345960916
臺中市南屯區同心里20鄰大墩三街135號二十三樓之1,66,6600700,同心里,20鄰,大墩三街,,,,,,135號二十三樓之1,120.649226903662,24.139345960916
臺中市南屯區同心里20鄰大墩三街135號二十三樓之2,66,6600700,同心里,20鄰,大墩三街,,,,,,135號二十三樓之2,120.649226903662,24.139345960916
臺中市南屯區同心里20鄰大墩三街135號二十三樓之3,66,6600700,同心里,20鄰,大墩三街,,,,,,135號二十三樓之3,120.649226903662,24.139345960916
臺中市南屯區同心里20鄰大墩三街135號二十三樓之5,66,6600700,同心里,20鄰,大墩三街,,,,,,135號二十三樓之5,120.649226903662,24.139345960916
臺中市南屯區同心里20鄰大墩三街135號二十四樓之1,66,6600700,同心里,20鄰,大墩三街,,,,,,135號二十四樓之1,120.649226903662,24.139345960916
臺中市南屯區同心里20鄰大墩三街135號二十四樓之2,66,6600700,同心里,20鄰,大墩三街,,,,,,135號二十四樓之2,120.649226903662,24.139345960916
臺中市南屯區同心里20鄰大墩三街135號二十四樓之3,66,6600700,同心里,20鄰,大墩三街,,,,,,135號二十四樓之3,120.649226903662,24.139345960916
臺中市南屯區同心里20鄰大墩三街135號二十四樓之5,66,6600700,同心里,20鄰,大墩三街,,,,,,135號二十四樓之5,120.649226903662,24.139345960916
臺中市南屯區同心里20鄰大墩三街137號,66,6600700,同心里,20鄰,大墩三街,,,,,,137號,120.649138391293,24.139348412138
臺中市南屯區同心里20鄰大墩三街139號,66,6600700,同心里,20鄰,大墩三街,,,,,,139號,120.649060607307,24.139345967001
臺中市南屯區同心里15鄰大墩三街172號,66,6600700,同心里,15鄰,大墩三街,,,,,,172號,120.648576864656,24.13956781476
臺中市南屯區同心里15鄰大墩三街130號,66,6600700,同心里,15鄰,大墩三街,,,,,,130號,120.649672195644,24.139573916785
臺中市南屯區同心里15鄰大墩三街132號,66,6600700,同心里,15鄰,大墩三街,,,,,,132號,120.649539484872,24.139601973228
臺中市南屯區同心里15鄰大墩三街136號,66,6600700,同心里,15鄰,大墩三街,,,,,,136號,120.649488715173,24.139601856673
臺中市南屯區同心里15鄰大墩三街138號,66,6600700,同心里,15鄰,大墩三街,,,,,,138號,120.649437157348,24.139601738293
臺中市南屯區同心里15鄰大墩三街140號,66,6600700,同心里,15鄰,大墩三街,,,,,,140號,120.64938550113,24.139601619668
臺中市南屯區同心里15鄰大墩三街142號,66,6600700,同心里,15鄰,大墩三街,,,,,,142號,120.649188278153,24.139608931799
臺中市南屯區同心里15鄰大墩三街156號,66,6600700,同心里,15鄰,大墩三街,,,,,,156號,120.649026768893,24.139598267183
臺中市南屯區同心里15鄰大墩三街158號,66,6600700,同心里,15鄰,大墩三街,,,,,,158號,120.648982494604,24.139597262463
臺中市南屯區同心里15鄰大墩三街160號,66,6600700,同心里,15鄰,大墩三街,,,,,,160號,120.648937826522,24.139596338088
臺中市南屯區同心里18鄰大墩三街161巷2號,66,6600700,同心里,18鄰,大墩三街,,161巷,,,,2號,120.648836642578,24.139367989143
臺中市南屯區同心里18鄰大墩三街161巷6號,66,6600700,同心里,18鄰,大墩三街,,161巷,,,,6號,120.64884536012,24.139325156136
臺中市南屯區同心里18鄰大墩三街161巷8號,66,6600700,同心里,18鄰,大墩三街,,161巷,,,,8號,120.648823231891,24.139285385345
臺中市南屯區同心里18鄰大墩三街161巷10號,66,6600700,同心里,18鄰,大墩三街,,161巷,,,,10號,120.648817979055,24.139238059729
臺中市南屯區同心里18鄰大墩三街161巷12號,66,6600700,同心里,18鄰,大墩三街,,161巷,,,,12號,120.648818692727,24.139192914868
臺中市南屯區同心里18鄰大墩三街161巷16號,66,6600700,同心里,18鄰,大墩三街,,161巷,,,,16號,120.648825504041,24.139148768228
臺中市南屯區同心里15鄰大墩三街162號,66,6600700,同心里,15鄰,大墩三街,,,,,,162號,120.648894337626,24.139595976228
臺中市南屯區同心里18鄰大墩三街163號,66,6600700,同心里,18鄰,大墩三街,,,,,,163號,120.648725495935,24.139307733747
臺中市南屯區同心里18鄰大墩三街165號,66,6600700,同心里,18鄰,大墩三街,,,,,,165號,120.648662031748,24.13930758771
臺中市南屯區同心里15鄰大墩三街166號,66,6600700,同心里,15鄰,大墩三街,,,,,,166號,120.648850062868,24.139595504197
臺中市南屯區同心里18鄰大墩三街167巷1號,66,6600700,同心里,18鄰,大墩三街,,167巷,,,,1號,120.648692883242,24.139216011308
臺中市南屯區同心里18鄰大墩三街167巷2號,66,6600700,同心里,18鄰,大墩三街,,167巷,,,,2號,120.64869403568,24.139153982667
臺中市南屯區同心里18鄰大墩三街167巷3號,66,6600700,同心里,18鄰,大墩三街,,167巷,,,,3號,120.648513170392,24.139161593422
臺中市南屯區同心里18鄰大墩三街167巷6號,66,6600700,同心里,18鄰,大墩三街,,167巷,,,,6號,120.648520870951,24.139223741765
臺中市南屯區同心里15鄰大墩三街168號,66,6600700,同心里,15鄰,大墩三街,,,,,,168號,120.648803819246,24.139595036653
臺中市南屯區同心里18鄰大墩三街169號,66,6600700,同心里,18鄰,大墩三街,,,,,,169號,120.648557839227,24.139306165057
臺中市南屯區同心里15鄰大墩三街170之1號,66,6600700,同心里,15鄰,大墩三街,,,,,,170之1號,120.648720362575,24.139586889834
臺中市南屯區同心里15鄰大墩三街170之3號,66,6600700,同心里,15鄰,大墩三街,,,,,,170之3號,120.648637275518,24.139582834092
臺中市南屯區同心里15鄰大墩三街170之2號,66,6600700,同心里,15鄰,大墩三街,,,,,,170之2號,120.648678910602,24.139584663535
臺中市南屯區同心里15鄰大墩三街170號,66,6600700,同心里,15鄰,大墩三街,,,,,,170號,120.648765898863,24.13958227228
臺中市南屯區同心里18鄰大墩三街171號,66,6600700,同心里,18鄰,大墩三街,,,,,,171號,120.648513667139,24.139303806042
臺中市南屯區同心里18鄰大墩三街173號,66,6600700,同心里,18鄰,大墩三街,,,,,,173號,120.648472245328,24.139303177944
臺中市南屯區同心里18鄰大墩三街175號,66,6600700,同心里,18鄰,大墩三街,,,,,,175號,120.648429621376,24.139310384498
臺中市南屯區同心里15鄰大墩三街176號,66,6600700,同心里,15鄰,大墩三街,,,,,,176號,120.648502181172,24.139555922798
臺中市南屯區同心里18鄰大墩三街177號,66,6600700,同心里,18鄰,大墩三街,,,,,,177號,120.648388099715,24.139310288875
臺中市南屯區同心里15鄰大墩三街178號,66,6600700,同心里,15鄰,大墩三街,,,,,,178號,120.648459265894,24.139604871141
臺中市南屯區同心里18鄰大墩三街179號,66,6600700,同心里,18鄰,大墩三街,,,,,,179號,120.648345393125,24.139311373349
臺中市南屯區同心里15鄰大墩三街180號,66,6600700,同心里,15鄰,大墩三街,,,,,,180號,120.648398916397,24.139519206638
臺中市南屯區同心里15鄰大墩三街180之2號,66,6600700,同心里,15鄰,大墩三街,,,,,,180之2號,120.648346613588,24.139552250791
臺中市南屯區同心里15鄰大墩三街180之1號,66,6600700,同心里,15鄰,大墩三街,,,,,,180之1號,120.648360024832,24.139530223103
臺中市南屯區同心里15鄰大墩三街180號二樓之3,66,6600700,同心里,15鄰,大墩三街,,,,,,180號二樓之3,120.648398916397,24.139519206638
臺中市南屯區同心里15鄰大墩三街180號二樓之2,66,6600700,同心里,15鄰,大墩三街,,,,,,180號二樓之2,120.648398916397,24.139519206638
臺中市南屯區同心里15鄰大墩三街180號二樓之1,66,6600700,同心里,15鄰,大墩三街,,,,,,180號二樓之1,120.648398916397,24.139519206638
臺中市南屯區同心里15鄰大墩三街180號三樓之2,66,6600700,同心里,15鄰,大墩三街,,,,,,180號三樓之2,120.648398916397,24.139519206638
臺中市南屯區同心里15鄰大墩三街180號三樓之3,66,6600700,同心里,15鄰,大墩三街,,,,,,180號三樓之3,120.648398916397,24.139519206638
臺中市南屯區同心里15鄰大墩三街180號三樓之1,66,6600700,同心里,15鄰,大墩三街,,,,,,180號三樓之1,120.648398916397,24.139519206638
臺中市南屯區同心里15鄰大墩三街180號四樓之3,66,6600700,同心里,15鄰,大墩三街,,,,,,180號四樓之3,120.648398916397,24.139519206638
