FULL_ADDR,COUNTY,TOWN,VILLAGE,NEIGHBORHOOD,ROAD,SECTION,LANE,ALLEY,SUB_ALLEY,TONG,NUMBER,X,Y
臺中市南屯區同心里15鄰大墩三街180號四樓之1,66,6600700,同心里,15鄰,大墩三街,,,,,,180號四樓之1,120.648398916397,24.139519206638
臺中市南屯區同心里15鄰大墩三街180號四樓之2,66,6600700,同心里,15鄰,大墩三街,,,,,,180號四樓之2,120.648398916397,24.139519206638
臺中市南屯區同心里15鄰大墩三街180號五樓之3,66,6600700,同心里,15鄰,大墩三街,,,,,,180號五樓之3,120.648398916397,24.139519206638
臺中市南屯區同心里15鄰大墩三街180號五樓之2,66,6600700,同心里,15鄰,大墩三街,,,,,,180號五樓之2,120.648398916397,24.139519206638
臺中市南屯區同心里15鄰大墩三街180號五樓之1,66,6600700,同心里,15鄰,大墩三街,,,,,,180號五樓之1,120.648398916397,24.139519206638
臺中市南屯區同心里15鄰大墩三街180號六樓之1,66,6600700,同心里,15鄰,大墩三街,,,,,,180號六樓之1,120.648398916397,24.139519206638
臺中市南屯區同心里15鄰大墩三街180號六樓之2,66,6600700,同心里,15鄰,大墩三街,,,,,,180號六樓之2,120.648398916397,24.139519206638
臺中市南屯區同心里15鄰大墩三街180號七樓之1,66,6600700,同心里,15鄰,大墩三街,,,,,,180號七樓之1,120.648398916397,24.139519206638
臺中市南屯區同心里15鄰大墩三街180號七樓之2,66,6600700,同心里,15鄰,大墩三街,,,,,,180號七樓之2,120.648398916397,24.139519206638
臺中市南屯區同心里15鄰大墩三街180號七樓之3,66,6600700,同心里,15鄰,大墩三街,,,,,,180號七樓之3,120.648398916397,24.139519206638
臺中市南屯區同心里15鄰大墩三街180號八樓之1,66,6600700,同心里,15鄰,大墩三街,,,,,,180號八樓之1,120.648398916397,24.139519206638
臺中市南屯區同心里18鄰大墩三街181巷1號,66,6600700,同心里,18鄰,大墩三街,,181巷,,,,1號,120.648383636381,24.139215389681
臺中市南屯區同心里18鄰大墩三街181巷2號,66,6600700,同心里,18鄰,大墩三街,,181巷,,,,2號,120.648164526191,24.139211634338
臺中市南屯區同心里18鄰大墩三街181巷3號,66,6600700,同心里,18鄰,大墩三街,,181巷,,,,3號,120.648391554091,24.139162496218
臺中市南屯區同心里18鄰大墩三街181巷6號,66,6600700,同心里,18鄰,大墩三街,,181巷,,,,6號,120.648160738749,24.13915744981
臺中市南屯區同心里18鄰大墩三街183號,66,6600700,同心里,18鄰,大墩三街,,,,,,183號,120.648251344156,24.13930664204
臺中市南屯區同心里18鄰大墩三街185號,66,6600700,同心里,18鄰,大墩三街,,,,,,185號,120.648207661097,24.13930535855
臺中市南屯區同心里15鄰大墩三街186號,66,6600700,同心里,15鄰,大墩三街,,,,,,186號,120.648254077187,24.139553473274
臺中市南屯區同心里18鄰大墩三街187號,66,6600700,同心里,18鄰,大墩三街,,,,,,187號,120.648164761922,24.139304907549
臺中市南屯區同心里15鄰大墩三街188號,66,6600700,同心里,15鄰,大墩三街,,,,,,188號,120.648185681133,24.139574281709
臺中市南屯區同心里18鄰大墩三街189號,66,6600700,同心里,18鄰,大墩三街,,,,,,189號,120.648122473383,24.139297767233
臺中市南屯區同心里15鄰大墩三街190號,66,6600700,同心里,15鄰,大墩三街,,,,,,190號,120.648090462482,24.139514405671
臺中市南屯區同心里15鄰大墩三街190號二樓,66,6600700,同心里,15鄰,大墩三街,,,,,,190號二樓,120.648090462482,24.139514405671
臺中市南屯區同心里15鄰大墩三街190號三樓,66,6600700,同心里,15鄰,大墩三街,,,,,,190號三樓,120.648090462482,24.139514405671
臺中市南屯區同心里15鄰大墩三街190號四樓,66,6600700,同心里,15鄰,大墩三街,,,,,,190號四樓,120.648090462482,24.139514405671
臺中市南屯區同心里15鄰大墩三街190號五樓,66,6600700,同心里,15鄰,大墩三街,,,,,,190號五樓,120.648090462482,24.139514405671
臺中市南屯區同心里15鄰大墩三街190號六樓,66,6600700,同心里,15鄰,大墩三街,,,,,,190號六樓,120.648090462482,24.139514405671
臺中市南屯區同心里15鄰大墩三街192號,66,6600700,同心里,15鄰,大墩三街,,,,,,192號,120.648018043094,24.139557145953
臺中市南屯區同心里15鄰大墩三街192號二樓,66,6600700,同心里,15鄰,大墩三街,,,,,,192號二樓,120.648018043094,24.139557145953
臺中市南屯區同心里15鄰大墩三街192號三樓,66,6600700,同心里,15鄰,大墩三街,,,,,,192號三樓,120.648018043094,24.139557145953
臺中市南屯區同心里15鄰大墩三街192號四樓,66,6600700,同心里,15鄰,大墩三街,,,,,,192號四樓,120.648018043094,24.139557145953
臺中市南屯區同心里15鄰大墩三街192號五樓,66,6600700,同心里,15鄰,大墩三街,,,,,,192號五樓,120.648018043094,24.139557145953
臺中市南屯區同心里15鄰大墩三街192號六樓,66,6600700,同心里,15鄰,大墩三街,,,,,,192號六樓,120.648018043094,24.139557145953
臺中市南屯區同心里15鄰大墩三街196號,66,6600700,同心里,15鄰,大墩三街,,,,,,196號,120.64792090695,24.139570529125
臺中市南屯區同心里15鄰大墩三街196號二樓,66,6600700,同心里,15鄰,大墩三街,,,,,,196號二樓,120.64792090695,24.139570529125
臺中市南屯區同心里15鄰大墩三街196號三樓,66,6600700,同心里,15鄰,大墩三街,,,,,,196號三樓,120.64792090695,24.139570529125
臺中市南屯區同心里15鄰大墩三街196號四樓,66,6600700,同心里,15鄰,大墩三街,,,,,,196號四樓,120.64792090695,24.139570529125
臺中市南屯區同心里15鄰大墩三街196號五樓,66,6600700,同心里,15鄰,大墩三街,,,,,,196號五樓,120.64792090695,24.139570529125
臺中市南屯區同心里15鄰大墩三街196號六樓,66,6600700,同心里,15鄰,大墩三街,,,,,,196號六樓,120.64792090695,24.139570529125
臺中市南屯區同心里15鄰大墩三街206號,66,6600700,同心里,15鄰,大墩三街,,,,,,206號,120.64781638765,24.139579850077
臺中市南屯區同心里15鄰大墩三街208號,66,6600700,同心里,15鄰,大墩三街,,,,,,208號,120.647766497301,24.139581640161
臺中市南屯區同心里15鄰大墩三街210號,66,6600700,同心里,15鄰,大墩三街,,,,,,210號,120.647723600803,24.139580538932
臺中市南屯區同心里15鄰大墩三街212號,66,6600700,同心里,15鄰,大墩三街,,,,,,212號,120.647680999212,24.139579537694
臺中市南屯區同心里15鄰大墩三街216號,66,6600700,同心里,15鄰,大墩三街,,,,,,216號,120.647631115066,24.139579422566
