FULL_ADDR,COUNTY,TOWN,VILLAGE,NEIGHBORHOOD,ROAD,SECTION,LANE,ALLEY,SUB_ALLEY,TONG,NUMBER,X,Y
臺中市清水區海濱里14鄰北一路11之1號,66,6601200,海濱里,14鄰,北一路,,,,,,11之1號,120.532145797888,24.281928076109
臺中市清水區海濱里14鄰北一路11號,66,6601200,海濱里,14鄰,北一路,,,,,,11號,120.531966090622,24.282145673586
臺中市清水區海濱里14鄰北一路15號,66,6601200,海濱里,14鄰,北一路,,,,,,15號,120.530551195045,24.281847568317
臺中市清水區海濱里14鄰北一路18號,66,6601200,海濱里,14鄰,北一路,,,,,,18號,120.530804228792,24.282397857163
臺中市清水區海濱里14鄰北一路80號,66,6601200,海濱里,14鄰,北一路,,,,,,80號,120.526680204236,24.281905673802
