FULL_ADDR,COUNTY,TOWN,VILLAGE,NEIGHBORHOOD,ROAD,SECTION,LANE,ALLEY,SUB_ALLEY,TONG,NUMBER,X,Y
臺中市大安區松雅里2鄰松圳路17號,66,6602200,松雅里,2鄰,松圳路,,,,,,17號,120.603597712996,24.362978464389
臺中市大安區松雅里2鄰松圳路47號二樓之1,66,6602200,松雅里,2鄰,松圳路,,,,,,47號二樓之1,120.604718495259,24.36272634813
臺中市大安區松雅里2鄰松圳路47號二樓之2,66,6602200,松雅里,2鄰,松圳路,,,,,,47號二樓之2,120.604718495259,24.36272634813
臺中市大安區松雅里2鄰松圳路47號二樓之3,66,6602200,松雅里,2鄰,松圳路,,,,,,47號二樓之3,120.604718495259,24.36272634813
臺中市大安區松雅里2鄰松圳路47號二樓之5,66,6602200,松雅里,2鄰,松圳路,,,,,,47號二樓之5,120.604718495259,24.36272634813
臺中市大安區松雅里2鄰松圳路47號三樓之1,66,6602200,松雅里,2鄰,松圳路,,,,,,47號三樓之1,120.604718495259,24.36272634813
臺中市大安區松雅里2鄰松圳路47號三樓之2,66,6602200,松雅里,2鄰,松圳路,,,,,,47號三樓之2,120.604718495259,24.36272634813
臺中市大安區松雅里2鄰松圳路47號三樓之3,66,6602200,松雅里,2鄰,松圳路,,,,,,47號三樓之3,120.604718495259,24.36272634813
臺中市大安區松雅里2鄰松圳路47號三樓之5,66,6602200,松雅里,2鄰,松圳路,,,,,,47號三樓之5,120.604718495259,24.36272634813
臺中市大安區松雅里2鄰松圳路47號四樓之1,66,6602200,松雅里,2鄰,松圳路,,,,,,47號四樓之1,120.604718495259,24.36272634813
臺中市大安區松雅里2鄰松圳路47號四樓之2,66,6602200,松雅里,2鄰,松圳路,,,,,,47號四樓之2,120.604718495259,24.36272634813
臺中市大安區松雅里2鄰松圳路47號四樓之3,66,6602200,松雅里,2鄰,松圳路,,,,,,47號四樓之3,120.604718495259,24.36272634813
臺中市大安區松雅里2鄰松圳路47號四樓之5,66,6602200,松雅里,2鄰,松圳路,,,,,,47號四樓之5,120.604718495259,24.36272634813
臺中市大安區松雅里2鄰松圳路47號五樓之1,66,6602200,松雅里,2鄰,松圳路,,,,,,47號五樓之1,120.604718495259,24.36272634813
臺中市大安區松雅里2鄰松圳路47號五樓之2,66,6602200,松雅里,2鄰,松圳路,,,,,,47號五樓之2,120.604718495259,24.36272634813
臺中市大安區松雅里2鄰松圳路47號五樓之3,66,6602200,松雅里,2鄰,松圳路,,,,,,47號五樓之3,120.604718495259,24.36272634813
臺中市大安區松雅里2鄰松圳路47號五樓之5,66,6602200,松雅里,2鄰,松圳路,,,,,,47號五樓之5,120.604718495259,24.36272634813
臺中市大安區松雅里2鄰松圳路47號六樓之1,66,6602200,松雅里,2鄰,松圳路,,,,,,47號六樓之1,120.604718495259,24.36272634813
臺中市大安區松雅里2鄰松圳路47號六樓之2,66,6602200,松雅里,2鄰,松圳路,,,,,,47號六樓之2,120.604718495259,24.36272634813
臺中市大安區松雅里2鄰松圳路47號六樓之3,66,6602200,松雅里,2鄰,松圳路,,,,,,47號六樓之3,120.604718495259,24.36272634813
臺中市大安區松雅里2鄰松圳路47號六樓之5,66,6602200,松雅里,2鄰,松圳路,,,,,,47號六樓之5,120.604718495259,24.36272634813
臺中市大安區松雅里2鄰松圳路47號七樓之1,66,6602200,松雅里,2鄰,松圳路,,,,,,47號七樓之1,120.604718495259,24.36272634813
臺中市大安區松雅里2鄰松圳路47號七樓之2,66,6602200,松雅里,2鄰,松圳路,,,,,,47號七樓之2,120.604718495259,24.36272634813
臺中市大安區松雅里2鄰松圳路47號七樓之3,66,6602200,松雅里,2鄰,松圳路,,,,,,47號七樓之3,120.604718495259,24.36272634813
臺中市大安區松雅里2鄰松圳路47號七樓之5,66,6602200,松雅里,2鄰,松圳路,,,,,,47號七樓之5,120.604718495259,24.36272634813
臺中市大安區松雅里2鄰松圳路47號八樓之1,66,6602200,松雅里,2鄰,松圳路,,,,,,47號八樓之1,120.604718495259,24.36272634813
臺中市大安區松雅里2鄰松圳路47號八樓之2,66,6602200,松雅里,2鄰,松圳路,,,,,,47號八樓之2,120.604718495259,24.36272634813
臺中市大安區松雅里2鄰松圳路47號八樓之3,66,6602200,松雅里,2鄰,松圳路,,,,,,47號八樓之3,120.604718495259,24.36272634813
臺中市大安區松雅里2鄰松圳路47號八樓之5,66,6602200,松雅里,2鄰,松圳路,,,,,,47號八樓之5,120.604718495259,24.36272634813
臺中市大安區松雅里2鄰松圳路49號,66,6602200,松雅里,2鄰,松圳路,,,,,,49號,120.604882025807,24.362761084593
臺中市大安區松雅里2鄰松圳路49之1號,66,6602200,松雅里,2鄰,松圳路,,,,,,49之1號,120.604929802583,24.362762229367
臺中市大安區松雅里2鄰松圳路49之2號,66,6602200,松雅里,2鄰,松圳路,,,,,,49之2號,120.604968778265,24.362765671651
臺中市大安區松雅里2鄰松圳路49之3號,66,6602200,松雅里,2鄰,松圳路,,,,,,49之3號,120.605017813134,24.36276795733
臺中市大安區松雅里2鄰松圳路55號,66,6602200,松雅里,2鄰,松圳路,,,,,,55號,120.605342234798,24.362704046083
臺中市大安區松雅里2鄰松圳路11號,66,6602200,松雅里,2鄰,松圳路,,,,,,11號,120.603390821847,24.363023709427
臺中市大安區松雅里2鄰松圳路13號,66,6602200,松雅里,2鄰,松圳路,,,,,,13號,120.603488437741,24.363012019366
臺中市大安區松雅里2鄰松圳路15號,66,6602200,松雅里,2鄰,松圳路,,,,,,15號,120.603546354822,24.363000559517
臺中市大安區松雅里2鄰松圳路25號,66,6602200,松雅里,2鄰,松圳路,,,,,,25號,120.603771507866,24.362919598101
臺中市大安區松雅里2鄰松圳路31號,66,6602200,松雅里,2鄰,松圳路,,,,,,31號,120.603983452673,24.362853283012
臺中市大安區松雅里2鄰松圳路39號,66,6602200,松雅里,2鄰,松圳路,,,,,,39號,120.604367990945,24.362724341442
臺中市大安區松雅里2鄰松圳路41號,66,6602200,松雅里,2鄰,松圳路,,,,,,41號,120.604441287286,24.36271053772
臺中市大安區松雅里2鄰松圳路43號,66,6602200,松雅里,2鄰,松圳路,,,,,,43號,120.60454192902,24.362682918675
臺中市大安區松雅里2鄰松圳路53號,66,6602200,松雅里,2鄰,松圳路,,,,,,53號,120.605246032153,24.362773418315
臺中市大安區松雅里2鄰松圳路67號,66,6602200,松雅里,2鄰,松圳路,,,,,,67號,120.605734095976,24.362544457581
臺中市大安區松雅里2鄰松圳路69之1號,66,6602200,松雅里,2鄰,松圳路,,,,,,69之1號,120.605846476282,24.362510502739
臺中市大安區松雅里2鄰松圳路69號,66,6602200,松雅里,2鄰,松圳路,,,,,,69號,120.605793198613,24.362530697554
臺中市大安區松雅里2鄰松圳路71號,66,6602200,松雅里,2鄰,松圳路,,,,,,71號,120.605894460809,24.362499919068
臺中市大安區松雅里2鄰松圳路73號,66,6602200,松雅里,2鄰,松圳路,,,,,,73號,120.60648146537,24.362221914651
臺中市大安區松雅里2鄰松圳路88號,66,6602200,松雅里,2鄰,松圳路,,,,,,88號,120.605895403916,24.362345001812
