FULL_ADDR,COUNTY,TOWN,VILLAGE,NEIGHBORHOOD,ROAD,SECTION,LANE,ALLEY,SUB_ALLEY,TONG,NUMBER,X,Y
臺中市北屯區水景里7鄰景賢六路206號,66,6600800,水景里,7鄰,景賢六路,,,,,,206號,120.712056003734,24.168220858123
臺中市北屯區水景里7鄰景賢六路208號,66,6600800,水景里,7鄰,景賢六路,,,,,,208號,120.712154757748,24.168263121068
臺中市北屯區水景里7鄰景賢六路210號,66,6600800,水景里,7鄰,景賢六路,,,,,,210號,120.712212060054,24.168288709887
臺中市北屯區水景里7鄰景賢六路212號,66,6600800,水景里,7鄰,景賢六路,,,,,,212號,120.712285210992,24.168273136898
臺中市北屯區水景里7鄰景賢六路216號,66,6600800,水景里,7鄰,景賢六路,,,,,,216號,120.712341293142,24.168310949044
臺中市北屯區水景里7鄰景賢六路218號,66,6600800,水景里,7鄰,景賢六路,,,,,,218號,120.712422978962,24.168303166314
臺中市北屯區水景里7鄰景賢六路237號,66,6600800,水景里,7鄰,景賢六路,,,,,,237號,120.711753890359,24.168186535974
臺中市北屯區水景里7鄰景賢六路239號,66,6600800,水景里,7鄰,景賢六路,,,,,,239號,120.711748525461,24.168290543408
臺中市北屯區水景里36鄰景賢六路15號,66,6600800,水景里,36鄰,景賢六路,,,,,,15號,120.711793432544,24.165120502475
臺中市北屯區水景里36鄰景賢六路17號,66,6600800,水景里,36鄰,景賢六路,,,,,,17號,120.711784963644,24.16518164197
臺中市北屯區水景里36鄰景賢六路17號三樓之1,66,6600800,水景里,36鄰,景賢六路,,,,,,17號三樓之1,120.711784963644,24.16518164197
臺中市北屯區水景里36鄰景賢六路17號三樓之2,66,6600800,水景里,36鄰,景賢六路,,,,,,17號三樓之2,120.711784963644,24.16518164197
臺中市北屯區水景里36鄰景賢六路17號三樓之3,66,6600800,水景里,36鄰,景賢六路,,,,,,17號三樓之3,120.711784963644,24.16518164197
臺中市北屯區水景里36鄰景賢六路17號四樓之1,66,6600800,水景里,36鄰,景賢六路,,,,,,17號四樓之1,120.711784963644,24.16518164197
臺中市北屯區水景里36鄰景賢六路17號四樓之2,66,6600800,水景里,36鄰,景賢六路,,,,,,17號四樓之2,120.711784963644,24.16518164197
臺中市北屯區水景里36鄰景賢六路17號四樓之3,66,6600800,水景里,36鄰,景賢六路,,,,,,17號四樓之3,120.711784963644,24.16518164197
臺中市北屯區水景里36鄰景賢六路17號五樓之1,66,6600800,水景里,36鄰,景賢六路,,,,,,17號五樓之1,120.711784963644,24.16518164197
臺中市北屯區水景里36鄰景賢六路17號五樓之2,66,6600800,水景里,36鄰,景賢六路,,,,,,17號五樓之2,120.711784963644,24.16518164197
臺中市北屯區水景里36鄰景賢六路17號五樓之3,66,6600800,水景里,36鄰,景賢六路,,,,,,17號五樓之3,120.711784963644,24.16518164197
臺中市北屯區水景里36鄰景賢六路17號六樓之1,66,6600800,水景里,36鄰,景賢六路,,,,,,17號六樓之1,120.711784963644,24.16518164197
臺中市北屯區水景里36鄰景賢六路17號六樓之2,66,6600800,水景里,36鄰,景賢六路,,,,,,17號六樓之2,120.711784963644,24.16518164197
臺中市北屯區水景里36鄰景賢六路17號六樓之3,66,6600800,水景里,36鄰,景賢六路,,,,,,17號六樓之3,120.711784963644,24.16518164197
臺中市北屯區水景里36鄰景賢六路17號七樓之1,66,6600800,水景里,36鄰,景賢六路,,,,,,17號七樓之1,120.711784963644,24.16518164197
臺中市北屯區水景里36鄰景賢六路17號七樓之2,66,6600800,水景里,36鄰,景賢六路,,,,,,17號七樓之2,120.711784963644,24.16518164197
臺中市北屯區水景里36鄰景賢六路17號七樓之3,66,6600800,水景里,36鄰,景賢六路,,,,,,17號七樓之3,120.711784963644,24.16518164197
臺中市北屯區水景里36鄰景賢六路17號八樓之1,66,6600800,水景里,36鄰,景賢六路,,,,,,17號八樓之1,120.711784963644,24.16518164197
臺中市北屯區水景里36鄰景賢六路17號八樓之2,66,6600800,水景里,36鄰,景賢六路,,,,,,17號八樓之2,120.711784963644,24.16518164197
臺中市北屯區水景里36鄰景賢六路17號八樓之3,66,6600800,水景里,36鄰,景賢六路,,,,,,17號八樓之3,120.711784963644,24.16518164197
臺中市北屯區水景里36鄰景賢六路17號九樓之1,66,6600800,水景里,36鄰,景賢六路,,,,,,17號九樓之1,120.711784963644,24.16518164197
臺中市北屯區水景里36鄰景賢六路17號九樓之2,66,6600800,水景里,36鄰,景賢六路,,,,,,17號九樓之2,120.711784963644,24.16518164197
臺中市北屯區水景里36鄰景賢六路17號九樓之3,66,6600800,水景里,36鄰,景賢六路,,,,,,17號九樓之3,120.711784963644,24.16518164197
臺中市北屯區水景里36鄰景賢六路17號十樓之1,66,6600800,水景里,36鄰,景賢六路,,,,,,17號十樓之1,120.711784963644,24.16518164197
臺中市北屯區水景里36鄰景賢六路17號十樓之2,66,6600800,水景里,36鄰,景賢六路,,,,,,17號十樓之2,120.711784963644,24.16518164197
臺中市北屯區水景里36鄰景賢六路17號十樓之3,66,6600800,水景里,36鄰,景賢六路,,,,,,17號十樓之3,120.711784963644,24.16518164197
臺中市北屯區水景里36鄰景賢六路17號十一樓之1,66,6600800,水景里,36鄰,景賢六路,,,,,,17號十一樓之1,120.711784963644,24.16518164197
臺中市北屯區水景里36鄰景賢六路17號十一樓之2,66,6600800,水景里,36鄰,景賢六路,,,,,,17號十一樓之2,120.711784963644,24.16518164197
臺中市北屯區水景里36鄰景賢六路17號十一樓之3,66,6600800,水景里,36鄰,景賢六路,,,,,,17號十一樓之3,120.711784963644,24.16518164197
臺中市北屯區水景里36鄰景賢六路17號十二樓之1,66,6600800,水景里,36鄰,景賢六路,,,,,,17號十二樓之1,120.711784963644,24.16518164197
臺中市北屯區水景里36鄰景賢六路17號十二樓之2,66,6600800,水景里,36鄰,景賢六路,,,,,,17號十二樓之2,120.711784963644,24.16518164197
臺中市北屯區水景里36鄰景賢六路19號,66,6600800,水景里,36鄰,景賢六路,,,,,,19號,120.711784689102,24.16530396147
臺中市北屯區水景里36鄰景賢六路21號,66,6600800,水景里,36鄰,景賢六路,,,,,,21號,120.711710570041,24.165494610661
臺中市北屯區水景里36鄰景賢六路23號,66,6600800,水景里,36鄰,景賢六路,,,,,,23號,120.71172074964,24.165569708581
臺中市北屯區水景里36鄰景賢六路25號,66,6600800,水景里,36鄰,景賢六路,,,,,,25號,120.711721674743,24.165626251845
臺中市北屯區水景里36鄰景賢六路27號,66,6600800,水景里,36鄰,景賢六路,,,,,,27號,120.711716121961,24.165690376514
臺中市北屯區水景里36鄰景賢六路200號,66,6600800,水景里,36鄰,景賢六路,,,,,,200號,120.712161011083,24.16655670269
臺中市北屯區水景里36鄰景賢六路201號,66,6600800,水景里,36鄰,景賢六路,,,,,,201號,120.711534013236,24.166910803366
臺中市北屯區水景里7鄰景賢六路222之1號,66,6600800,水景里,7鄰,景賢六路,,,,,,222之1號,120.712209887105,24.168342682963
臺中市北屯區水景里7鄰景賢六路223號,66,6600800,水景里,7鄰,景賢六路,,,,,,223號,120.711730753253,24.167685320756
臺中市北屯區水景里7鄰景賢六路226號,66,6600800,水景里,7鄰,景賢六路,,,,,,226號,120.712162854448,24.168412363643
臺中市北屯區水景里7鄰景賢六路227號,66,6600800,水景里,7鄰,景賢六路,,,,,,227號,120.711723510531,24.167745523495
臺中市北屯區水景里7鄰景賢六路228號,66,6600800,水景里,7鄰,景賢六路,,,,,,228號,120.712152664541,24.168493102501
臺中市北屯區水景里7鄰景賢六路229號,66,6600800,水景里,7鄰,景賢六路,,,,,,229號,120.711699907447,24.167796422217
臺中市北屯區水景里7鄰景賢六路230號,66,6600800,水景里,7鄰,景賢六路,,,,,,230號,120.712144482258,24.168573863205
臺中市北屯區水景里7鄰景賢六路231號,66,6600800,水景里,7鄰,景賢六路,,,,,,231號,120.711739064918,24.167856938381
臺中市北屯區水景里7鄰景賢六路233號,66,6600800,水景里,7鄰,景賢六路,,,,,,233號,120.711743087799,24.167919338471
臺中市北屯區水景里7鄰景賢六路255號,66,6600800,水景里,7鄰,景賢六路,,,,,,255號,120.711759127049,24.168568368007
