FULL_ADDR,COUNTY,TOWN,VILLAGE,NEIGHBORHOOD,ROAD,SECTION,LANE,ALLEY,SUB_ALLEY,TONG,NUMBER,X,Y
臺中市北屯區松竹里11鄰河北三街17號,66,6600800,松竹里,11鄰,河北三街,,,,,,17號,120.684638419465,24.180848450812
臺中市北屯區松竹里11鄰河北三街17號二樓,66,6600800,松竹里,11鄰,河北三街,,,,,,17號二樓,120.684638419465,24.180848450812
臺中市北屯區松竹里11鄰河北三街17號三樓之1,66,6600800,松竹里,11鄰,河北三街,,,,,,17號三樓之1,120.684638419465,24.180848450812
臺中市北屯區松竹里11鄰河北三街17號三樓之2,66,6600800,松竹里,11鄰,河北三街,,,,,,17號三樓之2,120.684638419465,24.180848450812
臺中市北屯區松竹里11鄰河北三街17號三樓之3,66,6600800,松竹里,11鄰,河北三街,,,,,,17號三樓之3,120.684638419465,24.180848450812
臺中市北屯區松竹里11鄰河北三街17號三樓之5,66,6600800,松竹里,11鄰,河北三街,,,,,,17號三樓之5,120.684638419465,24.180848450812
臺中市北屯區松竹里11鄰河北三街17號四樓之1,66,6600800,松竹里,11鄰,河北三街,,,,,,17號四樓之1,120.684638419465,24.180848450812
臺中市北屯區松竹里11鄰河北三街17號四樓之2,66,6600800,松竹里,11鄰,河北三街,,,,,,17號四樓之2,120.684638419465,24.180848450812
臺中市北屯區松竹里11鄰河北三街17號四樓之3,66,6600800,松竹里,11鄰,河北三街,,,,,,17號四樓之3,120.684638419465,24.180848450812
臺中市北屯區松竹里11鄰河北三街17號四樓之5,66,6600800,松竹里,11鄰,河北三街,,,,,,17號四樓之5,120.684638419465,24.180848450812
臺中市北屯區松竹里11鄰河北三街17號五樓之1,66,6600800,松竹里,11鄰,河北三街,,,,,,17號五樓之1,120.684638419465,24.180848450812
臺中市北屯區松竹里11鄰河北三街17號五樓之2,66,6600800,松竹里,11鄰,河北三街,,,,,,17號五樓之2,120.684638419465,24.180848450812
臺中市北屯區松竹里11鄰河北三街17號五樓之3,66,6600800,松竹里,11鄰,河北三街,,,,,,17號五樓之3,120.684638419465,24.180848450812
臺中市北屯區松竹里11鄰河北三街17號五樓之5,66,6600800,松竹里,11鄰,河北三街,,,,,,17號五樓之5,120.684638419465,24.180848450812
臺中市北屯區松竹里11鄰河北三街17號六樓之1,66,6600800,松竹里,11鄰,河北三街,,,,,,17號六樓之1,120.684638419465,24.180848450812
臺中市北屯區松竹里11鄰河北三街17號六樓之2,66,6600800,松竹里,11鄰,河北三街,,,,,,17號六樓之2,120.684638419465,24.180848450812
臺中市北屯區松竹里11鄰河北三街17號六樓之3,66,6600800,松竹里,11鄰,河北三街,,,,,,17號六樓之3,120.684638419465,24.180848450812
臺中市北屯區松竹里11鄰河北三街17號六樓之5,66,6600800,松竹里,11鄰,河北三街,,,,,,17號六樓之5,120.684638419465,24.180848450812
臺中市北屯區松竹里11鄰河北三街17號七樓之1,66,6600800,松竹里,11鄰,河北三街,,,,,,17號七樓之1,120.684638419465,24.180848450812
臺中市北屯區松竹里11鄰河北三街17號七樓之2,66,6600800,松竹里,11鄰,河北三街,,,,,,17號七樓之2,120.684638419465,24.180848450812
臺中市北屯區松竹里11鄰河北三街17號七樓之3,66,6600800,松竹里,11鄰,河北三街,,,,,,17號七樓之3,120.684638419465,24.180848450812
臺中市北屯區松竹里11鄰河北三街17號七樓之5,66,6600800,松竹里,11鄰,河北三街,,,,,,17號七樓之5,120.684638419465,24.180848450812
臺中市北屯區松竹里11鄰河北三街17號八樓之1,66,6600800,松竹里,11鄰,河北三街,,,,,,17號八樓之1,120.684638419465,24.180848450812
臺中市北屯區松竹里11鄰河北三街17號八樓之2,66,6600800,松竹里,11鄰,河北三街,,,,,,17號八樓之2,120.684638419465,24.180848450812
臺中市北屯區松竹里11鄰河北三街17號八樓之3,66,6600800,松竹里,11鄰,河北三街,,,,,,17號八樓之3,120.684638419465,24.180848450812
臺中市北屯區松竹里11鄰河北三街17號八樓之5,66,6600800,松竹里,11鄰,河北三街,,,,,,17號八樓之5,120.684638419465,24.180848450812
臺中市北屯區松竹里11鄰河北三街17號九樓之1,66,6600800,松竹里,11鄰,河北三街,,,,,,17號九樓之1,120.684638419465,24.180848450812
臺中市北屯區松竹里11鄰河北三街17號九樓之2,66,6600800,松竹里,11鄰,河北三街,,,,,,17號九樓之2,120.684638419465,24.180848450812
臺中市北屯區松竹里11鄰河北三街17號九樓之3,66,6600800,松竹里,11鄰,河北三街,,,,,,17號九樓之3,120.684638419465,24.180848450812
臺中市北屯區松竹里11鄰河北三街17號九樓之5,66,6600800,松竹里,11鄰,河北三街,,,,,,17號九樓之5,120.684638419465,24.180848450812
臺中市北屯區松竹里11鄰河北三街17號十樓之1,66,6600800,松竹里,11鄰,河北三街,,,,,,17號十樓之1,120.684638419465,24.180848450812
臺中市北屯區松竹里11鄰河北三街17號十樓之2,66,6600800,松竹里,11鄰,河北三街,,,,,,17號十樓之2,120.684638419465,24.180848450812
臺中市北屯區松竹里11鄰河北三街17號十樓之3,66,6600800,松竹里,11鄰,河北三街,,,,,,17號十樓之3,120.684638419465,24.180848450812
臺中市北屯區松竹里11鄰河北三街17號十樓之5,66,6600800,松竹里,11鄰,河北三街,,,,,,17號十樓之5,120.684638419465,24.180848450812
臺中市北屯區松竹里11鄰河北三街17號十一樓之1,66,6600800,松竹里,11鄰,河北三街,,,,,,17號十一樓之1,120.684638419465,24.180848450812
臺中市北屯區松竹里11鄰河北三街17號十一樓之2,66,6600800,松竹里,11鄰,河北三街,,,,,,17號十一樓之2,120.684638419465,24.180848450812
臺中市北屯區松竹里11鄰河北三街17號十一樓之3,66,6600800,松竹里,11鄰,河北三街,,,,,,17號十一樓之3,120.684638419465,24.180848450812
臺中市北屯區松竹里11鄰河北三街17號十一樓之5,66,6600800,松竹里,11鄰,河北三街,,,,,,17號十一樓之5,120.684638419465,24.180848450812
臺中市北屯區松竹里11鄰河北三街17號十二樓之1,66,6600800,松竹里,11鄰,河北三街,,,,,,17號十二樓之1,120.684638419465,24.180848450812
臺中市北屯區松竹里11鄰河北三街17號十二樓之2,66,6600800,松竹里,11鄰,河北三街,,,,,,17號十二樓之2,120.684638419465,24.180848450812
臺中市北屯區松竹里11鄰河北三街17號十二樓之3,66,6600800,松竹里,11鄰,河北三街,,,,,,17號十二樓之3,120.684638419465,24.180848450812
臺中市北屯區松竹里11鄰河北三街17號十二樓之5,66,6600800,松竹里,11鄰,河北三街,,,,,,17號十二樓之5,120.684638419465,24.180848450812
臺中市北屯區松竹里11鄰河北三街17號十三樓之1,66,6600800,松竹里,11鄰,河北三街,,,,,,17號十三樓之1,120.684638419465,24.180848450812
臺中市北屯區松竹里11鄰河北三街17號十三樓之2,66,6600800,松竹里,11鄰,河北三街,,,,,,17號十三樓之2,120.684638419465,24.180848450812
臺中市北屯區松竹里11鄰河北三街17號十三樓之3,66,6600800,松竹里,11鄰,河北三街,,,,,,17號十三樓之3,120.684638419465,24.180848450812
臺中市北屯區松竹里11鄰河北三街17號十三樓之5,66,6600800,松竹里,11鄰,河北三街,,,,,,17號十三樓之5,120.684638419465,24.180848450812
臺中市北屯區松竹里11鄰河北三街17號十四樓之1,66,6600800,松竹里,11鄰,河北三街,,,,,,17號十四樓之1,120.684638419465,24.180848450812
臺中市北屯區松竹里11鄰河北三街17號十四樓之2,66,6600800,松竹里,11鄰,河北三街,,,,,,17號十四樓之2,120.684638419465,24.180848450812
臺中市北屯區松竹里11鄰河北三街17號十四樓之3,66,6600800,松竹里,11鄰,河北三街,,,,,,17號十四樓之3,120.684638419465,24.180848450812
臺中市北屯區松竹里11鄰河北三街17號十四樓之5,66,6600800,松竹里,11鄰,河北三街,,,,,,17號十四樓之5,120.684638419465,24.180848450812
臺中市北屯區松竹里11鄰河北三街17號十五樓之1,66,6600800,松竹里,11鄰,河北三街,,,,,,17號十五樓之1,120.684638419465,24.180848450812
臺中市北屯區松竹里11鄰河北三街17號十五樓之2,66,6600800,松竹里,11鄰,河北三街,,,,,,17號十五樓之2,120.684638419465,24.180848450812
臺中市北屯區松竹里11鄰河北三街22號,66,6600800,松竹里,11鄰,河北三街,,,,,,22號,120.684830589821,24.181042011401
臺中市北屯區松竹里11鄰河北三街23號,66,6600800,松竹里,11鄰,河北三街,,,,,,23號,120.683901411032,24.180885145579
臺中市北屯區松竹里11鄰河北三街25號二樓,66,6600800,松竹里,11鄰,河北三街,,,,,,25號二樓,120.68382871836,24.18079421455
臺中市北屯區松竹里11鄰河北三街25號三樓,66,6600800,松竹里,11鄰,河北三街,,,,,,25號三樓,120.68382871836,24.18079421455
臺中市北屯區松竹里11鄰河北三街25號四樓,66,6600800,松竹里,11鄰,河北三街,,,,,,25號四樓,120.68382871836,24.18079421455
臺中市北屯區松竹里11鄰河北三街25號五樓,66,6600800,松竹里,11鄰,河北三街,,,,,,25號五樓,120.68382871836,24.18079421455
臺中市北屯區松竹里11鄰河北三街25號六樓,66,6600800,松竹里,11鄰,河北三街,,,,,,25號六樓,120.68382871836,24.18079421455
臺中市北屯區松竹里11鄰河北三街25號七樓,66,6600800,松竹里,11鄰,河北三街,,,,,,25號七樓,120.68382871836,24.18079421455
臺中市北屯區松竹里11鄰河北三街25號八樓,66,6600800,松竹里,11鄰,河北三街,,,,,,25號八樓,120.68382871836,24.18079421455
臺中市北屯區松竹里11鄰河北三街25號九樓,66,6600800,松竹里,11鄰,河北三街,,,,,,25號九樓,120.68382871836,24.18079421455
臺中市北屯區松竹里11鄰河北三街25號十樓,66,6600800,松竹里,11鄰,河北三街,,,,,,25號十樓,120.68382871836,24.18079421455
臺中市北屯區松竹里11鄰河北三街25號十一樓,66,6600800,松竹里,11鄰,河北三街,,,,,,25號十一樓,120.68382871836,24.18079421455
臺中市北屯區松竹里11鄰河北三街25號十二樓,66,6600800,松竹里,11鄰,河北三街,,,,,,25號十二樓,120.68382871836,24.18079421455
臺中市北屯區松竹里11鄰河北三街25號十三樓,66,6600800,松竹里,11鄰,河北三街,,,,,,25號十三樓,120.68382871836,24.18079421455
臺中市北屯區松竹里11鄰河北三街25號十四樓,66,6600800,松竹里,11鄰,河北三街,,,,,,25號十四樓,120.68382871836,24.18079421455
臺中市北屯區松竹里11鄰河北三街25號十五樓,66,6600800,松竹里,11鄰,河北三街,,,,,,25號十五樓,120.68382871836,24.18079421455
臺中市北屯區松竹里11鄰河北三街26號,66,6600800,松竹里,11鄰,河北三街,,,,,,26號,120.684780967537,24.181044870422
臺中市北屯區松竹里11鄰河北三街27號二樓,66,6600800,松竹里,11鄰,河北三街,,,,,,27號二樓,120.683825825761,24.180911273073
臺中市北屯區松竹里11鄰河北三街27號三樓,66,6600800,松竹里,11鄰,河北三街,,,,,,27號三樓,120.683825825761,24.180911273073
臺中市北屯區松竹里11鄰河北三街27號四樓,66,6600800,松竹里,11鄰,河北三街,,,,,,27號四樓,120.683825825761,24.180911273073
臺中市北屯區松竹里11鄰河北三街27號五樓,66,6600800,松竹里,11鄰,河北三街,,,,,,27號五樓,120.683825825761,24.180911273073
臺中市北屯區松竹里11鄰河北三街27號六樓,66,6600800,松竹里,11鄰,河北三街,,,,,,27號六樓,120.683825825761,24.180911273073
臺中市北屯區松竹里11鄰河北三街27號七樓,66,6600800,松竹里,11鄰,河北三街,,,,,,27號七樓,120.683825825761,24.180911273073
臺中市北屯區松竹里11鄰河北三街27號八樓,66,6600800,松竹里,11鄰,河北三街,,,,,,27號八樓,120.683825825761,24.180911273073
臺中市北屯區松竹里11鄰河北三街27號九樓,66,6600800,松竹里,11鄰,河北三街,,,,,,27號九樓,120.683825825761,24.180911273073
臺中市北屯區松竹里11鄰河北三街27號十樓,66,6600800,松竹里,11鄰,河北三街,,,,,,27號十樓,120.683825825761,24.180911273073
臺中市北屯區松竹里11鄰河北三街27號十一樓,66,6600800,松竹里,11鄰,河北三街,,,,,,27號十一樓,120.683825825761,24.180911273073
臺中市北屯區松竹里11鄰河北三街27號十二樓,66,6600800,松竹里,11鄰,河北三街,,,,,,27號十二樓,120.683825825761,24.180911273073
臺中市北屯區松竹里11鄰河北三街27號十三樓,66,6600800,松竹里,11鄰,河北三街,,,,,,27號十三樓,120.683825825761,24.180911273073
臺中市北屯區松竹里11鄰河北三街27號十四樓,66,6600800,松竹里,11鄰,河北三街,,,,,,27號十四樓,120.683825825761,24.180911273073
臺中市北屯區松竹里11鄰河北三街27號十五樓,66,6600800,松竹里,11鄰,河北三街,,,,,,27號十五樓,120.683825825761,24.180911273073
臺中市北屯區松竹里11鄰河北三街28號,66,6600800,松竹里,11鄰,河北三街,,,,,,28號,120.684734578016,24.181048738361
臺中市北屯區松竹里11鄰河北三街29號二樓,66,6600800,松竹里,11鄰,河北三街,,,,,,29號二樓,120.683643493621,24.180927617085
臺中市北屯區松竹里11鄰河北三街29號三樓,66,6600800,松竹里,11鄰,河北三街,,,,,,29號三樓,120.683643493621,24.180927617085
臺中市北屯區松竹里11鄰河北三街29號四樓,66,6600800,松竹里,11鄰,河北三街,,,,,,29號四樓,120.683643493621,24.180927617085
臺中市北屯區松竹里11鄰河北三街29號五樓,66,6600800,松竹里,11鄰,河北三街,,,,,,29號五樓,120.683643493621,24.180927617085
臺中市北屯區松竹里11鄰河北三街29號六樓,66,6600800,松竹里,11鄰,河北三街,,,,,,29號六樓,120.683643493621,24.180927617085
臺中市北屯區松竹里11鄰河北三街29號七樓,66,6600800,松竹里,11鄰,河北三街,,,,,,29號七樓,120.683643493621,24.180927617085
臺中市北屯區松竹里11鄰河北三街29號八樓,66,6600800,松竹里,11鄰,河北三街,,,,,,29號八樓,120.683643493621,24.180927617085
臺中市北屯區松竹里11鄰河北三街29號九樓,66,6600800,松竹里,11鄰,河北三街,,,,,,29號九樓,120.683643493621,24.180927617085
臺中市北屯區松竹里11鄰河北三街29號十樓,66,6600800,松竹里,11鄰,河北三街,,,,,,29號十樓,120.683643493621,24.180927617085
臺中市北屯區松竹里11鄰河北三街29號十一樓,66,6600800,松竹里,11鄰,河北三街,,,,,,29號十一樓,120.683643493621,24.180927617085
臺中市北屯區松竹里11鄰河北三街29號十二樓,66,6600800,松竹里,11鄰,河北三街,,,,,,29號十二樓,120.683643493621,24.180927617085
臺中市北屯區松竹里11鄰河北三街29號十三樓,66,6600800,松竹里,11鄰,河北三街,,,,,,29號十三樓,120.683643493621,24.180927617085
臺中市北屯區松竹里11鄰河北三街29號十四樓,66,6600800,松竹里,11鄰,河北三街,,,,,,29號十四樓,120.683643493621,24.180927617085
臺中市北屯區松竹里11鄰河北三街29號十五樓,66,6600800,松竹里,11鄰,河北三街,,,,,,29號十五樓,120.683643493621,24.180927617085
臺中市北屯區松竹里11鄰河北三街31號二樓,66,6600800,松竹里,11鄰,河北三街,,,,,,31號二樓,120.683638520899,24.180832049975
臺中市北屯區松竹里11鄰河北三街31號三樓,66,6600800,松竹里,11鄰,河北三街,,,,,,31號三樓,120.683638520899,24.180832049975
臺中市北屯區松竹里11鄰河北三街31號四樓,66,6600800,松竹里,11鄰,河北三街,,,,,,31號四樓,120.683638520899,24.180832049975
臺中市北屯區松竹里11鄰河北三街31號五樓,66,6600800,松竹里,11鄰,河北三街,,,,,,31號五樓,120.683638520899,24.180832049975
臺中市北屯區松竹里11鄰河北三街31號六樓,66,6600800,松竹里,11鄰,河北三街,,,,,,31號六樓,120.683638520899,24.180832049975
臺中市北屯區松竹里11鄰河北三街31號七樓,66,6600800,松竹里,11鄰,河北三街,,,,,,31號七樓,120.683638520899,24.180832049975
臺中市北屯區松竹里11鄰河北三街31號八樓,66,6600800,松竹里,11鄰,河北三街,,,,,,31號八樓,120.683638520899,24.180832049975
臺中市北屯區松竹里11鄰河北三街31號九樓,66,6600800,松竹里,11鄰,河北三街,,,,,,31號九樓,120.683638520899,24.180832049975
臺中市北屯區松竹里11鄰河北三街31號十樓,66,6600800,松竹里,11鄰,河北三街,,,,,,31號十樓,120.683638520899,24.180832049975
臺中市北屯區松竹里11鄰河北三街31號十一樓,66,6600800,松竹里,11鄰,河北三街,,,,,,31號十一樓,120.683638520899,24.180832049975
臺中市北屯區松竹里11鄰河北三街31號十二樓,66,6600800,松竹里,11鄰,河北三街,,,,,,31號十二樓,120.683638520899,24.180832049975
臺中市北屯區松竹里11鄰河北三街31號十三樓,66,6600800,松竹里,11鄰,河北三街,,,,,,31號十三樓,120.683638520899,24.180832049975
臺中市北屯區松竹里11鄰河北三街31號十四樓,66,6600800,松竹里,11鄰,河北三街,,,,,,31號十四樓,120.683638520899,24.180832049975
臺中市北屯區松竹里11鄰河北三街31號十五樓,66,6600800,松竹里,11鄰,河北三街,,,,,,31號十五樓,120.683638520899,24.180832049975
臺中市北屯區松竹里11鄰河北三街33號,66,6600800,松竹里,11鄰,河北三街,,,,,,33號,120.683476572289,24.180919126254
臺中市北屯區松竹里11鄰河北三街35號,66,6600800,松竹里,11鄰,河北三街,,,,,,35號,120.683381789188,24.180914152976
臺中市北屯區松竹里11鄰河北三街39號,66,6600800,松竹里,11鄰,河北三街,,,,,,39號,120.683281827356,24.180898649779
臺中市北屯區松竹里11鄰河北三街53號,66,6600800,松竹里,11鄰,河北三街,,,,,,53號,120.683167077862,24.180965905188
臺中市北屯區松竹里11鄰河北三街55號,66,6600800,松竹里,11鄰,河北三街,,,,,,55號,120.683120197152,24.180968191491
臺中市北屯區松竹里11鄰河北三街57號,66,6600800,松竹里,11鄰,河北三街,,,,,,57號,120.683068111048,24.180969284126
臺中市北屯區松竹里11鄰河北三街59號,66,6600800,松竹里,11鄰,河北三街,,,,,,59號,120.683018635033,24.180967980383
臺中市北屯區松竹里11鄰河北三街76號,66,6600800,松竹里,11鄰,河北三街,,,,,,76號,120.68370692001,24.181112370207
臺中市北屯區松竹里11鄰河北三街78號,66,6600800,松竹里,11鄰,河北三街,,,,,,78號,120.683641067781,24.181135402699
臺中市北屯區松竹里11鄰河北三街80號,66,6600800,松竹里,11鄰,河北三街,,,,,,80號,120.68358559307,24.181140253686
臺中市北屯區松竹里11鄰河北三街82號,66,6600800,松竹里,11鄰,河北三街,,,,,,82號,120.683520647851,24.181146303947
