FULL_ADDR,COUNTY,TOWN,VILLAGE,NEIGHBORHOOD,ROAD,SECTION,LANE,ALLEY,SUB_ALLEY,TONG,NUMBER,X,Y
臺中市南屯區三和里1鄰益豐東街19號,66,6600700,三和里,1鄰,益豐東街,,,,,,19號,120.632444322452,24.150093185266
臺中市南屯區三和里1鄰益豐東街56號,66,6600700,三和里,1鄰,益豐東街,,,,,,56號,120.632152706091,24.150297411132
臺中市南屯區三和里1鄰益豐東街65號,66,6600700,三和里,1鄰,益豐東街,,,,,,65號,120.63130974731,24.150058918372
臺中市南屯區三和里1鄰益豐東街66號,66,6600700,三和里,1鄰,益豐東街,,,,,,66號,120.631836802082,24.150282247696
臺中市南屯區三和里1鄰益豐東街18之1號,66,6600700,三和里,1鄰,益豐東街,,,,,,18之1號,120.632699057874,24.150137256453
臺中市南屯區三和里1鄰益豐東街18號二樓之5,66,6600700,三和里,1鄰,益豐東街,,,,,,18號二樓之5,120.632701739922,24.15008953415
臺中市南屯區三和里1鄰益豐東街18號二樓之3,66,6600700,三和里,1鄰,益豐東街,,,,,,18號二樓之3,120.632701739922,24.15008953415
臺中市南屯區三和里1鄰益豐東街18號二樓之2,66,6600700,三和里,1鄰,益豐東街,,,,,,18號二樓之2,120.632701739922,24.15008953415
臺中市南屯區三和里1鄰益豐東街18號二樓之1,66,6600700,三和里,1鄰,益豐東街,,,,,,18號二樓之1,120.632701739922,24.15008953415
臺中市南屯區三和里1鄰益豐東街18號三樓之5,66,6600700,三和里,1鄰,益豐東街,,,,,,18號三樓之5,120.632701739922,24.15008953415
臺中市南屯區三和里1鄰益豐東街18號三樓之3,66,6600700,三和里,1鄰,益豐東街,,,,,,18號三樓之3,120.632701739922,24.15008953415
臺中市南屯區三和里1鄰益豐東街18號三樓之2,66,6600700,三和里,1鄰,益豐東街,,,,,,18號三樓之2,120.632701739922,24.15008953415
臺中市南屯區三和里1鄰益豐東街18號三樓之1,66,6600700,三和里,1鄰,益豐東街,,,,,,18號三樓之1,120.632701739922,24.15008953415
臺中市南屯區三和里1鄰益豐東街18號四樓之5,66,6600700,三和里,1鄰,益豐東街,,,,,,18號四樓之5,120.632701739922,24.15008953415
臺中市南屯區三和里1鄰益豐東街18號四樓之3,66,6600700,三和里,1鄰,益豐東街,,,,,,18號四樓之3,120.632701739922,24.15008953415
臺中市南屯區三和里1鄰益豐東街18號四樓之2,66,6600700,三和里,1鄰,益豐東街,,,,,,18號四樓之2,120.632701739922,24.15008953415
臺中市南屯區三和里1鄰益豐東街18號四樓之1,66,6600700,三和里,1鄰,益豐東街,,,,,,18號四樓之1,120.632701739922,24.15008953415
臺中市南屯區三和里1鄰益豐東街18號五樓之5,66,6600700,三和里,1鄰,益豐東街,,,,,,18號五樓之5,120.632701739922,24.15008953415
臺中市南屯區三和里1鄰益豐東街18號五樓之3,66,6600700,三和里,1鄰,益豐東街,,,,,,18號五樓之3,120.632701739922,24.15008953415
臺中市南屯區三和里1鄰益豐東街18號五樓之2,66,6600700,三和里,1鄰,益豐東街,,,,,,18號五樓之2,120.632701739922,24.15008953415
臺中市南屯區三和里1鄰益豐東街18號五樓之1,66,6600700,三和里,1鄰,益豐東街,,,,,,18號五樓之1,120.632701739922,24.15008953415
臺中市南屯區三和里1鄰益豐東街18號六樓之5,66,6600700,三和里,1鄰,益豐東街,,,,,,18號六樓之5,120.632701739922,24.15008953415
臺中市南屯區三和里1鄰益豐東街18號六樓之3,66,6600700,三和里,1鄰,益豐東街,,,,,,18號六樓之3,120.632701739922,24.15008953415
臺中市南屯區三和里1鄰益豐東街18號六樓之2,66,6600700,三和里,1鄰,益豐東街,,,,,,18號六樓之2,120.632701739922,24.15008953415
臺中市南屯區三和里1鄰益豐東街18號六樓之1,66,6600700,三和里,1鄰,益豐東街,,,,,,18號六樓之1,120.632701739922,24.15008953415
臺中市南屯區三和里1鄰益豐東街18號七樓之5,66,6600700,三和里,1鄰,益豐東街,,,,,,18號七樓之5,120.632701739922,24.15008953415
臺中市南屯區三和里1鄰益豐東街18號七樓之3,66,6600700,三和里,1鄰,益豐東街,,,,,,18號七樓之3,120.632701739922,24.15008953415
臺中市南屯區三和里1鄰益豐東街18號七樓之2,66,6600700,三和里,1鄰,益豐東街,,,,,,18號七樓之2,120.632701739922,24.15008953415
臺中市南屯區三和里1鄰益豐東街18號七樓之1,66,6600700,三和里,1鄰,益豐東街,,,,,,18號七樓之1,120.632701739922,24.15008953415
臺中市南屯區三和里1鄰益豐東街18號八樓之5,66,6600700,三和里,1鄰,益豐東街,,,,,,18號八樓之5,120.632701739922,24.15008953415
臺中市南屯區三和里1鄰益豐東街18號八樓之3,66,6600700,三和里,1鄰,益豐東街,,,,,,18號八樓之3,120.632701739922,24.15008953415
臺中市南屯區三和里1鄰益豐東街18號八樓之2,66,6600700,三和里,1鄰,益豐東街,,,,,,18號八樓之2,120.632701739922,24.15008953415
臺中市南屯區三和里1鄰益豐東街18號八樓之1,66,6600700,三和里,1鄰,益豐東街,,,,,,18號八樓之1,120.632701739922,24.15008953415
臺中市南屯區三和里1鄰益豐東街18號九樓之5,66,6600700,三和里,1鄰,益豐東街,,,,,,18號九樓之5,120.632701739922,24.15008953415
臺中市南屯區三和里1鄰益豐東街18號九樓之3,66,6600700,三和里,1鄰,益豐東街,,,,,,18號九樓之3,120.632701739922,24.15008953415
臺中市南屯區三和里1鄰益豐東街18號九樓之2,66,6600700,三和里,1鄰,益豐東街,,,,,,18號九樓之2,120.632701739922,24.15008953415
臺中市南屯區三和里1鄰益豐東街18號九樓之1,66,6600700,三和里,1鄰,益豐東街,,,,,,18號九樓之1,120.632701739922,24.15008953415
臺中市南屯區三和里1鄰益豐東街18號十樓之5,66,6600700,三和里,1鄰,益豐東街,,,,,,18號十樓之5,120.632701739922,24.15008953415
臺中市南屯區三和里1鄰益豐東街18號十樓之3,66,6600700,三和里,1鄰,益豐東街,,,,,,18號十樓之3,120.632701739922,24.15008953415
臺中市南屯區三和里1鄰益豐東街18號十樓之2,66,6600700,三和里,1鄰,益豐東街,,,,,,18號十樓之2,120.632701739922,24.15008953415
臺中市南屯區三和里1鄰益豐東街18號十樓之1,66,6600700,三和里,1鄰,益豐東街,,,,,,18號十樓之1,120.632701739922,24.15008953415
臺中市南屯區三和里1鄰益豐東街18號十一樓之5,66,6600700,三和里,1鄰,益豐東街,,,,,,18號十一樓之5,120.632701739922,24.15008953415
臺中市南屯區三和里1鄰益豐東街18號十一樓之3,66,6600700,三和里,1鄰,益豐東街,,,,,,18號十一樓之3,120.632701739922,24.15008953415
臺中市南屯區三和里1鄰益豐東街18號十一樓之2,66,6600700,三和里,1鄰,益豐東街,,,,,,18號十一樓之2,120.632701739922,24.15008953415
臺中市南屯區三和里1鄰益豐東街18號十一樓之1,66,6600700,三和里,1鄰,益豐東街,,,,,,18號十一樓之1,120.632701739922,24.15008953415
臺中市南屯區三和里1鄰益豐東街18號十二樓之5,66,6600700,三和里,1鄰,益豐東街,,,,,,18號十二樓之5,120.632701739922,24.15008953415
臺中市南屯區三和里1鄰益豐東街18號十二樓之3,66,6600700,三和里,1鄰,益豐東街,,,,,,18號十二樓之3,120.632701739922,24.15008953415
臺中市南屯區三和里1鄰益豐東街18號十二樓之2,66,6600700,三和里,1鄰,益豐東街,,,,,,18號十二樓之2,120.632701739922,24.15008953415
臺中市南屯區三和里1鄰益豐東街18號十二樓之1,66,6600700,三和里,1鄰,益豐東街,,,,,,18號十二樓之1,120.632701739922,24.15008953415
臺中市南屯區三和里1鄰益豐東街31號,66,6600700,三和里,1鄰,益豐東街,,,,,,31號,120.632187851187,24.150080820291
臺中市南屯區三和里1鄰益豐東街35號,66,6600700,三和里,1鄰,益豐東街,,,,,,35號,120.6320300894,24.150082155563
臺中市南屯區三和里1鄰益豐東街37號,66,6600700,三和里,1鄰,益豐東街,,,,,,37號,120.631965716252,24.15008215384
臺中市南屯區三和里1鄰益豐東街39號,66,6600700,三和里,1鄰,益豐東街,,,,,,39號,120.631900001879,24.150082157884
臺中市南屯區三和里1鄰益豐東街49號,66,6600700,三和里,1鄰,益豐東街,,,,,,49號,120.631831075811,24.150053955722
臺中市南屯區三和里1鄰益豐東街51號,66,6600700,三和里,1鄰,益豐東街,,,,,,51號,120.631773407747,24.150053952034
臺中市南屯區三和里1鄰益豐東街53號,66,6600700,三和里,1鄰,益豐東街,,,,,,53號,120.631711716724,24.15005028176
臺中市南屯區三和里1鄰益豐東街55號,66,6600700,三和里,1鄰,益豐東街,,,,,,55號,120.631637956667,24.150049056353
臺中市南屯區三和里1鄰益豐東街58號,66,6600700,三和里,1鄰,益豐東街,,,,,,58號,120.632064840546,24.150285009804
臺中市南屯區三和里1鄰益豐東街60號,66,6600700,三和里,1鄰,益豐東街,,,,,,60號,120.631981737002,24.150287608508
臺中市南屯區三和里1鄰益豐東街68號,66,6600700,三和里,1鄰,益豐東街,,,,,,68號,120.631762010611,24.150286870831
臺中市南屯區三和里1鄰益豐東街70號,66,6600700,三和里,1鄰,益豐東街,,,,,,70號,120.6316879393,24.150307333016
臺中市南屯區三和里1鄰益豐東街86號,66,6600700,三和里,1鄰,益豐東街,,,,,,86號,120.631508784874,24.150294214422
臺中市南屯區三和里1鄰益豐東街88號,66,6600700,三和里,1鄰,益豐東街,,,,,,88號,120.631452458322,24.150295441833
臺中市南屯區三和里1鄰益豐東街90號,66,6600700,三和里,1鄰,益豐東街,,,,,,90號,120.63136394593,24.150300338633
臺中市南屯區三和里1鄰益豐東街92號,66,6600700,三和里,1鄰,益豐東街,,,,,,92號,120.631310300954,24.150299116505
臺中市南屯區三和里1鄰益豐東街96號,66,6600700,三和里,1鄰,益豐東街,,,,,,96號,120.631253975104,24.150296668929
臺中市南屯區三和里1鄰益豐東街98號,66,6600700,三和里,1鄰,益豐東街,,,,,,98號,120.631201671771,24.150296668956
臺中市南屯區三和里1鄰益豐東街100號,66,6600700,三和里,1鄰,益豐東街,,,,,,100號,120.631146687018,24.150296662486
臺中市南屯區三和里1鄰益豐東街107號,66,6600700,三和里,1鄰,益豐東街,,,,,,107號,120.630169229568,24.150115210337
臺中市南屯區三和里1鄰益豐東街109號,66,6600700,三和里,1鄰,益豐東街,,,,,,109號,120.630087622039,24.15012695829
臺中市南屯區三和里1鄰益豐東街115號,66,6600700,三和里,1鄰,益豐東街,,,,,,115號,120.62987263,24.150142978676
臺中市南屯區三和里1鄰益豐東街117號,66,6600700,三和里,1鄰,益豐東街,,,,,,117號,120.629758321224,24.150147288283
臺中市南屯區三和里1鄰益豐東街121號,66,6600700,三和里,1鄰,益豐東街,,,,,,121號,120.629669225095,24.150145194026
臺中市南屯區三和里1鄰益豐東街123號,66,6600700,三和里,1鄰,益豐東街,,,,,,123號,120.629609588317,24.150166584124
臺中市南屯區三和里1鄰益豐東街125號,66,6600700,三和里,1鄰,益豐東街,,,,,,125號,120.629550579972,24.150166585372
臺中市南屯區三和里1鄰益豐東街127號,66,6600700,三和里,1鄰,益豐東街,,,,,,127號,120.629496935307,24.150169037523
臺中市南屯區三和里1鄰益豐東街129號,66,6600700,三和里,1鄰,益豐東街,,,,,,129號,120.629437926962,24.150169038728
臺中市南屯區三和里1鄰益豐東街133號,66,6600700,三和里,1鄰,益豐東街,,,,,,133號,120.629369995416,24.150181379317
臺中市南屯區三和里1鄰益豐東街142號,66,6600700,三和里,1鄰,益豐東街,,,,,,142號,120.630123091151,24.150348703927
臺中市南屯區三和里1鄰益豐東街148號,66,6600700,三和里,1鄰,益豐東街,,,,,,148號,120.629955196232,24.15036658121
臺中市南屯區三和里1鄰益豐東街182號,66,6600700,三和里,1鄰,益豐東街,,,,,,182號,120.629082001596,24.15037043888
臺中市南屯區三和里1鄰益豐東街186號,66,6600700,三和里,1鄰,益豐東街,,,,,,186號,120.629016287195,24.150382676348
臺中市南屯區三和里1鄰益豐東街188號二樓,66,6600700,三和里,1鄰,益豐東街,,,,,,188號二樓,120.628954596383,24.150388792692
臺中市南屯區三和里1鄰益豐東街188號三樓,66,6600700,三和里,1鄰,益豐東街,,,,,,188號三樓,120.628954596383,24.150388792692
臺中市南屯區三和里1鄰益豐東街188號四樓,66,6600700,三和里,1鄰,益豐東街,,,,,,188號四樓,120.628954596383,24.150388792692
臺中市南屯區三和里1鄰益豐東街188號五樓,66,6600700,三和里,1鄰,益豐東街,,,,,,188號五樓,120.628954596383,24.150388792692
臺中市南屯區三和里1鄰益豐東街188號六樓,66,6600700,三和里,1鄰,益豐東街,,,,,,188號六樓,120.628954596383,24.150388792692
臺中市南屯區三和里1鄰益豐東街188號七樓,66,6600700,三和里,1鄰,益豐東街,,,,,,188號七樓,120.628954596383,24.150388792692
