FULL_ADDR,COUNTY,TOWN,VILLAGE,NEIGHBORHOOD,ROAD,SECTION,LANE,ALLEY,SUB_ALLEY,TONG,NUMBER,X,Y
臺中市西屯區林厝里2鄰科雅東路9號,66,6600600,林厝里,2鄰,科雅東路,,,,,,9號,120.620828971053,24.208888685561
臺中市大雅區秀山里14鄰科雅東路16號,66,6601800,秀山里,14鄰,科雅東路,,,,,,16號,120.627209679179,24.219145511983
臺中市大雅區秀山里14鄰科雅東路18號,66,6601800,秀山里,14鄰,科雅東路,,,,,,18號,120.627119373823,24.219063179432
臺中市大雅區秀山里14鄰科雅東路36號,66,6601800,秀山里,14鄰,科雅東路,,,,,,36號,120.629362641446,24.223084622856
臺中市大雅區秀山里14鄰科雅東路50號,66,6601800,秀山里,14鄰,科雅東路,,,,,,50號,120.62975424053,24.223926996542
臺中市大雅區橫山里13鄰科雅東路1號,66,6601800,橫山里,13鄰,科雅東路,,,,,,1號,120.622625564582,24.208564637233
臺中市大雅區橫山里13鄰科雅東路19號,66,6601800,橫山里,13鄰,科雅東路,,,,,,19號,120.622909878295,24.209308318074
