FULL_ADDR,COUNTY,TOWN,VILLAGE,NEIGHBORHOOD,ROAD,SECTION,LANE,ALLEY,SUB_ALLEY,TONG,NUMBER,X,Y
臺中市西屯區港尾里12鄰經貿十一街19號,66,6600600,港尾里,12鄰,經貿十一街,,,,,,19號,120.654596686547,24.198071388865
臺中市西屯區港尾里12鄰經貿十一街21號二樓之2,66,6600600,港尾里,12鄰,經貿十一街,,,,,,21號二樓之2,120.654509058377,24.198006143619
臺中市西屯區港尾里12鄰經貿十一街21號二樓之1,66,6600600,港尾里,12鄰,經貿十一街,,,,,,21號二樓之1,120.654509058377,24.198006143619
臺中市西屯區港尾里12鄰經貿十一街21號三樓之2,66,6600600,港尾里,12鄰,經貿十一街,,,,,,21號三樓之2,120.654509058377,24.198006143619
臺中市西屯區港尾里12鄰經貿十一街21號三樓之1,66,6600600,港尾里,12鄰,經貿十一街,,,,,,21號三樓之1,120.654509058377,24.198006143619
臺中市西屯區港尾里12鄰經貿十一街21號四樓之2,66,6600600,港尾里,12鄰,經貿十一街,,,,,,21號四樓之2,120.654509058377,24.198006143619
臺中市西屯區港尾里12鄰經貿十一街21號四樓之1,66,6600600,港尾里,12鄰,經貿十一街,,,,,,21號四樓之1,120.654509058377,24.198006143619
臺中市西屯區港尾里12鄰經貿十一街23號,66,6600600,港尾里,12鄰,經貿十一街,,,,,,23號,120.654367813239,24.197978419606
