FULL_ADDR,COUNTY,TOWN,VILLAGE,NEIGHBORHOOD,ROAD,SECTION,LANE,ALLEY,SUB_ALLEY,TONG,NUMBER,X,Y
臺南市柳營區中埕里5鄰奇美路一段205巷263號,67,6700400,6700400-003,5鄰,奇美路,一段,205巷,,,,263號,120.317394222568,23.2760239626482
臺南市柳營區中埕里8鄰奇美路一段258巷52號,67,6700400,6700400-003,8鄰,奇美路,一段,258巷,,,,52號,120.317116587689,23.2699537051654
臺南市柳營區太康里3鄰奇美路二段236巷130號,67,6700400,6700400-007,3鄰,奇美路,二段,236巷,,,,130號,120.328232816499,23.2843627864539
臺南市柳營區太康里3鄰奇美路二段236巷175號,67,6700400,6700400-007,3鄰,奇美路,二段,236巷,,,,175號,120.329900892868,23.2847805129521
臺南市柳營區東昇里14鄰奇美路一段205巷292弄155之3號,67,6700400,6700400-004,14鄰,奇美路,一段,205巷,292弄,,,155之3號,120.320987623588,23.2763855798269
臺南市柳營區東昇里14鄰奇美路一段205巷292弄155之5號,67,6700400,6700400-004,14鄰,奇美路,一段,205巷,292弄,,,155之5號,120.321007449671,23.2766008500587
臺南市柳營區東昇里14鄰奇美路一段205巷292弄159之3號,67,6700400,6700400-004,14鄰,奇美路,一段,205巷,292弄,,,159之3號,120.321098754565,23.2763865121095
臺南市柳營區東昇里19鄰奇美路一段458巷73號,67,6700400,6700400-004,19鄰,奇美路,一段,458巷,,,,73號,120.326858939481,23.2758437897036
臺南市柳營區東昇里19鄰奇美路一段588號,67,6700400,6700400-004,19鄰,奇美路,一段,,,,,588號,120.325477141014,23.2774908862776
臺南市柳營區東昇里19鄰奇美路一段590巷141號,67,6700400,6700400-004,19鄰,奇美路,一段,590巷,,,,141號,120.328045988682,23.278426758056
