FULL_ADDR,COUNTY,TOWN,VILLAGE,NEIGHBORHOOD,ROAD,SECTION,LANE,ALLEY,SUB_ALLEY,TONG,NUMBER,X,Y
桃園市新屋區新生里3鄰中山路臨271號,68,6801100,6801100-002,3鄰,中山路臨,,,,,,271號,121.105092138385,24.9725432667511
桃園市新屋區新生里14鄰中山路臨457之1號,68,6801100,6801100-002,14鄰,中山路臨,,,,,,457之1號,121.0992323621,24.9733115422758
桃園市新屋區新生里14鄰中山路臨568號,68,6801100,6801100-002,14鄰,中山路臨,,,,,,568號,121.098765112426,24.9737530711818
桃園市新屋區新生里14鄰中山路臨570號,68,6801100,6801100-002,14鄰,中山路臨,,,,,,570號,121.098714705638,24.9737636678476
桃園市新屋區新生里14鄰中山路臨574號,68,6801100,6801100-002,14鄰,中山路臨,,,,,,574號,121.098561892546,24.9737855275504
