FULL_ADDR,COUNTY,TOWN,VILLAGE,NEIGHBORHOOD,ROAD,SECTION,LANE,ALLEY,SUB_ALLEY,TONG,NUMBER,X,Y
桃園市大溪區仁和里20鄰仁和東街1號,68,6800300,6800300-027,20鄰,仁和東街,,,,,,1號,121.273576352969,24.8930063195402
桃園市大溪區仁和里20鄰仁和東街3號,68,6800300,6800300-027,20鄰,仁和東街,,,,,,3號,121.273600958222,24.8930324569226
桃園市大溪區仁和里20鄰仁和東街5號,68,6800300,6800300-027,20鄰,仁和東街,,,,,,5號,121.273627757608,24.8930660838872
桃園市大溪區仁和里20鄰仁和東街7號,68,6800300,6800300-027,20鄰,仁和東街,,,,,,7號,121.273656524114,24.8930940193191
桃園市大溪區仁和里20鄰仁和東街9號,68,6800300,6800300-027,20鄰,仁和東街,,,,,,9號,121.27368936144,24.8931276351998
桃園市大溪區仁和里20鄰仁和東街11號,68,6800300,6800300-027,20鄰,仁和東街,,,,,,11號,121.273715453863,24.8931548532485
桃園市大溪區仁和里20鄰仁和東街13號,68,6800300,6800300-027,20鄰,仁和東街,,,,,,13號,121.273742141982,24.8931828827598
桃園市大溪區仁和里20鄰仁和東街15號,68,6800300,6800300-027,20鄰,仁和東街,,,,,,15號,121.273772991349,24.8932127103212
桃園市大溪區仁和里20鄰仁和東街17號,68,6800300,6800300-027,20鄰,仁和東街,,,,,,17號,121.273799679493,24.8932407398218
桃園市大溪區仁和里20鄰仁和東街19號,68,6800300,6800300-027,20鄰,仁和東街,,,,,,19號,121.273832611698,24.8932724595223
桃園市大溪區仁和里20鄰仁和東街21號,68,6800300,6800300-027,20鄰,仁和東街,,,,,,21號,121.273988359136,24.8933837652276
桃園市大溪區仁和里20鄰仁和東街23號,68,6800300,6800300-027,20鄰,仁和東街,,,,,,23號,121.274019822432,24.8934226200539
桃園市大溪區仁和里20鄰仁和東街25號,68,6800300,6800300-027,20鄰,仁和東街,,,,,,25號,121.274058887666,24.8934525227522
桃園市大溪區仁和里20鄰仁和東街27號,68,6800300,6800300-027,20鄰,仁和東街,,,,,,27號,121.274101912018,24.8934823278837
桃園市大溪區仁和里20鄰仁和東街29號,68,6800300,6800300-027,20鄰,仁和東街,,,,,,29號,121.274140389775,24.8935151207416
桃園市大溪區仁和里20鄰仁和東街31號,68,6800300,6800300-027,20鄰,仁和東街,,,,,,31號,121.274177380422,24.8935468329082
桃園市大溪區仁和里20鄰仁和東街52號,68,6800300,6800300-027,20鄰,仁和東街,,,,,,52號,121.274439252385,24.8933510662885
桃園市大溪區仁和里20鄰仁和東街56號,68,6800300,6800300-027,20鄰,仁和東街,,,,,,56號,121.274473253029,24.8933734845831
桃園市大溪區仁和里20鄰仁和東街58號,68,6800300,6800300-027,20鄰,仁和東街,,,,,,58號,121.274506177256,24.8934015024855
桃園市大溪區仁和里20鄰仁和東街60號,68,6800300,6800300-027,20鄰,仁和東街,,,,,,60號,121.274543151391,24.893425720983
桃園市大溪區仁和里20鄰仁和東街62號,68,6800300,6800300-027,20鄰,仁和東街,,,,,,62號,121.274571910198,24.8934500448715
桃園市大溪區仁和里20鄰仁和東街63號,68,6800300,6800300-027,20鄰,仁和東街,,,,,,63號,121.274750732295,24.8939687609898
桃園市大溪區仁和里20鄰仁和東街65號,68,6800300,6800300-027,20鄰,仁和東街,,,,,,65號,121.27477337911,24.8940042913597
桃園市大溪區仁和里20鄰仁和東街66號,68,6800300,6800300-027,20鄰,仁和東街,,,,,,66號,121.274588729082,24.8934910933468
桃園市大溪區仁和里20鄰仁和東街67號,68,6800300,6800300-027,20鄰,仁和東街,,,,,,67號,121.274793942902,24.8940378393042
桃園市大溪區仁和里20鄰仁和東街68號,68,6800300,6800300-027,20鄰,仁和東街,,,,,,68號,121.274619467364,24.893515323299
桃園市大溪區仁和里20鄰仁和東街70號,68,6800300,6800300-027,20鄰,仁和東街,,,,,,70號,121.274654362922,24.8935395455933
桃園市大溪區仁和里20鄰仁和東街72號,68,6800300,6800300-027,20鄰,仁和東街,,,,,,72號,121.274691337327,24.8935638543371
桃園市大溪區仁和里13鄰仁和東街95號,68,6800300,6800300-027,13鄰,仁和東街,,,,,,95號,121.275280893159,24.8943735221745
桃園市大溪區仁和里13鄰仁和東街95號三樓,68,6800300,6800300-027,13鄰,仁和東街,,,,,,95號三樓,121.275280893159,24.8943735221745
桃園市大溪區仁和里13鄰仁和東街95號二樓,68,6800300,6800300-027,13鄰,仁和東街,,,,,,95號二樓,121.275280893159,24.8943735221745
桃園市大溪區仁和里13鄰仁和東街95號四樓,68,6800300,6800300-027,13鄰,仁和東街,,,,,,95號四樓,121.275280893159,24.8943735221745
桃園市大溪區仁和里13鄰仁和東街95號五樓,68,6800300,6800300-027,13鄰,仁和東街,,,,,,95號五樓,121.275280893159,24.8943735221745
桃園市大溪區仁和里13鄰仁和東街95號六樓,68,6800300,6800300-027,13鄰,仁和東街,,,,,,95號六樓,121.275280893159,24.8943735221745
桃園市大溪區仁和里13鄰仁和東街95號七樓,68,6800300,6800300-027,13鄰,仁和東街,,,,,,95號七樓,121.275280893159,24.8943735221745
桃園市大溪區仁和里20鄰仁和東街96號,68,6800300,6800300-027,20鄰,仁和東街,,,,,,96號,121.27501487767,24.8939056170237
桃園市大溪區仁和里20鄰仁和東街96號二樓之1,68,6800300,6800300-027,20鄰,仁和東街,,,,,,96號二樓之1,121.27501487767,24.8939056170237
桃園市大溪區仁和里20鄰仁和東街96號二樓之2,68,6800300,6800300-027,20鄰,仁和東街,,,,,,96號二樓之2,121.27501487767,24.8939056170237
桃園市大溪區仁和里20鄰仁和東街96號二樓之3,68,6800300,6800300-027,20鄰,仁和東街,,,,,,96號二樓之3,121.27501487767,24.8939056170237
桃園市大溪區仁和里20鄰仁和東街96號三樓之1,68,6800300,6800300-027,20鄰,仁和東街,,,,,,96號三樓之1,121.27501487767,24.8939056170237
桃園市大溪區仁和里20鄰仁和東街96號七樓之3,68,6800300,6800300-027,20鄰,仁和東街,,,,,,96號七樓之3,121.27501487767,24.8939056170237
桃園市大溪區仁和里20鄰仁和東街96號八樓之1,68,6800300,6800300-027,20鄰,仁和東街,,,,,,96號八樓之1,121.27501487767,24.8939056170237
桃園市大溪區仁和里20鄰仁和東街96號八樓之2,68,6800300,6800300-027,20鄰,仁和東街,,,,,,96號八樓之2,121.27501487767,24.8939056170237
桃園市大溪區仁和里20鄰仁和東街96號八樓之3,68,6800300,6800300-027,20鄰,仁和東街,,,,,,96號八樓之3,121.27501487767,24.8939056170237
桃園市大溪區仁和里20鄰仁和東街96號九樓之1,68,6800300,6800300-027,20鄰,仁和東街,,,,,,96號九樓之1,121.27501487767,24.8939056170237
桃園市大溪區仁和里20鄰仁和東街96號九樓之2,68,6800300,6800300-027,20鄰,仁和東街,,,,,,96號九樓之2,121.27501487767,24.8939056170237
桃園市大溪區仁和里20鄰仁和東街96號九樓之3,68,6800300,6800300-027,20鄰,仁和東街,,,,,,96號九樓之3,121.27501487767,24.8939056170237
桃園市大溪區仁和里20鄰仁和東街96號十樓之1,68,6800300,6800300-027,20鄰,仁和東街,,,,,,96號十樓之1,121.27501487767,24.8939056170237
桃園市大溪區仁和里20鄰仁和東街96號十一樓之5,68,6800300,6800300-027,20鄰,仁和東街,,,,,,96號十一樓之5,121.27501487767,24.8939056170237
桃園市大溪區仁和里20鄰仁和東街96號五樓之3,68,6800300,6800300-027,20鄰,仁和東街,,,,,,96號五樓之3,121.27501487767,24.8939056170237
桃園市大溪區仁和里20鄰仁和東街96號六樓之1,68,6800300,6800300-027,20鄰,仁和東街,,,,,,96號六樓之1,121.27501487767,24.8939056170237
桃園市大溪區仁和里20鄰仁和東街96號六樓之2,68,6800300,6800300-027,20鄰,仁和東街,,,,,,96號六樓之2,121.27501487767,24.8939056170237
桃園市大溪區仁和里20鄰仁和東街96號六樓之3,68,6800300,6800300-027,20鄰,仁和東街,,,,,,96號六樓之3,121.27501487767,24.8939056170237
桃園市大溪區仁和里20鄰仁和東街96號七樓之1,68,6800300,6800300-027,20鄰,仁和東街,,,,,,96號七樓之1,121.27501487767,24.8939056170237
桃園市大溪區仁和里20鄰仁和東街96號七樓之2,68,6800300,6800300-027,20鄰,仁和東街,,,,,,96號七樓之2,121.27501487767,24.8939056170237
桃園市大溪區仁和里20鄰仁和東街96號三樓之5,68,6800300,6800300-027,20鄰,仁和東街,,,,,,96號三樓之5,121.27501487767,24.8939056170237
桃園市大溪區仁和里20鄰仁和東街96號四樓之5,68,6800300,6800300-027,20鄰,仁和東街,,,,,,96號四樓之5,121.27501487767,24.8939056170237
桃園市大溪區仁和里20鄰仁和東街96號五樓之5,68,6800300,6800300-027,20鄰,仁和東街,,,,,,96號五樓之5,121.27501487767,24.8939056170237
桃園市大溪區仁和里20鄰仁和東街96號六樓之5,68,6800300,6800300-027,20鄰,仁和東街,,,,,,96號六樓之5,121.27501487767,24.8939056170237
桃園市大溪區仁和里20鄰仁和東街96號七樓之5,68,6800300,6800300-027,20鄰,仁和東街,,,,,,96號七樓之5,121.27501487767,24.8939056170237
桃園市大溪區仁和里20鄰仁和東街96號八樓之5,68,6800300,6800300-027,20鄰,仁和東街,,,,,,96號八樓之5,121.27501487767,24.8939056170237
桃園市大溪區仁和里20鄰仁和東街96號九樓之5,68,6800300,6800300-027,20鄰,仁和東街,,,,,,96號九樓之5,121.27501487767,24.8939056170237
桃園市大溪區仁和里20鄰仁和東街96號十樓之5,68,6800300,6800300-027,20鄰,仁和東街,,,,,,96號十樓之5,121.27501487767,24.8939056170237
桃園市大溪區仁和里20鄰仁和東街96號三樓之2,68,6800300,6800300-027,20鄰,仁和東街,,,,,,96號三樓之2,121.27501487767,24.8939056170237
桃園市大溪區仁和里20鄰仁和東街96號三樓之3,68,6800300,6800300-027,20鄰,仁和東街,,,,,,96號三樓之3,121.27501487767,24.8939056170237
桃園市大溪區仁和里20鄰仁和東街96號四樓之1,68,6800300,6800300-027,20鄰,仁和東街,,,,,,96號四樓之1,121.27501487767,24.8939056170237
桃園市大溪區仁和里20鄰仁和東街96號十樓之2,68,6800300,6800300-027,20鄰,仁和東街,,,,,,96號十樓之2,121.27501487767,24.8939056170237
桃園市大溪區仁和里20鄰仁和東街96號十樓之3,68,6800300,6800300-027,20鄰,仁和東街,,,,,,96號十樓之3,121.27501487767,24.8939056170237
桃園市大溪區仁和里20鄰仁和東街96號四樓之2,68,6800300,6800300-027,20鄰,仁和東街,,,,,,96號四樓之2,121.27501487767,24.8939056170237
桃園市大溪區仁和里20鄰仁和東街96號四樓之3,68,6800300,6800300-027,20鄰,仁和東街,,,,,,96號四樓之3,121.27501487767,24.8939056170237
桃園市大溪區仁和里20鄰仁和東街96號五樓之1,68,6800300,6800300-027,20鄰,仁和東街,,,,,,96號五樓之1,121.27501487767,24.8939056170237
桃園市大溪區仁和里20鄰仁和東街96號五樓之2,68,6800300,6800300-027,20鄰,仁和東街,,,,,,96號五樓之2,121.27501487767,24.8939056170237
桃園市大溪區仁和里20鄰仁和東街96號十一樓之1,68,6800300,6800300-027,20鄰,仁和東街,,,,,,96號十一樓之1,121.27501487767,24.8939056170237
桃園市大溪區仁和里20鄰仁和東街96號十一樓之2,68,6800300,6800300-027,20鄰,仁和東街,,,,,,96號十一樓之2,121.27501487767,24.8939056170237
桃園市大溪區仁和里20鄰仁和東街96號十一樓之3,68,6800300,6800300-027,20鄰,仁和東街,,,,,,96號十一樓之3,121.27501487767,24.8939056170237
桃園市大溪區仁和里20鄰仁和東街96號十二樓之1,68,6800300,6800300-027,20鄰,仁和東街,,,,,,96號十二樓之1,121.27501487767,24.8939056170237
桃園市大溪區仁和里20鄰仁和東街96號十二樓之2,68,6800300,6800300-027,20鄰,仁和東街,,,,,,96號十二樓之2,121.27501487767,24.8939056170237
桃園市大溪區仁和里20鄰仁和東街96號十二樓之3,68,6800300,6800300-027,20鄰,仁和東街,,,,,,96號十二樓之3,121.27501487767,24.8939056170237
桃園市大溪區仁和里20鄰仁和東街96號二樓之5,68,6800300,6800300-027,20鄰,仁和東街,,,,,,96號二樓之5,121.27501487767,24.8939056170237
桃園市大溪區仁和里13鄰仁和東街97號,68,6800300,6800300-027,13鄰,仁和東街,,,,,,97號,121.27530392372,24.894403454118
桃園市大溪區仁和里13鄰仁和東街97號五樓,68,6800300,6800300-027,13鄰,仁和東街,,,,,,97號五樓,121.27530392372,24.894403454118
桃園市大溪區仁和里13鄰仁和東街97號二樓,68,6800300,6800300-027,13鄰,仁和東街,,,,,,97號二樓,121.27530392372,24.894403454118
桃園市大溪區仁和里13鄰仁和東街97號三樓,68,6800300,6800300-027,13鄰,仁和東街,,,,,,97號三樓,121.27530392372,24.894403454118
桃園市大溪區仁和里13鄰仁和東街97號四樓,68,6800300,6800300-027,13鄰,仁和東街,,,,,,97號四樓,121.27530392372,24.894403454118
桃園市大溪區仁和里13鄰仁和東街97號六樓,68,6800300,6800300-027,13鄰,仁和東街,,,,,,97號六樓,121.27530392372,24.894403454118
桃園市大溪區仁和里13鄰仁和東街97號七樓,68,6800300,6800300-027,13鄰,仁和東街,,,,,,97號七樓,121.27530392372,24.894403454118
桃園市大溪區仁和里13鄰仁和東街99號,68,6800300,6800300-027,13鄰,仁和東街,,,,,,99號,121.275331893241,24.8944287724391
桃園市大溪區仁和里13鄰仁和東街99號二樓,68,6800300,6800300-027,13鄰,仁和東街,,,,,,99號二樓,121.275331893241,24.8944287724391
桃園市大溪區仁和里13鄰仁和東街99號三樓,68,6800300,6800300-027,13鄰,仁和東街,,,,,,99號三樓,121.275331893241,24.8944287724391
桃園市大溪區仁和里13鄰仁和東街99號四樓,68,6800300,6800300-027,13鄰,仁和東街,,,,,,99號四樓,121.275331893241,24.8944287724391
桃園市大溪區仁和里13鄰仁和東街99號五樓,68,6800300,6800300-027,13鄰,仁和東街,,,,,,99號五樓,121.275331893241,24.8944287724391
桃園市大溪區仁和里13鄰仁和東街99號六樓,68,6800300,6800300-027,13鄰,仁和東街,,,,,,99號六樓,121.275331893241,24.8944287724391
桃園市大溪區仁和里13鄰仁和東街99號七樓,68,6800300,6800300-027,13鄰,仁和東街,,,,,,99號七樓,121.275331893241,24.8944287724391
桃園市大溪區仁和里13鄰仁和東街101號,68,6800300,6800300-027,13鄰,仁和東街,,,,,,101號,121.275360654038,24.8944538184415
桃園市大溪區仁和里13鄰仁和東街101號三樓,68,6800300,6800300-027,13鄰,仁和東街,,,,,,101號三樓,121.275360654038,24.8944538184415
桃園市大溪區仁和里13鄰仁和東街101號四樓,68,6800300,6800300-027,13鄰,仁和東街,,,,,,101號四樓,121.275360654038,24.8944538184415
桃園市大溪區仁和里13鄰仁和東街101號五樓,68,6800300,6800300-027,13鄰,仁和東街,,,,,,101號五樓,121.275360654038,24.8944538184415
桃園市大溪區仁和里13鄰仁和東街101號二樓,68,6800300,6800300-027,13鄰,仁和東街,,,,,,101號二樓,121.275360654038,24.8944538184415
桃園市大溪區仁和里13鄰仁和東街101號六樓,68,6800300,6800300-027,13鄰,仁和東街,,,,,,101號六樓,121.275360654038,24.8944538184415
桃園市大溪區仁和里13鄰仁和東街101號七樓,68,6800300,6800300-027,13鄰,仁和東街,,,,,,101號七樓,121.275360654038,24.8944538184415
桃園市大溪區仁和里19鄰仁和東街103號,68,6800300,6800300-027,19鄰,仁和東街,,,,,,103號,121.275489219562,24.8946258438333
桃園市大溪區仁和里19鄰仁和東街105號,68,6800300,6800300-027,19鄰,仁和東街,,,,,,105號,121.275517995263,24.894657570824
桃園市大溪區仁和里19鄰仁和東街107號,68,6800300,6800300-027,19鄰,仁和東街,,,,,,107號,121.275544679904,24.8946837040359
桃園市大溪區仁和里19鄰仁和東街109號,68,6800300,6800300-027,19鄰,仁和東街,,,,,,109號,121.275571451315,24.8947043297327
桃園市大溪區仁和里20鄰仁和東街110號,68,6800300,6800300-027,20鄰,仁和東街,,,,,,110號,121.275443781864,24.8942224466019
桃園市大溪區仁和里19鄰仁和東街111號,68,6800300,6800300-027,19鄰,仁和東街,,,,,,111號,121.275602198507,24.8947323514045
桃園市大溪區仁和里20鄰仁和東街112號,68,6800300,6800300-027,20鄰,仁和東街,,,,,,112號,121.27547255746,24.894254173604
桃園市大溪區仁和里19鄰仁和東街113號,68,6800300,6800300-027,19鄰,仁和東街,,,,,,113號,121.275635123149,24.8947602787634
桃園市大溪區仁和里19鄰仁和東街115號,68,6800300,6800300-027,19鄰,仁和東街,,,,,,115號,121.275669246634,24.8947931695433
桃園市大溪區仁和里20鄰仁和東街116號,68,6800300,6800300-027,20鄰,仁和東街,,,,,,116號,121.275503407507,24.8942840007975
桃園市大溪區仁和里19鄰仁和東街117號,68,6800300,6800300-027,19鄰,仁和東街,,,,,,117號,121.275690300102,24.8948241884897
桃園市大溪區仁和里20鄰仁和東街118號,68,6800300,6800300-027,20鄰,仁和東街,,,,,,118號,121.275536225009,24.8943083170014
桃園市大溪區仁和里19鄰仁和東街119號,68,6800300,6800300-027,19鄰,仁和東街,,,,,,119號,121.275721877518,24.8948694529266
桃園市大溪區仁和里20鄰仁和東街120號,68,6800300,6800300-027,20鄰,仁和東街,,,,,,120號,121.275567066869,24.8943344425348
桃園市大溪區仁和里19鄰仁和東街121號,68,6800300,6800300-027,19鄰,仁和東街,,,,,,121號,121.275755866175,24.8948861830237
桃園市大溪區仁和里20鄰仁和東街122號,68,6800300,6800300-027,20鄰,仁和東街,,,,,,122號,121.275595838313,24.894364273547
桃園市大溪區仁和里20鄰仁和東街126號,68,6800300,6800300-027,20鄰,仁和東街,,,,,,126號,121.275634796819,24.8943903840757
桃園市大溪區仁和里20鄰仁和東街128號,68,6800300,6800300-027,20鄰,仁和東街,,,,,,128號,121.275661584619,24.8944184130502
桃園市大溪區仁和里20鄰仁和東街130號,68,6800300,6800300-027,20鄰,仁和東街,,,,,,130號,121.275700444173,24.8944445237441
桃園市大溪區仁和里4鄰仁和東街131號,68,6800300,6800300-027,4鄰,仁和東街,,,,,,131號,121.27597451797,24.8949735352626
桃園市大溪區仁和里20鄰仁和東街132號,68,6800300,6800300-027,20鄰,仁和東街,,,,,,132號,121.275735352635,24.89447434339
桃園市大溪區仁和里4鄰仁和東街133號,68,6800300,6800300-027,4鄰,仁和東街,,,,,,133號,121.276028132349,24.8950023271117
桃園市大溪區仁和里4鄰仁和東街135號,68,6800300,6800300-027,4鄰,仁和東街,,,,,,135號,121.276069178036,24.895032135323
桃園市大溪區仁和里4鄰仁和東街137號,68,6800300,6800300-027,4鄰,仁和東街,,,,,,137號,121.276108264951,24.8950713367265
桃園市大溪區仁和里4鄰仁和東街139號,68,6800300,6800300-027,4鄰,仁和東街,,,,,,139號,121.27615138532,24.8950993353875
