FULL_ADDR,COUNTY,TOWN,VILLAGE,NEIGHBORHOOD,ROAD,SECTION,LANE,ALLEY,SUB_ALLEY,TONG,NUMBER,X,Y
桃園市新屋區笨港里9鄰文安路160號,68,6801100,6801100-017,9鄰,文安路,,,,,,160號,121.024175954073,24.9833244580179
桃園市新屋區笨港里9鄰文安路166號,68,6801100,6801100-017,9鄰,文安路,,,,,,166號,121.023976842158,24.9832698683919
桃園市新屋區笨港里9鄰文安路168巷18號,68,6801100,6801100-017,9鄰,文安路,,168巷,,,,18號,121.024073271573,24.9835193075832
桃園市新屋區笨港里9鄰文安路168巷19號,68,6801100,6801100-017,9鄰,文安路,,168巷,,,,19號,121.023820201155,24.9836049375527
桃園市新屋區笨港里9鄰文安路170號,68,6801100,6801100-017,9鄰,文安路,,,,,,170號,121.023830844556,24.9833216245857
