FULL_ADDR,COUNTY,TOWN,VILLAGE,NEIGHBORHOOD,ROAD,SECTION,LANE,ALLEY,SUB_ALLEY,TONG,NUMBER,X,Y
桃園市觀音區白玉里1鄰桃科九路56號,68,6801200,6801200-002,1鄰,桃科九路,,,,,,56號,121.089539471868,25.0487061367822
桃園市觀音區白玉里1鄰桃科九路58號,68,6801200,6801200-002,1鄰,桃科九路,,,,,,58號,121.089539471868,25.0487061367822
桃園市觀音區白玉里1鄰桃科九路58號五樓,68,6801200,6801200-002,1鄰,桃科九路,,,,,,58號五樓,121.089539471868,25.0487061367822
桃園市觀音區白玉里1鄰桃科九路107號,68,6801200,6801200-002,1鄰,桃科九路,,,,,,107號,121.08859761221,25.0494801573352
桃園市觀音區白玉里1鄰桃科九路190號,68,6801200,6801200-002,1鄰,桃科九路,,,,,,190號,121.087866456342,25.0516583113334
桃園市觀音區白玉里9鄰桃科九路200巷17號,68,6801200,6801200-002,9鄰,桃科九路,,200巷,,,,17號,121.087301211016,25.0524695676649
桃園市觀音區白玉里3鄰桃科九路200巷67號,68,6801200,6801200-002,3鄰,桃科九路,,200巷,,,,67號,121.097119556025,25.0479816372469
