FULL_ADDR,COUNTY,TOWN,VILLAGE,NEIGHBORHOOD,ROAD,SECTION,LANE,ALLEY,SUB_ALLEY,TONG,NUMBER,X,Y
桃園市新屋區深圳里3鄰深圳二路17巷6號,68,6801100,6801100-018,3鄰,深圳二路,,17巷,,,,6號,121.013362517729,24.9608106664589
桃園市新屋區深圳里3鄰深圳二路17巷8號,68,6801100,6801100-018,3鄰,深圳二路,,17巷,,,,8號,121.013315767323,24.9607663410541
桃園市新屋區深圳里3鄰深圳二路50號,68,6801100,6801100-018,3鄰,深圳二路,,,,,,50號,121.01326055841,24.961269590659
桃園市新屋區深圳里3鄰深圳二路56號,68,6801100,6801100-018,3鄰,深圳二路,,,,,,56號,121.013200644655,24.9613077862383
桃園市新屋區深圳里3鄰深圳二路58號,68,6801100,6801100-018,3鄰,深圳二路,,,,,,58號,121.013152713275,24.9613350563359
桃園市新屋區深圳里5鄰深圳二路168號,68,6801100,6801100-018,5鄰,深圳二路,,,,,,168號,121.013193188073,24.9582505794788
