FULL_ADDR,COUNTY,TOWN,VILLAGE,NEIGHBORHOOD,ROAD,SECTION,LANE,ALLEY,SUB_ALLEY,TONG,NUMBER,X,Y
桃園市龜山區文化里19鄰華亞五路2號,68,6800700,6800700-020,19鄰,華亞五路,,,,,,2號,121.375436270223,25.0353844835784
桃園市龜山區文化里19鄰華亞五路6號,68,6800700,6800700-020,19鄰,華亞五路,,,,,,6號,121.374728210436,25.0345622654594
桃園市龜山區文化里19鄰華亞五路100之1號,68,6800700,6800700-020,19鄰,華亞五路,,,,,,100之1號,121.378218427791,25.0336211704899
桃園市龜山區文化里19鄰華亞五路116巷6號,68,6800700,6800700-020,19鄰,華亞五路,,116巷,,,,6號,121.37845805056,25.0333991886518
桃園市龜山區文化里19鄰華亞五路116巷8號,68,6800700,6800700-020,19鄰,華亞五路,,116巷,,,,8號,121.37843616033,25.0332407992215
