FULL_ADDR,COUNTY,TOWN,VILLAGE,NEIGHBORHOOD,ROAD,SECTION,LANE,ALLEY,SUB_ALLEY,TONG,NUMBER,X,Y
桃園市大園區橫峰里39鄰致祥二街8號,68,6800600,6800600-005,39鄰,致祥二街,,,,,,8號,121.211364869465,25.007818044718
桃園市大園區橫峰里39鄰致祥二街8號二樓,68,6800600,6800600-005,39鄰,致祥二街,,,,,,8號二樓,121.211364869465,25.007818044718
桃園市大園區橫峰里39鄰致祥二街8號三樓,68,6800600,6800600-005,39鄰,致祥二街,,,,,,8號三樓,121.211364869465,25.007818044718
桃園市大園區橫峰里39鄰致祥二街8號五樓,68,6800600,6800600-005,39鄰,致祥二街,,,,,,8號五樓,121.211364869465,25.007818044718
桃園市大園區橫峰里39鄰致祥二街8號六樓,68,6800600,6800600-005,39鄰,致祥二街,,,,,,8號六樓,121.211364869465,25.007818044718
桃園市大園區橫峰里39鄰致祥二街8號四樓,68,6800600,6800600-005,39鄰,致祥二街,,,,,,8號四樓,121.211364869465,25.007818044718
桃園市大園區橫峰里39鄰致祥二街10號,68,6800600,6800600-005,39鄰,致祥二街,,,,,,10號,121.211284708975,25.007870613232
桃園市大園區橫峰里39鄰致祥二街10號二樓,68,6800600,6800600-005,39鄰,致祥二街,,,,,,10號二樓,121.211284708975,25.007870613232
