FULL_ADDR,COUNTY,TOWN,VILLAGE,NEIGHBORHOOD,ROAD,SECTION,LANE,ALLEY,SUB_ALLEY,TONG,NUMBER,X,Y
桃園市蘆竹區錦中里12鄰錦中街2號,68,6800500,6800500-020,12鄰,錦中街,,,,,,2號,121.288728210404,25.0517279846949
桃園市蘆竹區錦中里12鄰錦中街16號,68,6800500,6800500-020,12鄰,錦中街,,,,,,16號,121.288885192935,25.0518519081335
桃園市蘆竹區錦中里12鄰錦中街18號,68,6800500,6800500-020,12鄰,錦中街,,,,,,18號,121.288924360299,25.0518600476575
桃園市蘆竹區錦中里12鄰錦中街20號,68,6800500,6800500-020,12鄰,錦中街,,,,,,20號,121.288980465594,25.0518640012266
桃園市蘆竹區錦中里12鄰錦中街22號,68,6800500,6800500-020,12鄰,錦中街,,,,,,22號,121.289040944397,25.0518733632116
桃園市蘆竹區錦中里12鄰錦中街24號,68,6800500,6800500-020,12鄰,錦中街,,,,,,24號,121.289084568512,25.051880139784
桃園市蘆竹區錦中里12鄰錦中街26號,68,6800500,6800500-020,12鄰,錦中街,,,,,,26號,121.28913266991,25.0518943107897
桃園市蘆竹區錦中里12鄰錦中街28號,68,6800500,6800500-020,12鄰,錦中街,,,,,,28號,121.289174804224,25.0518997359986
桃園市蘆竹區錦中里12鄰錦中街30號,68,6800500,6800500-020,12鄰,錦中街,,,,,,30號,121.289222987166,25.0519064133725
桃園市蘆竹區錦中里12鄰錦中街31號七樓,68,6800500,6800500-020,12鄰,錦中街,,,,,,31號七樓,121.289797853196,25.0522986535554
桃園市蘆竹區錦中里12鄰錦中街31號九樓,68,6800500,6800500-020,12鄰,錦中街,,,,,,31號九樓,121.289797853196,25.0522986535554
桃園市蘆竹區錦中里12鄰錦中街31號八樓,68,6800500,6800500-020,12鄰,錦中街,,,,,,31號八樓,121.289797853196,25.0522986535554
桃園市蘆竹區錦中里12鄰錦中街31號十一樓,68,6800500,6800500-020,12鄰,錦中街,,,,,,31號十一樓,121.289797853196,25.0522986535554
桃園市蘆竹區錦中里12鄰錦中街31號十七樓,68,6800500,6800500-020,12鄰,錦中街,,,,,,31號十七樓,121.289797853196,25.0522986535554
桃園市蘆竹區錦中里12鄰錦中街31號十二樓,68,6800500,6800500-020,12鄰,錦中街,,,,,,31號十二樓,121.289797853196,25.0522986535554
桃園市蘆竹區錦中里12鄰錦中街31號十三樓,68,6800500,6800500-020,12鄰,錦中街,,,,,,31號十三樓,121.289797853196,25.0522986535554
桃園市蘆竹區錦中里12鄰錦中街31號十五樓,68,6800500,6800500-020,12鄰,錦中街,,,,,,31號十五樓,121.289797853196,25.0522986535554
桃園市蘆竹區錦中里12鄰錦中街31號十六樓,68,6800500,6800500-020,12鄰,錦中街,,,,,,31號十六樓,121.289797853196,25.0522986535554
桃園市蘆竹區錦中里12鄰錦中街31號十四樓,68,6800500,6800500-020,12鄰,錦中街,,,,,,31號十四樓,121.289797853196,25.0522986535554
桃園市蘆竹區錦中里12鄰錦中街31號三樓,68,6800500,6800500-020,12鄰,錦中街,,,,,,31號三樓,121.289797853196,25.0522986535554
桃園市蘆竹區錦中里12鄰錦中街31號五樓,68,6800500,6800500-020,12鄰,錦中街,,,,,,31號五樓,121.289797853196,25.0522986535554
桃園市蘆竹區錦中里12鄰錦中街31號六樓,68,6800500,6800500-020,12鄰,錦中街,,,,,,31號六樓,121.289797853196,25.0522986535554
桃園市蘆竹區錦中里12鄰錦中街31號四樓,68,6800500,6800500-020,12鄰,錦中街,,,,,,31號四樓,121.289797853196,25.0522986535554
桃園市蘆竹區錦中里12鄰錦中街31號十樓,68,6800500,6800500-020,12鄰,錦中街,,,,,,31號十樓,121.289797853196,25.0522986535554
桃園市蘆竹區錦中里12鄰錦中街32號,68,6800500,6800500-020,12鄰,錦中街,,,,,,32號,121.289414876394,25.0519541601646
桃園市蘆竹區錦中里12鄰錦中街32號二樓,68,6800500,6800500-020,12鄰,錦中街,,,,,,32號二樓,121.289414876394,25.0519541601646
桃園市蘆竹區錦中里12鄰錦中街32號三樓,68,6800500,6800500-020,12鄰,錦中街,,,,,,32號三樓,121.289414876394,25.0519541601646
桃園市蘆竹區錦中里12鄰錦中街32號四樓,68,6800500,6800500-020,12鄰,錦中街,,,,,,32號四樓,121.289414876394,25.0519541601646
桃園市蘆竹區錦中里12鄰錦中街32號五樓,68,6800500,6800500-020,12鄰,錦中街,,,,,,32號五樓,121.289414876394,25.0519541601646
桃園市蘆竹區錦中里12鄰錦中街33號,68,6800500,6800500-020,12鄰,錦中街,,,,,,33號,121.289970418515,25.0523049976792
桃園市蘆竹區錦中里12鄰錦中街33號十五樓,68,6800500,6800500-020,12鄰,錦中街,,,,,,33號十五樓,121.289970418515,25.0523049976792
桃園市蘆竹區錦中里12鄰錦中街33號十六樓,68,6800500,6800500-020,12鄰,錦中街,,,,,,33號十六樓,121.289970418515,25.0523049976792
桃園市蘆竹區錦中里12鄰錦中街33號十四樓,68,6800500,6800500-020,12鄰,錦中街,,,,,,33號十四樓,121.289970418515,25.0523049976792
桃園市蘆竹區錦中里12鄰錦中街33號十樓,68,6800500,6800500-020,12鄰,錦中街,,,,,,33號十樓,121.289970418515,25.0523049976792
桃園市蘆竹區錦中里12鄰錦中街33號三樓,68,6800500,6800500-020,12鄰,錦中街,,,,,,33號三樓,121.289970418515,25.0523049976792
桃園市蘆竹區錦中里12鄰錦中街33號六樓,68,6800500,6800500-020,12鄰,錦中街,,,,,,33號六樓,121.289970418515,25.0523049976792
桃園市蘆竹區錦中里12鄰錦中街33號五樓,68,6800500,6800500-020,12鄰,錦中街,,,,,,33號五樓,121.289970418515,25.0523049976792
桃園市蘆竹區錦中里12鄰錦中街33號七樓,68,6800500,6800500-020,12鄰,錦中街,,,,,,33號七樓,121.289970418515,25.0523049976792
桃園市蘆竹區錦中里12鄰錦中街33號九樓,68,6800500,6800500-020,12鄰,錦中街,,,,,,33號九樓,121.289970418515,25.0523049976792
桃園市蘆竹區錦中里12鄰錦中街33號八樓,68,6800500,6800500-020,12鄰,錦中街,,,,,,33號八樓,121.289970418515,25.0523049976792
桃園市蘆竹區錦中里12鄰錦中街33號十一樓,68,6800500,6800500-020,12鄰,錦中街,,,,,,33號十一樓,121.289970418515,25.0523049976792
桃園市蘆竹區錦中里12鄰錦中街33號十三樓,68,6800500,6800500-020,12鄰,錦中街,,,,,,33號十三樓,121.289970418515,25.0523049976792
桃園市蘆竹區錦中里12鄰錦中街33號十二樓,68,6800500,6800500-020,12鄰,錦中街,,,,,,33號十二樓,121.289970418515,25.0523049976792
桃園市蘆竹區錦中里12鄰錦中街33號四樓,68,6800500,6800500-020,12鄰,錦中街,,,,,,33號四樓,121.289970418515,25.0523049976792
桃園市蘆竹區錦中里12鄰錦中街35號,68,6800500,6800500-020,12鄰,錦中街,,,,,,35號,121.289988796297,25.052449413712
桃園市蘆竹區錦中里12鄰錦中街35號七樓,68,6800500,6800500-020,12鄰,錦中街,,,,,,35號七樓,121.289988796297,25.052449413712
桃園市蘆竹區錦中里12鄰錦中街35號二樓,68,6800500,6800500-020,12鄰,錦中街,,,,,,35號二樓,121.289988796297,25.052449413712
桃園市蘆竹區錦中里12鄰錦中街35號八樓,68,6800500,6800500-020,12鄰,錦中街,,,,,,35號八樓,121.289988796297,25.052449413712
桃園市蘆竹區錦中里12鄰錦中街35號十一樓,68,6800500,6800500-020,12鄰,錦中街,,,,,,35號十一樓,121.289988796297,25.052449413712
桃園市蘆竹區錦中里12鄰錦中街35號十二樓,68,6800500,6800500-020,12鄰,錦中街,,,,,,35號十二樓,121.289988796297,25.052449413712
桃園市蘆竹區錦中里12鄰錦中街35號十三樓,68,6800500,6800500-020,12鄰,錦中街,,,,,,35號十三樓,121.289988796297,25.052449413712
桃園市蘆竹區錦中里12鄰錦中街35號十五樓,68,6800500,6800500-020,12鄰,錦中街,,,,,,35號十五樓,121.289988796297,25.052449413712
桃園市蘆竹區錦中里12鄰錦中街35號十六樓,68,6800500,6800500-020,12鄰,錦中街,,,,,,35號十六樓,121.289988796297,25.052449413712
桃園市蘆竹區錦中里12鄰錦中街35號十四樓,68,6800500,6800500-020,12鄰,錦中街,,,,,,35號十四樓,121.289988796297,25.052449413712
桃園市蘆竹區錦中里12鄰錦中街35號十樓,68,6800500,6800500-020,12鄰,錦中街,,,,,,35號十樓,121.289988796297,25.052449413712
桃園市蘆竹區錦中里12鄰錦中街35號三樓,68,6800500,6800500-020,12鄰,錦中街,,,,,,35號三樓,121.289988796297,25.052449413712
桃園市蘆竹區錦中里12鄰錦中街35號五樓,68,6800500,6800500-020,12鄰,錦中街,,,,,,35號五樓,121.289988796297,25.052449413712
桃園市蘆竹區錦中里12鄰錦中街35號六樓,68,6800500,6800500-020,12鄰,錦中街,,,,,,35號六樓,121.289988796297,25.052449413712
桃園市蘆竹區錦中里12鄰錦中街35號四樓,68,6800500,6800500-020,12鄰,錦中街,,,,,,35號四樓,121.289988796297,25.052449413712
桃園市蘆竹區錦中里12鄰錦中街35號九樓,68,6800500,6800500-020,12鄰,錦中街,,,,,,35號九樓,121.289988796297,25.052449413712
桃園市蘆竹區錦中里12鄰錦中街37號,68,6800500,6800500-020,12鄰,錦中街,,,,,,37號,121.289876935891,25.0525906532314
桃園市蘆竹區錦中里12鄰錦中街39號,68,6800500,6800500-020,12鄰,錦中街,,,,,,39號,121.289802117798,25.0525527903162
